Title,Article,Tags,Personas,Summary,Meeting_Plan,Meeting
Social Anthropology,"Social anthropology is the study of patterns of behaviour in human societies and cultures. It is the dominant constituent of anthropology throughout the United Kingdom and much of Europe,[1] where it is distinguished from cultural anthropology.[2] In the United States, social anthropology is commonly subsumed within cultural anthropology or sociocultural anthropology.

The term cultural anthropology is generally applied to ethnographic works that are holistic in spirit, are oriented to the ways in which culture affects individual experience, or aim to provide a rounded view of the knowledge, customs, and institutions of people. Social anthropology is a term applied to ethnographic works that attempt to isolate a particular system of social relations such as those that comprise domestic life, economy, law, politics, or religion, give analytical priority to the organizational bases of social life, and attend to cultural phenomena as somewhat secondary to the main issues of social scientific inquiry.[3]

Topics of interest for social anthropologists have included customs, economic and political organization, law and conflict resolution, patterns of consumption and exchange, kinship and family structure, gender relations, childbearing and socialization, religion, while present-day social anthropologists are also concerned with issues of globalism, ethnic violence, gender studies, transnationalism and local experience, and the emerging cultures of cyberspace,[4] and can also help with bringing opponents together when environmental concerns come into conflict with economic developments.[5] 
British and American anthropologists including Gillian Tett and Karen Ho who studied Wall Street provided an alternative explanation for the 2008 financial crisis to the technical explanations rooted in economic and political theory.[6]

Differences among British, French, and American sociocultural anthropologies have diminished with increasing dialogue and borrowing of both theory and methods. Social and cultural anthropologists, and some who integrate the two, are found in most institutes of anthropology. Thus the formal names of institutional units no longer necessarily reflect fully the content of the disciplines these cover. Some, such as the Institute of Social and Cultural Anthropology[7] (Oxford), changed their name to reflect the change in composition; others, such as Social Anthropology at the University of Kent,[8] became simply Anthropology. Most retain the name under which they were founded.

Long-term qualitative research, including intensive field studies (emphasizing participant observation methods), has been traditionally encouraged in social anthropology rather than quantitative analysis of surveys, questionnaires and brief field visits typically used by economists, political scientists, and (most) sociologists.[9]

Cognitive anthropology studies how people represent and think about events and objects in the world. It links human thought processes and the physical and ideational aspects of culture.[10] The scopes of these two disciplines intersect in the field of cognitive development. The following part of the section shows the significance of their co-research for understanding the processes that constitute society.
According to Sir Edward Tylor: ""Culture, or civilization, taken in its broad, ethnographic sense, is that complex whole which includes knowledge, belief, art, morals, law, custom, and any other capabilities and habits acquired by man as a member of society.”[11] The cultural consensus principle is incorporated in the reasoning behind the cultural consonance model[12] and other similar models (see cognitive anthropology) that seek to evaluate the effects of shared cognitive structures on social life and the human condition[13] beginning from the onset of cognitive development. The major part of social and cognitive anthropology concepts (e.g., Cultural consonance, Cultural models, Knowledge structures, Shared knowledge etc.) seem to rely upon broad pervasive, unaware interactions between society members. Research shows that unconscious remembering increases recall efficiency over time[14] and yields greater confidence in that thought.[15] According to the received view in cognitive sciences, cognition begins from birth (and even from prenatal) due to motive forces of shared intentionality: unaware knowledge assimilation. Therefore, mechanisms of unaware interactions at the onset of life, one of the focuses of research in cognitive sciences, have become the central research issue in social and cognitive anthropology. 

Another intersection of these two disciplines appears in neuroscience research. Behavioral propensities (an exteriorization of Cultural models, Schemata, etc.; see key concepts of cognitive anthropology) are the product of biological and cultural factors that manifest in individual brain development, neural wiring, and neurochemical homeostasis.[16] According to received view in neuroscience, an observed human behavior, in any context, is the last event in a long chain of biological and cultural interactions.[17][18] The brain´s anatomy is subject to neuroplasticity and depends on both, contextual (cultural) and historically dependent (previous experience) mechanisms to shape the neural system.[19] By bridging sociology with anthropology and cognitive science perspectives, we can assess shared cultural knowledge[20] – understand processes underlying unspoken social norms and beliefs, as well as study processes of shaping individual values that together constitute societies.

Social anthropology is distinguished from subjects such as economics or political science by its holistic range and the attention it gives to the comparative diversity of societies and cultures across the world, and the capacity this gives the discipline to re-examine Euro-American assumptions. It is differentiated from sociology, both in its main methods (based on long-term participant observation and linguistic competence),[21] and in its commitment to the relevance and illumination provided by micro studies.  It extends beyond strictly social phenomena to culture, art, individuality, and cognition.[22] Many social anthropologists use quantitative methods, too, particularly those whose research touches on topics such as local economies, demography, human ecology, cognition, or health and illness.

Specializations within social anthropology shift as its objects of study are transformed and as new intellectual paradigms appear; musicology and medical anthropology are examples of current, well-defined specialities.[23] More recent and currently specializations are:

The subject has been enlivened by, and has contributed to, approaches from other disciplines, such as philosophy (ethics, phenomenology, logic), the history of science, psychoanalysis, and linguistics.

The subject has both ethical and reflexive dimensions. Practitioners have developed an awareness of the sense in which scholars create their objects of study and the ways in which anthropologists themselves may contribute to processes of change in the societies they study.  An example of this is the ""hawthorne effect"", whereby those being studied may alter their behaviour in response to the knowledge that they are being watched and studied.

Social anthropology has historical roots in a number of 19th-century disciplines, including the study of Classics, ethnography, ethnology, folklore, linguistics, and sociology, among others. Its immediate precursor took shape in the work of Edward Burnett Tylor and James George Frazer in the late 19th century and underwent major changes in both method and theory during the period 1890–1920 with a new emphasis on original fieldwork, long-term holistic study of social behavior in natural settings, and the introduction of French and German social theory.

Polish anthropologist and ethnographer Bronisław Malinowski, one of the most important influences on British social anthropology, emphasized long-term fieldwork in which anthropologists work in the vernacular and immerse themselves in the daily practices of local people.[30] This development was bolstered by Franz Boas' introduction of the concept of cultural relativism, arguing that cultures are based on different ideas about the world and can therefore only be properly understood in terms of their own standards and values.[31]

Museums such as the British Museum weren't the only site of anthropological studies; with the New Imperialism period, starting in the 1870s, zoos became unattended ""laboratories"", especially the so-called ""ethnological exhibitions"" or ""Negro villages"". Thus, ""savages"" from the Americas, Africa and Asia were displayed, often nude, in cages, in what has been termed ""human zoos"". In 1906, Congolese pygmy Ota Benga was put by American anthropologist Madison Grant in a cage in the Bronx Zoo, labelled ""the missing link"" between an orangutan and the ""White race""—Grant, a renowned eugenicist, was also the author of The Passing of the Great Race (1916). Such exhibitions were attempts to illustrate and prove in the same movement the validity of scientific racism, whose first formulation may be found in Arthur de Gobineau's An Essay on the Inequality of Human Races (1853–1855). In 1931, the Colonial Exhibition in Paris still displayed Kanaks from New Caledonia in the ""indigenous village""; it received 24 million visitors in six months, thus demonstrating the popularity of such ""human zoos"".

Anthropology grew increasingly distinct from natural history and by the end of the 19th century the discipline began to crystallize into its modern form—by 1935, for example, it was possible for T. K. Penniman to write a history of the discipline entitled A Hundred Years of Anthropology. At the time, the field was dominated by ""the comparative method"". It was assumed that all societies passed through a single evolutionary process from the most primitive to most advanced. Non-European societies were thus seen as evolutionary ""living fossils"" that could be studied in order to understand the European past. Scholars wrote histories of prehistoric migrations which were sometimes valuable but often also fanciful. It was during this time that Europeans first accurately traced Polynesian migrations across the Pacific Ocean for instance—although some of them believed it originated in Egypt. Finally, the concept of race was actively discussed as a way to classify—and rank—human beings based on difference.

Edward Burnett Tylor (1832–1917) and James George Frazer (1854–1941) are generally considered the antecedents to modern social anthropologists in Great Britain. Although the British anthropologist Tylor undertook a field trip to Mexico, both he and Frazer derived most of the material for their comparative studies through extensive reading, not fieldwork, mainly the Classics (literature and history of Ancient Greece and Rome), the work of the early European folklorists, and reports from missionaries, travelers, and contemporaneous ethnologists.

Tylor advocated strongly for unilinealism and a form of ""uniformity of mankind"".[32] Tylor in particular laid the groundwork for theories of cultural diffusionism, stating that there are three ways that different groups can have similar cultural forms or technologies: ""independent invention, inheritance from ancestors in a distant region, transmission from one race  [sic] to another.""[33]

Tylor formulated one of the early and influential anthropological conceptions of culture as ""that complex whole, which includes knowledge, belief, art, morals, law, custom, and any other capabilities and habits acquired by [humans] as [members] of society.""[34] However, as Stocking notes, Tylor mainly concerned himself with describing and mapping the distribution of particular elements of culture, rather than with the larger function, and he generally seemed to assume a Victorian idea of progress rather than the idea of non-directional, multilineal cultural change proposed by later anthropologists. Tylor also theorized about the origins of religious beliefs in human beings, proposing a theory of animism as the earliest stage, and noting that ""religion"" has many components, of which he believed the most important to be belief in supernatural beings (as opposed to moral systems, cosmology, etc.).

Frazer, a Scottish scholar with a broad knowledge of Classics, also concerned himself with the study of religion, mythology, and magic. His comparative studies, most influentially in the numerous editions of The Golden Bough, analyzed similarities in religious belief and symbolism globally. Neither Tylor nor Frazer, however, were particularly interested in fieldwork, nor were they interested in examining how the cultural elements and institutions fit together. The Golden Bough was abridged drastically in subsequent editions after his first.

Toward the turn of the 20th century, a number of anthropologists became dissatisfied with this categorization of cultural elements; historical reconstructions also came to seem increasingly speculative to them. Under the influence of several younger scholars, a new approach came to predominate among British anthropologists, concerned with analyzing how societies held together in the present (synchronic analysis, rather than diachronic or historical analysis), and emphasizing long-term (one to several years) immersion fieldwork. Cambridge University financed a multidisciplinary expedition to the Torres Strait Islands in 1898, organized by Alfred Cort Haddon and including a physician-anthropologist, William Rivers, as well as a linguist, a botanist, and other specialists. The findings of the expedition set new standards for ethnographic description.

A decade and a half later, the Polish anthropology student Bronisław Malinowski (1884–1942) was beginning what he expected to be a brief period of fieldwork in the old model, collecting lists of cultural items, when the outbreak of the First World War stranded him in New Guinea. As a subject of the Austro-Hungarian Empire resident on a British colonial possession, he was effectively confined to New Guinea for several years.[35]

He made use of the time by undertaking far more intensive fieldwork than had been done by British anthropologists, and his classic ethnographical work, Argonauts of the Western Pacific (1922) advocated an approach to fieldwork that became standard in the field: getting ""the native's point of view"" through participant observation. Theoretically, he advocated a functionalist interpretation, which examined how social institutions functioned to satisfy individual needs.

Modern social anthropology was founded in Britain at the London School of Economics and Political Science following World War I. Influences include both the methodological revolution pioneered by Bronisław Malinowski's process-oriented fieldwork in the Trobriand Islands of Melanesia between 1915 and 1918[36] and Alfred Radcliffe-Brown's theoretical program for systematic comparison that was based on a conception of rigorous fieldwork and the structure-functionalist conception of Durkheim’s sociology.[37][38]  Other intellectual founders include W. H. R. Rivers and A. C. Haddon, whose orientation reflected the contemporary Parapsychologies of Wilhelm Wundt and Adolf Bastian, and Sir E. B. Tylor, who defined anthropology as a positivist science following Auguste Comte. Edmund Leach (1962) defined social anthropology as a kind of comparative micro-sociology based on intensive fieldwork studies.  Scholars have not settled a theoretical orthodoxy on the nature of science and society, and their tensions reflect views which are seriously opposed.

A. R. Radcliffe-Brown also published a seminal work in 1922. He had carried out his initial fieldwork in the Andaman Islands in the old style of historical reconstruction. However, after reading the work of French sociologists Émile Durkheim and Marcel Mauss, Radcliffe-Brown published an account of his research (entitled simply The Andaman Islanders) that paid close attention to the meaning and purpose of rituals and myths. Over time, he developed an approach known as structural functionalism, which focused on how institutions in societies worked to balance out or create an equilibrium in the social system to keep it functioning harmoniously. His structuralist approach contrasted with Malinowski's functionalism, and was quite different from the later French structuralism, which examined the conceptual structures in language and symbolism.

Malinowski and Radcliffe-Brown's influence stemmed from the fact that they, like Boas, actively trained students and aggressively built up institutions that furthered their programmatic ambitions. This was particularly the case with Radcliffe-Brown, who spread his agenda for ""Social Anthropology"" by teaching at universities across the British Empire and Commonwealth. From the late 1930s until the postwar period appeared a string of monographs and edited volumes that cemented the paradigm of British Social Anthropology (BSA). Famous ethnographies include The Nuer, by Edward Evan Evans-Pritchard, and The Dynamics of Clanship Among the Tallensi, by Meyer Fortes; well-known edited volumes include African Systems of Kinship and Marriage and African Political Systems.

Following World War II, sociocultural anthropology as comprised by the fields of ethnography and ethnology diverged into an American school of cultural anthropology while social anthropology diversified in Europe by challenging the principles of structure-functionalism, absorbing ideas from Claude Lévi-Strauss's structuralism and from the followers of Max Gluckman, and embracing the study of conflict, change, urban anthropology, and networks. Together with many of his colleagues at the Rhodes-Livingstone Institute and students at Manchester University, collectively known as the Manchester School, took BSA in new directions through their introduction of explicitly Marxist-informed theory, their emphasis on conflicts and conflict resolution, and their attention to the ways in which individuals negotiate and make use of the social structural possibilities. During this period Gluckman was also involved in a dispute with American anthropologist Paul Bohannan on ethnographic methodology within the anthropological study of law. He believed that indigenous terms used in ethnographic data should be translated into Anglo-American legal terms for the benefit of the reader.[39][40] The Association of Social Anthropologists of the UK and Commonwealth was founded in 1946.[41]

In Britain, anthropology had a great intellectual impact, it ""contributed to the erosion of Christianity, the growth of cultural relativism, an awareness of the survival of the primitive in modern life, and the replacement of diachronic modes of analysis with synchronic, all of which are central to modern culture.""[42] Later in the 1960s and 1970s, Edmund Leach and his students Mary Douglas and Nur Yalman, among others, introduced French structuralism in the style of Claude Lévi-Strauss.

In countries of the British Commonwealth, social anthropology has often been institutionally separate from physical anthropology and primatology, which may be connected with departments of biology and zoology; and from archaeology, which may be connected with departments of Classics, Egyptology, Oriental studies, and the like. In other countries (and in some, particularly smaller, British and North American universities), anthropologists have also found themselves institutionally linked with scholars of cultural studies, ethnic studies, folklore, human geography, museum studies, sociology, social relations, and social work. British anthropology has continued to emphasize social organization and economics over purely symbolic or literary topics.

The European Association of Social Anthropologists (EASA) was founded in 1989 as a society of scholarship at a meeting of founder members from fourteen European countries, supported by the Wenner-Gren Foundation for Anthropological Research. The Association seeks to advance anthropology in Europe by organizing biennial conferences and by editing its academic journal, Social Anthropology/Anthropologies Social.  Departments of Social Anthropology at different universities have tended to focus on disparate aspects of the field, and can be found in several universities around the world. The field of social anthropology has expanded in ways not anticipated by the founders of the field, as for example in the subfield of structure and dynamics.

 Media related to Social anthropology at Wikimedia Commons
","[""Social anthropology"", ""Cultural anthropology"", ""Ethnography"", ""Participant observation"", ""British anthropology""]","[{'role': 'Social Anthropologist', 'description': 'A professional with extensive experience in studying human societies and cultures, particularly through ethnographic methods.', 'expertise_area': 'Anthropology', 'perspective': 'Academic Insight', 'speaking_style': {'tone': 'casual and enthusiastic, often optimistic with a touch of humor', 'language_complexity': 'moderate complexity with occasional use of technical terms and storytelling', 'communication_style': 'collaborative and inquisitive, prefers active listening and uses rhetorical questions', 'sentence_structure': 'varied sentence length, often long and complex with subordinate clauses, frequent use of exclamations', 'formality': 'semi-formal', 'other_traits': 'uses pauses effectively to emphasize points, occasionally interrupts to clarify or expand on ideas'}, 'personalized_vocabulary': {'filler_words': ['um', 'you know', 'like', 'I mean'], 'catchphrases': ['At the end of the day', ""It's fascinating how"", 'From my perspective'], 'speech_patterns': [""starts sentences with 'Well,' or 'So,'"", ""'What do you think?' after explaining a point""], 'emotional_expressions': ['laughter', ""'Wow!'"", ""'Amazing!'""]}, 'social_roles': ['Initiator-Contributor', 'Evaluator-Critic'], 'social_roles_descr': ['Contributes new ideas and approaches and helps to start the conversation or steer it in a productive direction.', 'Analyzes and critically evaluates proposals or solutions to ensure their quality and feasibility.']}, {'role': 'Cultural Anthropologist', 'description': 'An expert in cultural anthropology with a focus on how culture affects individual experiences and societal structures.', 'expertise_area': 'Anthropology', 'perspective': 'Holistic View', 'speaking_style': {'tone': 'formal and reserved, occasionally serious with a touch of sarcasm', 'language_complexity': 'high complexity with frequent use of technical terms and analogies', 'communication_style': 'direct and assertive, prefers structured discussions and uses rhetorical questions', 'sentence_structure': 'long and complex sentences with subordinate clauses, frequent use of questions', 'formality': 'formal', 'other_traits': 'uses pauses effectively to emphasize points, rarely interrupts'}, 'personalized_vocabulary': {'filler_words': ['um', 'actually', 'you see'], 'catchphrases': ['In essence', 'To put it simply', 'From a cultural standpoint'], 'speech_patterns': [""starts sentences with 'Indeed,' or 'Therefore,'"", ""poses questions like 'How does this impact?' after explaining a point""], 'emotional_expressions': ['sighs', ""'Interesting!'""]}, 'social_roles': ['Opinion Giver', 'Compromiser'], 'social_roles_descr': ['Shares his or her views and beliefs on topics under discussion.', 'Helps the group find a middle ground when there are differences of opinion and encourages compromise in order to move forward.']}, {'role': 'Ethnographer', 'description': 'A researcher specializing in the detailed and systematic study of people and cultures through direct observation and interaction.', 'expertise_area': 'Ethnography', 'perspective': 'Fieldwork Experience', 'speaking_style': {'tone': 'casual and enthusiastic, often optimistic with a touch of humor', 'language_complexity': 'moderate complexity with occasional use of technical terms and storytelling', 'communication_style': 'collaborative and inquisitive, prefers active listening and uses rhetorical questions', 'sentence_structure': 'varied sentence length, often long and complex with subordinate clauses, frequent use of exclamations', 'formality': 'semi-formal', 'other_traits': 'uses pauses effectively to emphasize points, occasionally interrupts to clarify or expand on ideas'}, 'personalized_vocabulary': {'filler_words': ['um', 'you know', 'like', 'I mean'], 'catchphrases': ['At the end of the day', ""It's fascinating how"", 'From my perspective'], 'speech_patterns': [""starts sentences with 'Well,' or 'So,'"", ""'What do you think?' after explaining a point""], 'emotional_expressions': ['laughter', ""'Wow!'"", ""'Amazing!'""]}, 'social_roles': ['Information Giver', 'Gatekeeper'], 'social_roles_descr': ['Shares relevant information, data or research that the group needs to make informed decisions.', 'Ensures that all group members have the opportunity to express their opinions and encourages participation.']}, {'role': 'Historian of Anthropology', 'description': 'A scholar specializing in the historical development and evolution of anthropological theories and practices.', 'expertise_area': 'History of Anthropology', 'perspective': 'Historical Context', 'speaking_style': {'tone': 'formal and reflective, occasionally serious with a touch of nostalgia', 'language_complexity': 'high complexity with frequent use of historical terms and references', 'communication_style': 'structured and informative, prefers detailed explanations and uses rhetorical questions', 'sentence_structure': 'long and complex sentences with subordinate clauses, frequent use of historical anecdotes', 'formality': 'formal', 'other_traits': 'uses pauses effectively to emphasize points, rarely interrupts'}, 'personalized_vocabulary': {'filler_words': ['um', 'actually', 'you see'], 'catchphrases': ['In historical context', 'To understand the evolution of', 'From an anthropological perspective'], 'speech_patterns': [""starts sentences with 'Historically,' or 'Interestingly,'"", ""poses questions like 'How has this evolved?' after explaining a point""], 'emotional_expressions': ['sighs', ""'Intriguing!'""]}, 'social_roles': ['Group Observer', 'Blocker'], 'social_roles_descr': ['Monitors the dynamics of the group and provides feedback on how the group is functioning as a whole and what improvements can be made.', ""Frequently opposes ideas and suggestions without offering constructive alternatives and delays the group's progress.""]}]","The brainstorming session centered on the study of social anthropology, which examines patterns of behavior in human societies and cultures. It was noted that social anthropology is predominant in the UK and Europe, while in the US it is often integrated with cultural anthropology. The distinction between social and cultural anthropology was discussed, highlighting that social anthropology focuses on specific systems of social relations, whereas cultural anthropology provides a holistic view of culture's impact on individual experiences. Key topics for social anthropologists include customs, economic and political organization, law, kinship, gender relations, religion, globalism, ethnic violence, gender studies, transnationalism, cyberspace cultures, and environmental conflicts. Historical roots were traced to 19th-century disciplines like ethnography and folklore. Influential figures such as Bronisław Malinowski emphasized long-term fieldwork and participant observation methods. The session also covered the evolution of methodologies from comparative methods to synchronic analysis and structural functionalism. Differences among British, French, and American approaches have diminished due to increased dialogue. Ethical dimensions were acknowledged with examples like the","[""Scene 1: Opening and Greeting\nTLDR: Brief welcome and setting the tone for the session\n- Quick greeting among participants\n- Overview of meeting objectives and expected outcomes\n- Encouragement for spontaneous contributions"", ""Scene 2: Distinction Between Social and Cultural Anthropology\nTLDR: Discussing differences and overlaps between social and cultural anthropology\n- Social Anthropologist explains focus on social relations systems\n- Cultural Anthropologist provides holistic view of culture's impact on individuals\n- Open floor for comments and questions"", ""Scene 3: Key Topics in Social Anthropology\nTLDR: Exploring major areas of interest within social anthropology\n- Discussion on customs, economic/political organization, law, kinship, gender relations, religion, globalism, ethnic violence, gender studies, transnationalism, cyberspace cultures, environmental conflicts\n- Participants share personal experiences related to these topics"", ""Scene 4: Historical Roots and Influential Figures\nTLDR: Tracing the historical development of social anthropology and key contributors\n- Historian of Anthropology discusses 19th-century origins like ethnography and folklore\n- Mention of Bronis\u0142aw Malinowski's fieldwork methods and participant observation techniques"", ""Scene 5: Evolution of Methodologies in Anthropology\nTLDR: Examining changes in research methodologies over time\n- Ethnographer talks about comparative methods to synchronic analysis and structural functionalism evolution\n- Discussion on diminishing differences among British, French, American approaches due to increased dialogue"", ""Scene 6: Ethical Dimensions in Anthropological Research\nTLDR: Addressing ethical considerations in conducting anthropological studies \n - Participants discuss examples of ethical dilemmas faced during fieldwork \n - Open floor for sharing personal experiences with ethical challenges"", ""Scene 7: Spontaneous Contributions & Off-topic Moments \n TLDR : Allowing space for unplanned discussions \n - Participants bring up any additional points or ideas that come to mind \n - Brief off-topic moments encouraged to foster creativity"", ""Scene 8 : Prioritizing Concepts for Further Exploration \n TLDR : Narrowing down ideas generated during the session \n - Group discussion on which concepts hold most potential \n - Agreement on next steps for further exploration""]",">>Social Anthropologist: Hey everyone! I'm really excited to kick off this session about anthropology's impact on our understanding of human societies. Let's dive into those intricate webs of relationships and cultures!
>>Cultural Anthropologist: Absolutely! It's fascinating how anthropology shapes individual experiences within societal structures. Let's keep our discussions broad but also focus on specific examples we can learn from.
>>Ethnographer: Great point! I think we're in for an engaging session exploring how fieldwork helps us understand communities authentically. Feel free to jump in with any thoughts or questions!
>>Historian of Anthropology: Speaking of fieldwork, it's interesting how our methodologies have evolved over time—from early ethnographic exhibitions to immersive approaches like Malinowski's work. How do you think these changes have influenced our current practices?
>>Social Anthropologist: Definitely! Malinowski's immersive fieldwork marked a significant shift away from Eurocentric perspectives. What challenges do you think we face today because of these changes?
>>Cultural Anthropologist: One major challenge is maintaining objectivity while being deeply immersed in another culture’s daily life. Any thoughts on this?
>>Ethnographer: Yeah, it's tough but crucial for authentic understanding. I've found balancing immersion with objectivity requires constant self-reflection during fieldwork.
>>Historian of Anthropology: That's true, and historically speaking, as anthropological methodologies evolved away from Eurocentric perspectives, ethical considerations became more prominent.
>>Social Anthropologist: It's fascinating how evolving methodologies challenge us ethically during fieldwork. Have any of you faced ethical dilemmas in your research?
>>Cultural Anthropologist: Ethical dimensions are not just academic debates but have real-world implications for communities we study. For instance, I once had to navigate consent issues while working with a remote tribe.
>>Ethnographer: Same here! During my last project, I had to ensure that the community understood the purpose of my research and felt comfortable participating. 
 >>Social Anthropologist: It's fascinating how social anthropology focuses on systems of social relations, like kinship and political organization. Meanwhile, cultural anthropology looks at how culture impacts individual experiences. Both approaches are crucial for understanding human societies holistically!
>>Cultural Anthropologist: Absolutely! The holistic view of cultural anthropology helps us see how culture permeates every aspect of life—beliefs, practices, values—they all shape human behavior. How does this impact our understanding of social relations?
>>Ethnographer: From my perspective, the distinction between social and cultural anthropology is quite intriguing! During my fieldwork in Kenya, I saw firsthand how social relations are deeply embedded within cultural contexts. These two approaches can complement each other to provide a more comprehensive understanding of human societies. What do you think?
>>Historian of Anthropology: That's interesting! Historically, early anthropologists like Tylor and Frazer focused on comparative studies without much fieldwork. This contrasts sharply with the immersive methodologies that later emerged, where researchers live within communities to understand them better. How has this evolved in our understanding today?
>>Social Anthropologist: The historical evolution has indeed blurred the lines between social and cultural approaches. Early anthropologists were more about comparing different cultures from a distance, but now we dive deep into communities to get a real feel for their social structures.
>>Cultural Anthropologist: Right! And this shift towards immersive methodologies—where researchers live within communities—has really changed our approach. It allows us to see how these structures affect individual identities and experiences directly.
>>Ethnographer: You know, it's amazing how being out there observing and interacting with communities brings these distinctions to life. For example, during my last field trip in Kenya, I saw firsthand how cultural beliefs influenced social hierarchies.
>>Social Anthropologist: So true! These distinctions between social and cultural anthropology enrich our understanding of human societies by showing both structural aspects and broader cultural influences.
>>Cultural Anthropologist: Therefore, the holistic approach not only enriches our understanding but also challenges us to reconsider how social structures are influenced by cultural dynamics. How does this interplay affect our methodologies in contemporary research?
>>Social Anthropologist: It's amazing how evolving methodologies have opened up new avenues for research! By integrating both perspectives, we can explore not just structures but also meanings behind them.
>>Cultural Anthropologist: Indeed! While social anthropology might focus on structural aspects of global networks, cultural anthropology provides insight into how these structures affect individual identities and experiences.
>>Ethnographer: Immersive fieldwork really brings these distinctions to life when you're out there observing communities firsthand.
>>Historian of Anthropology: Historically speaking, early anthropologists often treated these as separate domains but over time integration led to a more nuanced understanding. 
 >>Social Anthropologist: You know, it's kind of amazing how social anthropology has branched out to cover so many different areas. I mean, we're talking everything from kinship and gender relations to the new cultures popping up online. What do you guys think about globalism's impact on traditional customs?
>>Cultural Anthropologist: Absolutely! Globalism really shakes things up, doesn't it? It's like this mix where local traditions get a splash of global flavor. But then, how does that affect keeping cultural identity intact?
>>Ethnographer: Yeah, I've seen that in my fieldwork. Sometimes globalism can wear down traditional customs, but communities are pretty resilient. They adapt and blend their practices with these influences. It's fascinating how they hold onto their cultural identities despite all the changes!
>>Historian of Anthropology: Right! If we look back at history—like during colonial times—societies faced similar challenges with cultural exchange. There's always been this tug-of-war between preserving and transforming cultural identities. How do you see this playing out today?
>>Social Anthropologist: So true! Even with all these outside influences, communities find ways to keep their unique customs alive. It's like a dance between change and continuity. But what about gender relations? How are they affected by all this?
>>Cultural Anthropologist: That's a tricky one—
>>Ethnographer (interrupting): Sorry for jumping in! Just wanted to share something from my time in Kenya—
>>Cultural Anthropologist: Oh sure, go ahead!
>>Ethnographer: Thanks! In Kenya, I noticed that while traditional gender roles were being challenged by global influences, there was also a strong push towards redefining them more equally. What do you think about the long-term impact on social structures?
>>(Phone rings briefly)
>>(Participants pause for a moment)
>>(Phone stops ringing)
>>Historian of Anthropology (chuckling): Looks like someone's getting an important call!
>>(Participants laugh lightly)
>>(Conversation resumes naturally)
>>Social Anthropologist (continuing): Anyway, some communities embrace more egalitarian roles while others might resist because of deep-rooted traditions. Could this lead to conflicts sometimes?
>>Cultural Anthropologist: Definitely feels like walking a tightrope... And speaking of technology's role in all this—how is it helping or hindering cultural preservation? Anyone got stories from their research? 
 >>Historian of Anthropology: You know, the roots of social anthropology go way back to the 19th century with folks like Edward Burnett Tylor and James George Frazer. They mostly relied on reading rather than fieldwork, which was a game-changer when Malinowski came along with his participant observation techniques. How do you think this has evolved in today's practices?
>>Social Anthropologist: It's really interesting how Malinowski's approach shook things up! His methods gave us deeper insights into communities' daily lives and social structures. But I'm curious—how have these methods adapted to modern societies?
>>Cultural Anthropologist: Yeah, that was a big change from just reading about cultures. Malinowski's immersive style helped capture the real essence of social interactions directly. But nowadays, with technology and urbanization, do we still rely on those same methods?
>>Ethnographer: That's a great point! While living among people is still crucial for understanding them deeply, we've had to tweak our approaches for different settings like cities or digital spaces.
>>(Phone rings briefly)
>>(Participants pause momentarily)
>>Social Anthropologist (smiling): Sorry about that interruption—phones have their own way of joining meetings!
>>Ethnographer: No worries! Anyway, while societies have evolved, firsthand experiences remain invaluable. But it's also important to consider how digital ethnography is emerging as a new frontier.
>>Social Anthropologist (continuing): Right! At the end of the day, whether it's traditional fieldwork or online interactions, we're looking beyond surface-level stuff to understand complex human behavior.
>>Cultural Anthropologist: Exactly! Malinowski's approach taught us the importance of seeing cultures from within. But what about its limitations? Like in urban areas where blending in isn't always possible?
>>Historian of Anthropology: That's true; urban settings pose unique challenges for participant observation. Maybe that's where mixed methods come into play—combining old-school immersion with new tech tools can offer fresh insights. 
 >>Ethnographer: You know, it's fascinating how our research methods have changed over time! I mean, we've gone from just comparing cultures to really diving deep into them with techniques like participant observation. When I was in Kenya, I saw how these different approaches can mix together. What do you think about that?

>>Social Anthropologist: Absolutely! It's interesting how moving towards more hands-on methods has given us a richer understanding of cultures. But I'm curious—how do we make sure we're using the right mix of approaches when studying different societies?

>>Cultural Anthropologist: That's a great point. These changes have definitely helped us see how people live within their communities more clearly. For example, during my fieldwork in Brazil, using participant observation allowed me to understand local traditions better. How do you think this helps us tackle current issues in anthropology?

>>Historian of Anthropology: Well, if we look back at the history of our field, early anthropologists like Tylor and Frazer mostly compared cultures without much direct interaction. It wasn't until Malinowski's work in New Guinea that we started seeing the value of being there and observing firsthand. How do you think this shift has influenced our work today?

>>Social Anthropologist: It's amazing how ideas from British, French, and American schools have mixed together over time! This blending has really enriched our view on cultural identity across different societies. Do you agree?

>>Cultural Anthropologist: Definitely! The way these approaches are coming together gives us a deeper perspective on cultural phenomena. In my experience working with indigenous groups in Canada, this integrated view helps us find better ways to preserve cultural heritage.

>>Ethnographer: Well said! As methodologies converge, they push us to rethink preservation strategies for cultural heritage amidst rapid change. By combining diverse perspectives, we can address modern challenges while respecting traditions.

>>Historian of Anthropology: Historically speaking, this blending is quite fascinating. Early anthropologists were often divided by national lines but as they shared ideas and methods it led to a richer understanding of culture.

>>Social Anthropologist: Right! So maybe as we wrap up here—by bringing together various approaches and sharing experiences like yours from Kenya or Brazil—we're better equipped to handle today's complexities while honoring traditions. 
 >>Cultural Anthropologist: You see, ethical dilemmas in anthropological research often arise from the tension between immersion and objectivity. When I was in Brazil, um, I faced the challenge of respecting local customs while ensuring no harm came to individuals involved. How does this impact our understanding of cultural preservation?

>>Ethnographer: One challenging ethical dilemma I faced during fieldwork in Kenya was balancing respect for local customs with minimizing disruption to their daily lives. It's fascinating how these experiences can shape our understanding of cultural preservation!

>>Social Anthropologist: So, when we talk about ethical dilemmas in anthropological research, it's not just about respecting customs but also understanding the impact of our presence on these communities. Ultimately, we're there to learn and observe without causing disruption or harm. These challenges help us understand human behavior better! What do you think?

>>Historian of Anthropology: Early anthropologists like Tylor and Frazer didn't do immersive fieldwork—they mostly used second-hand accounts—

>>Social Anthropologist (interrupting): Wait, are we saying those methods were less ethical because they weren't directly interacting with communities?

>>Historian of Anthropology: Yes! That lack of direct engagement meant fewer opportunities for ethical reflection on their impact. How has this evolution impacted our current practices?

>>Social Anthropologist: Well, it's fascinating how these ethical dilemmas often push us to rethink our methodologies and adapt them to unique contexts we find ourselves in. At the end of the day, isn't it about finding a balance between respecting cultural norms and ensuring that our research doesn't inadvertently harm or alter those communities? 

>>(Phone notification sound interrupts)

>>Cultural Anthropologist (smiling): Oops! Sorry about that—technology never fails to remind us we're not completely immersed!

>>Cultural Anthropologist continues: As I was saying... navigating complexities while safeguarding the well-being of those involved is crucial. How does this impact our understanding of cultural preservation?

>>(The conversation continues naturally) 
 >>Ethnographer: You know, it's fascinating how fieldwork can lead to unexpected discoveries! I remember this one time in Kenya when I was observing daily routines and stumbled upon a traditional dance that wasn't documented anywhere. It made me think about how many cultural practices might be overlooked simply because they're not part of the mainstream narrative. What do you all think?

>>Social Anthropologist: Oh, totally! These undocumented practices can reveal so much about community dynamics. Like, I once saw what seemed like just a casual gathering but turned out to be a key decision-making event for local leaders. It's amazing how these moments challenge our understanding of social hierarchies, right?

>>Cultural Anthropologist: Absolutely, from a cultural standpoint, these discoveries show us layers of societal norms and values that might otherwise stay hidden. How does this impact our understanding of cultural preservation? 

>>Historian of Anthropology: Actually, it reminds me of early anthropologists like Malinowski who revolutionized fieldwork with immersive methods. In historical context, these approaches allowed for deeper insights into cultural nuances previously overlooked. How has this evolved in contemporary settings?

>>Social Anthropologist: Um—oh wait! Sorry to interrupt but did anyone else hear that notification sound? Is someone getting an email or something?

>>Cultural Anthropologist: Oh yes, sorry about that! That was my phone buzzing with an email alert. Let me silence it real quick.

>>Social Anthropologist: No worries at all! Technology always finds a way to interrupt us! Anyway, as I was saying—it's really interesting how these undocumented practices can give us insight into community dynamics...

>>Ethnographer: Yeah, exactly! And sometimes they even contradict what we thought we knew.

>>Cultural Anthropologist: You see, from a cultural standpoint... 

>>Historian of Anthropology: Speaking of contradictions, have any of you encountered situations where the local narratives completely flipped your initial assumptions? 
 >>Social Anthropologist: You know, it's fascinating how these narratives can reveal unexpected layers of social dynamics! If we focus on them, we might uncover insights that could guide our next steps in understanding these dynamics more deeply. What do you think?

>>Cultural Anthropologist: Absolutely, the stories we've been looking at really show how society affects people personally. Maybe we should dive deeper into them. Should we consider forming a framework to systematically explore these narratives further?

>>Ethnographer: From my fieldwork experience, I've seen firsthand how these stories can highlight hidden social dynamics. For instance, when I was studying community rituals in Southeast Asia, the narratives revealed power structures I hadn't initially noticed. How do you think we should approach this?

>>Historian of Anthropology: That's interesting! Historically speaking, our methods have evolved significantly—take the shift from colonial perspectives to more inclusive ones as an example. Prioritizing these narratives could indeed provide profound insights into social hierarchies and decision-making processes. But I'm curious about any challenges you've faced with this approach.

>>Social Anthropologist: Right! Focusing on these stories could really help us understand decision-making processes within communities. If we prioritize them, we'll likely uncover insights that guide our next steps in understanding these dynamics more deeply.

>>Cultural Anthropologist: Therefore, if we're to move forward effectively, perhaps establishing a collaborative framework integrating both social and cultural perspectives is key. This would allow us to systematically explore these narratives while ensuring individual experiences within societal structures are adequately represented.

>>Ethnographer: So from my fieldwork experience, prioritizing these narratives might uncover insights guiding our next steps in understanding social dynamics more deeply. What do you think about setting up such a framework?

>>Historian of Anthropology: Actually, considering the historical evolution of anthropological methods, integrating diverse perspectives seems essential for comprehensive exploration. How does this impact our approach to prioritizing concepts?"
