Title,Article,Tags,Personas,Summary,Meeting_Plan,Meeting
The effects of the war were more dramatic in the South. Tens of thousands of slaves escaped to British lines throughout the South, causing dramatic losses to slaveholders and disrupting cultivation and harvesting of crops. For instance, South Carolina was estimated to have lost about 25,000 slaves to flight, migration, or death which amounted to a third of its slave population.
During the war, the British commanders attempted to weaken the Patriots by issuing proclamations of freedom to their slaves. In the November 1775 document known as Dunmore's Proclamation Virginia royal governor, Lord Dunmore recruited Black men into the British forces with the promise of freedom, protection for their families, and land grants. Some men responded and briefly formed the British Ethiopian Regiment. Historian David Brion Davis explains the difficulties with a policy of wholesale arming of the slaves:

But England greatly feared the effects of any such move on its own West Indies, where Americans had already aroused alarm over a possible threat to incite slave insurrections. The British elites also understood that an all-out attack on one form of property could easily lead to an assault on all boundaries of privilege and social order, as envisioned by radical religious sects in Britain's seventeenth-century civil wars.
Davis underscores the British dilemma: ""Britain, when confronted by the rebellious American colonists, hoped to exploit their fear of slave revolts while also reassuring the large number of slave-holding Loyalists and wealthy Caribbean planters and merchants that their slave property would be secure"". The Americans, however, accused the British of encouraging slave revolts, with the issue becoming one of the 27 colonial grievances.

The existence of slavery in the American colonies had attracted criticism from both sides of the Atlantic as many could not reconcile the existence of the institution with the egalitarian ideals espoused by leaders of the Revolution. British writer Samuel Johnson wrote ""how is it we hear the loudest yelps for liberty among the drivers of the Negroes?"" in a text opposing the grievances of the colonists. Referring to this contradiction, English abolitionist Thomas Day wrote in a 1776 letter that if there be an object truly ridiculous in nature, it is an American patriot, signing resolutions of independency with the one hand, and with the other brandishing a whip over his affrighted slaves. Thomas Jefferson unsuccessfully attempted to include a section in the Declaration of Independence which asserted that King George III had ""forced"" the slave trade onto the colonies. Despite the turmoil of the period, African-Americans contributed to the foundation of an American national identity during the Revolution. Phyllis Wheatley, an African-American poet, popularized the image of Columbia to represent America.
The 1779 Philipsburg Proclamation expanded the promise of freedom for Black men who enlisted in the British military to all the colonies in rebellion. British forces gave transportation to 10,000 slaves when they evacuated Savannah and Charleston, carrying through on their promise. They evacuated and resettled more than 3,000 Black Loyalists from New York to Nova Scotia, Upper Canada, and Lower Canada. Others sailed with the British to England or were resettled as freedmen in the West Indies of the Caribbean. But slaves carried to the Caribbean under control of Loyalist masters generally remained slaves until British abolition of slavery in its colonies in 1833–1838. More than 1,200 of the Black Loyalists of Nova Scotia later resettled in the British colony of Sierra Leone, where they became leaders of the Krio ethnic group of Freetown and the later national government. Many of their descendants still live in Sierra Leone, as well as other African countries.


Effects of the revolution

After the Revolution, genuinely democratic politics became possible in the former American colonies. The rights of the people were incorporated into state constitutions. Concepts of liberty, individual rights, equality among men and hostility toward corruption became incorporated as core values of liberal republicanism. The new United States government was empowered to undertake its own project of territorial expansion and settler colonialism. The greatest challenge to the old order in Europe was the challenge to inherited political power and the democratic idea that government rests on the consent of the governed. The example of the first successful revolution against a European empire, and the first successful establishment of a republican form of democratically elected government, provided a model for many other colonial peoples who realized that they too could break away and become self-governing nations with directly elected representative government.


Interpretations
Interpretations vary concerning the effect of the Revolution. Historians such as Bernard Bailyn, Gordon Wood, and Edmund Morgan view it as a unique and radical event which produced deep changes and had a profound effect on world affairs, such as an increasing belief in the principles of the Enlightenment. These were demonstrated by a leadership and government that espoused protection of natural rights, and a system of laws chosen by the people. John Murrin, by contrast, argues that the definition of ""the people"" at that time was mostly restricted to free men who passed a property qualification.
Gordon Wood states:

The American Revolution was integral to the changes occurring in American society, politics and culture .... These changes were radical, and they were extensive .... The Revolution not only radically changed the personal and social relationships of people, including the position of women, but also destroyed aristocracy as it'd been understood in the Western world for at least two millennia.
Edmund Morgan has argued that, in terms of long-term impact on American society and values:

The Revolution did revolutionize social relations. It did displace the deference, the patronage, the social divisions that had determined the way people viewed one another for centuries and still view one another in much of the world. It did give to ordinary people a pride and power, not to say an arrogance, that have continued to shock visitors from less favored lands. It may have left standing a host of inequalities that have troubled us ever since. But it generated the egalitarian view of human society that makes them troubling and makes our world so different from the one in which the revolutionists had grown up.


Inspiring other independence movements and revolutions

The first shot of the American Revolution at the Battle of Lexington and Concord is referred to as the ""shot heard 'round the world"". The Revolutionary War victory not only established the United States as the first modern constitutional republic, but marked the transition from an age of monarchy to a new age of freedom by inspiring similar movements worldwide. The American Revolution was the first of the Atlantic Revolutions: followed most notably by the French Revolution, the Haitian Revolution, and the Latin American wars of independence. Aftershocks contributed to rebellions in Ireland, the Polish–Lithuanian Commonwealth, and the Netherlands.
The U.S. Constitution, drafted shortly after independence, remains the world's oldest written constitution, and has been emulated by other countries, in some cases verbatim. Some historians and scholars argue that the subsequent wave of independence and revolutionary movements has contributed to the continued expansion of democratic government; 144 countries, representing two-third of the world's population, are full or partially democracies of same form.
The Dutch Republic, also at war with Britain, was the next country after France to sign a treaty with the United States, on October 8, 1782. On April 3, 1783, Ambassador Extraordinary Gustaf Philip Creutz, representing King Gustav III of Sweden, and Benjamin Franklin, signed a Treaty of Amity and Commerce with the U.S.
The Revolution had a strong, immediate influence in Great Britain, Ireland, the Netherlands, and France. Many British and Irish Whigs in Parliament spoke glowingly in favor of the American cause. In Ireland, the Protestant minority who controlled Ireland demanded self-rule. Under the leadership of Henry Grattan, the Irish Patriot Party forced the reversal of mercantilist prohibitions against trade with other British colonies. The King and his cabinet in London could not risk another rebellion, and so made a series of concessions to the Patriot faction in Dublin. Armed volunteer units of the Protestant Ascendancy were set up ostensibly to protect against an invasion from France. As had been in colonial America, so too in Ireland now the King no longer had a monopoly of lethal force.
For many Europeans, such as the Marquis de Lafayette, who later were active during the era of the French Revolution, the American case along with the Dutch Revolt (end of the 16th century) and the 17th century English Civil War, was among the examples of overthrowing an old regime. The American Declaration of Independence influenced the French Declaration of the Rights of Man and of the Citizen of 1789. The spirit of the Declaration of Independence led to laws ending slavery in all the Northern states and the Northwest Territory, with New Jersey the last in 1804. States such as New Jersey and New York adopted gradual emancipation, which kept some people as slaves for more than two decades longer.


Status of African Americans

During the revolution, the contradiction between the Patriots' professed ideals of liberty and the institution of slavery generated increased scrutiny of the latter.: 235 : 105–106 : 186  As early as 1764, the Boston Patriot leader James Otis, Jr. declared that all men, ""white or black"", were ""by the law of nature"" born free.: 237  Anti-slavery calls became more common in the early 1770s. In 1773, Benjamin Rush, the future signer of the Declaration of Independence, called on ""advocates for American liberty"" to oppose slavery.: 239  Slavery became an issue that had to be addressed.  As historian Christopher L. Brown put it, slavery ""had never been on the agenda in a serious way before,"" but the Revolution ""forced it to be a public question from there forward.""
In the late 1760s and early 1770s, several colonies, including Massachusetts and Virginia, attempted to restrict the slave trade, but were prevented from doing so by royally appointed governors.: 245  In 1774, as part of a broader non-importation movement aimed at Britain, the Continental Congress called on all the colonies to ban the importation of slaves, and the colonies passed acts doing so.: 245 
In the first two decades after the American Revolution, state legislatures and individuals took actions to free slaves, in part based on revolutionary ideals. Northern states passed new constitutions that contained language about equal rights or specifically abolished slavery; some states, such as New York and New Jersey, where slavery was more widespread, passed laws by the end of the 18th century to abolish slavery by a gradual method. By 1804, all the northern states had passed laws outlawing slavery, either immediately or over time.
No southern state abolished slavery. However, individual owners could free their slaves by personal decision. Numerous slaveholders who freed their slaves cited revolutionary ideals in their documents; others freed slaves as a reward for service. Records also suggest that some slaveholders were freeing their own mixed-race children, born into slavery to slave mothers. The number of free Blacks as a proportion of the Black population in the upper South increased from less than 1 percent to nearly 10 percent between 1790 and 1810 as a result of these actions. Nevertheless, slavery continued in the South, where it became a ""peculiar institution"", setting the stage for future sectional conflict between North and South over the issue.: 186–187 
Thousands of free Blacks in the northern states fought in the state militias and Continental Army. In the south, both sides offered freedom to slaves who would perform military service. Roughly 20,000 slaves fought in the American Revolution.


Status of American women

The status of women during the Revolutionary War can be illustrated by the interchange of gender, sexuality, citizenship, and class. While women were entering a period in which they found themselves gaining more identity within society, it was clear that they were still very much considered under men as their role in society remained being a good wife and mother. Their clothes, the way they responded to their husband, and listened to their husband, was incredibly important in the social sphere. Having a woman who was dressed well for her role as a good wife and mother as well as fitting the social role, was a symbol of not only status, but a family devoted to the republic. As they continued to nurture social and political partnerships, their role in enabling the success of the revolution emphasized their changing role in society – leading to the post-revolutionary reconstruction of gender ideology.

In addition, the democratic ideals of the Revolution inspired changes in the roles of women. Patriot women married to Loyalists who left the state could get a divorce and obtain control of the ex-husband's property. Abigail Adams expressed to her husband, the president, the desire of women to have a place in the new republic: I desire you would remember the Ladies, and be more generous and favourable to them than your ancestors. Do not put such unlimited power into the hands of the Husbands.

As discussions rose regarding the rights of man post Revolutionary war, women began pushing a debate for the rights of women as well. One particular woman, Mary Wallstonecraft, would pioneer the discussion regarding women's rights, and push those like Abigail Adams to begin expressing the desire to want a larger place in society. Wollstonecraft was an English writer, philosopher, and advocate for women's rights, and would publish the Vindication of the Rights of Woman (1792) – challenging the idea that rights should only be granted to men. As one of the first major advocates and foundational figures for women's rights and gender equality in a time where women were considered inferior to men, Wollstonecraft focused on equal education and social opportunities for women – believing that if women were educated the same as men, they would gain autonomy over their own lives and better contribute to society. Her radical ideas would give ground to the conversation in allowing women to be bearers of rights alongside men – that while the rights of man were taking on a new meaning post-revolutionary America, it was time for the rights of women too. Inspired by the radical feminism in her work, women in the early republic would change their views on marriage, education, participation in public life, and autonomy – pushing them to lay the groundwork for the later women's suffrage movement, education opportunities, property rights, and more.
However, this new sense of independence and dignity did not come with ease, as a gender hierarchy would continue to bind what it meant for women to have rights during the post-revolutionary era. Women in the early republic had many limitations – they could not vote, hold political office, earn fair wages, lacked opportunities for higher education and certain professions, and most importantly, own property independently of their husbands. In addition, they held little legal powers in subjects such as divorce, property rights, and child custody. A central legal concept that reinforced these restrictions was coverture, a central legal doctrine that limited women's lives in all aspects – making a woman's legal identity a part of their husband's and essentially making them subordinates. The denial of things like property rights to women through coverture would play an important role in why they were denied many other rights, as property was a symbol of individual liberty and empowerment during the post-revolutionary era.
So while women would eventually begin gaining new rights such as increased access to education and limited property and voting rights – much of their lives still depended on men.  This stark contrast of men's versus women's rights comes from the deeply established gender roles from philosophical theories like the Scottish Theory –  stating that the rights of women were simply benefits in life. The emphasis of women's rights was on duty and obligation, instead of liberty and choice – confining women to the traditional role of wife and mother. On the other hand, men's rights were heavily inspired by Locke, as it emphasized equality, individual autonomy, and the expansion of personal freedoms. This is evident in their rights to property, participation in government, and autonomy. So while women were becoming bearers of rights, the foundation and philosophy of those given rights differed vastly and continued to stay limited.
The early national period of America would continue to struggle with the concept of rights and equality, as women also faced the notion that women should be under the dominance of men – carried by a resurgence of Christian beliefs. Women were blamed for the ""Fall of Man"", in reference to Eve and Adam in the Bible.  So while women were beginning to bear rights, the type of language that was being used when talking about the rights of women was done with care and hesitance. This Christian worldview has viewed women as inferior to men long before the early republic, however it is important to note the influence it would continue to place onto their rights as they began to oppose traditional gender roles.
It is also important to note that for more than thirty years, however, the 1776 New Jersey State Constitution gave the vote to ""all inhabitants"" who had a certain level of wealth, including unmarried women and blacks (not married women because they could not own property separately from their husbands), until in 1807, when that state legislature passed a bill interpreting the constitution to mean universal white male suffrage, excluding paupers.


Loyalist expatriation

Tens of thousands of Loyalists left the United States following the war; Philip Ranlet estimates 20,000, while Maya Jasanoff estimates as many as 70,000. Some migrated to Britain, but the great majority received land and subsidies for resettlement in British colonies in North America, especially Quebec (concentrating in the Eastern Townships), Prince Edward Island, and Nova Scotia. Britain created the colonies of Upper Canada (Ontario) and New Brunswick expressly for their benefit, and the Crown awarded land to Loyalists as compensation for losses in the United States. Nevertheless, approximately eighty-five percent of the Loyalists stayed in the United States as American citizens, and some of the exiles later returned to the U.S. Patrick Henry spoke of the issue of allowing Loyalists to return as such: ""Shall we, who have laid the proud British lion at our feet, be frightened of its whelps?"" His actions helped secure return of the Loyalists to American soil.


Commemorations

The American Revolution has a central place in the American memory as the story of the nation's founding. It is covered in the schools, memorialized by two national holidays, Washington's Birthday in February and Independence Day in July, and commemorated in innumerable monuments. George Washington's estate at Mount Vernon was one of the first national pilgrimages for tourists and attracted 10,000 visitors a year by the 1850s.
The Revolution became a matter of contention in the 1850s in the debates leading to the American Civil War (1861–1865), as spokesmen of both the Northern United States and the Southern United States claimed that their region was the true custodian of the legacy of 1776. The United States Bicentennial in 1976 came a year after the American withdrawal from the Vietnam War, and speakers stressed the themes of renewal and rebirth based on a restoration of traditional values.
Today, more than 100 battlefields and historic sites of the American Revolution are protected and maintained by the government. The National Park Service alone manages and maintains more than 50 battlefield parks and many other sites such as Independence Hall that are related to the Revolution. The private American Battlefield Trust uses government grants and other funds to preserve almost 700 acres of battlefield land in six states, and the ambitious private recreation/restoration/preservation/interpretation of over 300 acres of pre-1790 Colonial Williamsburg was created in the first half of the 20th century for public visitation.


See also
Timeline of the American Revolution
International relations (1648–1814)
List of George Washington articles
List of films about the American Revolution
List of plays and musicals about the American Revolution
List of television series and miniseries about the American Revolution
Museum of the American Revolution
Influence of the American Revolution on the French Revolution


Notes


References


Sources


Further reading


Reference works


Surveys of the era


Specialized studies


Historiography


Primary sources


External links
American Revolution, US National Park Service website portal
American Independence Teaching with Historic Places uses historic places in National Parks and the National Park Service's National Register of Historic Places to enliven history, social studies, geography, civics, and other subjects
Ben Franklin's World, podcast on early America, sponsored by the Colonial Williamsburg Foundation. <www.benfranklinsworld.com>
Library of Congress Guide to the American Revolution
""Hessians:"" German Soldiers in the American Revolutionary War. Academic blog with original German sources, English translations, and commentary.
Museum of the American Revolution
Revolution! The Atlantic World Reborn, explores the transformations in the world's politics from 1763 to 1815, with particular attention to three revolutions in America, France, and Haiti. Linking the attack on monarchism and aristocracy to the struggle against slavery, it at how freedom, equality, and sovereignty of the people became universal goals. New-York Historical Society
132 historic photographs dealing with the personalities, monuments, weapons and locations of the American Revolution; these are pre-1923 and out of copyright.
Pictures of the Revolutionary War: Select Audiovisual Records, National Archives and Records Administration images, including non-military events and portraits
The Democratic Revolution of the Enlightenment. Legacy of the struggle for independence and democracy.
