Title,Article,Tags,Personas,Summary,Meeting_Plan,Meeting
In the winter of 1775, the Americans invaded northeastern Quebec under generals Benedict Arnold and Richard Montgomery, expecting to rally sympathetic colonists there. The attack was a failure; many Americans were killed, captured, or died of smallpox.
In March 1776, aided by the fortification of Dorchester Heights with cannons recently captured at Fort Ticonderoga, the Continental Army led by George Washington forced the British to evacuate Boston. The revolutionaries now fully controlled all thirteen colonies and were ready to declare independence. There still were many Loyalists, but they were no longer in control anywhere by July 1776, and all of the Royal officials had fled.


Creating new state constitutions

Following the Battle of Bunker Hill in June 1775, the Patriots had control of Massachusetts outside Boston's city limits, and the Loyalists suddenly found themselves on the defensive with no protection from the British army. In each of the Thirteen Colonies, American patriots overthrew their existing governments, closed courts, and drove out British colonial officials. They held elected conventions and established their own legislatures, which existed outside any legal parameters established by the British. New constitutions were drawn up in each state to supersede royal charters. They proclaimed that they were now states, no longer colonies.
On January 5, 1776, New Hampshire ratified the first state constitution. In May 1776, Congress voted to suppress all forms of crown authority, to be replaced by locally created authority. New Jersey, South Carolina, and Virginia created their constitutions before July 4. Rhode Island and Connecticut simply took their existing royal charters and deleted all references to the crown. The new states were all committed to republicanism, with no inherited offices. On May 26, 1776, John Adams wrote James Sullivan from Philadelphia warning against extending the franchise too far:

Depend upon it, sir, it is dangerous to open so fruitful a source of controversy and altercation, as would be opened by attempting to alter the qualifications of voters. There will be no end of it. New claims will arise. Women will demand a vote. Lads from twelve to twenty one will think their rights not enough attended to, and every man, who has not a farthing, will demand an equal voice with any other in all acts of state. It tends to confound and destroy all distinctions, and prostrate all ranks, to one common level[.]
The resulting constitutions in states, including those of Delaware, Maryland, Massachusetts, New York, and Virginia featured:

Property qualifications for voting and even more substantial requirements for elected positions (though New York and Maryland lowered property qualifications)
Bicameral legislatures, with the upper house as a check on the lower
Strong governors with veto power over the legislature and substantial appointment authority
Few or no restraints on individuals holding multiple positions in government
The continuation of state-established religion
In Pennsylvania, New Jersey, and New Hampshire, the resulting constitutions embodied:

universal manhood suffrage, or minimal property requirements for voting or holding office (New Jersey enfranchised some property-owning widows, a step that it retracted 25 years later)
strong, unicameral legislatures
relatively weak governors without veto powers, and with little appointing authority
prohibition against individuals holding multiple government posts
The radical provisions of Pennsylvania's constitution lasted 14 years. In 1790, conservatives gained power in the state legislature, called a new constitutional convention, and rewrote the constitution. The new constitution substantially reduced universal male suffrage, gave the governor veto power and patronage appointment authority, and added an upper house with substantial wealth qualifications to the unicameral legislature. Thomas Paine called it a constitution unworthy of America.


Second Continental Congress

In April 1776, the North Carolina Provincial Congress issued the Halifax Resolves explicitly authorizing its delegates to vote for independence. By June, nine Provincial Congresses supported independence from Britain, and Pennsylvania, Delaware, Maryland, and New York followed. Richard Henry Lee was instructed by the Virginia legislature to propose independence, and he did so on June 7, 1776.


Declaration of Independence

Gathered at Pennsylvania State House, later renamed Independence Hall, in Philadelphia, 56 of the nation's Founding Fathers, representing America's Thirteen Colonies, unanimously adopted and issued to King George III the Declaration of Independence, which was drafted largely by Thomas Jefferson and presented by the Committee of Five, which was charged with authoring it. The Congress struck several provisions of Jefferson's draft, and then adopted it unanimously on July 4. The Declaration embodied the political philosophies of liberalism and republicanism, rejected monarchy and aristocracy, and famously proclaimed that ""all men are created equal"". With the issuance of the Declaration of Independence, each colony began operating as independent and sovereign states. The next step was to form a union to facilitate international relations and alliances.
On November 5, 1777, the Congress approved the Articles of Confederation and Perpetual Union and sent it to each state for ratification. The Congress immediately began operating under the Articles' terms, providing a structure of shared sovereignty during prosecution of the Revolutionary War and facilitating international relations and alliances. The Articles were fully ratified on March 1, 1781. At that point, the Continental Congress was dissolved and a new government of the United States in Congress Assembled took its place the following day, on March 2, 1782, with Samuel Huntington leading the Congress as presiding officer.


Defending the revolution


British return: 1776–1777

According to British historian Jeremy Black, the British had significant advantages, including a highly trained army, the world's largest navy, and an efficient system of public finance that could easily fund the war. However, they seriously misunderstood the depth of support for the American Patriot position, misinterpreting the situation as merely a large-scale riot. The British government believed that they could overawe the Americans by sending a large military and naval force:

Convinced that the Revolution was the work of a full few miscreants who had rallied an armed rabble to their cause, they expected that the revolutionaries would be intimidated .... Then the vast majority of Americans, who were loyal but cowed by the terroristic tactics ... would rise up, kick out the rebels, and restore loyal government in each colony.
In the Siege of Boston, Washington forced the British out of the city in the spring of 1776, and neither the British nor the Loyalists controlled any significant areas. The British, however, were amassing forces at their naval base at Halifax, Nova Scotia. They returned in force in July 1776, landing in New York and defeating Washington's Continental Army in August at the Battle of Brooklyn. This gave the British control of New York City and its strategic harbor. Following that victory, they requested a meeting with representatives from Congress to negotiate an end to hostilities.
A delegation including John Adams and Benjamin Franklin met British admiral Richard Howe on Staten Island in New York Harbor on September 11 in what became known as the Staten Island Peace Conference. Howe demanded that the Americans retract the Declaration of Independence, which they refused to do, and negotiations ended. The British then seized New York City and nearly captured Washington's army. They made the city their main political and military base of operations, holding it until November 1783. The city became the destination for Loyalist refugees and a focal point of Washington's intelligence network.

The British also took New Jersey, pushing the Continental Army into Pennsylvania. Washington crossed the Delaware River back into New Jersey in a surprise attack in late December 1776 and defeated the Hessian and British armies at Trenton and Princeton, thereby regaining control of most of New Jersey. The victories gave an important boost to Patriots at a time when morale was flagging, and they have become iconic events of the war.
In September 1777, in anticipation of a coordinated attack by the British Army on the revolutionary capital of Philadelphia, the Continental Congress was forced to depart Philadelphia temporarily for Baltimore, where they continued deliberations.
In 1777, the British sent Burgoyne's invasion force from Canada south to New York to seal off New England. Their aim was to isolate New England, which the British perceived as the primary source of agitation. Rather than move north to support Burgoyne, the British army in New York City went to Philadelphia in a major case of mis-coordination, capturing it from Washington. The invasion army under Burgoyne was much too slow and became trapped in northern New York state. It surrendered after the Battles of Saratoga in October 1777. From early October 1777 until November 15, a siege distracted British troops at Fort Mifflin, Philadelphia, Pennsylvania, and allowed Washington time to preserve the Continental Army by safely leading his troops to harsh winter quarters at Valley Forge.


Prisoners

On August 23, 1775, George III declared Americans to be traitors to the Crown if they took up arms against royal authority. There were thousands of British and Hessian soldiers in American hands following their surrender at the Battles of Saratoga. Lord Germain took a hard line, but the British generals on American soil never held treason trials, and instead treated captured American soldiers as prisoners of war. The dilemma was that tens of thousands of Loyalists were under American control and American retaliation would have been easy. The British built much of their strategy around using these Loyalists. The British maltreated the prisoners whom they held, resulting in more deaths to American prisoners of war than from combat operations. At the end of the war, both sides released their surviving prisoners.


American alliances after 1778

The capture of a British army at Saratoga encouraged the French to formally enter the war in support of Congress, and Benjamin Franklin negotiated a permanent military alliance in early 1778; France thus became the first foreign nation to officially recognize the Declaration of Independence. On February 6, 1778, the United States and France signed the Treaty of Amity and Commerce and the Treaty of Alliance. William Pitt spoke out in Parliament urging Britain to make peace in America and to unite with America against France, while British politicians who had sympathized with colonial grievances now turned against the Americans for allying with Britain's rival and enemy.
The Spanish and the Dutch became allies of the French in 1779 and 1780 respectively, forcing the British to fight a global war without major allies, and requiring it to slip through a combined blockade of the Atlantic. Britain began to view the American war for independence as merely one front in a wider war, and the British chose to withdraw troops from America to reinforce the British colonies in the Caribbean, which were under threat of Spanish or French invasion. British commander Sir Henry Clinton evacuated Philadelphia and returned to New York City.  Washington intercepted him in the Battle of Monmouth Court House, the last major battle fought in the north. After an inconclusive engagement, the British retreated to New York City. The northern war subsequently became a stalemate, as the focus of attention shifted to the smaller southern theater.


1778–1783: the British move south

The British Royal Navy blockaded ports and held New York City for the duration of the war, and other cities for brief periods, but failed in their effort to destroy Washington's forces. The British strategy now concentrated on a campaign in the southern states. With fewer regular troops at their disposal, the British commanders saw the ""southern strategy"" as a more viable plan, as they perceived the south as strongly Loyalist with a large population of recent immigrants and large numbers of slaves who might be tempted to run away from their masters to join the British and gain their freedom.
Beginning in late December 1778, the British captured Savannah and controlled the Georgia coastline. In 1780, they launched a fresh invasion and took Charleston. A significant victory at the Battle of Camden meant that royal forces soon controlled most of Georgia and South Carolina. The British set up a network of forts inland, hoping that the Loyalists would rally to the flag. Not enough Loyalists turned out, however, and the British had to fight their way north into North Carolina and Virginia with a severely weakened army. Behind them, much of the territory that they had already captured dissolved into a chaotic guerrilla war, fought predominantly between bands of Loyalists and American militia, which negated many of the gains that the British had previously made.


Surrender at Yorktown (1781)

The British army under Cornwallis marched to Yorktown, Virginia, where they expected to be rescued by a British fleet. The fleet did arrive, but so did a larger French fleet. The French were victorious in the Battle of the Chesapeake, and the British fleet returned to New York for reinforcements, leaving Cornwallis trapped. In October 1781, the British surrendered their second invading army of the war under a siege by the combined French and Continental armies commanded by Washington.


End of the war
Washington did not know if or when the British might reopen hostilities after Yorktown. They still had 26,000 troops occupying New York City, Charleston, and Savannah, together with a powerful fleet. The French army and navy departed, so the Americans were on their own in 1782–83. The American treasury was empty, and the unpaid soldiers were growing restive, almost to the point of mutiny or possible coup d'etat. Washington dispelled the unrest among officers of the Newburgh Conspiracy in 1783, and Congress subsequently created the promise of a five years bonus for all officers.
Historians continue to debate whether the odds were long or short for American victory. John E. Ferling says that the odds were so long that the American victory was ""almost a miracle"". On the other hand, Joseph Ellis says that the odds favored the Americans, and asks whether there ever was any realistic chance for the British to win. He argues that this opportunity came only once, in the summer of 1776, and Admiral Howe and his brother General Howe ""missed several opportunities to destroy the Continental Army .... Chance, luck, and even the vagaries of the weather played crucial roles."" Ellis's point is that the strategic and tactical decisions of the Howes were fatally flawed because they underestimated the challenges posed by the Patriots. Ellis concludes that, once the Howe brothers failed, the opportunity ""would never come again"" for a British victory.
Support for the conflict had never been strong in Britain, where many sympathized with the Americans, but now it reached a new low. King George wanted to fight on, but his supporters lost control of Parliament and they launched no further offensives in America on the eastern seaboard.


Paris peace treaty

During negotiations in Paris, the American delegation discovered that France supported American independence but no territorial gains, hoping to confine the new nation to the area east of the Appalachian Mountains. The Americans opened direct secret negotiations with London, cutting out the French. British Prime Minister Lord Shelburne was in charge of the British negotiations, and he saw a chance to make the United States a valuable economic partner, facilitating trade and investment opportunities. The US obtained all the land east of the Mississippi River, including southern Canada, but Spain took control of Florida from the British. It gained fishing rights off Canadian coasts, and agreed to allow British merchants and Loyalists to recover their property. Prime Minister Shelburne foresaw highly profitable two-way trade between Britain and the rapidly growing United States, which did come to pass. The blockade was lifted and American merchants were free to trade with any nation anywhere in the world.
The British largely abandoned their Indigenous allies, who were not a party to this treaty and did not recognize it until they were defeated militarily by the United States. However, the British did sell them munitions and maintain forts in American territory until the Jay Treaty of 1795.
Losing the war and the Thirteen Colonies was a shock to Britain. The war revealed the limitations of Britain's fiscal-military state when they discovered that they suddenly faced powerful enemies with no allies, and they were dependent on extended and vulnerable transatlantic lines of communication. The defeat heightened dissension and escalated political antagonism to the King's ministers.  The King went so far as to draft letters of abdication, although they were never delivered. Inside Parliament, the primary concern changed from fears of an over-mighty monarch to the issues of representation, parliamentary reform, and government retrenchment. Reformers sought to destroy what they saw as widespread institutional corruption, and the result was a crisis from 1776 to 1783. The crisis ended after 1784 confidence in the British constitution was restored during the administration of Prime Minister William Pitt.


Finance

Britain's war against the Americans, the French, and the Spanish cost about £100 million. The Treasury borrowed 40 percent of the money that it needed. Britain had a sophisticated financial system based on the wealth of thousands of landowners who supported the government, together with banks and financiers in London. In London the British had relatively little difficulty financing their war, keeping their suppliers and soldiers paid, and hiring tens of thousands of German soldiers.
In sharp contrast, Congress and the American states had no end of difficulty financing the war. In 1775, there was at most 12 million dollars in gold in the colonies, not nearly enough to cover current transactions, let alone finance a major war. The British made the situation much worse by imposing a tight blockade on every American port, which cut off almost all trade. One partial solution was to rely on volunteer support from militiamen and donations from patriotic citizens. Another was to delay actual payments, pay soldiers and suppliers in depreciated currency, and promise that it would be made good after the war. Indeed, the soldiers and officers were given land grants in 1783 to cover the wages that they had earned but had not been paid during the war. The national government did not have a strong leader in financial matters until 1781, when Robert Morris was named Superintendent of Finance of the United States. Morris used a French loan in 1782 to set up the private Bank of North America to finance the war. He reduced the civil list, saved money by using competitive bidding for contracts, tightened accounting procedures, and demanded the national government's full share of money and supplies from the individual states.
Congress used four main methods to cover the cost of the war, which cost about 66 million dollars in specie (gold and silver). Congress made issues of paper money, known colloquially as ""Continental Dollars"", in 1775–1780 and in 1780–1781. The first issue amounted to 242 million dollars. This paper money would supposedly be redeemed for state taxes, but the holders were eventually paid off in 1791 at the rate of one cent on the dollar. By 1780, the paper money was so devalued that the phrase ""not worth a Continental"" became synonymous with worthlessness. The skyrocketing inflation was a hardship on the few people who had fixed incomes, but 90 percent of the people were farmers and were not directly affected by it. Debtors benefited by paying off their debts with depreciated paper. The greatest burden was borne by the soldiers of the Continental Army whose wages were usually paid late and declined in value every month, weakening their morale and adding to the hardships of their families.
Beginning in 1777, Congress repeatedly asked the states to provide money, but the states had no system of taxation and were of little help. By 1780, Congress was making requisitions for specific supplies of corn, beef, pork, and other necessities, an inefficient system which barely kept the army alive. Starting in 1776, the Congress sought to raise money by loans from wealthy individuals, promising to redeem the bonds after the war. The bonds were redeemed in 1791 at face value, but the scheme raised little money because Americans had little specie, and many of the rich merchants were supporters of the Crown. The French secretly supplied the Americans with money, gunpowder, and munitions to weaken Great Britain; the subsidies continued when France entered the war in 1778, and the French government and Paris bankers lent large sums to the American war effort. The Americans struggled to pay off the loans; they ceased making interest payments to France in 1785 and defaulted on installments due in 1787. In 1790, however, they resumed regular payments on their debts to the French, and settled their accounts with the French government in 1795 when James Swan, an American banker, assumed responsibility for the balance of the debt in exchange for the right to refinance it at a profit.


Concluding the revolution

The war ended in 1783 and was followed by a period of prosperity. The national government was still operating under the Articles of Confederation and settled the issue of the western territories, which the states ceded to Congress. American settlers moved rapidly into those areas, with Vermont, Kentucky, and Tennessee becoming states in the 1790s.
However, the national government had no money either to pay the war debts owed to European nations and the private banks, or to pay Americans who had been given millions of dollars of promissory notes for supplies during the war. Nationalists led by Washington, Alexander Hamilton, and other veterans feared that the new nation was too fragile to withstand an international war, or even the repetition of internal revolts such as the Shays's Rebellion of 1786 in Massachusetts. They convinced Congress to call the Philadelphia Convention in 1787. The Convention adopted a new Constitution which provided for a republic with a much stronger national government in a federal framework, including an effective executive in a check-and-balance system with the judiciary and legislature. The Constitution was ratified in 1788, after a fierce debate in the states over the proposed new government. The new administration under President George Washington took office in New York in March 1789. James Madison spearheaded Congressional legislation proposing amendments to the Constitution as assurances to those cautious about federal power, guaranteeing many of the inalienable rights that formed a foundation for the revolution. Rhode Island was the final state to ratify the Constitution in 1790, the first ten amendments were ratified in 1791 and became known as the United States Bill of Rights.


National debt

The national debt fell into three categories after the American Revolution. The first was the $12 million owed to foreigners, mostly money borrowed from France. There was general agreement to pay the foreign debts at full value. The national government owed $40 million and state governments owed $25 million to Americans who had sold food, horses, and supplies to the Patriot forces. There were also other debts which consisted of promissory notes issued during the war to soldiers, merchants, and farmers who accepted these payments on the premise that the new Constitution would create a government that would pay these debts eventually.
The war expenses of the individual states added up to $114 million, compared to $37 million by the central government. In 1790, Congress combined the remaining state debts with the foreign and domestic debts into one national debt totaling $80 million at the recommendation of first Secretary of the Treasury Alexander Hamilton. Everyone received face value for wartime certificates, so that the national honor would be sustained and the national credit established.


Ideology and factions
The population of the Thirteen States was not homogeneous in political views and attitudes. Loyalties and allegiances varied widely within regions and communities and even within families, and sometimes shifted during the Revolution.


Ideology behind the revolution

The American Enlightenment was a critical precursor of the American Revolution. Chief among the ideas of the American Enlightenment were the concepts of natural law, natural rights, consent of the governed, individualism, property rights, self-ownership, self-determination, liberalism, republicanism, and defense against corruption. A growing number of American colonists embraced these views and fostered an intellectual environment which led to a new sense of political and social identity.


Liberalism

