Title,Article,Tags,Personas,Summary,Meeting_Plan,Meeting
Food Culture,"1800s: Martineau · Tocqueville · Marx · Spencer · Le Bon  · Ward · Pareto · Tönnies · Veblen · Simmel · Durkheim · Addams · Mead · Weber · Du Bois · Mannheim · Elias

The sociology of food is the study of food and how it relates to the history, progression, and future development of society. Studies includes the production and consumption of food as well as its medical, spiritual and ethical applications.

The aspect of food distribution in societies can be examined through the analysis of the changes in the food supply chain. Globalization in particular has significant effects on the food supply chain by enabling scale effect in the food distribution industry.[1]

Scale effects resulting from centralized acquisition purchase centres in the food supply chain favor large players such as big retailers or distributors in the food distribution market. This is due to the fact that they can utilize their strong market power and financial advantage over smaller players. Having both strong market power and greater access to the financial credit market meant that they can impose barriers to entry and cement their position in the food distribution market. This would result in a food distribution chain that is characterized by large players on one end and small players choosing niche markets to operate in on the other end. The existence of smaller players in specialized food distribution markets could be attributed to their shrinking market share and their inability to compete with the larger players due to the scale effects. Through this mechanism, globalization has displaced smaller role players.[2]
Another mechanism troubling the specialized food distribution markets is the ability of distribution chains to possess their own brand. Stores with their own brand are able to combat price wars between competitors by lowering the price of their own brand, thus making consumers more likely to purchase goods from them.[3]

In the early stages of humanity, food served the sole purpose of nurishment and survival. Food was a source of energy obtained by hunting and gathering, a labor intensive process, which required early humans to eat a calorie rich diet.

These developments eventually lead to agriculture, which also goes into the labor for food and the economic part of the sociology of food. As the years went on, food become more and more of a way to bring cultures and people together. In many cultures, food is what brings people together. This carried for centuries. From the homo-sapiens hunting and gathering, to the colonists to the New World sharing a feast with the Native Americans (that has been revived as a tradition named Thanksgiving[4]), to the popularization of restaurants/eating out in the last several decades and the togetherness that comes with eating; these developments now show communication and connectivity relating to food. According to sociologists, there are different groups of food that are divided up by their purpose and meaning. There are cultural super foods, which are the staples for a culture. There are prestige foods, which reflect economic status, and body image food which is mainly consumed for the betterment of the body. Sympathetic foods are eaten for an acclaimed desirable property, like a superstition.  Lastly, there are physiological foods, which are consumed for a specific health reason (like what a pregnant woman eats for a healthy pregnancy). These different categories help researchers and sociologists study culture in the perspective of food. It often shows how food grows, molds and changes with society. For example, if someone believes in homeopathy, that would fall under the sympathetic foods or physiologic foods. This is because they are consumed for their properties and beliefs of what it could do. Another example of one of these categories of foods would be caviar or oysters for the prestige foods because they are often more expensive and those who consume it and purchase it do so to show their socioeconomic status, or SES.

Through the lens of a symbolic interactionist, there are many symbols that have to do with the sociology of food. Food, in many cultures, brings people together and connects them on multiple different levels. For example, the tradition of eating with the family around the table. It represents togetherness with one and another and communication. Food itself could symbolize something greater than what it is. In America, fast food could represent the busy family that needs a quick dinner to some. To others, however, it could display the “McDonaldization Theory” which centers around the idea of, specifically American, consumption. Another example of how the sociology of food can be symbolized would be making the food from scratch. This definitely goes along with the family. With other theories of sociology, conflict theory also pertains to the sociology of food. As mentioned before, food was first and foremost used for nourishment and means of survival. Due to this, that can fall under conflict theory. The roles of the hunter and gather meant that early humans had to fight and forage to survive. The conflict could also display the survival of the fittest, because there was a conflict for getting food and nourishment, only the ones who were able to prevail and provide nourishment for themselves and their families survived. This evolved into what it is today, with people having jobs to make a living for themselves, which goes into food and nourishment.[5]

Eating disorders are symbolic of the sociology of food.[6] They represent how much forced control (or the lack thereof) someone can have over themselves about something so essential for survival.[7][8] Eating disorders do not limit themselves to Anorexia. These disorders include bulimia and Binge Eating Disorder (binge eating) as well.[9] People with such disorders often use food as a reward.[10] In other cases they see food as something to avoid, even though they need it for survival.[11] The relationship that people share with their food is always varied and is a very complex topic.[12] From a sociological standpoint, media has a lot to do with this.[13][14] Not only does this have to with the sociology of food, but it has to do with how media represents society as a whole. Both men and women, (but majorly women) [15] see targeted and inaccurate representations of ""the perfect body"",[16] leading them to want to have a body more like the one considered normal. In disorders like Anorexia Nervosa or Bulimia Nervosa/Bulimia, patients have an intense fear of gaining weight and consuming calories. These disorders go on to represent the damaged relationship people share with their food and their weight, and how it is always attached to negativity in popular media. Inaccurate representation leads people to focus more and more on their external appearance as opposed to them taking into consideration their absolute need for nourishment. 
The false image shown publicly of what a perfect body looks like and how it is affected by consuming as many calories as a person normally might, has led to Anorexia Nervosa being the mental health disorder with the highest mortality rate.[17] Many people in society and the way society is developing have what is called body dysmorphia. Body dysmorphia disorder is a mental health condition where a person spends a lot of time worrying about flaws in their appearance.[18] Body image has become a problem surrounding this topic as social media can show unrealistic standards related to eating issues/disorders and the sociology based on food consumption.

The fad of diets has been around for centuries,[19] but the obsession with being thin and slim only really began trending in mainstream media in the 1990s,[20] for example, through trends, such as heroin chic.[21][22] Historically, if a woman was large and plump, it showed that she was getting taken care of. It showed her wealth because she could afford to eat, as opposed to a peasant who did not have the luxury to readily available meals.[23] The desired woman was not stick thin. The notable change began in the 1920s era were the “boyish” figure became the most desired for a woman.[24] Later, going into the 1960s, models like Twiggy made headlines about how thin she was, and many women strived to be like her body type.[25] This carried on to the 1980s where dieting (like the South Beach Diet and Weight Watchers) grew in popularity, along with the popularization of working out and work out videos.[26][27] This was the start of mainstream dieting fads.[28] Among these, others like the Atkins diet, Jenny Craig, and paleo began to take popularity.[29][30] As of early-mid-2010s, other diets became mainstream. This included vegetarianism, dairy-free, veganism, raw diets, and gluten-free.[31][32] There are many reasons why someone would choose a certain type of diet: moral reasons, digestive issues, outside influence, or religious influence.[33][34] The similarities and changes in the modern diet or communities and the effect of globalization on food production and supply. An important factor mentioned states, from the effect of globalization on food production and supply to evolving cultural responses to food – including cooking and eating practices, the management of consumer anxieties, and concerns over obesity and the medicalization of food – the first part examines how changing food practices have shaped and are shaped by wider social trends.[35]

The evolution of the American diet and the resulting rise in obesity is a clear example on how food shapes society and daily life.[36] Due to the fast-paced lives that many Americans have, fast food and prepackaged foods with higher caloric density have grown in popularity.[37] The environment in which people with certain socioeconomic backgrounds live also heavily affect the type of food they consume,[38] as high-calorie and low-nutritional food tend to be cheaper and easier to find.[39] Lack of physical fitness is also a crucial aspect that is adding to the obesity epidemic.[40][41] Studies have found that a neighborhood's walkability and access to recreation activities is correlated with increased exercise[42]  and decreased risk of obesity.[43] There has been progress on combating America's obesity problem, with programs being put in place to help promote healthy eating and fitness.[44][45][46]
","[""Sociology of food"", ""Globalization and food supply chain"", ""Eating disorders and body image"", ""Cultural significance of food"", ""Diet trends and societal impact""]","[{'role': 'Sociologist', 'description': 'An expert in the sociology of food, focusing on cultural and societal impacts.', 'expertise_area': 'Sociology', 'perspective': 'Cultural Analysis', 'speaking_style': {'tone': 'casual and enthusiastic with a touch of humor', 'language_complexity': 'moderate complexity with use of metaphors and storytelling', 'communication_style': 'collaborative and inquisitive, often uses rhetorical questions', 'sentence_structure': 'varied sentence length with frequent use of exclamations and questions', 'formality': 'semi-formal', 'other_traits': 'uses pauses effectively to emphasize points'}, 'personalized_vocabulary': {'filler_words': ['you know', 'like', 'I mean'], 'catchphrases': ['food for thought', 'cultural melting pot'], 'speech_patterns': [""starts sentences with 'Interestingly,' or 'You see,'""], 'emotional_expressions': ['laughter', 'Wow!', 'Amazing!']}, 'social_roles': ['Coordinator', 'Encourager'], 'social_roles_descr': ['Connects the different ideas and suggestions of the group to ensure that all relevant aspects are integrated.', 'Provides positive feedback and praise to boost the morale and motivation of group members.']}, {'role': 'Nutritionist', 'description': 'A professional specializing in dietary trends and their impact on health and society.', 'expertise_area': 'Nutrition', 'perspective': 'Health and Societal Impact', 'speaking_style': {'tone': 'optimistic and engaging with a touch of seriousness', 'language_complexity': 'simple language with common terms, occasionally uses analogies', 'communication_style': 'direct and assertive, encourages feedback', 'sentence_structure': 'short and concise sentences, occasional use of questions for clarity', 'formality': 'informal', 'other_traits': 'uses rhythm in speech to maintain interest'}, 'personalized_vocabulary': {'filler_words': ['um', 'well', 'you know'], 'catchphrases': ['health is wealth', 'balanced diet'], 'speech_patterns': [""often starts with 'Let's consider,' or 'Think about this,'""], 'emotional_expressions': ['sighs when discussing challenges', ""enthusiastic 'Great!'""]}, 'social_roles': ['Information Giver', 'Standard Setter'], 'social_roles_descr': ['Shares relevant information, data or research that the group needs to make informed decisions.', 'Emphasizes the importance of adhering to certain norms and standards within the group to ensure quality and efficiency.']}, {'role': 'Cultural Anthropologist', 'description': 'A specialist in the cultural significance of food and its role in shaping societal norms.', 'expertise_area': 'Cultural Anthropology', 'perspective': 'Cultural Significance', 'speaking_style': {'tone': 'thoughtful and reflective with occasional humor', 'language_complexity': 'complex language with cultural references and analogies', 'communication_style': 'collaborative and exploratory, often poses open-ended questions', 'sentence_structure': 'long and complex sentences with subordinate clauses, frequent use of rhetorical devices', 'formality': 'semi-formal to formal', 'other_traits': 'uses pauses for dramatic effect, occasionally interrupts to clarify points'}, 'personalized_vocabulary': {'filler_words': ['actually', 'you see', 'perhaps'], 'catchphrases': ['cultural tapestry', 'food as identity'], 'speech_patterns': [""often begins with 'In essence,' or 'From a cultural perspective,'"", ""frequently uses 'Consider this,'""], 'emotional_expressions': ['chuckles when amused', ""exclaims 'Fascinating!'""]}, 'social_roles': ['Opinion Giver', 'Gatekeeper'], 'social_roles_descr': ['Shares his or her views and beliefs on topics under discussion.', 'Ensures that all group members have the opportunity to express their opinions and encourages participation.']}, {'role': 'Economist', 'description': 'An expert in analyzing the economic aspects of globalization and its impact on food supply chains.', 'expertise_area': 'Economics', 'perspective': 'Economic Analysis', 'speaking_style': {'tone': 'analytical and pragmatic with occasional sarcasm', 'language_complexity': 'technical language with industry jargon, uses data-driven examples', 'communication_style': 'assertive and informative, prefers structured arguments', 'sentence_structure': 'medium-length sentences with clear structure, frequent use of statistics', 'formality': 'formal', 'other_traits': 'uses rhetorical devices to emphasize points, rarely interrupts'}, 'personalized_vocabulary': {'filler_words': ['actually', ""let's see"", 'basically'], 'catchphrases': ['economic equilibrium', 'supply chain dynamics'], 'speech_patterns': [""often starts with 'From an economic standpoint,' or 'Analyzing the data,'"", ""frequently uses 'Let's break this down,'""], 'emotional_expressions': ['nods in agreement when discussing facts', ""exclaims 'Precisely!'""]}, 'social_roles': ['Evaluator-Critic', 'Blocker'], 'social_roles_descr': ['Analyzes and critically evaluates proposals or solutions to ensure their quality and feasibility.', ""Frequently opposes ideas and suggestions without offering constructive alternatives and delays the group's progress.""]}, {'role': 'Psychologist', 'description': 'A specialist in understanding eating disorders and body image issues, focusing on mental health impacts.', 'expertise_area': 'Psychology', 'perspective': 'Mental Health Analysis', 'speaking_style': {'tone': 'empathetic and supportive with a touch of seriousness', 'language_complexity': 'moderate complexity with psychological terminology and analogies', 'communication_style': 'collaborative and empathetic, encourages sharing experiences', 'sentence_structure': 'medium-length sentences with clear structure, occasional use of questions for engagement', 'formality': 'semi-formal', 'other_traits': 'uses pauses to allow reflection, occasionally repeats key points for emphasis'}, 'personalized_vocabulary': {'filler_words': ['well', 'you know', 'I guess'], 'catchphrases': ['mind over matter', 'body positivity'], 'speech_patterns': [""often starts with 'Let's explore,' or 'Consider this perspective,'"", ""frequently uses 'Reflect on this,'""], 'emotional_expressions': ['nods in understanding when discussing sensitive topics', ""exclaims 'Interesting!'""]}, 'social_roles': ['Harmonizer', 'Group Observer'], 'social_roles_descr': ['Mediates in conflicts and ensures that tensions in the group are reduced to promote a harmonious working environment.', 'Monitors the dynamics of the group and provides feedback on how the group is functioning as a whole and what improvements can be made.']}, {'role': 'Food Historian', 'description': 'An expert in the historical evolution of food practices and their societal impacts.', 'expertise_area': 'History', 'perspective': 'Historical Context', 'speaking_style': {'tone': 'informative and engaging with a touch of nostalgia', 'language_complexity': 'complex language with historical references and storytelling', 'communication_style': 'exploratory and narrative, often uses anecdotes', 'sentence_structure': 'long and descriptive sentences with varied structure, frequent use of historical examples', 'formality': 'semi-formal to formal', 'other_traits': 'uses rhetorical devices to draw connections between past and present, occasionally pauses for dramatic effect'}, 'personalized_vocabulary': {'filler_words': ['well', 'you know', ""let's see""], 'catchphrases': ['history repeats itself', 'culinary heritage'], 'speech_patterns': [""often starts with 'Historically speaking,' or 'In the past,'"", ""frequently uses 'Imagine this scenario,'""], 'emotional_expressions': ['smiles when discussing intriguing facts', ""exclaims 'Remarkable!'""]}, 'social_roles': ['Initiator-Contributor', 'Recorder'], 'social_roles_descr': ['Contributes new ideas and approaches and helps to start the conversation or steer it in a productive direction.', 'Documents the group decisions, ideas, and actions in order to have a reference for future discussions.']}]","The meeting focused on the sociology of food, exploring its historical and cultural significance, distribution mechanisms, and societal impacts. It was noted that globalization has reshaped food supply chains, favoring large distributors over smaller niche players due to scale effects and market power. The evolution from hunting and gathering to agriculture highlighted food's role in cultural connectivity, exemplified by traditions like Thanksgiving. Sociologists categorize foods based on their cultural significance, economic status reflection, health benefits, or superstitions. Symbolic interactionism views food as a connector within families and societies, while conflict theory relates it to survival struggles.

Eating disorders were discussed as symbolic of societal pressures regarding body image influenced by media portrayals. Historical shifts in beauty standards have impacted dieting trends from the 1920s onwards. The rise of various diets reflects moral, religious, or health motivations amid globalization's influence on food practices. The American diet's evolution has led to increased obesity rates due to fast-paced lifestyles and socioeconomic factors affecting food choices. Efforts are underway to address these issues through programs promoting healthy eating and physical activity.","[""Scene 1: Warm Welcome\nTLDR: Brief greetings and setting the tone for a casual catch-up.\n- Exchange quick hellos and light-hearted remarks\n- Set expectations for a relaxed and open discussion\n- Mention the meeting objectives briefly"", ""Scene 2: Food Culture Overview\nTLDR: Discuss the sociology of food, its cultural significance, and societal impacts.\n- Sociologist shares insights on food as a cultural connector\n- Cultural Anthropologist adds perspectives on traditions like Thanksgiving\n- Open floor for spontaneous thoughts or anecdotes"", ""Scene 3: Globalization and Food Supply Chains\nTLDR: Explore how globalization has reshaped food distribution mechanisms.\n- Economist discusses large distributors vs. niche players\n- Nutritionist comments on health implications of global supply chains\n- Allow room for personal experiences with local vs. global foods"", ""Scene 4: Eating Disorders and Body Image\nTLDR: Delve into societal pressures influencing eating disorders.\n- Psychologist explains media portrayals affecting body image\n- Participants share personal observations or stories related to dieting trends\n- Encourage empathetic dialogue and support"", ""Scene 5: Historical Evolution of Diet Trends\nTLDR: Examine historical shifts in beauty standards impacting diets.\n- Food Historian narrates changes from the 1920s onwards\n- Discussion on moral, religious, or health motivations behind diets today\n- Spontaneous contributions about current diet practices"", ""Scene 6: American Diet and Obesity Rates\nTLDR: Address socioeconomic factors affecting food choices leading to obesity.\n- Nutritionist highlights fast-paced lifestyles contributing to unhealthy eating habits\n- Economist provides data-driven analysis on economic influences \n - Open discussion on personal strategies for healthy living"", ""Scene 7: Programs Promoting Healthy Eating and Physical Activity \n TLDR : Share efforts underway to address dietary issues through various programs .\n - Psychologist talks about mental health benefits of physical activity \n - Participants discuss successful initiatives they know of \n - Opportunity for sharing ideas or suggestions"", ""Scene 8 : Casual Wrap-Up \n TLDR : Conclude with reflections , off-topic moments , and future catch-ups .\n - Reflect on key takeaways from the discussion \n - Allow brief off-topic conversations or humorous exchanges \n - Plan next casual catch-up meeting""]",">>Cultural Anthropologist: Hey there! You know, it's fascinating how food can be such a universal language, connecting us across cultures and histories. I mean, who doesn't love a good meal to break the ice? Just last week, I shared a traditional dish from my hometown with friends, and it sparked so many stories about their own culinary traditions. Let's keep this chat light and fun as we explore the cultural significance of our favorite dishes.
>>Sociologist: That's a great point! Food really is the ultimate cultural melting pot. Every dish has a story to tell about where it came from and who made it. I remember visiting Italy and learning how pasta shapes vary by region—each with its own history. Building on your idea, let's dive into these stories and see what they reveal about our cultures.
>>Nutritionist: Absolutely! And speaking of connections, I've noticed that certain foods bring people together but also impact health differently across cultures. For instance, my grandmother's hearty stew is comforting but not exactly heart-healthy if eaten too often! How do you all think these dishes affect society?
>>Economist: That's interesting! Building on what we've discussed about food as a connector, globalization has changed how we access these foods, impacting local cultures. When I traveled to Thailand, I saw firsthand how local markets are affected by larger distributors. It's fascinating yet challenging for small producers trying to maintain authenticity.
>>Psychologist: Great insights everyone! When we talk about food, it's not just about what we eat but how it affects our mental health and body image. For example, comfort foods can evoke nostalgia but also lead to emotional eating patterns. How do you think these aspects intertwine with cultural significance?
>>Food Historian: Historically speaking, food has always been a cornerstone of societal development. In ancient times, sharing meals was not just about sustenance but forging alliances and building communities—like the feasts during harvest festivals in medieval Europe that united villages. These practices continue to influence our modern culinary heritage in ways we might not even realize. 
 >>Sociologist: You know, food is like a cultural melting pot. It brings people together in ways that transcend language and borders. I mean, just think about how dishes evolve when they travel across cultures—it's amazing!

>>Cultural Anthropologist: Absolutely! Food is a big part of who we are and how we celebrate. Different cultures have unique rituals around meals. For instance, in Japan, the tea ceremony is not just about drinking tea; it's a whole experience that reflects harmony and respect.

>>Nutritionist: That's interesting! How do you think these cultural values influence dietary choices? Like, do traditional practices affect what people consider healthy?

>>Economist: From an economic standpoint, globalization has reshaped food supply chains, often favoring large distributors over smaller local players. This shift impacts cultural traditions by altering access to traditional foods and influencing dietary habits.

>>Psychologist: And speaking of influences, the psychological impact of food is profound. Media often portrays unrealistic standards that can lead to harmful behaviors and mental health issues. It's crucial we foster body positivity and awareness around these topics.

>>Food Historian: Historically speaking, communal feasts were about more than just sharing meals—they were opportunities for forging alliances and strengthening community ties. It's fascinating how those ancient practices mirror today's family gatherings where food still connects us deeply.

>>Sociologist: Exactly! Food isn't just about what we eat; it's a reflection of our values and beliefs. Think about how certain foods are tied to celebrations or rituals—like cake with birthdays! These traditions evolve but remain central to our social fabric.

>>Nutritionist: Right, but with the rise of fast food and prepackaged meals reshaping our diets, we're facing health issues like obesity. We need to balance convenience with nutrition to foster healthier communities.

>>Cultural Anthropologist: In essence, when we gather around the table for Thanksgiving or any other celebration, it's not just about the meal itself; it's about reaffirming connections to each other and shared history.

>>Psychologist: Let's explore this further—how can we encourage mindful eating practices amidst all these societal pressures? Maybe focusing on positive media representation could help combat distorted self-image issues.

>>Food Historian: Linking back to modern practices—just as medieval feasts showcased wealth and power through grand displays, today’s gatherings reflect personal values through choice of cuisine or even sustainable sourcing. 
 >>Economist: Globalization has indeed reshaped food supply chains by favoring large distributors over niche players. Analyzing the data, we see that these big players leverage their market power to dominate distribution channels, often sidelining smaller entities. This creates a dynamic where niche markets struggle to compete unless they carve out specialized roles. Perhaps smaller entities could focus on unique local products or sustainable practices to differentiate themselves.

>>Sociologist: Globalization has transformed our food supply chains into a cultural melting pot! It's like we're all sharing the same pantry now. But I wonder how this affects our local food traditions and identities. Are we losing something essential in the process?

>>Nutritionist: Well, let's consider the health implications of these global supply chains. While they offer variety, they often prioritize processed foods over fresh options, which can impact our health negatively. Think about it: a balanced diet is harder to maintain when local produce is overshadowed by imported goods.

>>Cultural Anthropologist: Globalization gives us many choices but also challenges our local food traditions. When global products overshadow local ones, are we not risking losing those unique culinary stories that define us?

>>Psychologist: When we lose touch with local foods, it can affect our mental health too. It might lead to feeling disconnected from cultural roots and identity, which can contribute to stress or anxiety.

>>Food Historian: Historically speaking, globalization has transformed our food supply chains in profound ways. Centuries ago, local markets thrived on regional produce, fostering unique culinary traditions and community bonds. Today, however, the dominance of large distributors often overshadows these local gems.

>>Economist: That's right! And if niche players focus on specialized roles or sustainable practices as I mentioned earlier, they might find new opportunities within this global landscape.

>>Sociologist: Exactly! This makes me think about how much we're trading off for convenience and variety in terms of losing those unique flavors and traditions that define us.

>>Nutritionist: Promoting local produce not only supports healthier diets but also strengthens community ties. It's like investing in both our health and cultural heritage at the same time.

>>Cultural Anthropologist: Maybe we should explore ways to balance this global-local dynamic better? Ensuring that while we enjoy diverse cuisines brought by globalization, we don't lose sight of preserving our unique culinary narratives.

>>Psychologist: That's a great point! How about considering initiatives that encourage people to reconnect with their cultural roots through food?

>>Food Historian: We could look into supporting educational programs that highlight the importance of preserving culinary heritage alongside embracing global diversity.

>>Economist: To wrap up, let's summarize some key insights we've discussed today—supporting niche players through specialization and sustainability; promoting local produce for health benefits; balancing global diversity with preserving culinary heritage—and propose exploring strategies for supporting local producers within global supply chains. 
 >>Psychologist: Let's talk about how media portrayals can really mess with our body image and mental health. We're constantly bombarded with these unrealistic standards that skew our self-perception. Ads are always pushing extreme diets or fitness regimes, promising quick results.

>>Sociologist: It's crazy how dieting trends keep changing, right? I know someone who tried every diet just to fit in. How do we balance this with maintaining our cultural identity?

>>Nutritionist: That's a great point! I've seen friends get caught up in fads too, forgetting about their overall well-being. We need to focus on balanced diets rather than chasing unrealistic ideals. What do you think is the best way to promote that?

>>Cultural Anthropologist: From a cultural standpoint, food reflects our identity and values. People often adopt diets aligning with their heritage but feel pressured by mainstream trends. These choices definitely affect self-image and mental health.

>>Sociologist: Food can be comforting but also anxiety-inducing. I've seen folks feel guilty after indulging in favorite meals because of societal pressures. We're caught between embracing who we are and what society expects us to be!

>>Nutritionist: Exactly! The pressure to conform leads people to extreme diets, neglecting their health. It's like chasing an illusion! We should nourish both body and mind.

>>Psychologist: The media's beauty standards can really mess with our self-esteem, leading to harmful comparisons and eating disorders. Supporting each other in embracing body positivity is key.

>>Food Historian: Historically speaking, the obsession with body image has evolved significantly over time. In the past, fuller figures were celebrated as signs of prosperity! Today’s pressures demand unattainable ideals reflecting broader societal shifts.

>>Economist: From an economic perspective, extreme dieting trends disrupt food supply chains significantly. When consumers chase fads, it spikes demand for specific products causing price volatility. 
 >>Food Historian: It's interesting how diet trends have changed over time. In the 1920s, people started preferring a 'boyish' figure instead of plumpness, which was seen as healthy before. This shift wasn't just about looks; it reflected changes in society, like women's roles and economic shifts.
>>Sociologist: That's a great point about media influence on diets! It's also worth noting how globalization plays a role in shaping these trends. Moral and religious motivations add even more layers to our dietary choices today.
>>Nutritionist: I agree with you both; the pursuit of thinness often leads to diets that aren't balanced or healthy. We need to focus on promoting balanced diets for long-term health rather than chasing trends.
>>Cultural Anthropologist: Absolutely, diet trends show how our cultural values change over time. Globalization has made some diets more accessible while others become niche—creating an interplay between tradition and modernity.
>>Psychologist: Media's portrayal of ideal body types can lead to unrealistic expectations and impact mental health. These standards can push people towards extreme diets that aren't sustainable or healthy.
>>Economist: Changing consumer demands due to diet trends can affect food prices and supply chains. It's important to consider these impacts when discussing diet trends.

>>Sociologist: Wow, it's amazing how our food choices reflect deeper societal values and anxieties. Isn't it intriguing how globalization has influenced these trends?

>>Nutritionist: Think about this: the pursuit of thinness often leads to diets that aren't sustainable or healthy. We need to focus on health over trends by promoting a balanced diet for long-term well-being.

>>Cultural Anthropologist: From a cultural perspective, you see that the evolution of diet trends is not merely about aesthetics but also reflects deeper societal values and anxieties. Globalization has made some diets more accessible while others become niche—creating an interplay between tradition and modernity.

>>Psychologist: Reflecting on media's portrayal of ideal body types often leads to unrealistic expectations impacting mental health significantly. These standards can drive individuals towards extreme diets which might not be sustainable or healthy in the long run. 
 >>Nutritionist: Let's talk about how our busy lives lead to unhealthy eating habits. When we're always on the go, it's easy to grab whatever's convenient, which often means poor food choices. Health is wealth, and finding ways to fit balanced diets into our hectic schedules is crucial.
>>Sociologist: Absolutely! Our food choices reflect not just our lifestyles but also socioeconomic factors. It's fascinating how these choices can tell us so much about who we are and where we come from.
>>Cultural Anthropologist: From a cultural perspective, food isn't just about sustenance; it's tied to identity and tradition. Our fast-paced lifestyle often makes us overlook healthier options rooted in culinary heritage. Embracing these traditions could help us eat more mindfully.
>>Economist: Right, and data shows that lower-income areas often have limited access to fresh produce, leading people to rely on cheaper, high-calorie foods. This economic constraint directly impacts health outcomes.
>>Psychologist: And this has mental health implications too. Choosing convenience over nutrition can lead to feelings of guilt and anxiety, worsening body image issues. Balancing our diets can really improve overall well-being.
>>Sociologist: Exactly! It's not just about convenience but also access and affordability. If we could promote local produce and make healthier options more accessible, it would bridge some of these gaps.
>>Nutritionist: We can make small changes like meal prepping or choosing healthier snacks that fit into our busy schedules. These adjustments can really make a difference.
>>Cultural Anthropologist: Integrating traditional practices into modern lifestyles could create a more balanced approach to eating that honors both heritage and health.
>>Food Historian: Historically speaking, the evolution of the American diet is fascinating! Early on, food was mainly about survival; as societies developed, it became a symbol of prosperity and cultural identity. The rise in obesity rates today can be traced back to shifts where convenience trumps tradition.
>>Economist: Economic constraints are major drivers of unhealthy eating habits when fresh produce is scarce in lower-income areas; people resort to cheaper calorie-dense foods due to systemic issues rooted in economic inequality.
>>Psychologist: Prioritizing convenience over nutrition leads to negative emotions like guilt and anxiety which exacerbate body image issues creating mental health challenges beyond just food choices; finding balance in diets improves overall well-being significantly. 
 >>Nutritionist: Programs that promote healthy eating can really make a difference in people's lives. They help improve individual health and bring communities together.
>>Sociologist: Food programs are like a cultural melting pot, blending traditions with modern practices. Sharing nutrition knowledge enriches diets and strengthens social bonds.
>>Cultural Anthropologist: Absolutely! These initiatives often revive traditional recipes, fostering a sense of identity and continuity.
>>Economist: That's a great point about community well-being. From an economic perspective, these programs also boost local economies by increasing demand for fresh produce.
>>Nutritionist: Think about this: programs that integrate physical activity with healthy eating can really amplify their impact. When people move more, they often feel better mentally and physically, which makes sticking to a balanced diet easier. It's like a positive cycle!
>>Psychologist: Let's explore the mental health benefits of physical activity. Engaging in regular exercise can significantly reduce stress and anxiety, creating a positive feedback loop that encourages healthier eating habits. It's mind over matter!
>>(Phone notification sound)
>>Food Historian (silencing phone): Sorry about that—forgot to silence my phone.
>>(Everyone chuckles briefly)
>>Sociologist: As I was saying... when we talk about these programs—
>>(Psychologist's phone rings)
>>(Psychologist quickly silences the phone)
>>(Everyone settles down)
>>Sociologist: Okay... these programs connect people through shared experiences and traditions.
>>(Economist checks watch)
>>(Economist nods at Sociologist to continue)
>>Sociologist: How can we ensure these initiatives are inclusive and celebrate the diversity of food cultures while promoting health? 
 >>Food Historian: You know, sharing meals has always been a big part of bringing people together. Think about those ancient feasts where everyone in the village would gather around to eat and tell stories. Those traditions have changed over time but still influence how we get together today.

>>Nutritionist: That's true! And when we share meals, it can actually help us make healthier choices. People tend to encourage each other to try new foods or stick to balanced diets, which is great for both our bodies and minds.

>>Sociologist: Absolutely, food really does bring people together across different cultures. It's interesting how these traditions evolve yet still hold the power to connect us. In some cultures, communal eating is a way to strengthen family bonds or even resolve conflicts.

>>Nutritionist: Right, it's not just about unity; it's also about making better health choices together. When we're all at the table, there's this shared responsibility that encourages us to eat well.

>>Cultural Anthropologist: Yeah, food isn't just something we eat; it's part of who we are and how we connect with others. Sharing meals goes beyond just filling our stomachs—it's about building relationships that last.

>>Economist (interrupts): Sorry to jump in here—I've been thinking about what you've all said regarding community impact. I'm curious if there's an economic angle we're missing? Like how these gatherings might support local businesses or boost economies?

>>Cultural Anthropologist: That's a good point! Communal eating can definitely help local economies by supporting small businesses like farmers' markets or family-owned restaurants. It creates demand for locally sourced products and strengthens community ties economically as well.

>>Sociologist: And when local economies thrive because of these gatherings, it can lead to stronger social structures too. Communities become more interconnected and resilient."
