Title,Article,Tags,Personas,Summary,Meeting_Plan,Meeting
John Locke is often referred to as ""the philosopher of the American Revolution"" due to his work in the Social Contract and Natural Rights theories that underpinned the Revolution's political ideology. Locke's Two Treatises of Government published in 1689 was especially influential. He argued that all humans were created equally free, and governments therefore needed the ""consent of the governed"". In late eighteenth-century America, belief was still widespread in ""equality by creation"" and ""rights by creation"". Locke's ideas on liberty influenced the political thinking of English writers such as John Trenchard, Thomas Gordon, and Benjamin Hoadly, whose political ideas in turn also had a strong influence on the American Patriots. His work also inspired symbols used in the American Revolution such as the ""Appeal to Heaven"" found on the Pine Tree Flag, which alludes to Locke's concept of the right of revolution.
The theory of the social contract influenced the belief among many of the Founders that the right of the people to overthrow their leaders, should those leaders betray the historic rights of Englishmen, was one of the ""natural rights"" of man. The Americans heavily relied on Montesquieu's analysis of the wisdom of the ""balanced"" British Constitution (mixed government) in writing the state and national constitutions.


Republicanism

The American interpretation of republicanism was inspired by the Whig party in Great Britain which openly criticized the corruption within the British government. Americans were increasingly embracing republican values, seeing Britain as corrupt and hostile to American interests. The colonists associated political corruption with ostentatious luxury and inherited aristocracy.
The Founding Fathers were strong advocates of republican values, particularly Samuel Adams, Patrick Henry, John Adams, Benjamin Franklin, Thomas Jefferson, Thomas Paine, George Washington, James Madison, and Alexander Hamilton, which required men to put civic duty ahead of their personal desires. Men were honor bound by civic obligation to be prepared and willing to fight for the rights and liberties of their countrymen. John Adams wrote to Mercy Otis Warren in 1776, agreeing with some classical Greek and Roman thinkers: ""Public Virtue cannot exist without private, and public Virtue is the only Foundation of Republics."" He continued:

There must be a positive Passion for the public good, the public Interest, Honour, Power, and Glory, established in the Minds of the People, or there can be no Republican Government, nor any real Liberty. And this public Passion must be Superior to all private Passions. Men must be ready, they must pride themselves, and be happy to sacrifice their private Pleasures, Passions, and Interests, nay their private Friendships and dearest connections, when they Stand in Competition with the Rights of society.


Protestant dissenters and the Great Awakening

Protestant churches that had separated from the Church of England, called ""dissenters"", were the ""school of democracy"", in the words of historian Patricia Bonomi. Before the Revolution, the Southern Colonies and three of the New England Colonies had official established churches: Congregational in Massachusetts Bay, Connecticut, and New Hampshire, and the Church of England in Maryland, Virginia, North-Carolina, South Carolina, and Georgia. The New York, New Jersey, Pennsylvania, Delaware, and the Colony of Rhode Island and Providence Plantations had no officially established churches. Church membership statistics from the period are unreliable and scarce, but what little data exists indicates that the Church of England was not in the majority, not even in the colonies where it was the established church, and they probably did not comprise even 30 percent of the population in most localities (with the possible exception of Virginia).
John Witherspoon, who was considered a ""new light"" Presbyterian, wrote widely circulated sermons linking the American Revolution to the teachings of the Bible. Throughout the colonies, dissenting Protestant ministers from the Congregational, Baptist, and Presbyterian churches preached Revolutionary themes in their sermons while most Church of England clergymen preached loyalty to the king, the titular head of the English state church. Religious motivation for fighting tyranny transcended socioeconomic lines. The Declaration of Independence also referred to the ""Laws of Nature and of Nature's God"" as justification for the Americans' separation from the British monarchy: the signers of the Declaration professed their ""firm reliance on the Protection of divine Providence"", and they appealed to ""the Supreme Judge for the rectitude of our intentions"".
Historian Bernard Bailyn argues that the evangelicalism of the era challenged traditional notions of natural hierarchy by preaching that the Bible teaches that all men are equal, so that the true value of a man lies in his moral behavior, not in his class. Kidd argues that religious disestablishment, belief in God as the source of human rights, and shared convictions about sin, virtue, and divine providence worked together to unite rationalists and evangelicals and thus encouraged a large proportion of Americans to fight for independence from the Empire. Bailyn, on the other hand, denies that religion played such a critical role. Alan Heimert argues that New Light anti-authoritarianism was essential to furthering democracy in colonial American society, and set the stage for a confrontation with British monarchical and aristocratic rule.


Class and psychology of the factions

John Adams concluded in 1818:

The Revolution was effected before the war commenced. The Revolution was in the minds and hearts of the people .... This radical change in the principles, opinions, sentiments, and affections of the people was the real American Revolution.
In the mid-20th century, historian Leonard Woods Labaree identified eight characteristics of the Loyalists that made them essentially conservative, opposite to the characteristics of the Patriots. Loyalists tended to feel that resistance to the Crown was morally wrong, while the Patriots thought that morality was on their side. Loyalists were alienated when the Patriots resorted to violence, such as burning houses and tarring and feathering. Loyalists wanted to take a centrist position and resisted the Patriots' demand to declare their opposition to the Crown. Many Loyalists had maintained strong and long-standing relations with Britain, especially merchants in port cities such as New York and Boston. Many Loyalists felt that independence was bound to come eventually, but they were fearful that revolution might lead to anarchy, tyranny, or mob rule. In contrast, the prevailing attitude among Patriots was a desire to seize the initiative. Labaree also wrote that Loyalists were pessimists who lacked the confidence in the future displayed by the Patriots.
Historians in the early 20th century such as J. Franklin Jameson examined the class composition of the Patriot cause, looking for evidence of a class war inside the revolution. More recent historians have largely abandoned that interpretation, emphasizing instead the high level of ideological unity. Both Loyalists and Patriots were a ""mixed lot"", but ideological demands always came first. The Patriots viewed independence as a means to gain freedom from British oppression and to reassert their basic rights. Most yeomen farmers, craftsmen, and small merchants joined the Patriot cause to demand more political equality. They were especially successful in Pennsylvania but less so in New England, where John Adams attacked Thomas Paine's Common Sense for the ""absurd democratical notions"" that it proposed.


King George III

The revolution became a personal issue for the king, fueled by his growing belief that British leniency would be taken as weakness by the Americans. He also sincerely believed that he was defending Britain's constitution against usurpers, rather than opposing patriots fighting for their natural rights.
King George III is often accused of obstinately trying to keep Great Britain at war with the revolutionaries in America, despite the opinions of his own ministers. In the words of the British historian George Otto Trevelyan, the King was determined ""never to acknowledge the independence of the Americans, and to punish their contumacy by the indefinite prolongation of a war which promised to be eternal."" The king wanted to ""keep the rebels harassed, anxious, and poor, until the day when, by a natural and inevitable process, discontent and disappointment were converted into penitence and remorse"". Later historians defend George by saying in the context of the times no king would willingly surrender such a large territory, and his conduct was far less ruthless than contemporary monarchs in Europe. After the surrender of a British army at Saratoga, both Parliament and the British people were largely in favor of the war; recruitment ran at high levels and although political opponents were vocal, they remained a small minority.
With the setbacks in America, Lord North asked to transfer power to Lord Chatham, whom he thought more capable, but George refused to do so; he suggested instead that Chatham serve as a subordinate minister in North's administration, but Chatham refused. He died later in the same year. Lord North was allied to the ""King's Friends"" in Parliament and believed George III had the right to exercise powers. In early 1778, Britain's chief rival France signed a treaty of alliance with the United States, and the confrontation soon escalated from a ""rebellion"" to something that has been characterized as ""world war"". The French fleet was able to outrun the British naval blockade of the Mediterranean and sailed to North America. The conflict now affected North America, Europe and India. The United States and France were joined by Spain in 1779 and the Dutch Republic, while Britain had no major allies of its own, except for the Loyalist minority in America and German auxiliaries (i.e. Hessians). Lord Gower and Lord Weymouth both resigned from the government. Lord North again requested that he also be allowed to resign, but he stayed in office at George III's insistence. Opposition to the costly war was increasing, and in June 1780 contributed to disturbances in London known as the Gordon riots.
As late as the Siege of Charleston in 1780, Loyalists could still believe in their eventual victory, as British troops inflicted defeats on the Continental forces at the Battle of Camden and the Battle of Guilford Court House. In late 1781, the news of Cornwallis's surrender at the siege of Yorktown reached London; Lord North's parliamentary support ebbed away and he resigned the following year. The king drafted an abdication notice, which was never delivered, finally accepted the defeat in North America, and authorized peace negotiations. The Treaties of Paris, by which Britain recognized the independence of the United States and returned Florida to Spain, were signed in 1782 and 1783 respectively. In early 1783, George III privately conceded ""America is lost!"" He reflected that the Northern colonies had developed into Britain's ""successful rivals"" in commercial trade and fishing.
When John Adams was appointed American Minister to London in 1785, George had become resigned to the new relationship between his country and the former colonies. He told Adams, ""I was the last to consent to the separation; but the separation having been made and having become inevitable, I have always said, as I say now, that I would be the first to meet the friendship of the United States as an independent power.""


Patriots

Those who fought for independence were called ""Revolutionaries"", ""Continentals"", ""Rebels"", ""Patriots"", ""Whigs"", ""Congress-men"", or ""Americans"" during and after the war. They included a full range of social and economic classes but were unanimous regarding the need to defend the rights of Americans and uphold the principles of republicanism in rejecting monarchy and aristocracy, while emphasizing civic virtue by citizens. The signers of the Declaration of Independence were mostly—with definite exceptions—well-educated, of British stock, and of the Protestant faith. Newspapers were strongholds of patriotism (although there were a few Loyalist papers) and printed many pamphlets, announcements, patriotic letters, and pronouncements.
According to historian Robert Calhoon, 40 to 45 percent of the white population in the Thirteen Colonies supported the Patriots' cause, 15 to 20 percent supported the Loyalists, and the remainder were neutral or kept a low profile. Mark Lender concludes that ordinary people became insurgents against the British because they held a sense of rights which the British were violating, rights that stressed local autonomy, fair dealing, and government by consent. They were highly sensitive to the issue of tyranny, which they saw manifested in the British response to the Boston Tea Party. The arrival in Boston of the British Army heightened their sense of violated rights, leading to rage and demands for revenge. They had faith that God was on their side.
Thomas Paine published his pamphlet Common Sense in January 1776, after the Revolution had started. It was widely distributed and often read aloud in taverns, contributing significantly to concurrently spreading the ideas of republicanism and liberalism, bolstering enthusiasm for separation from Great Britain and encouraging recruitment for the Continental Army. Paine presented the Revolution as the solution for Americans alarmed by the threat of tyranny.


Loyalists

The consensus of scholars is that about 15 to 20 percent of the white population remained loyal to the British Crown. Those who actively supported the king were known at the time as ""Loyalists"", ""Tories"", or ""King's men"". The Loyalists never controlled territory unless the British Army occupied it. They were typically older, less willing to break with old loyalties, and often connected to the Church of England; they included many established merchants with strong business connections throughout the Empire, as well as royal officials such as Thomas Hutchinson of Boston.
There were 500 to 1,000 Black Loyalists, enslaved African Americans who escaped to British lines and supported Britain's cause via several means. Many of them died from disease, but the survivors were evacuated by the British to their remaining colonies in North America.
The revolution could divide families, such as William Franklin, son of Benjamin Franklin and royal governor of the Province of New Jersey who remained loyal to the Crown throughout the war. He and his father never spoke again. Recent immigrants who had not been fully Americanized were also inclined to support the King.
After the war, the great majority of the half-million Loyalists remained in America and resumed normal lives. Some became prominent American leaders, such as Samuel Seabury. Approximately 46,000 Loyalists relocated to Canada; others moved to Britain (7,000), Florida, or the West Indies (9,000). The exiles represented approximately two percent of the total population of the colonies. Nearly all Black Loyalists left for Nova Scotia, Florida, or England, where they could remain free. Loyalists who left the South in 1783 took thousands of their slaves with them as they fled to the British West Indies.


Neutrals

A minority of uncertain size tried to stay neutral in the war. Most kept a low profile, but the Quakers were the most important group to speak out for neutrality, especially in Pennsylvania. The Quakers continued to do business with the British even after the war began, and they were accused of supporting British rule, ""contrivers and authors of seditious publications"" critical of the revolutionary cause. Most Quakers remained neutral, although a sizeable number participated to some degree.


Role of women

Women contributed to the American Revolution in many ways and were involved on both sides. Formal politics did not include women, but ordinary domestic behaviors became charged with political significance as Patriot women confronted a war which permeated all aspects of political, civil, and domestic life. They participated by boycotting British goods, spying on the British, following armies as they marched, washing, cooking, and mending for soldiers, delivering secret messages, and even fighting disguised as men in a few cases, such as Deborah Samson. Mercy Otis Warren held meetings in her house and cleverly attacked Loyalists with her creative plays and histories. Many women also acted as nurses and helpers, tending to the soldiers' wounds and buying and selling goods for them. Some of these camp followers even participated in combat, such as Madam John Turchin who led her husband's regiment into battle. Above all, women continued the agricultural work at home to feed their families and the armies. They maintained their families during their husbands' absences and sometimes after their deaths.
American women were integral to the success of the boycott of British goods, as the boycotted items were largely household articles such as tea and cloth. Women had to return to knitting goods and to spinning and weaving their own cloth—skills that had fallen into disuse. In 1769, the women of Boston produced 40,000 skeins of yarn, and 180 women in Middletown, Massachusetts wove 20,522 yards (18,765 m) of cloth. Many women gathered food, money, clothes, and other supplies during the war to help the soldiers. A woman's loyalty to her husband could become an open political act, especially for women in America committed to men who remained loyal to the King. Legal divorce, usually rare, was granted to Patriot women whose husbands supported the King.


Other participants


France and Spain

In early 1776, France set up a major program of aid to the Americans, and the Spanish secretly added funds. Each country spent one million ""livres tournaises"" to buy munitions. A dummy corporation run by Pierre Beaumarchais concealed their activities. American Patriots obtained some munitions from the Dutch Republic as well, through the French and Spanish ports in the West Indies. Heavy expenditures and a weak taxation system pushed France toward bankruptcy.
In 1777, Charles François Adrien le Paulmier, Chevalier d'Annemours, acting as a secret agent for France, made sure General George Washington was privy to his mission. He followed Congress around for the next two years, reporting what he observed back to France. The Treaty of Alliance between the French and the Americans followed in 1778, which led to more French money, matériel and troops being sent to the United States.
Spain did not officially recognize the United States, but it was a French ally and it separately declared war on Britain on June 21, 1779. Bernardo de Gálvez, general of the Spanish forces in New Spain, also served as governor of Louisiana. He led an expedition of colonial troops to capture Florida from the British and to keep open a vital conduit for supplies going to the Americans.


Germans

Ethnic Germans served on both sides of the American Revolutionary War. As George III was also the Elector of Hanover, many supported the Loyalist cause and served as allies of the Kingdom of Great Britain; most notably rented auxiliary troops from German states such as the Landgraviate of Hessen-Kassel.
American Patriots tended to represent such troops as mercenaries in propaganda against the British Crown. Even American historians followed suit, in spite of Colonial-era jurists drawing a distinction between auxiliaries and mercenaries, with auxiliaries serving their prince when sent to the aid of another prince, and mercenaries serving a foreign prince as individuals. By this distinction the troops which served in the American Revolution were auxiliaries.
Other German individuals came to assist the American revolutionaries, most notably Friedrich Wilhelm von Steuben, who served as a general in the Continental Army and is credited with professionalizing that force, but most Germans who served were already colonists. Von Steuben's native Prussia joined the League of Armed Neutrality, and King Frederick II of Prussia was well appreciated in the United States for his support early in the war. He expressed interest in opening trade with the United States and bypassing English ports, and allowed an American agent to buy arms in Prussia. Frederick predicted American success, and promised to recognize the United States and American diplomats once France did the same. Prussia also interfered in the recruiting efforts of Russia and neighboring German states when they raised armies to send to the Americas, and Frederick II forbade enlistment for the American war within Prussia. All Prussian roads were denied to troops from Anhalt-Zerbst, which delayed reinforcements that Howe had hoped to receive during the winter of 1777–1778.
However, when the War of the Bavarian Succession (1778–1779) erupted, Frederick II became much more cautious with Prussian/British relations. U.S. ships were denied access to Prussian ports, and Frederick refused to officially recognize the United States until they had signed the Treaty of Paris. Even after the war, Frederick II predicted that the United States was too large to operate as a republic, and that it would soon rejoin the British Empire with representatives in Parliament.


Native Americans

Most Indigenous people rejected pleas that they remain neutral and instead supported the British Crown. The great majority of the 200,000 Indigenous people east of the Mississippi distrusted the Americans and supported the British cause, hoping to forestall continued expansion of settlement into their territories. Those tribes closely involved in trade tended to side with the Patriots, although political factors were important as well. Some tried to remain neutral, seeing little value in joining what they perceived to be a ""white man's war"", and fearing reprisals from whichever side they opposed.
The great majority of Indigenous people did not participate directly in the war, with the notable exceptions of warriors and bands associated with four of the Iroquois tribes in New York and Pennsylvania which allied with the British, and the Oneida and Tuscarora tribes among the Iroquois of central and western New York who supported the American cause. The British did have other allies, particularly in the regions of southwest Quebec on the Patriot's frontier. The British provided arms to Indigenous people who were led by Loyalists in war parties to raid frontier settlements from the Carolinas to New York. These war parties managed to kill many settlers on the frontier, especially in Pennsylvania and New York's Mohawk Valley.
In 1776, Cherokee war parties attacked American Colonists all along the southern Quebec frontier of the uplands throughout the Washington District, North Carolina (now Tennessee) and the Kentucky wilderness area. The Chickamauga Cherokee under Dragging Canoe allied themselves closely with the British, and fought on for an additional decade after the Treaty of Paris was signed. They launched raids with roughly 200 warriors, as seen in the Cherokee–American wars; they could not mobilize enough forces to invade settler areas without the help of allies, most often the Creek.
Joseph Brant (also Thayendanegea) of the powerful Mohawk tribe in New York was the most prominent Indigenous leader against the Patriot forces. In 1778 and 1780, he led 300 Iroquois warriors and 100 white Loyalists in multiple attacks on small frontier settlements in New York and Pennsylvania, killing many settlers and destroying villages, crops, and stores.
In 1779, the Continental Army forced the hostile Indigenous people out of upstate New York when Washington sent an army under John Sullivan which destroyed 40 evacuated Iroquois villages in central and western New York. The Battle of Newtown proved decisive, as the Patriots had an advantage of three-to-one, and it ended significant resistance; there was little combat otherwise.  Facing starvation and homeless for the winter, the Iroquois fled to Canada.
At the peace conference following the war, the British ceded lands which they did not really control, without consultation with their Indigenous allies. They transferred control to the United States of all the land south of the Great Lakes east of the Mississippi and north of Florida. Calloway concludes:

Burned villages and crops, murdered chiefs, divided councils and civil wars, migrations, towns and forts choked with refugees, economic disruption, breaking of ancient traditions, losses in battle and to disease and hunger, betrayal to their enemies, all made the American Revolution one of the darkest periods in American Indian history.


Black Americans

Free Blacks in the New England Colonies and Middle Colonies in the North as well as Southern Colonies fought on both sides of the War, but the majority fought for the Patriots. Gary Nash reports that there were about 9,000 Black veteran Patriots, counting the Continental Army and Navy, state militia units, privateers, wagoneers in the Army, servants to officers, and spies. Ray Raphael notes that thousands did join the Loyalist cause, but ""a far larger number, free as well as slave, tried to further their interests by siding with the patriots."" Crispus Attucks was one of the five people killed in the Boston Massacre in 1770 and is considered the first American casualty for the cause of independence.
