Title,Article,Tags,Personas,Summary,Meeting_Plan,Meeting
American_Revolution,"The American Revolution (1765–1783) was a colonial rebellion and war of independence in which the Thirteen Colonies broke from British rule to form the United States of America. The revolutionary era reached its zenith with the American Revolutionary War, which commenced on April 19, 1775, with the Battles of Lexington and Concord. The leaders of the American Revolution were colonial separatists who, as British subjects, initially sought greater autonomy. However, they came to embrace the cause of full independence and the necessity of prevailing in the Revolutionary War to obtain it. The Second Continental Congress, which represented the colonies and convened in the present-day Independence Hall in Philadelphia, established the Continental Army and appointed George Washington as its commander-in-chief in June 1775. The following year, the Congress unanimously adopted the Declaration of Independence, which served to inspire, formalize, and escalate the war. Throughout the majority of the eight-year war, the outcome appeared to be uncertain. However, in 1781, a decisive victory by Washington and the Continental Army in the Siege of Yorktown led King George III and the British to negotiate the cessation of colonial rule and the acknowledgment of American independence. This was formalized in the Treaty of Paris in 1783, resulting in the establishment of the United States of America as a sovereign nation.
Discontent with colonial rule began shortly after the defeat of France in the French and Indian War in 1763. Even though the colonies had fought in and supported the war, British Parliament imposed new taxes to compensate for wartime costs and transferred control of the colonies' western lands to British officials in Montreal. Representatives from several colonies convened the Stamp Act Congress in 1765; its ""Declaration of Rights and Grievances"" argued that taxation without representation violated their rights as Englishmen. In 1767, tensions flared again following British Parliament's passage of the Townshend Acts. In an effort to quell the mounting rebellion, King George III deployed British troops to Boston, where British troops killed protesters in the Boston Massacre on March 5, 1770. In 1772, anti-tax demonstrators destroyed the Royal Navy customs schooner Gaspee off present-day Warwick, Rhode Island. On December 16, 1773, in a seminal event in the American Revolution's escalation, Sons of Liberty activists wearing costumes of Native Americans instigated the Boston Tea Party, during which they boarded and dumped chests of tea owned by the British East India Company into Boston Harbor. London responded by closing Boston Harbor and enacting a series of punitive laws, which effectively ended self-government in Massachusetts but also served to expand and intensify the revolutionary cause.
In late 1774, 12 of the Thirteen Colonies sent delegates to the First Continental Congress, which met inside Carpenters' Hall in Philadelphia; the Province of Georgia joined in 1775. The First Continental Congress began coordinating Patriot resistance through underground networks of committees. Following the Battles of Lexington and Concord, Continental Army surrounded Boston, forcing the British to withdraw by sea in March 1776, and leaving Patriots in control in every colony. In August 1775, King George III proclaimed Massachusetts to be in a state of open defiance and rebellion.
In 1776, the Second Continental Congress began debating and deliberating on the Articles of Confederation, an effort to establish a self-governing rule of law in the Thirteen Colonies. On July 2, they passed the Lee Resolution, affirming their support for national independence, and on July 4, 1776, they unanimously adopted the Declaration of Independence, authored primarily by Thomas Jefferson, which embodied the political philosophies of liberalism and republicanism, rejected monarchy and aristocracy, and famously proclaimed that ""all men are created equal"".
The Revolutionary War continued for another five years during which France ultimately entered the war, supporting the colonial cause of independence. On September 28, 1781, Washington, with support from Marquis de Lafayette, the French Army, and French Navy, led the Continental Army's most decisive victory, capturing roughly 7,500 British troops led by British general Charles Cornwallis during the Siege of Yorktown, leading to the collapse of King George's control of Parliament and consensus in Parliament that the war should be ended on American terms. On September 3, 1783, the British signed the Treaty of Paris, ceding to the new nation nearly all the territory east of the Mississippi River and south of the Great Lakes. About 60,000 Loyalists migrated to other British territories in Canada and elsewhere, but the great majority remained in the United States. With its victory in the American Revolution, the United States became the first large-scale modern nation to establish a federal constitutional republic based on a written constitution, extending the principles of consent of the governed and the rule of law over a continental territory, albeit with the significant democratic limitations typical of the era.


Origins

Under the British policy of salutary neglect, Britain traded with the colonies but otherwise mostly left them alone over the first 150 years of the colonies' existence. The colonists became accustomed to running their own affairs, and they liked it. This British policy changed significantly after the French and Indian War, prompting the Thirteen Colonies to seek greater autonomy from Britain. After the Revolution, one colonist, Capt. Levi Preston, of Danvers, Massachusetts, was asked why the Americans rebelled against England, responded, ""…we always had governed ourselves, and we always meant to. They didn't mean we should.""


1651–1763: Early seeds

The Thirteen Colonies were established in the 17th century as part of the English Empire and became parts of the British Empire after the union of England and Scotland in 1707. The development of a unique American identity can be traced to the English Civil War (1642–1651) and its aftermath. The Puritan colonies of New England supported the Commonwealth government responsible for the execution of King Charles I. After the Stuart Restoration of 1660, Massachusetts did not recognize Charles II as the legitimate king for more than a year after his coronation. In King Philip's War (1675–1678), the New England colonies fought a handful of Native American tribes without military assistance from England, thereby contributing to the development of a uniquely American identity separate from that of the British people.
In the 1680s, Charles and his brother, James II, attempted to bring New England under direct English control. The colonists fiercely opposed this, and the Crown nullified their colonial charters in response. In 1686, James finalized these efforts by consolidating the separate New England colonies along with New York and New Jersey into the Dominion of New England. Edmund Andros was appointed royal governor and tasked with governing the new Dominion under his direct rule. Colonial assemblies and town meetings were restricted, new taxes were levied, and rights were abridged. Dominion rule triggered bitter resentment throughout New England. When James tried to rule without Parliament, the English aristocracy removed him from power in the Glorious Revolution of 1688. This was followed by the 1689 Boston revolt, which overthrew Dominion rule. Colonial governments reasserted their control after the revolt. The new monarchs, William and Mary, granted new charters to the individual New England colonies, and local democratic self-government was restored.
After the Glorious Revolution in 1688, the British Empire was a constitutional monarchy with sovereignty in the King-in-Parliament. Aristocrats inherited seats in the House of Lords, while the gentry and merchants controlled the elected House of Commons. The king ruled through cabinet ministers who depended on majority support in the Commons to govern effectively. British subjects on both sides of the Atlantic proudly claimed the unwritten British constitution, with its guarantees of the rights of Englishmen, protected personal liberty better than any other government. It served as the model for colonial governments. The Crown appointed a royal governor to exercise executive power. Property owners elected a colonial assembly with powers to legislate and levy taxes, but the British government reserved the right to veto colonial legislation. Radical Whig ideology profoundly influenced American political philosophy with its love of liberty and opposition to tyrannical government.
With little industry except shipbuilding, the colonies exported agricultural products to Britain in return for manufactured goods. They also imported molasses, rum, and sugar from the British West Indies. The British government pursued a policy of mercantilism in order to grow its economic and political power. According to mercantilism, the colonies existed for the mother country's economic benefit, and the colonists' economic needs took second place. In 1651, Parliament passed the first in a series of Navigation Acts, which restricted colonial trade with foreign countries. The Thirteen Colonies could trade with the rest of the empire but only ship certain commodities like tobacco to Britain. Any European imports bound for British America had to first pass through an English port and pay customs duties. Other laws regulated colonial industries, such as the Wool Act 1698, the Hat Act 1731, and the Iron Act 1750.
Colonial reactions to these policies were mixed. The Molasses Act 1733 placed a duty of six pence per gallon upon foreign molasses imported into the colonies. This act was particularly egregious to the New England colonists, who protested it as taxation without representation. The act increased the smuggling of foreign molasses, and the British government ceased enforcement efforts after the 1740s. On the other hand, certain merchants and local industries benefitted from the restrictions on foreign competition. The limits on foreign-built ships greatly benefitted the colonial shipbuilding industry, particularly in New England. Some argue that the economic impact was minimal on the colonists, but the political friction that the acts triggered was more serious, as the merchants most directly affected were also the most politically active.
The British government lacked the resources and information needed to control the colonies. Instead, British officials negotiated and compromised with colonial leaders to gain compliance with imperial policies. The colonies defended themselves with colonial militias, and the British government rarely sent military forces to America before 1755. According to historian Robert Middlekauff, ""Americans had become almost completely self-governing"" before the American Revolution, a practice that was consistent with the British monarchy's practice of salutary neglect.
During the French and Indian War (1754–1763), the British government fielded 45,000 soldiers, half British Regulars and half colonial volunteers. The colonies also contributed money to the war effort; however, two-fifths of this spending was reimbursed by the British government. Great Britain defeated France and acquired that nation's territory east of the Mississippi River.
In early 1763, the Bute ministry decided to permanently garrison 10,000 soldiers in North America. This would allow approximately 1,500 politically well-connected British Army officers to remain on active duty with full pay (stationing a standing army in Great Britain during peacetime was politically unacceptable). A standing army would provide defense against Native Americans in the west and foreign populations in newly acquired territories (the French in Canada and the Spanish in Florida). In addition, British soldiers could prevent white colonists from instigating conflict with Native Americans and help collect customs duties.
Migration beyond the Appalachian Mountains increased after the French threat was removed, and Native Americans launched Pontiac's War (1763–1766) in response. The Grenville ministry issued the Royal Proclamation of 1763, designating the territory between the Appalachian Mountains and the Mississippi River as an Indian Reserve closed to white settlement. The Proclamation angered settlers, fur traders, and land speculators; however, it failed to stop westward migration.


1764–1766: Taxes imposed and withdrawn

George Grenville became prime minister in 1763, and ""the need for money played a part in every important decision made by Grenville regarding the colonies—and for that matter by the ministries that followed up to 1776."" The national debt had grown to £133 million with annual debt payments of £5 million (out of an £8 million annual budget). Stationing troops in North America on a permanent basis would cost another £360,000 a year. On a per capita basis, Americans only paid 1 shilling in taxes to the empire compared to 26 shillings paid by the English. Grenville believed that the colonies should help pay the troop costs.
In 1764 Parliament passed the Sugar Act, decreasing the existing customs duties on sugar and molasses but providing stricter measures of enforcement and collection. That same year, Grenville proposed direct taxes on the colonies to raise revenue, but he delayed action to see whether the colonies would propose some way to raise the revenue themselves.
Parliament passed the Stamp Act in March 1765, which imposed direct taxes on the colonies for the first time. All official documents, newspapers, almanacs, and pamphlets were required to have the stamps—even decks of playing cards. The colonists did not object that the taxes were high; they were actually low. They objected to their lack of representation in the Parliament, which gave them no voice concerning legislation that affected them, such as the tax, violating the unwritten English constitution. This grievance was summarized in the slogan ""No taxation without representation"". Shortly following adoption of the Stamp Act, the Sons of Liberty formed, and began using public demonstrations, boycotts, and threats of violence to ensure that the British tax laws became unenforceable. In Boston, the Sons of Liberty burned the records of the vice admiralty court and looted the home of chief justice Thomas Hutchinson. Several legislatures called for united action, and nine colonies sent delegates to the Stamp Act Congress in New York City in October. Moderates led by John Dickinson drew up a Declaration of Rights and Grievances stating that the colonists were equal to all other British citizens and that taxes passed without representation violated their rights as Englishmen, and Congress emphasized their determination by organizing a boycott on imports of all British merchandise. American spokesmen such as Samuel Adams, James Otis, John Hancock, John Dickinson, Thomas Paine, and many others, rejected aristocracy and propounded ""republicanism"" as the political philosophy that was best suited to American conditions.
The Parliament at Westminster saw itself as the supreme lawmaking authority throughout the Empire and thus entitled to levy any tax without colonial approval or even consultation. They argued that the colonies were legally British corporations subordinate to the British Parliament. Parliament insisted that the colonists effectively enjoyed a ""virtual representation"", as most British people did, since only a small minority of the British population were eligible to elect representatives to Parliament. However, Americans such as James Otis maintained that there was no one in Parliament responsible specifically to any colonial constituency, so they were not ""virtually represented"" by anyone in Parliament.
The Rockingham government came to power in July 1765, and Parliament debated whether to repeal the stamp tax or to send an army to enforce it. Benjamin Franklin appeared before them to make the case for repeal, explaining that the colonies had spent heavily in manpower, money, and blood defending the empire, and that further taxes to pay for those wars were unjust and might bring about a rebellion. Parliament agreed and repealed the tax on February 21, 1766, but they insisted in the Declaratory Act of March 1766 that they retained full power to make laws for the colonies ""in all cases whatsoever"". The repeal nonetheless caused widespread celebrations in the colonies.


1767–1773: Townshend Acts and the Tea Act

In 1767, the British Parliament passed the Townshend Acts, which placed duties on several staple goods, including paper, glass, and tea, and established a Board of Customs in Boston to more rigorously execute trade regulations. Parliament's goal was not so much to collect revenue but to assert its authority over the colonies. The new taxes were enacted on the belief that Americans only objected to internal taxes and not to external taxes such as custom duties. However, in his widely read pamphlet, Letters from a Farmer in Pennsylvania, John Dickinson argued against the constitutionality of the acts because their purpose was to raise revenue and not to regulate trade. Colonists responded to the taxes by organizing new boycotts of British goods. These boycotts were less effective, however, as the goods taxed by the Townshend Acts were widely used.
In February 1768, the Assembly of Massachusetts Bay Colony issued a circular letter to the other colonies urging them to coordinate resistance. The governor dissolved the assembly when it refused to rescind the letter. Meanwhile, a riot broke out in Boston in June 1768 over the seizure of the sloop Liberty, owned by John Hancock, for alleged smuggling. Customs officials were forced to flee, prompting the British to deploy troops to Boston. A Boston town meeting declared that no obedience was due to parliamentary laws and called for the convening of a convention. A convention assembled but only issued a mild protest before dissolving itself. In January 1769, Parliament responded to the unrest by reactivating the Treason Act 1543 which called for subjects outside the realm to face trials for treason in England. The governor of Massachusetts was instructed to collect evidence of said treason, and the threat caused widespread outrage, though it was not carried out.
On March 5, 1770, a large crowd gathered around a group of British soldiers on a Boston street. The crowd grew threatening, throwing snowballs, rocks, and debris at them. One soldier was clubbed and fell. There was no order to fire, but the soldiers panicked and fired into the crowd. They hit 11 people; three civilians died of wounds at the scene of the shooting, and two died shortly after. The event quickly came to be called the Boston Massacre. The soldiers were tried and acquitted (defended by John Adams), but the widespread descriptions soon began to turn colonial sentiment against the British. This accelerated the downward spiral in the relationship between Britain and the province of Massachusetts.
A new ministry under Lord North came to power in 1770, and Parliament repealed most of the Townshend duties, except the tax on tea. This temporarily resolved the crisis, and the boycott of British goods largely ceased, with only the more radical patriots such as Samuel Adams continuing to agitate.
In June 1772, American patriots, including John Brown, burned a British warship that had been vigorously enforcing unpopular trade regulations, in what became known as the Gaspee Affair. The affair was investigated for possible treason, but no action was taken.
In 1773, private letters were published in which Massachusetts Governor Thomas Hutchinson claimed that the colonists could not enjoy all English liberties, and in which Lieutenant Governor Andrew Oliver called for the direct payment of colonial officials, which had been paid by local authorities. This would have reduced the influence of colonial representatives over their government. The letters' contents were used as evidence of a systematic plot against American rights, and discredited Hutchinson in the eyes of the people; the colonial Assembly petitioned for his recall. Benjamin Franklin, postmaster general for the colonies, acknowledged that he leaked the letters, which led to him being removed from his position.
In Boston, Samuel Adams set about creating new Committees of Correspondence, which linked Patriots in all 13 colonies and eventually provided the framework for a rebel government. Virginia, the largest colony, set up its Committee of Correspondence in early 1773, on which Patrick Henry and Thomas Jefferson served. A total of about 7,000 to 8,000 Patriots served on these Committees; Loyalists were excluded. The committees became the leaders of the American resistance to British actions, and later largely determined the war effort at the state and local level. When the First Continental Congress decided to boycott British products, the colonial and local Committees took charge, examining merchant records and publishing the names of merchants who attempted to defy the boycott by importing British goods.
Meanwhile, Parliament passed the Tea Act lowering the price of taxed tea exported to the colonies, to help the British East India Company undersell smuggled untaxed Dutch tea. Special consignees were appointed to sell the tea to bypass colonial merchants. The act was opposed by those who resisted the taxes and also by smugglers who stood to lose business. In every colony demonstrators warned merchants not to bring in tea that included the hated new tax. In most instances, the consignees were forced by the Americans to resign and the tea was turned back, but Massachusetts governor Hutchinson refused to allow Boston merchants to give in to pressure.
A town meeting in Boston determined that the tea would not be landed, and ignored a demand from the governor to disperse. On December 16, 1773, a group of men, led by Samuel Adams and dressed to evoke the appearance of Indigenous people, boarded the ships of the East India Company and dumped £10,000 worth of tea from their holds (approximately £636,000 in 2008) into Boston Harbor. Decades later, this event became known as the Boston Tea Party and remains a significant part of American patriotic lore.


1774–1775: Intolerable Acts

The British government responded by passing four laws that came to be known as the Intolerable Acts, further darkening colonial opinion towards England. The first was the Massachusetts Government Act which altered the Massachusetts charter and restricted town meetings. The second was the Administration of Justice Act which ordered that all British soldiers to be tried were to be arraigned in Britain, not in the colonies. The third was the Boston Port Act, which closed the port of Boston until the British had been compensated for the tea lost in the Boston Tea Party. The fourth was the Quartering Act of 1774, which allowed royal governors to house British troops in the homes of citizens without permission of the owner.
In response, Massachusetts patriots issued the Suffolk Resolves and formed an alternative shadow government known as the Provincial Congress, which began training militia outside British-occupied Boston. In September 1774, the First Continental Congress convened, consisting of representatives from each colony, to serve as a vehicle for deliberation and collective action. During secret debates, conservative Joseph Galloway proposed the creation of a colonial Parliament that would be able to approve or disapprove acts of the British Parliament, but his idea was tabled in a vote of 6 to 5 and was subsequently removed from the record. Congress called for a boycott beginning on December 1, 1774, of all British goods; it was enforced by new local committees authorized by the Congress.
It also began coordinating Patriot resistance by militias which existed in every colony and which had gained military experience in the French and Indian War. For the first time, the Patriots were armed and unified against Parliament.


Military hostilities begin

King George declared Massachusetts to be in a state of rebellion in February 1775 and the British garrison received orders to seize the rebels' weapons and arrest their leaders, leading to the Battles of Lexington and Concord on April 19, 1775. The Patriots assembled a militia 15,000 strong and laid siege to Boston, occupied by 6500 British soldiers. The Second Continental Congress convened in Philadelphia on June 14, 1775. The congress was divided on the best course of action. They authorized formation of the Continental Army and appointed George Washington as its commander-in-chief, and produced the Olive Branch Petition in which they attempted to come to an accord with King George. The king, however, issued a Proclamation of Rebellion which declared that the states were ""in rebellion"" and the members of Congress were traitors. The Battle of Bunker Hill followed on June 17, 1775. It was a British victory—but at a great cost: about 1,000 British casualties from a garrison of about 6,000, as compared to 500 American casualties from a much larger force.

As Benjamin Franklin wrote to Joseph Priestley in October 1775: Britain, at the expense of three millions, has killed 150 Yankees this campaign, which is £20,000 a head ... During the same time, 60,000 children have been born in America. From these data his mathematical head will easily calculate the time and expense necessary to kill us all.
