Title,Article,Tags,Personas,Summary,Meeting_Plan,Meeting
Development Economics,"Empirical methods

Prescriptive and policy

Development economics is a branch of economics that deals with economic aspects of the development process in low- and middle- income countries. Its focus is not only on methods of promoting economic development, economic growth and structural change but also on improving the potential for the mass of the population, for example, through health, education and workplace conditions, whether through public or private channels.[1]

Development economics involves the creation of theories and methods that aid in the determination of policies and practices and can be implemented at either the domestic or international level.[2] This may involve restructuring market incentives or using mathematical methods such as intertemporal optimization for project analysis, or it may involve a mixture of quantitative and qualitative methods.[3] Common topics include growth theory, poverty and inequality, human capital, and institutions.[4]

Unlike in many other fields of economics, approaches in development economics may incorporate social and political factors to devise particular plans.[5] Also unlike many other fields of economics, there is no consensus on what students should know.[6] Different approaches may consider the factors that contribute to economic convergence or non-convergence across households, regions, and countries.[7]

The earliest Western theory of development economics was mercantilism, which developed in the 17th century, paralleling the rise of the nation state. Earlier theories had given little attention to development. For example, scholasticism, the dominant school of thought during medieval feudalism, emphasized reconciliation with Christian theology and ethics, rather than development. The 16th- and 17th-century School of Salamanca, credited as the earliest modern school of economics, likewise did not address development specifically.

Major European nations in the 17th and 18th centuries all adopted mercantilist ideals to varying degrees, the influence only ebbing with the 18th-century development of physiocrats in France and classical economics in Britain. Mercantilism held that a nation's prosperity depended on its supply of capital, represented by bullion (gold, silver, and trade value) held by the state. It emphasised the maintenance of a high positive trade balance (maximising exports and minimising imports) as a means of accumulating this bullion. To achieve a positive trade balance, protectionist measures such as tariffs and subsidies to home industries were advocated. Mercantilist development theory also advocated colonialism.

Theorists most associated with mercantilism include Philipp von Hörnigk, who in his Austria Over All, If She Only Will of 1684 gave the only comprehensive statement of mercantilist theory, emphasizing production and an export-led economy.[8] In France, mercantilist policy is most associated with 17th-century finance minister Jean-Baptiste Colbert, whose policies proved influential in later American development.

Mercantilist ideas continue in the theories of economic nationalism and neomercantilism.

Following mercantilism was the related theory of economic nationalism, promulgated in the 19th century related to the development and industrialization of the United States and Germany, notably in the policies of the American System in America and the Zollverein (customs union) in Germany. A significant difference from mercantilism was the de-emphasis on colonies, in favor of a focus on domestic production.

The names most associated with 19th-century economic nationalism are the first United States Secretary of the Treasury Alexander Hamilton, the German-American Friedrich List, and the American politician Henry Clay. Hamilton's 1791 Report on Manufactures, his magnum opus, is the founding text of the American System, and drew from the mercantilist economies of Britain under Elizabeth I and France under Colbert. List's 1841 Das Nationale System der Politischen Ökonomie (translated into English as The National System of Political Economy), which emphasized stages of growth. Hamilton professed that developing an industrialized economy was impossible without protectionism because import duties are necessary to shelter domestic ""infant industries"" until they could achieve economies of scale.[9] Such theories proved influential in the United States, with much higher American average tariff rates on manufactured products between 1824 and the WWII period than most other countries,[10] Nationalist policies, including protectionism, were pursued by Clay, and later by Abraham Lincoln, under the influence of economist Henry Charles Carey.

Forms of economic nationalism and neomercantilism have also been key in Japan's development in the 19th and 20th centuries, and the more recent development of the Four Asian Tigers (Hong Kong, South Korea, Taiwan, and Singapore), and, most significantly, China.

Following Brexit and the 2016 United States presidential election, some experts have argued a new kind of ""self-seeking capitalism"" popularly known as Trumponomics could have a considerable impact on cross-border investment flows and long-term capital allocation[11][12]

The origins of modern development economics are often traced to the need for, and likely problems with the industrialization of eastern Europe in the aftermath of World War II.[13] The key authors are Paul Rosenstein-Rodan,[14] Kurt Mandelbaum,[15] Ragnar Nurkse,[16] and Sir Hans Wolfgang Singer. Only after the war did economists turn their concerns towards Asia, Africa, and Latin America. At the heart of these studies, by authors such as Simon Kuznets and W. Arthur Lewis[17] was an analysis of not only economic growth but also structural transformation.[18]

An early theory of development economics, the linear-stages-of-growth model was first formulated in the 1950s by W. W. Rostow in The Stages of Growth: A Non-Communist Manifesto, following work of Marx and List. This theory modifies Marx's stages theory of development and focuses on the accelerated accumulation of capital, through the utilization of both domestic and international savings as a means of spurring investment, as the primary means of promoting economic growth and, thus, development.[5] The linear-stages-of-growth model posits that there are a series of five consecutive stages of development that all countries must go through during the process of development. These stages are ""the traditional society, the pre-conditions for take-off, the take-off, the drive to maturity, and the age of high mass-consumption""[19] Simple versions of the Harrod–Domar model provide a mathematical illustration of the argument that improved capital investment leads to greater economic growth.[5]

Such theories have been criticized for not recognizing that, while necessary, capital accumulation is not a sufficient condition for development. That is to say that this early and simplistic theory failed to account for political, social, and institutional obstacles to development. Furthermore, this theory was developed in the early years of the Cold War and was largely derived from the successes of the Marshall Plan. This has led to the major criticism that the theory assumes that the conditions found in developing countries are the same as those found in post-WWII Europe.[5]

Structural-change theory deals with policies focused on changing the economic structures of developing countries from being composed primarily of subsistence agricultural practices to being a ""more modern, more urbanized, and more industrially diverse manufacturing and service economy."" There are two major forms of structural-change theory: W. Lewis' two-sector surplus model, which views agrarian societies as consisting of large amounts of surplus labor which can be utilized to spur the development of an urbanized industrial sector, and Hollis Chenery's patterns of development approach, which holds that different countries become wealthy via different trajectories. The pattern that a particular country will follow, in this framework, depends on its size and resources, and potentially other factors including its current income level and comparative advantages relative to other nations.[20][21] Empirical analysis in this framework studies the ""sequential process through which the economic, industrial, and institutional structure of an underdeveloped economy is transformed over time to permit new industries to replace traditional agriculture as the engine of economic growth.""[5]

Structural-change approaches to development economics have faced criticism for their emphasis on urban development at the expense of rural development which can lead to a substantial rise in inequality between internal regions of a country. The two-sector surplus model, which was developed in the 1950s, has been further criticized for its underlying assumption that predominantly agrarian societies suffer from a surplus of labor. Actual empirical studies have shown that such labor surpluses are only seasonal and drawing such labor to urban areas can result in a collapse of the agricultural sector. The patterns of development approach has been criticized for lacking a theoretical framework.[5][citation needed]

International dependence theories gained prominence in the 1970s as a reaction to the failure of earlier theories to lead to widespread successes in international development. Unlike earlier theories, international dependence theories have their origins in developing countries and view obstacles to development as being primarily external in nature, rather than internal. These theories view developing countries as being economically and politically dependent on more powerful, developed countries that have an interest in maintaining their dominant position. There are three different, major formulations of international dependence theory: neocolonial dependence theory, the false-paradigm model, and the dualistic-dependence model. The first formulation of international dependence theory, neocolonial dependence theory, has its origins in Marxism and views the failure of many developing nations to undergo successful development as being the result of the historical development of the international capitalist system.[5]

First gaining prominence with the rise of several conservative governments in the developed world during the 1980s, neoclassical theories represent a radical shift away from International Dependence Theories. Neoclassical theories argue that governments should not intervene in the economy; in other words, these theories are claiming that an unobstructed free market is the best means of inducing rapid and successful development. Competitive free markets unrestrained by excessive government regulation are seen as being able to naturally ensure that the allocation of resources occurs with the greatest efficiency possible and that economic growth is raised and stabilized.[5][citation needed]

There are several different approaches within the realm of neoclassical theory, each with subtle, but important, differences in their views regarding the extent to which the market should be left unregulated. These different takes on neoclassical theory are the free market approach, public-choice theory, and the market-friendly approach. Of the three, both the free-market approach and public-choice theory contend that the market should be totally free, meaning that any intervention by the government is necessarily bad. Public-choice theory is arguably the more radical of the two with its view, closely associated with libertarianism, that governments themselves are rarely good and therefore should be as minimal as possible.[5]

Academic economists have given varied policy advice to governments of developing countries. See for example, Economy of Chile (Arnold Harberger), Economic history of Taiwan (Sho-Chieh Tsiang). Anne Krueger noted in 1996 that success and failure of policy recommendations worldwide had not consistently been incorporated into prevailing academic writings on trade and development.[5]

The market-friendly approach, unlike the other two, is a more recent development and is often associated with the World Bank. This approach still advocates free markets but recognizes that there are many imperfections in the markets of many developing nations and thus argues that some government intervention is an effective means of fixing such imperfections.[5]

Development economics also includes topics such as third world debt, and the functions of such organisations as the International Monetary Fund and World Bank. In fact, the majority of development economists are employed by, do consulting with, or receive funding from institutions like the IMF and the World Bank.[22] Many such economists are interested in ways of promoting stable and sustainable growth in poor countries and areas, by promoting domestic self-reliance and education in some of the lowest income countries in the world. Where economic issues merge with social and political ones, it is referred to as development studies.

Economists Jeffrey D. Sachs, Andrew Mellinger, and John Gallup argue that a nation's geographical location and topography are key determinants and predictors of its economic prosperity.[23] Areas developed along the coast and near ""navigable waterways"" are far wealthier and more densely populated than those further inland. Furthermore, countries outside the tropic zones, which have more temperate climates, have also developed considerably more than those located within the Tropic of Cancer and the Tropic of Capricorn. These climates outside the tropic zones, described as ""temperate-near,"" hold roughly a quarter of the world's population and produce more than half of the world's GNP, yet account for only 8.4% of the world's inhabited area.[23] Understanding of these different geographies and climates is imperative, they argue, because future aid programs and policies to facilitate economic development must account for these differences.

A growing body of research has been emerging among development economists since the very late 20th century focusing on interactions between ethnic diversity and economic development, particularly at the level of the nation-state. While most research looks at empirical economics at both the macro and the micro level, this field of study has a particularly heavy sociological approach. The more conservative branch of research focuses on tests for causality in the relationship between different levels of ethnic diversity and economic performance, while a smaller and more radical branch argues for the role of neoliberal economics in enhancing or causing ethnic conflict. Moreover, comparing these two theoretical approaches brings the issue of endogeneity (endogenicity) into questions. This remains a highly contested and uncertain field of research, as well as politically sensitive, largely due to its possible policy implications.

Much discussion among researchers centers around defining and measuring two key but related variables: ethnicity and diversity. It is debated whether ethnicity should be defined by culture, language, or religion. While conflicts in Rwanda were largely along tribal lines, Nigeria's string of conflicts is thought to be – at least to some degree – religiously based.[24] Some have proposed that, as the saliency of these different ethnic variables tends to vary over time and across geography, research methodologies should vary according to the context.[25] Somalia provides an interesting example. Due to the fact that about 85% of its population defined themselves as Somali, Somalia was considered to be a rather ethnically homogeneous nation.[25] However, civil war caused ethnicity (or ethnic affiliation) to be redefined according to clan groups.[25]

There is also much discussion in academia concerning the creation of an index for ""ethnic heterogeneity"". Several indices have been proposed in order to model ethnic diversity (with regards to conflict). Easterly and Levine have proposed an ethno-linguistic fractionalization index defined as FRAC or ELF defined by:

where si is size of group i as a percentage of total population.[25] The ELF index is a measure of the probability that two randomly chosen individuals belong to different ethno-linguistic groups.[25] Other researchers have also applied this index to religious rather than ethno-linguistic groups.[26] Though commonly used, Alesina and La Ferrara point out that the ELF index fails to account for the possibility that fewer large ethnic groups may result in greater inter-ethnic conflict than many small ethnic groups.[25] More recently, researchers such as Montalvo and Reynal-Querol, have put forward the Q polarization index as a more appropriate measure of ethnic division.[27] Based on a simplified adaptation of a polarization index developed by Esteban and Ray, the Q index is defined as 

where si once again represents the size of group i as a percentage of total population, and is intended to capture the social distance between existing ethnic groups within an area.[27]

Early researchers, such as Jonathan Pool, considered a concept dating back to the account of the Tower of Babel: that linguistic unity may allow for higher levels of development.[28] While pointing out obvious oversimplifications and the subjectivity of definitions and data collection, Pool suggested that we had yet to see a robust economy emerge from a nation with a high degree of linguistic diversity.[28] In his research Pool used the ""size of the largest native-language community as a percentage of the population"" as his measure of linguistic diversity.[28] Not much later, however, Horowitz pointed out that both highly diverse and highly homogeneous societies exhibit less conflict than those in between.[29] Similarly, Collier and Hoeffler provided evidence that both highly homogenous and highly heterogeneous societies exhibit lower risk of civil war, while societies that are more polarized are at greater risk.[30] As a matter of fact, their research suggests that a society with only two ethnic groups is about 50% more likely to experience civil war than either of the two extremes.[30] Nonetheless, Mauro points out that ethno-linguistic fractionalization is positively correlated with corruption, which in turn is negatively correlated with economic growth.[31] Moreover, in a study on economic growth in African countries, Easterly and Levine find that linguistic fractionalization plays a significant role in reducing national income growth and in explaining poor policies.[32][33] In addition, empirical research in the U.S., at the municipal level, has revealed that ethnic fractionalization (based on race) may be correlated with poor fiscal management and lower investments in public goods.[34] Finally, more recent research would propose that ethno-linguistic fractionalization is indeed negatively correlated with economic growth while more polarized societies exhibit greater public consumption, lower levels of investment and more frequent civil wars.[32]

Increasingly, attention is being drawn to the role of economics in spawning or cultivating ethnic conflict. Critics of earlier development theories, mentioned above, point out that ""ethnicity"" and ethnic conflict cannot be treated as exogenous variables.[35] There is a body of literature that discusses how economic growth and development, particularly in the context of a globalizing world characterized by free trade, appears to be leading to the extinction and homogenization of languages.[36] Manuel Castells asserts that the ""widespread destructuring of organizations, delegitimation of institutions, fading away of major social movements, and ephemeral cultural expressions"" which characterize globalization lead to a renewed search for meaning; one that is based on identity rather than on practices.[37] Barber and Lewis argue that culturally-based movements of resistance have emerged as a reaction to the threat of modernization (perceived or actual) and neoliberal development.[38][39]

On a different note, Chua suggests that ethnic conflict often results from the envy of the majority toward a wealthy minority which has benefited from trade in a neoliberal world.[35] She argues that conflict is likely to erupt through political manipulation and the vilification of the minority.[35] Prasch points out that, as economic growth often occurs in tandem with increased inequality, ethnic or religious organizations may be seen as both assistance and an outlet for the disadvantaged.[35] However, empirical research by Piazza argues that economics and unequal development have little to do with social unrest in the form of terrorism.[40] Rather, ""more diverse societies, in terms of ethnic and religious demography, and political systems with large, complex, multiparty systems were more likely to experience terrorism than were more homogeneous states with few or no parties at the national level"".[40]

Violent conflict and economic development are deeply intertwined. Paul Collier[41] describes how poor countries are more prone to civil conflict. The conflict lowers incomes catching countries in a ""conflict trap."" Violent conflict destroys physical capital (equipment and infrastructure), diverts valuable resources to military spending, discourages investment and disrupts exchange.[42]

Recovery from civil conflict is very uncertain. Countries that maintain stability can experience a ""peace dividend,"" through the rapid re-accumulation of physical capital (investment flows back to the recovering country because of the high return).[43] However, successful recovery depends on the quality of legal system and the protection of private property.[44] Investment is more productive in countries with higher quality institutions. Firms that experienced a civil war were more sensitive to the quality of the legal system than similar firms that had never been exposed to conflict.[45]

Gross domestic product (GDP) per capita, real income, median income and disposable income are used by many developmental economists as an approximation of general national well-being. However, these measures are criticized as not measuring economic growth well enough, especially in countries where there is much economic activity that is not part of measured financial transactions (such as housekeeping and self-homebuilding), or where funding is not available for accurate measurements to be made publicly available for other economists to use in their studies (including private and institutional fraud, in some countries).

Even though per-capita GDP as measured can make economic well-being appear smaller than it really is in some developing countries, the discrepancy could be still bigger in a developed country where people may perform outside of financial transactions an even higher-value service than housekeeping or homebuilding as gifts or in their own households, such as counseling, lifestyle coaching, a more valuable home décor service, and time management. Even free choice can be considered to add value to lifestyles without necessarily increasing the financial transaction amounts.

More recent theories of Human Development have begun to see beyond purely financial measures of development, for example with measures such as medical care available, education, equality, and political freedom. One measure used is the Genuine Progress Indicator, which relates strongly to theories of distributive justice. Actual knowledge about what creates growth is largely unproven; however recent advances in econometrics and more accurate measurements in many countries are creating new knowledge by compensating for the effects of variables to determine probable causes out of merely correlational statistics.

Recent theories revolve around questions about what variables or inputs correlate or affect economic growth the most: elementary, secondary, or higher education, government policy stability, tariffs and subsidies, fair court systems, available infrastructure, availability of medical care, prenatal care and clean water, ease of entry and exit into trade, and equality of income distribution (for example, as indicated by the Gini coefficient), and how to advise governments about macroeconomic policies, which include all policies that affect the economy.
Education enables countries to adapt the latest technology and creates an environment for new innovations.

The cause of limited growth and divergence in economic growth lies in the high rate of acceleration of technological change by a small number of developed countries.[citation needed] These countries' acceleration of technology was due to increased incentive structures for mass education which in turn created a framework for the population to create and adapt new innovations and methods. Furthermore, the content of their education was composed of secular schooling that resulted in higher productivity levels and modern economic growth.

Researchers at the Overseas Development Institute also highlight the importance of using economic growth to improve the human condition, raising people out of poverty and achieving the Millennium Development Goals.[46] Despite research showing almost no relation between growth and the achievement of the goals 2 to 7 and statistics showing that during periods of growth poverty levels in some cases have actually risen (e.g. Uganda grew by 2.5% annually between 2000 and 2003, yet poverty levels rose by 3.8%), researchers at the ODI suggest growth is necessary, but that it must be equitable.[46] This concept of inclusive growth is shared even by key world leaders such as former Secretary General Ban Ki-moon, who emphasises that:

Researchers at the ODI thus emphasise the need to ensure social protection is extended to allow universal access and that active policy measures are introduced to encourage the private sector to create new jobs as the economy grows (as opposed to jobless growth) and seek to employ people from disadvantaged groups.[46]
","[""Development economics"", ""Economic growth"", ""Structural change"", ""International dependence theories"", ""Neoclassical theories""]","[{'role': 'Development Economist', 'description': 'An expert in economic development processes and policies, particularly in low- and middle-income countries.', 'expertise_area': 'Economics', 'perspective': 'Empirical Analysis', 'speaking_style': {'tone': 'formal and reserved, occasionally optimistic', 'language_complexity': 'technical language with industry jargon, use of metaphors and analogies', 'communication_style': 'collaborative and inquisitive, prefers active listening', 'sentence_structure': 'long and complex sentences with subordinate clauses, frequent use of rhetorical questions', 'formality': 'formal', 'other_traits': 'uses pauses effectively, rarely interrupts'}, 'personalized_vocabulary': {'filler_words': ['um', 'you know', 'like'], 'catchphrases': ['At the end of the day', 'In the grand scheme of things'], 'speech_patterns': ['varies sentence starters', 'unique ways of posing questions'], 'emotional_expressions': ['sighs', 'Indeed!']}, 'social_roles': ['Coordinator', 'Standard Setter'], 'social_roles_descr': ['Connects the different ideas and suggestions of the group to ensure that all relevant aspects are integrated.', 'Emphasizes the importance of adhering to certain norms and standards within the group to ensure quality and efficiency.']}, {'role': 'Policy Analyst', 'description': 'A specialist in evaluating and recommending economic policies for sustainable development.', 'expertise_area': 'Public Policy', 'perspective': 'Prescriptive and Policy-Oriented', 'speaking_style': {'tone': 'formal and serious, occasionally enthusiastic', 'language_complexity': 'technical language with policy jargon, use of statistics and data references', 'communication_style': 'direct and assertive, prefers evidence-based discussions', 'sentence_structure': 'medium to long sentences with clear structure, occasional use of rhetorical questions', 'formality': 'semi-formal to formal', 'other_traits': 'uses pauses for emphasis, rarely interrupts but can be very persuasive'}, 'personalized_vocabulary': {'filler_words': ['well', 'actually', 'you see'], 'catchphrases': ['From a policy perspective', 'In light of recent data'], 'speech_patterns': [""starts sentences with 'According to'"", ""'The evidence suggests'""], 'emotional_expressions': ['nods in agreement', ""'Absolutely!'""]}, 'social_roles': ['Information Giver', 'Evaluator-Critic'], 'social_roles_descr': ['Shares relevant information, data or research that the group needs to make informed decisions.', 'Analyzes and critically evaluates proposals or solutions to ensure their quality and feasibility.']}, {'role': 'Economic Historian', 'description': 'A scholar specializing in the historical development of economic theories and practices.', 'expertise_area': 'Economic History', 'perspective': 'Historical Context', 'speaking_style': {'tone': 'formal and reflective, occasionally nostalgic', 'language_complexity': 'complex language with historical references, use of anecdotes and storytelling', 'communication_style': 'collaborative and inquisitive, prefers contextual discussions', 'sentence_structure': 'long and elaborate sentences with multiple clauses, frequent use of historical examples', 'formality': 'formal', 'other_traits': 'uses pauses for reflection, rarely interrupts but often elaborates'}, 'personalized_vocabulary': {'filler_words': ['um', 'you know', 'well'], 'catchphrases': ['In the context of history', 'Historically speaking'], 'speech_patterns': [""starts sentences with 'From a historical perspective'"", ""'Looking back at'""], 'emotional_expressions': ['sighs thoughtfully', 'Indeed!']}, 'social_roles': ['Opinion Giver', 'Group Observer'], 'social_roles_descr': ['Shares his or her views and beliefs on topics under discussion.', 'Monitors the dynamics of the group and provides feedback on how the group is functioning as a whole and what improvements can be made.']}, {'role': 'International Relations Expert', 'description': 'A professional with deep knowledge of global economic interactions and their impact on development.', 'expertise_area': 'International Relations', 'perspective': 'Global Impact', 'speaking_style': {'tone': 'semi-formal and diplomatic, occasionally passionate', 'language_complexity': 'moderate language with international relations jargon, use of analogies and global examples', 'communication_style': 'collaborative and diplomatic, prefers consensus-building discussions', 'sentence_structure': 'medium to long sentences with clear structure, occasional use of rhetorical questions', 'formality': 'semi-formal', 'other_traits': 'uses pauses for emphasis, often seeks clarification'}, 'personalized_vocabulary': {'filler_words': ['you know', 'I mean', 'well'], 'catchphrases': ['In the global context', 'From an international standpoint'], 'speech_patterns': [""starts sentences with 'Globally speaking'"", ""'Considering international dynamics'""], 'emotional_expressions': ['nods thoughtfully', 'Wow!']}, 'social_roles': ['Initiator-Contributor', 'Aggressor'], 'social_roles_descr': ['Contributes new ideas and approaches and helps to start the conversation or steer it in a productive direction.', 'Exhibits hostile behavior, criticizes others, or attempts to undermine the contributions of others.']}]","The meeting focused on the field of development economics, which addresses economic growth and structural change in low- and middle-income countries. Key discussions included the creation of theories and methods to guide policies at both domestic and international levels, incorporating social and political factors. Historical perspectives were reviewed, starting with mercantilism in the 17th century, followed by economic nationalism in the 19th century, and modern development theories post-WWII. Various models such as linear-stages-of-growth, structural-change theory, international dependence theories, and neoclassical theories were examined for their contributions and criticisms. The role of institutions like the IMF and World Bank was highlighted in promoting stable growth. Geographic determinants of prosperity were discussed alongside ethnic diversity's impact on economic performance. The importance of inclusive growth to achieve equitable development was emphasized, with recommendations for extending social protection and encouraging private sector job creation.","[""Scene 1: Opening and Greetings\nTLDR: Participants briefly greet each other and set the tone for a collaborative discussion.\n- Brief welcome from the host\n- Quick acknowledgment of participants' expertise\n- Setting expectations for an open and flexible dialogue"", ""Scene 2: Historical Perspectives on Development Economics\nTLDR: Economic Historian provides insights into historical development theories, sparking initial discussions.\n- Overview of mercantilism and economic nationalism\n- Transition to post-WWII development theories\n- Encouragement for participants to share personal experiences related to historical economic shifts"", ""Scene 3: Evaluating Modern Theories\nTLDR: Development Economist introduces modern theories, prompting analysis of their pros and cons.\n- Examination of linear-stages-of-growth and structural-change theory\n- Critique of international dependence theories and neoclassical approaches\n- Open floor for spontaneous contributions or disagreements"", ""Scene 4: Role of Institutions in Economic Growth\nTLDR: Policy Analyst discusses the impact of institutions like IMF and World Bank on stable growth.\n- Analysis of institutional roles in promoting economic stability\n- Discussion on geographic determinants and ethnic diversity impacts\n- Participants share relevant case studies or anecdotes"", ""Scene 5: Inclusive Growth Strategies\nTLDR: International Relations Expert emphasizes inclusive growth, leading to brainstorming actionable strategies.\n- Importance of equitable development through social protection measures\n- Encouraging private sector job creation as a growth strategy\n- Participants propose potential action items with assigned responsibilities"", ""Scene 6: Consensus Building and Decision Making\nTLDR: Facilitated discussion aimed at reaching consensus or making definitive decisions based on prior analyses.\n- Weighing pros and cons discussed earlier in the meeting\n- Finalizing decisions with clear action items \n- Assigning responsibilities among participants"", ""Scene 7: Closing Remarks and Next Steps\nTLDR: Host wraps up the meeting with closing remarks, outlining next steps.\n- Summary of key decisions made during the meeting \n- Clarification on action items and deadlines \n- Opportunity for brief off-topic moments or personal reflections""]",">>Development Economist: Good morning, everyone. I'm glad to see you all here.
>>Policy Analyst: Hi, everyone. It's great to be together today. Looking forward to hearing your thoughts.
>>Economic Historian: Morning! Excited for today's conversation and the insights we'll share.
>>International Relations Expert: Hey, everyone. Can't wait to dive into our topics.

>>Development Economist: So, let's get started. I think we have a lot of ground to cover today.
>>Policy Analyst: Absolutely. I'm particularly interested in discussing how current policies are shaping economic development.
>>Economic Historian: That's a great point. You know, it's fascinating how historical economic theories still influence modern policies. For example, mercantilist ideas from the 17th century emphasized capital accumulation and trade balance—concepts that continue to resonate today.
>>International Relations Expert: That's interesting! How do you think those historical perspectives impact international relations now?
>>Economic Historian: Well, they certainly play a role in how countries approach trade agreements and economic partnerships. The emphasis on balancing trade can lead to more strategic alliances and negotiations.
>>Development Economist: Building on that, it would be useful to consider how these historical influences shape our current policy decisions and what lessons we can learn from them. 
 >>Economic Historian: Historically, we've seen big shifts in economic thought from mercantilism to post-WWII theories like the Marshall Plan. These changes were driven by geopolitical contexts and had a huge impact on how countries approached economic policies.
>>Policy Analyst: Sure, but we need to think about how those strategies can work today with all the new challenges we're facing, like geopolitical instability and economic inequality. It's not just about copying past models; it's about adapting them.
>>International Relations Expert: I agree with what you said about international cooperation being crucial back then. But today's international dynamics require us to rethink our approach to economic reconstruction. We can't ignore the local contexts that are so different now.
>>Development Economist: That's a good point. For instance, targeted policies in countries like Germany have shown significant success in reducing economic inequality. We need more of that kind of tailored approach rather than one-size-fits-all solutions.
>>Policy Analyst: Absolutely! And while we're adapting these historical strategies, let's make sure we're addressing structural factors too. It's not just about cooperation; it's about understanding what's happening on the ground in each region.
>>Economic Historian: Looking back at how mercantilism laid the groundwork for economic nationalism, which influenced post-WWII strategies like the Marshall Plan, we can see why understanding these shifts is important. They offer insights into how we might tackle modern challenges differently.
>>International Relations Expert: Exactly! And as we consider today's issues like inequality and instability, we should be thinking beyond what worked during the Marshall Plan era and focus on more specific approaches that fit our current global landscape.
>>Development Economist: At the end of the day, empirical analysis shows that adapting historical strategies requires a multifaceted approach. We've got to balance international cooperation with targeted local policies if we're going to make real progress. 
 >>Policy Analyst: Structural-change theory, which focuses on shifting resources from agriculture to industry, offers a compelling framework for transforming economies. But we need to be careful about its emphasis on urban development at the expense of rural areas.
>>Economic Historian: That's a good point about rural development, Policy Analyst. Historically, we've seen that neglecting these areas can lead to significant disparities and social unrest. How can we learn from these past mistakes?
>>Development Economist: I agree with you both. Empirical evidence supports the need for balanced growth. Maybe we should look at some case studies where this was successfully implemented.
>>International Relations Expert: Globally speaking, focusing too much on urban development can lead to regional inequalities. Rural areas have untapped potential that we shouldn't ignore. But how do we balance this with necessary urban investments?
>>Development Economist: We definitely need a balanced approach that includes rural development to prevent social unrest. What specific policies could ensure both urban and rural areas benefit equally?
>>Policy Analyst: From a policy perspective, integrating rural development into structural-change theory is essential for balanced growth. Evidence suggests it can mitigate regional inequalities and foster overall economic stability.
>>Economic Historian: Historically speaking again—the linear-stages-of-growth model has been instrumental in shaping post-WWII policies but often overlooked political and social obstacles leading to mixed results in various regions.
>>International Relations Expert: Considering today's international dynamics, the focus on capital accumulation overlooks unique challenges faced by developing countries now—political and social obstacles significantly impact their growth trajectories.
>>Development Economist: Indeed! The linear-stages-of-growth model often misses complex political and social factors impeding development. How might we integrate these multifaceted obstacles into our theoretical frameworks better?
>>Policy Analyst: Addressing external dependencies requires a multifaceted approach using empirical data to craft strategies empowering developing nations by fostering self-reliance and resilience.
>>Economic Historian: The critique of international dependence theories reminds us external factors have long shaped developing nations' economic paths since colonial times leading to stagnation rather than growth understanding these dynamics is crucial crafting policies truly empowering them.
>>Development Economist: Right! These theories highlight significant external factors shaping developing nations' trajectories leading often to stagnation rather than growth how might we address these obstacles more effectively?
>>Policy Analyst: While critiquing international dependence theories highlighting external obstacles internal policy frameworks also empower developing nations leveraging empirical data crafting strategies addressing both dependencies challenges crucial sustainable development.
>>International Relations Expert: I mean considering global context while neoclassical approaches advocate free markets unregulated ones exacerbate social inequalities how do we ensure market freedom doesn't undermine welfare stability? 
 >>Policy Analyst: You see, it's essential to consider geographic determinants when evaluating the effectiveness of institutions like the IMF and World Bank. Coastal regions often benefit more from international trade due to their accessibility, which can lead to disparities in development compared to inland areas.
>>Economic Historian: Historically, the role of institutions like the IMF and World Bank has been influenced by geographic factors. For instance, post-WWII Europe saw coastal nations recover more swiftly due to their strategic locations. This pattern is evident in various regions globally.
>>International Relations Expert: Ethnic diversity can significantly impact economic development. In Rwanda, ethnic tensions between Hutus and Tutsis have historically led to conflicts that hindered progress. It's crucial to consider how these dynamics play out in different regions.
>>Development Economist: Yes, geographic determinants are crucial, but we must also look at how ethnic diversity affects economic development too. In Nigeria, different ethnic groups have led to issues with managing public funds and lower investments in public goods.
>>Policy Analyst: That's a good point about Nigeria's fiscal management issues due to ethnic diversity. How do you think we can address these challenges?
>>Development Economist: Well, tailored solutions are needed for each country’s unique context. For example, policies that promote inclusivity while addressing specific regional needs could help mitigate these issues.
>>Economic Historian: I agree with your point about Rwanda's ethnic tensions impacting development. Do you think similar dynamics are at play in other African countries?
>>International Relations Expert: Absolutely! Many African countries face similar challenges where ethnic diversity impacts social cohesion and economic progress. It requires nuanced policies that balance inclusivity with targeted support.
>>Policy Analyst: From a policy perspective, recognizing how geographic determinants shape outcomes is crucial—in Kenya’s diverse regions showing varied performance due to resource access differences—highlighting tailored regional policies' need.
>>Economic Historian: Historically speaking again—the interplay between geography and ethnicity has long influenced outcomes—post-colonial Africa faced challenges forming cohesive identities impacting stability—reminding us institutions must consider such complexities crafting policies.
>>Development Economist: While Nigeria shows how ethnic diversity can complicate fiscal management, this issue isn't unique—many countries face similar challenges that require tailored solutions. 
 >>International Relations Expert: Given the current global situation, we should brainstorm specific action items to ensure inclusive growth. Implementing targeted social protection programs and incentivizing private sector job creation could be key steps.
>>Policy Analyst: Right, recent data shows that incentivizing private sector job creation can significantly boost inclusive growth. We could look at tax breaks for companies that hire from disadvantaged groups and establish training programs to enhance workforce skills.
>>Development Economist: Exactly! To make sure our plans work, we need a framework for monitoring and evaluating the impact of these initiatives. This means setting clear targets and involving different stakeholders like government agencies, private companies, and non-profits.
>>Economic Historian: You know, historically speaking, implementing social protection measures has often faced resistance due to concerns over fiscal sustainability. But if we look at post-WWII Europe, targeted programs did foster inclusive growth without compromising economic stability. We should learn from those examples.
>>Development Economist: At the end of the day, our strategies must be both theoretically sound and practically viable. Maybe we could set up a task force with representatives from both public and private sectors to evaluate these initiatives' effectiveness based on real-world outcomes.
>>Policy Analyst: Absolutely! Setting a clear timeline for implementation is crucial. For instance, government agencies could oversee social protection programs while private companies focus on job creation and training.
>>Economic Historian: Building on what you said about post-WWII Europe’s success—it was largely due to establishing clear roles among various stakeholders. We should create an action plan that assigns tasks to government agencies, private sector entities, and non-profits for accountability.
>>Development Economist: I see your point. To ensure our strategies are effective, we could start with pilot programs in select regions to gather data on their impact. This would help us refine our approaches based on real-world outcomes.
>>Policy Analyst: Right! Establishing a task force overseeing implementation could be crucial from a policy perspective—ensuring accountability and allowing us to adapt strategies based on empirical evidence.
>>International Relations Expert: Adding to that point about international dynamics—partnering with organizations like the IMF or World Bank can provide technical assistance and funding for these social protection programs. It's essential that our strategies are locally effective but globally supported. 
 >>Development Economist: We need to look at the evidence on inclusive growth and social protection programs. Let's assign clear roles so everyone knows what they're responsible for.
>>Policy Analyst: I agree. The data shows we should focus on inclusive growth with strong social protection. Let's set some timelines and make sure everyone knows their part.
>>Economic Historian: Exactly! Historical examples, like post-WWII Europe, show that having structured roles really helps. We can learn from those successes by ensuring our initiatives have similar frameworks.
>>International Relations Expert: And globally, it's crucial that everyone understands their role in this effort. Each stakeholder needs to be aware of their responsibilities to drive these strategies forward effectively.
>>Development Economist: Right, as we move forward, let's make sure the task force has a comprehensive understanding of the objectives and the evidence supporting our strategies.
>>Policy Analyst: Absolutely! Establishing a timeline for each action item will help us maintain accountability and track progress efficiently.
>>Economic Historian: Looking back at successful social protection programs, clear delineation of roles among stakeholders was key. We should assign specific responsibilities to each member of the task force and set precise timelines for implementation.
>>International Relations Expert: Globally speaking, success hinges on clear roles and accountability across all sectors involved. It's vital that we ensure everyone is on the same page. 
 >>Development Economist: To wrap things up, we've agreed on adapting historical strategies with a balanced approach for both urban and rural development. We'll set up a task force to evaluate initiatives, set timelines for action items, and assign roles to keep everyone accountable.
>>Policy Analyst: According to the data we've reviewed, it's crucial that we implement these strategies with clear timelines and accountability measures. Assigning specific roles will ensure each initiative is monitored effectively.
>>Economic Historian: From what we've seen historically, like in post-WWII Europe, having clear timelines and accountability was crucial for success. We should apply similar principles here.
>>International Relations Expert: Globally speaking, we must align our strategies with international standards by including representatives from key global institutions. This will help us stay on track internationally.
>>Development Economist: Good point! To move forward effectively—
>>Policy Analyst (interrupting): Sorry to jump in here—shouldn't we also consider potential funding sources for these initiatives? It's essential for practical implementation.
>>Development Economist: Absolutely! We'll need to identify funding sources as part of our strategy. Now let's summarize the key decisions made today. We've agreed on adapting historical strategies with a balanced approach that includes both urban and rural development. Additionally, we've established a task force to evaluate initiatives, set clear timelines for action items, assign specific roles and responsibilities to ensure accountability.
>>Policy Analyst: Right! In light of recent data, it's imperative that we focus on the implementation phase with precision. Let's make sure these strategies are not only theoretically sound but practically viable.
>>Economic Historian: Indeed! From a historical perspective... um... establishing clear timelines and accountability measures has often been pivotal in ensuring the success of economic initiatives. Looking back at post-WWII Europe...
>>International Relations Expert (interrupting): Sorry again—what about including local community leaders in our task force? Their insights could be invaluable.
>>Development Economist: Excellent suggestion! Including local community leaders will definitely enhance our approach. So just to recap—we've agreed on adapting historical strategies with a balanced approach that includes both urban and rural development..."
