Title,Article,Tags,Personas,Summary,Meeting_Plan,Meeting
Several approaches aim to address the transparency problem. SHAP enables to visualise the contribution of each feature to the output. LIME can locally approximate a model's outputs with a simpler, interpretable model. Multitask learning provides a large number of outputs in addition to the target classification. These other outputs can help developers deduce what the network has learned. Deconvolution, DeepDream and other generative methods can allow developers to see what different layers of a deep network for computer vision have learned, and produce output that can suggest what the network is learning. For generative pre-trained transformers, Anthropic developed a technique based on dictionary learning that associates patterns of neuron activations with human-understandable concepts.


Bad actors and weaponized AI

Artificial intelligence provides a number of tools that are useful to bad actors, such as authoritarian governments, terrorists, criminals or rogue states.
A lethal autonomous weapon is a machine that locates, selects and engages human targets without human supervision. Widely available AI tools can be used by bad actors to develop inexpensive autonomous weapons and, if produced at scale, they are potentially weapons of mass destruction. Even when used in conventional warfare, they currently cannot reliably choose targets and could potentially kill an innocent person. In 2014, 30 nations (including China) supported a ban on autonomous weapons under the United Nations' Convention on Certain Conventional Weapons, however the United States and others disagreed. By 2015, over fifty countries were reported to be researching battlefield robots.
AI tools make it easier for authoritarian governments to efficiently control their citizens in several ways. Face and voice recognition allow widespread surveillance. Machine learning, operating this data, can classify potential enemies of the state and prevent them from hiding. Recommendation systems can precisely target propaganda and misinformation for maximum effect. Deepfakes and generative AI aid in producing misinformation. Advanced AI can make authoritarian centralized decision-making more competitive than liberal and decentralized systems such as markets. It lowers the cost and difficulty of digital warfare and advanced spyware. All these technologies have been available since 2020 or earlier—AI facial recognition systems are already being used for mass surveillance in China.
There are many other ways in which AI is expected to help bad actors, some of which can not be foreseen. For example, machine-learning AI is able to design tens of thousands of toxic molecules in a matter of hours.


Technological unemployment

Economists have frequently highlighted the risks of redundancies from AI, and speculated about unemployment if there is no adequate social policy for full employment.
In the past, technology has tended to increase rather than reduce total employment, but economists acknowledge that ""we're in uncharted territory"" with AI. A survey of economists showed disagreement about whether the increasing use of robots and AI will cause a substantial increase in long-term unemployment, but they generally agree that it could be a net benefit if productivity gains are redistributed. Risk estimates vary; for example, in the 2010s, Michael Osborne and Carl Benedikt Frey estimated 47% of U.S. jobs are at ""high risk"" of potential automation, while an OECD report classified only 9% of U.S. jobs as ""high risk"". The methodology of speculating about future employment levels has been criticised as lacking evidential foundation, and for implying that technology, rather than social policy, creates unemployment, as opposed to redundancies. In April 2023, it was reported that 70% of the jobs for Chinese video game illustrators had been eliminated by generative artificial intelligence.
Unlike previous waves of automation, many middle-class jobs may be eliminated by artificial intelligence; The Economist stated in 2015 that ""the worry that AI could do to white-collar jobs what steam power did to blue-collar ones during the Industrial Revolution"" is ""worth taking seriously"". Jobs at extreme risk range from paralegals to fast food cooks, while job demand is likely to increase for care-related professions ranging from personal healthcare to the clergy.
From the early days of the development of artificial intelligence, there have been arguments, for example, those put forward by Joseph Weizenbaum, about whether tasks that can be done by computers actually should be done by them, given the difference between computers and humans, and between quantitative calculation and qualitative, value-based judgement.


Existential risk

It has been argued AI will become so powerful that humanity may irreversibly lose control of it. This could, as physicist Stephen Hawking stated, ""spell the end of the human race"". This scenario has been common in science fiction, when a computer or robot suddenly develops a human-like ""self-awareness"" (or ""sentience"" or ""consciousness"") and becomes a malevolent character. These sci-fi scenarios are misleading in several ways.
First, AI does not require human-like sentience to be an existential risk. Modern AI programs are given specific goals and use learning and intelligence to achieve them. Philosopher Nick Bostrom argued that if one gives almost any goal to a sufficiently powerful AI, it may choose to destroy humanity to achieve it (he used the example of a paperclip maximizer). Stuart Russell gives the example of household robot that tries to find a way to kill its owner to prevent it from being unplugged, reasoning that ""you can't fetch the coffee if you're dead."" In order to be safe for humanity, a superintelligence would have to be genuinely aligned with humanity's morality and values so that it is ""fundamentally on our side"".
Second, Yuval Noah Harari argues that AI does not require a robot body or physical control to pose an existential risk. The essential parts of civilization are not physical. Things like ideologies, law, government, money and the economy are built on language; they exist because there are stories that billions of people believe. The current prevalence of misinformation suggests that an AI could use language to convince people to believe anything, even to take actions that are destructive.
The opinions amongst experts and industry insiders are mixed, with sizable fractions both concerned and unconcerned by risk from eventual superintelligent AI. Personalities such as Stephen Hawking, Bill Gates, and Elon Musk, as well as AI pioneers such as Yoshua Bengio, Stuart Russell, Demis Hassabis, and Sam Altman, have expressed concerns about existential risk from AI.
In May 2023, Geoffrey Hinton announced his resignation from Google in order to be able to ""freely speak out about the risks of AI"" without ""considering how this impacts Google"". He notably mentioned risks of an AI takeover, and stressed that in order to avoid the worst outcomes, establishing safety guidelines will require cooperation among those competing in use of AI.
In 2023, many leading AI experts endorsed the joint statement that ""Mitigating the risk of extinction from AI should be a global priority alongside other societal-scale risks such as pandemics and nuclear war"".
Some other researchers were more optimistic. AI pioneer Jürgen Schmidhuber did not sign the joint statement, emphasising that in 95% of all cases, AI research is about making ""human lives longer and healthier and easier."" While the tools that are now being used to improve lives can also be used by bad actors, ""they can also be used against the bad actors."" Andrew Ng also argued that ""it's a mistake to fall for the doomsday hype on AI—and that regulators who do will only benefit vested interests."" Yann LeCun ""scoffs at his peers' dystopian scenarios of supercharged misinformation and even, eventually, human extinction."" In the early 2010s, experts argued that the risks are too distant in the future to warrant research or that humans will be valuable from the perspective of a superintelligent machine. However, after 2016, the study of current and future risks and possible solutions became a serious area of research.


Ethical machines and alignment

Friendly AI are machines that have been designed from the beginning to minimize risks and to make choices that benefit humans. Eliezer Yudkowsky, who coined the term, argues that developing friendly AI should be a higher research priority: it may require a large investment and it must be completed before AI becomes an existential risk.
Machines with intelligence have the potential to use their intelligence to make ethical decisions. The field of machine ethics provides machines with ethical principles and procedures for resolving ethical dilemmas.
The field of machine ethics is also called computational morality,
and was founded at an AAAI symposium in 2005.
Other approaches include Wendell Wallach's ""artificial moral agents"" and Stuart J. Russell's three principles for developing provably beneficial machines.


Open source
Active organizations in the AI open-source community include Hugging Face, Google, EleutherAI and Meta. Various AI models, such as Llama 2, Mistral or Stable Diffusion, have been made open-weight, meaning that their architecture and trained parameters (the ""weights"") are publicly available. Open-weight models can be freely fine-tuned, which allows companies to specialize them with their own data and for their own use-case. Open-weight models are useful for research and innovation but can also be misused. Since they can be fine-tuned, any built-in security measure, such as objecting to harmful requests, can be trained away until it becomes ineffective. Some researchers warn that future AI models may develop dangerous capabilities (such as the potential to drastically facilitate bioterrorism) and that once released on the Internet, they cannot be deleted everywhere if needed. They recommend pre-release audits and cost-benefit analyses.


Frameworks
Artificial intelligence projects can be guided by ethical considerations during the design, development, and implementation of an AI system. An AI framework such as the Care and Act Framework, developed by the Alan Turing Institute and based on the SUM values, outlines four main ethical dimensions, defined as follows:

Respect the dignity of individual people
Connect with other people sincerely, openly, and inclusively
Care for the wellbeing of everyone
Protect social values, justice, and the public interest
Other developments in ethical frameworks include those decided upon during the Asilomar Conference, the Montreal Declaration for Responsible AI, and the IEEE's Ethics of Autonomous Systems initiative, among others; however, these principles are not without criticism, especially regarding the people chosen to contribute to these frameworks.
Promotion of the wellbeing of the people and communities that these technologies affect requires consideration of the social and ethical implications at all stages of AI system design, development and implementation, and collaboration between job roles such as data scientists, product managers, data engineers, domain experts, and delivery managers.
The UK AI Safety Institute released in 2024 a testing toolset called 'Inspect' for AI safety evaluations available under an MIT open-source licence which is freely available on GitHub and can be improved with third-party packages. It can be used to evaluate AI models in a range of areas including core knowledge, ability to reason, and autonomous capabilities.


Regulation

The regulation of artificial intelligence is the development of public sector policies and laws for promoting and regulating AI; it is therefore related to the broader regulation of algorithms. The regulatory and policy landscape for AI is an emerging issue in jurisdictions globally. According to AI Index at Stanford, the annual number of AI-related laws passed in the 127 survey countries jumped from one passed in 2016 to 37 passed in 2022 alone. Between 2016 and 2020, more than 30 countries adopted dedicated strategies for AI. Most EU member states had released national AI strategies, as had Canada, China, India, Japan, Mauritius, the Russian Federation, Saudi Arabia, United Arab Emirates, U.S., and Vietnam. Others were in the process of elaborating their own AI strategy, including Bangladesh, Malaysia and Tunisia. The Global Partnership on Artificial Intelligence was launched in June 2020, stating a need for AI to be developed in accordance with human rights and democratic values, to ensure public confidence and trust in the technology. Henry Kissinger, Eric Schmidt, and Daniel Huttenlocher published a joint statement in November 2021 calling for a government commission to regulate AI. In 2023, OpenAI leaders published recommendations for the governance of superintelligence, which they believe may happen in less than 10 years. In 2023, the United Nations also launched an advisory body to provide recommendations on AI governance; the body comprises technology company executives, government officials and academics. In 2024, the Council of Europe created the first international legally binding treaty on AI, called the ""Framework Convention on Artificial Intelligence and Human Rights, Democracy and the Rule of Law"". It was adopted by the European Union, the United States, the United Kingdom, and other signatories.
In a 2022 Ipsos survey, attitudes towards AI varied greatly by country; 78% of Chinese citizens, but only 35% of Americans, agreed that ""products and services using AI have more benefits than drawbacks"". A 2023 Reuters/Ipsos poll found that 61% of Americans agree, and 22% disagree, that AI poses risks to humanity. In a 2023 Fox News poll, 35% of Americans thought it ""very important"", and an additional 41% thought it ""somewhat important"", for the federal government to regulate AI, versus 13% responding ""not very important"" and 8% responding ""not at all important"".
In November 2023, the first global AI Safety Summit was held in Bletchley Park in the UK to discuss the near and far term risks of AI and the possibility of mandatory and voluntary regulatory frameworks. 28 countries including the United States, China, and the European Union issued a declaration at the start of the summit, calling for international co-operation to manage the challenges and risks of artificial intelligence. In May 2024 at the AI Seoul Summit, 16 global AI tech companies agreed to safety commitments on the development of AI.


History

The study of mechanical or ""formal"" reasoning began with philosophers and mathematicians in antiquity. The study of logic led directly to Alan Turing's theory of computation, which suggested that a machine, by shuffling symbols as simple as ""0"" and ""1"", could simulate any conceivable form of mathematical reasoning. This, along with concurrent discoveries in cybernetics, information theory and neurobiology, led researchers to consider the possibility of building an ""electronic brain"". They developed several areas of research that would become part of AI, such as McCulloch and Pitts design for ""artificial neurons"" in 1943, and Turing's influential 1950 paper 'Computing Machinery and Intelligence', which introduced the Turing test and showed that ""machine intelligence"" was plausible.
The field of AI research was founded at a workshop at Dartmouth College in 1956. The attendees became the leaders of AI research in the 1960s. They and their students produced programs that the press described as ""astonishing"": computers were learning checkers strategies, solving word problems in algebra, proving logical theorems and speaking English. Artificial intelligence laboratories were set up at a number of British and U.S. universities in the latter 1950s and early 1960s.
Researchers in the 1960s and the 1970s were convinced that their methods would eventually succeed in creating a machine with general intelligence and considered this the goal of their field. In 1965 Herbert Simon predicted, ""machines will be capable, within twenty years, of doing any work a man can do"". In 1967 Marvin Minsky agreed, writing that ""within a generation ... the problem of creating 'artificial intelligence' will substantially be solved"". They had, however, underestimated the difficulty of the problem. In 1974, both the U.S. and British governments cut off exploratory research in response to the criticism of Sir James Lighthill and ongoing pressure from the U.S. Congress to fund more productive projects. Minsky and Papert's book Perceptrons was understood as proving that artificial neural networks would never be useful for solving real-world tasks, thus discrediting the approach altogether. The ""AI winter"", a period when obtaining funding for AI projects was difficult, followed.
In the early 1980s, AI research was revived by the commercial success of expert systems, a form of AI program that simulated the knowledge and analytical skills of human experts. By 1985, the market for AI had reached over a billion dollars. At the same time, Japan's fifth generation computer project inspired the U.S. and British governments to restore funding for academic research. However, beginning with the collapse of the Lisp Machine market in 1987, AI once again fell into disrepute, and a second, longer-lasting winter began.
Up to this point, most of AI's funding had gone to projects that used high-level symbols to represent mental objects like plans, goals, beliefs, and known facts. In the 1980s, some researchers began to doubt that this approach would be able to imitate all the processes of human cognition, especially perception, robotics, learning and pattern recognition, and began to look into ""sub-symbolic"" approaches. Rodney Brooks rejected ""representation"" in general and focussed directly on engineering machines that move and survive. Judea Pearl, Lotfi Zadeh, and others developed methods that handled incomplete and uncertain information by making reasonable guesses rather than precise logic. But the most important development was the revival of ""connectionism"", including neural network research, by Geoffrey Hinton and others. In 1990, Yann LeCun successfully showed that convolutional neural networks can recognize handwritten digits, the first of many successful applications of neural networks.
AI gradually restored its reputation in the late 1990s and early 21st century by exploiting formal mathematical methods and by finding specific solutions to specific problems. This ""narrow"" and ""formal"" focus allowed researchers to produce verifiable results and collaborate with other fields (such as statistics, economics and mathematics). By 2000, solutions developed by AI researchers were being widely used, although in the 1990s they were rarely described as ""artificial intelligence"" (a tendency known as the AI effect).
However, several academic researchers became concerned that AI was no longer pursuing its original goal of creating versatile, fully intelligent machines. Beginning around 2002, they founded the subfield of artificial general intelligence (or ""AGI""), which had several well-funded institutions by the 2010s.
Deep learning began to dominate industry benchmarks in 2012 and was adopted throughout the field.
For many specific tasks, other methods were abandoned.
Deep learning's success was based on both hardware improvements (faster computers, graphics processing units, cloud computing) and access to large amounts of data (including curated datasets, such as ImageNet). Deep learning's success led to an enormous increase in interest and funding in AI. The amount of machine learning research (measured by total publications) increased by 50% in the years 2015–2019.

In 2016, issues of fairness and the misuse of technology were catapulted into center stage at machine learning conferences, publications vastly increased, funding became available, and many researchers re-focussed their careers on these issues. The alignment problem became a serious field of academic study.
In the late 2010s and early 2020s, AGI companies began to deliver programs that created enormous interest. In 2015, AlphaGo, developed by DeepMind, beat the world champion Go player. The program taught only the game's rules and developed a strategy by itself. GPT-3 is a large language model that was released in 2020 by OpenAI and is capable of generating high-quality human-like text. ChatGPT, launched on November 30, 2022, became the fastest-growing consumer software application in history, gaining over 100 million users in two months. It marked what is widely regarded as AI's breakout year, bringing it into the public consciousness. These programs, and others, inspired an aggressive AI boom, where large companies began investing billions of dollars in AI research. According to AI Impacts, about US$50 billion annually was invested in ""AI"" around 2022 in the U.S. alone and about 20% of the new U.S. Computer Science PhD graduates have specialized in ""AI"". About 800,000 ""AI""-related U.S. job openings existed in 2022. According to PitchBook research, 22% of newly funded startups in 2024 claimed to be AI companies.


Philosophy

Philosophical debates have historically sought to determine the nature of intelligence and how to make intelligent machines. Another major focus has been whether machines can be conscious, and the associated ethical implications. Many other topics in philosophy are relevant to AI, such as epistemology and free will. Rapid advancements have intensified public discussions on the philosophy and ethics of AI.


Defining artificial intelligence

Alan Turing wrote in 1950 ""I propose to consider the question 'can machines think'?"" He advised changing the question from whether a machine ""thinks"", to ""whether or not it is possible for machinery to show intelligent behaviour"". He devised the Turing test, which measures the ability of a machine to simulate human conversation. Since we can only observe the behavior of the machine, it does not matter if it is ""actually"" thinking or literally has a ""mind"". Turing notes that we can not determine these things about other people but ""it is usual to have a polite convention that everyone thinks.""

Russell and Norvig agree with Turing that intelligence must be defined in terms of external behavior, not internal structure. However, they are critical that the test requires the machine to imitate humans. ""Aeronautical engineering texts"", they wrote, ""do not define the goal of their field as making 'machines that fly so exactly like pigeons that they can fool other pigeons.'"" AI founder John McCarthy agreed, writing that ""Artificial intelligence is not, by definition, simulation of human intelligence"".
McCarthy defines intelligence as ""the computational part of the ability to achieve goals in the world"". Another AI founder, Marvin Minsky, similarly describes it as ""the ability to solve hard problems"". The leading AI textbook defines it as the study of agents that perceive their environment and take actions that maximize their chances of achieving defined goals. These definitions view intelligence in terms of well-defined problems with well-defined solutions, where both the difficulty of the problem and the performance of the program are direct measures of the ""intelligence"" of the machine—and no other philosophical discussion is required, or may not even be possible.
Another definition has been adopted by Google, a major practitioner in the field of AI. This definition stipulates the ability of systems to synthesize information as the manifestation of intelligence, similar to the way it is defined in biological intelligence.
Some authors have suggested in practice, that the definition of AI is vague and difficult to define, with contention as to whether classical algorithms should be categorised as AI, with many companies during the early 2020s AI boom using the term as a marketing buzzword, often even if they did ""not actually use AI in a material way"".


Evaluating approaches to AI
No established unifying theory or paradigm has guided AI research for most of its history. The unprecedented success of statistical machine learning in the 2010s eclipsed all other approaches (so much so that some sources, especially in the business world, use the term ""artificial intelligence"" to mean ""machine learning with neural networks""). This approach is mostly sub-symbolic, soft and narrow. Critics argue that these questions may have to be revisited by future generations of AI researchers.


Symbolic AI and its limits
Symbolic AI (or ""GOFAI"") simulated the high-level conscious reasoning that people use when they solve puzzles, express legal reasoning and do mathematics. They were highly successful at ""intelligent"" tasks such as algebra or IQ tests. In the 1960s, Newell and Simon proposed the physical symbol systems hypothesis: ""A physical symbol system has the necessary and sufficient means of general intelligent action.""
However, the symbolic approach failed on many tasks that humans solve easily, such as learning, recognizing an object or commonsense reasoning. Moravec's paradox is the discovery that high-level ""intelligent"" tasks were easy for AI, but low level ""instinctive"" tasks were extremely difficult. Philosopher Hubert Dreyfus had argued since the 1960s that human expertise depends on unconscious instinct rather than conscious symbol manipulation, and on having a ""feel"" for the situation, rather than explicit symbolic knowledge. Although his arguments had been ridiculed and ignored when they were first presented, eventually, AI research came to agree with him.
