Title,Article,Tags,Personas,Summary,Meeting_Plan,Meeting
Game playing programs have been used since the 1950s to demonstrate and test AI's most advanced techniques. Deep Blue became the first computer chess-playing system to beat a reigning world chess champion, Garry Kasparov, on 11 May 1997. In 2011, in a Jeopardy! quiz show exhibition match, IBM's question answering system, Watson, defeated the two greatest Jeopardy! champions, Brad Rutter and Ken Jennings, by a significant margin. In March 2016, AlphaGo won 4 out of 5 games of Go in a match with Go champion Lee Sedol, becoming the first computer Go-playing system to beat a professional Go player without handicaps. Then, in 2017, it defeated Ke Jie, who was the best Go player in the world. Other programs handle imperfect-information games, such as the poker-playing program Pluribus. DeepMind developed increasingly generalistic reinforcement learning models, such as with MuZero, which could be trained to play chess, Go, or Atari games. In 2019, DeepMind's AlphaStar achieved grandmaster level in StarCraft II, a particularly challenging real-time strategy game that involves incomplete knowledge of what happens on the map. In 2021, an AI agent competed in a PlayStation Gran Turismo competition, winning against four of the world's best Gran Turismo drivers using deep reinforcement learning. In 2024, Google DeepMind introduced SIMA, a type of AI capable of autonomously playing nine previously unseen open-world video games by observing screen output, as well as executing short, specific tasks in response to natural language instructions.


Mathematics
Large language models, such as GPT-4, Gemini, Claude, Llama or Mistral, are increasingly used in mathematics. These probabilistic models are versatile, but can also produce wrong answers in the form of hallucinations. They sometimes need a large database of mathematical problems to learn from, but also methods such as supervised fine-tuning or trained classifiers with human-annotated data to improve answers for new problems and learn from corrections. A February 2024 study showed that the performance of some language models for reasoning capabilities in solving math problems not included in their training data was low, even for problems with only minor deviations from trained data. One technique to improve their performance involves training the models to produce correct reasoning steps, rather than just the correct result. The Alibaba Group developed a version of its Qwen models called Qwen2-Math, that achieved state-of-the-art performance on several mathematical benchmarks, including 84% accuracy on the MATH dataset of competition mathematics problems. In January 2025, Microsoft proposed the technique rStar-Math that leverages Monte Carlo tree search and step-by-step reasoning, enabling a relatively small language model like Qwen-7B to solve 53% of the AIME 2024 and 90% of the MATH benchmark problems.
Alternatively, dedicated models for mathematical problem solving with higher precision for the outcome including proof of theorems have been developed such as AlphaTensor, AlphaGeometry, AlphaProof and AlphaEvolve all from Google DeepMind, Llemma from EleutherAI or Julius.
When natural language is used to describe mathematical problems, converters can transform such prompts into a formal language such as Lean to define mathematical tasks.
Some models have been developed to solve challenging problems and reach good results in benchmark tests, others to serve as educational tools in mathematics.
Topological deep learning integrates various topological approaches.


Finance
Finance is one of the fastest growing sectors where applied AI tools are being deployed: from retail online banking to investment advice and insurance, where automated ""robot advisers"" have been in use for some years.
According to Nicolas Firzli, director of the World Pensions & Investments Forum, it may be too early to see the emergence of highly innovative AI-informed financial products and services. He argues that ""the deployment of AI tools will simply further automatise things: destroying tens of thousands of jobs in banking, financial planning, and pension advice in the process, but I'm not sure it will unleash a new wave of [e.g., sophisticated] pension innovation.""


Military

Various countries are deploying AI military applications. The main applications enhance command and control, communications, sensors, integration and interoperability. Research is targeting intelligence collection and analysis, logistics, cyber operations, information operations, and semiautonomous and autonomous vehicles. AI technologies enable coordination of sensors and effectors, threat detection and identification, marking of enemy positions, target acquisition, coordination and deconfliction of distributed Joint Fires between networked combat vehicles, both human-operated and autonomous.
AI has been used in military operations in Iraq, Syria, Israel and Ukraine.


Generative AI


Agents

AI agents are software entities designed to perceive their environment, make decisions, and take actions autonomously to achieve specific goals. These agents can interact with users, their environment, or other agents. AI agents are used in various applications, including virtual assistants, chatbots, autonomous vehicles, game-playing systems, and industrial robotics. AI agents operate within the constraints of their programming, available computational resources, and hardware limitations. This means they are restricted to performing tasks within their defined scope and have finite memory and processing capabilities. In real-world applications, AI agents often face time constraints for decision-making and action execution. Many AI agents incorporate learning algorithms, enabling them to improve their performance over time through experience or training. Using machine learning, AI agents can adapt to new situations and optimise their behaviour for their designated tasks.


Sexuality
Applications of AI in this domain include AI-enabled menstruation and fertility trackers that analyze user data to offer predictions, AI-integrated sex toys (e.g., teledildonics), AI-generated sexual education content, and AI agents that simulate sexual and romantic partners (e.g., Replika).  AI is also used for the production of non-consensual deepfake pornography, raising significant ethical and legal concerns.
AI technologies have also been used to attempt to identify online gender-based violence and online sexual grooming of minors.


Other industry-specific tasks
There are also thousands of successful AI applications used to solve specific problems for specific industries or institutions. In a 2017 survey, one in five companies reported having incorporated ""AI"" in some offerings or processes. A few examples are energy storage, medical diagnosis, military logistics, applications that predict the result of judicial decisions, foreign policy, or supply chain management.
AI applications for evacuation and disaster management are growing. AI has been used to investigate patterns in large-scale and small-scale evacuations using historical data from GPS, videos or social media. Furthermore, AI can provide real-time information on the evacuation conditions.
In agriculture, AI has helped farmers to increase yield and identify areas that need irrigation, fertilization, pesticide treatments. Agronomists use AI to conduct research and development. AI has been used to predict the ripening time for crops such as tomatoes, monitor soil moisture, operate agricultural robots, conduct predictive analytics, classify livestock pig call emotions, automate greenhouses, detect diseases and pests, and save water.
Artificial intelligence is used in astronomy to analyze increasing amounts of available data and applications, mainly for ""classification, regression, clustering, forecasting, generation, discovery, and the development of new scientific insights."" For example, it is used for discovering exoplanets, forecasting solar activity, and distinguishing between signals and instrumental effects in gravitational wave astronomy. Additionally, it could be used for activities in space, such as space exploration, including the analysis of data from space missions, real-time science decisions of spacecraft, space debris avoidance, and more autonomous operation.
During the 2024 Indian elections, US$50 million was spent on authorized AI-generated content, notably by creating deepfakes of allied (including sometimes deceased) politicians to better engage with voters, and by translating speeches to various local languages.


Ethics

AI has potential benefits and potential risks. AI may be able to advance science and find solutions for serious problems: Demis Hassabis of DeepMind hopes to ""solve intelligence, and then use that to solve everything else"". However, as the use of AI has become widespread, several unintended consequences and risks have been identified. In-production systems can sometimes not factor ethics and bias into their AI training processes, especially when the AI algorithms are inherently unexplainable in deep learning.


Risks and harm


Privacy and copyright

Machine learning algorithms require large amounts of data. The techniques used to acquire this data have raised concerns about privacy, surveillance and copyright.
AI-powered devices and services, such as virtual assistants and IoT products, continuously collect personal information, raising concerns about intrusive data gathering and unauthorized access by third parties. The loss of privacy is further exacerbated by AI's ability to process and combine vast amounts of data, potentially leading to a surveillance society where individual activities are constantly monitored and analyzed without adequate safeguards or transparency.
Sensitive user data collected may include online activity records, geolocation data, video, or audio. For example, in order to build speech recognition algorithms, Amazon has recorded millions of private conversations and allowed temporary workers to listen to and transcribe some of them. Opinions about this widespread surveillance range from those who see it as a necessary evil to those for whom it is clearly unethical and a violation of the right to privacy.
AI developers argue that this is the only way to deliver valuable applications and have developed several techniques that attempt to preserve privacy while still obtaining the data, such as data aggregation, de-identification and differential privacy. Since 2016, some privacy experts, such as Cynthia Dwork, have begun to view privacy in terms of fairness. Brian Christian wrote that experts have pivoted ""from the question of 'what they know' to the question of 'what they're doing with it'.""
Generative AI is often trained on unlicensed copyrighted works, including in domains such as images or computer code; the output is then used under the rationale of ""fair use"". Experts disagree about how well and under what circumstances this rationale will hold up in courts of law; relevant factors may include ""the purpose and character of the use of the copyrighted work"" and ""the effect upon the potential market for the copyrighted work"". Website owners who do not wish to have their content scraped can indicate it in a ""robots.txt"" file. In 2023, leading authors (including John Grisham and Jonathan Franzen) sued AI companies for using their work to train generative AI. Another discussed approach is to envision a separate sui generis system of protection for creations generated by AI to ensure fair attribution and compensation for human authors.


Dominance by tech giants
The commercial AI scene is dominated by Big Tech companies such as Alphabet Inc., Amazon, Apple Inc., Meta Platforms, and Microsoft. Some of these players already own the vast majority of existing cloud infrastructure and computing power from data centers, allowing them to entrench further in the marketplace.


Power needs and environmental impacts

In January 2024, the International Energy Agency (IEA) released Electricity 2024, Analysis and Forecast to 2026, forecasting electric power use. This is the first IEA report to make projections for data centers and power consumption for artificial intelligence and cryptocurrency. The report states that power demand for these uses might double by 2026, with additional electric power usage equal to electricity used by the whole Japanese nation.
Prodigious power consumption by AI is responsible for the growth of fossil fuel use, and might delay closings of obsolete, carbon-emitting coal energy facilities. There is a feverish rise in the construction of data centers throughout the US, making large technology firms (e.g., Microsoft, Meta, Google, Amazon) into voracious consumers of electric power. Projected electric consumption is so immense that there is concern that it will be fulfilled no matter the source. A ChatGPT search involves the use of 10 times the electrical energy as a Google search. The large firms are in haste to find power sources – from nuclear energy to geothermal to fusion. The tech firms argue that – in the long view – AI will be eventually kinder to the environment, but they need the energy now. AI makes the power grid more efficient and ""intelligent"", will assist in the growth of nuclear power, and track overall carbon emissions, according to technology firms.
A 2024 Goldman Sachs Research Paper, AI Data Centers and the Coming US Power Demand Surge, found ""US power demand (is) likely to experience growth not seen in a generation...."" and forecasts that, by 2030, US data centers will consume 8% of US power, as opposed to 3% in 2022, presaging growth for the electrical power generation industry by a variety of means. Data centers' need for more and more electrical power is such that they might max out the electrical grid. The Big Tech companies counter that AI can be used to maximize the utilization of the grid by all.
In 2024, the Wall Street Journal reported that big AI companies have begun negotiations with the US nuclear power providers to provide electricity to the data centers. In March 2024 Amazon purchased a Pennsylvania nuclear-powered data center for US$650 million. Nvidia CEO Jensen Huang said nuclear power is a good option for the data centers.
In September 2024, Microsoft announced an agreement with Constellation Energy to re-open the Three Mile Island nuclear power plant to provide Microsoft with 100% of all electric power produced by the plant for 20 years. Reopening the plant, which suffered a partial nuclear meltdown of its Unit 2 reactor in 1979, will require Constellation to get through strict regulatory processes which will include extensive safety scrutiny from the US Nuclear Regulatory Commission. If approved (this will be the first ever US re-commissioning of a nuclear plant), over 835 megawatts of power – enough for 800,000 homes – of energy will be produced. The cost for re-opening and upgrading is estimated at US$1.6 billion and is dependent on tax breaks for nuclear power contained in the 2022 US Inflation Reduction Act. The US government and the state of Michigan are investing almost US$2 billion to reopen the Palisades Nuclear reactor on Lake Michigan. Closed since 2022, the plant is planned to be reopened in October 2025. The Three Mile Island facility will be renamed the Crane Clean Energy Center after Chris Crane, a nuclear proponent and former CEO of Exelon who was responsible for Exelon's spinoff of Constellation.
After the last approval in September 2023, Taiwan suspended the approval of data centers north of Taoyuan with a capacity of more than 5 MW in 2024, due to power supply shortages. Taiwan aims to phase out nuclear power by 2025. On the other hand, Singapore imposed a ban on the opening of data centers in 2019 due to electric power, but in 2022, lifted this ban.
Although most nuclear plants in Japan have been shut down after the 2011 Fukushima nuclear accident, according to an October 2024 Bloomberg article in Japanese, cloud gaming services company Ubitus, in which Nvidia has a stake, is looking for land in Japan near nuclear power plant for a new data center for generative AI. Ubitus CEO Wesley Kuo said nuclear power plants are the most efficient, cheap and stable power for AI.
On 1 November 2024, the Federal Energy Regulatory Commission (FERC) rejected an application submitted by Talen Energy for approval to supply some electricity from the nuclear power station Susquehanna to Amazon's data center. 
According to the Commission Chairman Willie L. Phillips, it is a burden on the electricity grid as well as a significant cost shifting concern to households and other business sectors.
In 2025, a report prepared by the International Energy Agency estimated the greenhouse gas emissions from the energy consumption of AI at 180 million tons. By 2035, these emissions could rise to 300–500 million tonnes depending on what measures will be taken. This is below 1.5% of the energy sector emissions. The emissions reduction potential of AI was estimated at 5% of the energy sector emissions, but rebound effects (for example if people switch from public transport to autonomous cars) can reduce it.


Misinformation

YouTube, Facebook and others use recommender systems to guide users to more content. These AI programs were given the goal of maximizing user engagement (that is, the only goal was to keep people watching). The AI learned that users tended to choose misinformation, conspiracy theories, and extreme partisan content, and, to keep them watching, the AI recommended more of it. Users also tended to watch more content on the same subject, so the AI led people into filter bubbles where they received multiple versions of the same misinformation. This convinced many users that the misinformation was true, and ultimately undermined trust in institutions, the media and the government. The AI program had correctly learned to maximize its goal, but the result was harmful to society. After the U.S. election in 2016, major technology companies took some steps to mitigate the problem.
In the early 2020s, generative AI began to create images, audio, and texts that are virtually indistinguishable from real photographs, recordings, or human writing, while realistic AI-generated videos became feasible in the mid-2020s. It is possible for bad actors to use this technology to create massive amounts of misinformation or propaganda; one such potential malicious use is deepfakes for computational propaganda. AI pioneer Geoffrey Hinton expressed concern about AI enabling ""authoritarian leaders to manipulate their electorates"" on a large scale, among other risks.
AI researchers at Microsoft, OpenAI, universities and other organisations have suggested using ""personhood credentials"" as a way to overcome online deception enabled by AI models.


Algorithmic bias and fairness

Machine learning applications will be biased if they learn from biased data. The developers may not be aware that the bias exists. Bias can be introduced by the way training data is selected and by the way a model is deployed. If a biased algorithm is used to make decisions that can seriously harm people (as it can in medicine, finance, recruitment, housing or policing) then the algorithm may cause discrimination. The field of fairness studies how to prevent harms from algorithmic biases.
On June 28, 2015, Google Photos's new image labeling feature mistakenly identified Jacky Alcine and a friend as ""gorillas"" because they were black. The system was trained on a dataset that contained very few images of black people, a problem called ""sample size disparity"". Google ""fixed"" this problem by preventing the system from labelling anything as a ""gorilla"". Eight years later, in 2023, Google Photos still could not identify a gorilla, and neither could similar products from Apple, Facebook, Microsoft and Amazon.
COMPAS is a commercial program widely used by U.S. courts to assess the likelihood of a defendant becoming a recidivist. In 2016, Julia Angwin at ProPublica discovered that COMPAS exhibited racial bias, despite the fact that the program was not told the races of the defendants. Although the error rate for both whites and blacks was calibrated equal at exactly 61%, the errors for each race were different—the system consistently overestimated the chance that a black person would re-offend and would underestimate the chance that a white person would not re-offend. In 2017, several researchers showed that it was mathematically impossible for COMPAS to accommodate all possible measures of fairness when the base rates of re-offense were different for whites and blacks in the data.
A program can make biased decisions even if the data does not explicitly mention a problematic feature (such as ""race"" or ""gender""). The feature will correlate with other features (like ""address"", ""shopping history"" or ""first name""), and the program will make the same decisions based on these features as it would on ""race"" or ""gender"". Moritz Hardt said ""the most robust fact in this research area is that fairness through blindness doesn't work.""
Criticism of COMPAS highlighted that machine learning models are designed to make ""predictions"" that are only valid if we assume that the future will resemble the past. If they are trained on data that includes the results of racist decisions in the past, machine learning models must predict that racist decisions will be made in the future. If an application then uses these predictions as recommendations, some of these ""recommendations"" will likely be racist. Thus, machine learning is not well suited to help make decisions in areas where there is hope that the future will be better than the past. It is descriptive rather than prescriptive.
Bias and unfairness may go undetected because the developers are overwhelmingly white and male: among AI engineers, about 4% are black and 20% are women.
There are various conflicting definitions and mathematical models of fairness. These notions depend on ethical assumptions, and are influenced by beliefs about society. One broad category is distributive fairness, which focuses on the outcomes, often identifying groups and seeking to compensate for statistical disparities. Representational fairness tries to ensure that AI systems do not reinforce negative stereotypes or render certain groups invisible. Procedural fairness focuses on the decision process rather than the outcome. The most relevant notions of fairness may depend on the context, notably the type of AI application and the stakeholders. The subjectivity in the notions of bias and fairness makes it difficult for companies to operationalize them. Having access to sensitive attributes such as race or gender is also considered by many AI ethicists to be necessary in order to compensate for biases, but it may conflict with anti-discrimination laws.
At its 2022 Conference on Fairness, Accountability, and Transparency (ACM FAccT 2022), the Association for Computing Machinery, in Seoul, South Korea, presented and published findings that recommend that until AI and robotics systems are demonstrated to be free of bias mistakes, they are unsafe, and the use of self-learning neural networks trained on vast, unregulated sources of flawed internet data should be curtailed.


Lack of transparency

Many AI systems are so complex that their designers cannot explain how they reach their decisions. Particularly with deep neural networks, in which there are many non-linear relationships between inputs and outputs. But some popular explainability techniques exist.
It is impossible to be certain that a program is operating correctly if no one knows how exactly it works. There have been many cases where a machine learning program passed rigorous tests, but nevertheless learned something different than what the programmers intended. For example, a system that could identify skin diseases better than medical professionals was found to actually have a strong tendency to classify images with a ruler as ""cancerous"", because pictures of malignancies typically include a ruler to show the scale. Another machine learning system designed to help effectively allocate medical resources was found to classify patients with asthma as being at ""low risk"" of dying from pneumonia. Having asthma is actually a severe risk factor, but since the patients having asthma would usually get much more medical care, they were relatively unlikely to die according to the training data. The correlation between asthma and low risk of dying from pneumonia was real, but misleading.
People who have been harmed by an algorithm's decision have a right to an explanation. Doctors, for example, are expected to clearly and completely explain to their colleagues the reasoning behind any decision they make. Early drafts of the European Union's General Data Protection Regulation in 2016 included an explicit statement that this right exists. Industry experts noted that this is an unsolved problem with no solution in sight. Regulators argued that nevertheless the harm is real: if the problem has no solution, the tools should not be used.
DARPA established the XAI (""Explainable Artificial Intelligence"") program in 2014 to try to solve these problems.
