Title,Article,Tags,Personas,Summary,Meeting_Plan,Meeting
Menzies' 7 September official communique to Nasser presented a case for compensation for the Suez Canal Company and the ""establishment of principles"" for the future use of the canal that would ensure that it would ""continue to be an international waterway operated free of politics or national discrimination, and with financial structure so secure and an international confidence so high that an expanding and improving future for the Canal could be guaranteed"" and called for a convention to recognise Egyptian sovereignty of the canal, but for the establishment of an international body to run the canal. Nasser saw such measures as a ""derogation from Egyptian sovereignty"" and rejected Menzies' proposals. Menzies hinted to Nasser that Britain and France might use force to resolve the crisis, but Eisenhower openly opposed the use of force and Menzies left Egypt without success.
Instead of the 18-nation proposal, the United States proposed an association of canal users that would set rules for its operation. Whereas 14 of the other nations, not including Pakistan, agreed. Britain, in particular, believed that violation of the association rules would result in military force, but after Eden made a speech to this effect in parliament on 12 September, the US Ambassador Dulles insisted ""...we do not intend to shoot our way through"" the canal.: 89–92  The United States worked through diplomatic channels to resolve the crisis without military conflict. ""The British and French reluctantly agreed to pursue the diplomatic avenue but viewed it as merely an attempt to buy time, during which they continued their military preparations."" The British, Washington's closest ally, disregarded Eisenhower's argument that the American people would not accept a military solution.
On 25 September 1956 the Chancellor of the Exchequer Harold Macmillan met informally with Eisenhower at the White House. Macmillan doubted that Eisenhower had a determination to avoid war, and told Eden that the Americans would not in any way oppose the attempt to topple Nasser. The Americans refused to support any move that could be seen as imperialism or colonialism, seeing the US as the champion of decolonisation. Eisenhower felt the crisis had to be handled peacefully; he told Eden that American public opinion, and the international community, ""would be outraged"" unless all peaceful routes had been exhausted, and even then ""the eventual price might become far too heavy"". Eden and other leading British officials believed Nasser's support for Palestinian fedayeen against Israel, as well as his attempts to destabilise pro-western regimes in Iraq and other Arab states, would deter the US from intervening with the operation. London believed that Nasser's engagement with communist states would persuade the Americans to accept British and French actions if they were presented as a fait accompli.


Motives for invading Egypt


Britain and France
Britain was anxious lest it lose efficient access to the remains of its empire. Both Britain and France were eager that the canal should remain open as an important conduit of oil.
Both the French and the British felt that Nasser should be removed from power. The French ""held the Egyptian president responsible for assisting the anti-colonial rebellion in Algeria"". France was nervous about the growing influence that Nasser exerted on its North African colonies and protectorates.


Israel
On the eve of the invasion, David Ben-Gurion outlined to Guy Mollet, the French Prime minister, his plan for a 'new order' in the Middle East. This consisted of (a) Israel occupying and annexing both the Gaza Strip and the Sinai;(b) an Israeli annexation of Southern Lebanon, and the creation of a Christian Maronite state in the remaining territory; (c) the dismantling of Jordan by dividing its land between Israel and Iraq, with Israel annexing the West Bank and Iraq undertaking in a peace treaty to absorb the Palestinian refugees in the former, and in Jordanian refugee camps. Aspiring also to overthrow Nasser, the plan foresaw Israeli exercising control over the Gulf of Aqaba.
Israel wanted to reopen the Straits of Tiran leading to the Gulf of Aqaba to Israeli shipping, and saw the opportunity to strengthen its southern border and to weaken what it saw as a dangerous and hostile state. This was particularly felt in the form of attacks injuring approximately 1,300 civilians emanating from the Egyptian-held Gaza Strip, during the period of Israel's Border Wars
The Israelis were also deeply troubled by Egypt's procurement of large amounts of Soviet weaponry that included 530 armoured vehicles, of which 230 were tanks; 500 guns; 150 MiG-15 jet fighters; 50 Ilyushin Il-28 bombers; submarines and other naval craft. The influx of this advanced weaponry altered an already shaky balance of power. Israel was alarmed by the Czech arms deal, and believed it had only a narrow window of opportunity to hit Egypt's army. Additionally, Israel believed Egypt had formed a secret alliance with Jordan and Syria.
Notably, the strategic alignment of Israel and Britain leading up to the Suez invasion, as represented in the Protocol of Sèvres, ""marked the end of the estrangement between Britain and the Zionist movement that went back to the White Paper of 1939.""


Forces


British

British troops were well-trained, experienced, and had good morale, but suffered from the economic and technological limitations imposed by post-war austerity. The 16th Independent Parachute Brigade Group, which was intended to be the main British strike force against Egypt, was heavily involved in the Cyprus Emergency, which led to a neglect of paratroop training in favour of counter-insurgency operations. The Royal Navy could project formidable power through the guns of its warships and aircraft flown from its carriers, but lacked amphibious capability.
The Royal Navy had just undergone a major and innovative carrier modernisation program. The Royal Air Force (RAF) had just introduced two long-range bombers, the Vickers Valiant and the English Electric Canberra, but owing to their recent entry into service the RAF had not yet established proper bombing techniques for these aircraft. Despite this, General Charles Keightley, the commander of the invasion force, believed that air power alone was sufficient to defeat Egypt. By contrast, General Hugh Stockwell, the Task Force's ground commander, believed that methodical and systematic armoured operations centred on the Centurion battle tank would be the key to victory.


French
French troops were experienced and well-trained but suffered from cutbacks imposed by post-war politics of economic austerity. In 1956, the French Armed Forces was heavily involved in the Algerian war, which made operations against Egypt a major distraction. French paratroopers of the elite Regiment de Parachutistes Coloniaux (RPC) were extremely experienced, battle-hardened, and very tough soldiers, who had greatly distinguished themselves in the fighting in Indochina and in Algeria. The men of the RPC followed a ""shoot first, ask questions later"" policy towards civilians, first adopted in Vietnam, which was to lead to the killing of a number of Egyptian civilians. The rest of the French troops were described by the American military historian Derek Varble as ""competent, but not outstanding"".
The main French (and Israeli) tank, the AMX-13, was designed for mobile, flanking operations, which led to a tank that was lightly armoured but agile. General André Beaufre, who served as Stockwell's subordinate, favoured a swift campaign of movement in which the main objective was to encircle the enemy. Throughout the operation, Beaufre proved himself to be more aggressive than his British counterparts, always urging that some bold step be taken at once. The French Navy had a powerful carrier force which was excellent for projecting power inland, but, like its British counterpart, suffered from a lack of landing craft.


Israeli

American military historian Derek Varble called the Israel Defense Forces (IDF) the ""best"" military force in the Middle East while at the same time suffering from ""deficiencies"" such as ""immature doctrine, faulty logistics, and technical inadequacies"". The IDF's Chief of Staff, Major General Moshe Dayan, encouraged aggression, initiative, and ingenuity among the Israeli officer corps while ignoring logistics and armoured operations. Dayan, a firm infantry man, preferred that arm of the service at the expense of armour, which Dayan saw as clumsy, pricey, and suffering from frequent breakdowns.
At the same time, the IDF had a rather disorganised logistics arm, which was put under severe strain when the IDF invaded the Sinai. Most of the IDF weapons in 1956 came from France. The main IDF tank was the AMX-13 and the main aircraft were the Dassault Mystère IVA and the Ouragan. Superior pilot training was to give the Israeli Air Force an unbeatable edge over their Egyptian opponents. The Israeli Navy consisted of two destroyers, seven frigates, eight minesweepers, several landing craft, and fourteen torpedo boats.


Egyptian
In the Egyptian Armed Forces, politics rather than military competence was the main criterion for promotion. The Egyptian commander, Field Marshal Abdel Hakim Amer, was a purely political appointee who owed his position to his close friendship with Nasser. A heavy drinker, he would prove himself grossly incompetent as a general during the Crisis. In 1956, the Egyptian military was well equipped with weapons from the Soviet Union such as T-34 and IS-3 tanks, MiG-15 fighters, Ilyushin Il-28 bombers, SU-100 self-propelled guns and assault rifles.
Rigid lines between officers and men in the Egyptian Army led to a mutual ""mistrust and contempt"" between officers and the men who served under them. Egyptian troops were excellent in defensive operations, but had little capacity for offensive operations, owing to the lack of ""rapport and effective small-unit leadership"".


Invasion of Egypt


Casualties

British casualties stood at 22 dead and 96 wounded, while French casualties were 10 dead and 33 wounded. The Israeli losses were 172 dead and 817 wounded. The number of Egyptians killed was ""never reliably established"". Egyptian casualties to the Israeli invasion were estimated at 1,000–3,000 dead and 4,000 wounded, while losses to the Anglo-French operation were estimated at 650 dead and 900 wounded. 1,000 Egyptian civilians are estimated to have died.


End of hostilities


British anti-war protests

Although the public believed the British government's justification of the invasion as a separation of Israeli and Egyptian forces, protests against the war occurred in Britain after it began. On the popular television talk show Free Speech, an especially bitter debate took place on 31 October with the leftist historian A. J. P. Taylor and the Labour journalist and future party leader Michael Foot calling their colleague on Free Speech, the Conservative MP Robert Boothby, a ""criminal"" for supporting the war.
One television critic spoke of Free Speech during the war that ""the team seemed to not only on the verge of, but actually losing their tempers.... Boothby boomed, Foot fumed and Taylor trephined, with apparent real malice...."" The angry, passionate, much-watched debates about the Suez war on Free Speech mirrored the divided public response to the war. The British government pressured the BBC to support the war, and seriously considered taking over the network.
Eden's major mistake had been not to strike in July 1956 when there was widespread anger at Nasser's nationalisation of the Suez Canal Company, as by the fall of 1956 public anger had subsided, with many people in Britain having come to accept the fait accompli, and saw no reason for war. This was especially the case as Eden's claims that the Egyptians would hopelessly mismanage the canal had proven groundless, and that by September 1956 it was clear that the change of management had not affected shipping.
Even more importantly, Eden's obsession with secrecy and his desire to keep the preparations for war as secret as possible meant that the Eden government did nothing in the months running up to the attack to explain to the British people why it was felt that war was necessary. Many of the reservists who were called up for their National Service in the summer and fall of 1956 recalled feeling bewildered and confused as the Eden government started preparing to attack Egypt while at the same time Eden insisted in public that he wanted a peaceful resolution of the dispute, and was opposed to attacking Egypt. The British author David Pryce-Jones recalled that as a young officer, after the ultimatum was submitted to Egypt, he had to explain to his troops why war with Egypt was necessary without believing a word that he was saying. Only one British soldier, however, refused to fight.
Gaitskell was much offended that Eden had kept him in the dark about the planning for action against Egypt, and felt personally insulted that Eden had just assumed that he would support the war without consulting him first. On 31 October he cited in Parliament the fact that, despite Eden's claim that the British government had consulted closely with the Commonwealth, no other member nation did; in the Security Council, not even Australia had supported the British action. He called the invasion: 208–209 

an act of disastrous folly whose tragic consequences we shall regret for years. Yes, all of us will regret it, because it will have done irreparable harm to the prestige and reputation of our country ... we shall feel bound by every constitutional means at our disposal to oppose it.
The stormy and violent debates in the House of Commons on 1 November 1956 almost degenerated into fist-fights after several Labour MPs compared Eden to Hitler. Yet the Prime Minister insisted, ""We [are not] at war with Egypt now.[...] There has not been a declaration of war by us. We are in an armed conflict.""  The journalist Malcolm Muggeridge and actor Robert Speaight wrote in a public letter that

The bitter division in public opinion provoked by the British intervention in the Middle East has already had one disastrous consequence. It has deflected popular attention from the far more important struggle in Hungary. A week ago the feelings of the British people were fused in a single flame of admiration for the courage and apparent success of the Hungarian revolt. Now, that success seems threatened by Russian treachery and brute force, and Hungary has appealed to the West.... It is the first, and perhaps will prove the only opportunity to reverse the calamitous decisions of Yalta.... The Prime Minister has told us that 50 million tons of British shipping are at stake in his dispute with President Nasser. What is at stake in Central Europe are rather more than 50 million souls. It may be objected that it is not so easy to help the Hungarians; to this excuse they are entitled to reply that it was not so easy to help themselves.
The Suez Crisis played a key role in the reconciliation of the Gaitskellite and Bevanite factions of the Labour Party, which both condemned the invasion, after the 1955 leadership election. Gaitskell was so impressed by his erstwhile rival Aneurin Bevan's forceful condemnation of the invasion that he offered him the role of Shadow Foreign Secretary, replacing Alfred Robens.
Lady Violet Bonham Carter, an influential Liberal Party member, wrote in a letter to The Times that

I am one of the millions who watching the martyrdom of Hungary and listening yesterday to the transmission of her agonizing appeals of help (immediately followed by our ""successful bombings"" of Egyptian ""targets"") who have felt a humiliation, shame and anger which are beyond expression.... We cannot order Soviet Russia to obey the edict of the United Nations which we ourselves have defied, nor to withdraw her tanks and guns from Hungary while we are bombing and invading Egypt. Today we are standing in the dock with Russia.... Never in my lifetime has our name stood so low in the eyes of the world. Never have we stood so ingloriously alone.
According to public opinion polls at the time, 37% of the British people supported the war while 44% were opposed. The Observer newspaper in a leader (editorial) attacked the Eden government for its ""folly and crookedness"" in attacking Egypt while The Manchester Guardian urged its readers to write letters of protest to their MPs. The Economist spoke of the ""strange union of cynicism and hysteria"" in the government and The Spectator stated that Eden would soon have to face ""a terrible indictment"". The majority of letters written to MPs from their constituents were against the Suez attack. Significantly, many of the letters came from voters who identified as Conservatives. The historian Keith Feiling wrote ""the harm done seems to me terrifying: for my part I have resigned from the party while the present leader is there"". The law professor and future Conservative cabinet minister Norman St. John-Stevas wrote at the time:

I had wanted to stand for the party at the next election, but I cannot bring myself to vote for the party at the moment, let alone stand for it. I am thinking of joining the Labour Party and am having lunch with Frank Pakenham next week.
The historian Hugh Trevor-Roper expressed regret that no senior minister resigned and hoped ""some kind of national Tory party can be saved from the wreck"". A master at Eton College in a letter to his MP declared:

I write to you to express my complete abhorrence of the policy which the government is pursuing.... I have voted Conservative in the last three elections, but I am quite sure my next vote will be for a Labour candidate.
The Labour Party and the Trade Union Congress organised nation-wide anti-war protests, starting on 1 November under the slogan ""Law, not war!"" On 4 November, at an anti-war rally in Trafalgar Square attended by 30,000 people (making it easily the biggest rally in London since 1945), the Labour MP Aneurin Bevan accused the government of ""a policy of bankruptcy and despair"". Bevan stated at the Trafalgar rally:

We are stronger than Egypt but there are other countries stronger than us. Are we prepared to accept for ourselves the logic we are applying to Egypt? If nations more powerful than ourselves accept the absence of principle, the anarchistic attitude of Eden and launch bombs on London, what answer have we got, what complaint have we got? If we are going to appeal to force, if force is to be the arbiter to which we appeal, it would at least make common sense to try to make sure beforehand that we have got it, even if you accept that abysmal logic, that decadent point of view.
We are in fact in the position today of having appealed to force in the case of a small nation, where if it is appealed to against us it will result in the destruction of Great Britain, not only as a nation, but as an island containing living men and women. Therefore I say to Anthony, I say to the British government, there is no count at all upon which they can be defended.

They have besmirched the name of Britain. They have made us ashamed of the things of which formerly we were proud. They have offended against every principle of decency and there is only way in which they can even begin to restore their tarnished reputation and that is to get out! Get out! Get out!
Inspired by Bevan's speech, the crowd at Trafalgar Square then marched on 10 Downing Street chanting ""Eden Must Go!"", and attempted to storm the Prime Minister's residence. The ensuing clashes between the police and the demonstrators which were captured by television cameras had a huge demoralising effect on the Eden cabinet, which was meeting there. The British historian Anthony Adamthwaite wrote in 1988 that American financial pressure was the key factor that forced Eden to accept a ceasefire, but the public protests, declining poll numbers and signs that many Conservative voters were deserting the government were important secondary factors.


Domestic support for Eden
According to some historians, the majority of British people were on Eden's side. On 10 and 11 November an opinion poll found 53% supported the war, with 32% opposed.
The majority of Conservative constituency associations passed resolutions of support to ""Sir Anthony"". Gilbert Murray was among Oxford scholars who signed a statement supporting Eden; such an act by the famous advocate of internationalism amazed both sides. He explained that, if not stopped, he believed Nasserism would become a Soviet-led worldwide anti-western movement.: 202–203  British historian Barry Turner wrote that

The public reaction to press comment highlighted the divisions within the country. But there was no doubt that Eden still commanded strong support from a sizeable minority, maybe even a majority, of voters who thought that it was about time that the upset Arabs should be taught a lesson. The Observer and Guardian lost readers; so too did the News Chronicle, a liberal newspaper that was soon to fold as a result of falling circulation. The economist Roy Harrod wrote at the time that the ""more level-headed British, whom I believe to be in the majority though not the most vocal"" were supporting the ""notable act of courage and statesmanship"" of the government. Eden himself claimed that his mail went from eight to one against the military action immediately after its start, to four to one in support on the day before the ceasefire.
The conflict exposed the division within the Labour Party between its middle-class internationalist intelligentsia who opposed the conflict, and working-class voters who supported it. One Conservative MP wrote: ""I have lost my middle-class followers, but this has been at least balanced by backing from working-class electors who normally vote Socialist and who favour a strong line on Suez"".
The Labour MP Richard Crossman said that ""when the Labour Party leadership tried to organise demonstrations in the Provinces of the kind they'd held in Trafalgar Square, there was great reluctance among the working classes, because we were at war. It was Munich in reverse. And it was very, very acute"". Fellow Labour MP James Callaghan agreed: ""The horny-handed sons of toil rallied to the call of the bugle. They reacted against us in the same way as they did against Chamberlain a few months after Munich"".
""My working mates were solidly in favour of Eden"", recalled future Labour and SDP MP David Owen. Comparing opposition to Suez to what he described as the Cambridge Apostles's ""defeatist, even traitorous"" support of pre-World War II appeasement, Owen told Kenneth Harris, ""there was Gaitskell ... criticizing Eden, and here were these men working alongside me, who should have been his natural supporters, furious with him. The Daily Mirror backed Gaitskell, but these men were tearing up their Daily Mirrors every day"". Callaghan recalled that up until the fighting started ""we had public opinion on our side; but as soon as we actually went to war, I could feel the change"". Another Labour MP, Barbara Castle, recalled that Labour's protest against the conflict was ""drowned in a wave of public jingoism"".
During the Lewisham North and Warwick and Leamington by-elections held in February and March 1957, Labour instructed its activists not to emphasise their opposition to Suez because the government's action had considerable support. Callaghan believed that the Conservatives increased their majority at the 1959 election in part because working-class voters were still angry at the party for opposing the conflict. The Labour MP Stanley Evans resigned from his seat and his membership of the party due to his support for British action in Suez.


International responses


Responses by Western governments

The operation, aimed at taking control of the Suez Canal, Gaza, and parts of Sinai, was highly successful for the invaders from a military point of view, but was a disaster from a political point of view, resulting in international criticism and diplomatic pressure. Along with the Suez crisis, the United States was also dealing with the near-simultaneous Hungarian revolution. Vice-President Richard Nixon later explained: ""We couldn't on one hand, complain about the Soviets intervening in Hungary and, on the other hand, approve of the British and the French picking that particular time to intervene against Nasser"". Beyond that, it was Eisenhower's belief that if the United States were seen to acquiesce in the attack on Egypt, that the resulting backlash in the Arab world might win the Arabs over to the Soviet Union.
Despite having no commercial or military interest in the area, many countries were concerned with the growing rift between Western allied nations. The Swedish ambassador to the Court of St. James's, Gunnar Hägglöf wrote in a letter to the anti-war Conservative M.P. Edward Boyle

I don't think there is any part of the world where the sympathies for England are greater than in Scandinavia. But Scandinavian opinion has never been more shocked by a British government's action—not even by the British-German Naval Agreement of 1935—than by the Suez intervention.
