Title,Article,Tags,Personas,Summary,Meeting_Plan,Meeting
Nasser had let it be known, in 1954–55, that he was considering buying weapons from the Soviet Union, and thus coming under Soviet influence, as a way of pressuring the Americans into selling him the arms he desired. Khrushchev, who very much wanted to win the Soviet Union influence in the Middle East, was more than ready to arm Egypt if the Americans proved unwilling. During secret talks with the Soviets in 1955, Nasser's demands for weapons were more than amply satisfied as the Soviet Union had not signed the Tripartite Declaration. The news in September 1955 of the Egyptian purchase of a huge quantity of Soviet arms via Czechoslovakia was greeted with shock and rage in the West, where this was seen as a major increase in Soviet influence in the Near East. In Britain, the increase of Soviet influence in the Near East was seen as an ominous development that threatened to put an end to British influence in the oil-rich region.


France and Egypt's support for Algerian rebels

Over the same period, the French Premier Guy Mollet was facing an increasingly serious rebellion in Algeria, where the Algerian National Liberation Front (FLN) rebels were being verbally supported by Egypt via transmissions of the Voice of the Arabs radio, financially supported with Suez Canal revenue and clandestinely owned Egyptian ships were shipping arms to the FLN. Mollet came to perceive Nasser as a major threat. During a visit to London in March 1956, Mollet told Eden his country was faced with an Islamic threat to the very soul of France supported by the Soviet Union. Mollet stated: ""All this is in the works of Nasser, just as Hitler's policy was written down in Mein Kampf. Nasser has the ambition to recreate the conquests of Islam. But his present position is largely due to the policy of the West in building up and flattering him"".
In a May 1956 gathering of French veterans, Louis Mangin spoke in place of the unavailable Minister of Defence and gave a violently anti-Nasser speech, which compared the Egyptian leader to Hitler. He accused Nasser of plotting to rule the entire Middle East and of seeking to annex Algeria, whose ""people live in community with France"". Mangin urged France to stand up to Nasser, and being a strong friend of Israel, urged an alliance with that nation against Egypt.


Fluctuation of the Egyptian–Israeli relationship
Prior to 1955, Nasser had pursued efforts to reach peace with Israel and had worked to prevent cross-border Palestinian attacks. In February 1955, Unit 101, an Israeli unit under Ariel Sharon, conducted a raid on the Egyptian Army headquarters in Gaza in retaliation for a Palestinian fedayeen attack that killed an Israeli civilian. As a result of the incident, Nasser began allowing raids into Israel by the Palestinian militants. Egypt established fedayeen bases not just in Gaza but also in Jordan and Lebanon, from which incursions could be launched with a greater amount of plausible deniability on the part of Nasser's Egypt. The raids triggered a series of Israeli reprisal operations, which ultimately contributed to the Suez Crisis.


Emergence of a French–Israeli alliance
Starting in 1949 owing to shared nuclear research, France and Israel started to move towards an alliance. Following the outbreak of the Algerian War in late 1954, France began to ship more and more arms to Israel. In November 1954, the Director-General of Israel's Ministry of Defense Shimon Peres visited Paris, where he was received by the French Defense Minister Marie-Pierre Kœnig, who told him that France would sell Israel any weapons it wanted to buy. By early 1955, France was shipping large amounts of weapons to Israel. In April 1956, following another visit to Paris by Peres, France agreed to totally disregard the Tripartite Declaration, and supply even more weapons to Israel. During the same visit, Peres informed the French that Israel had decided upon war with Egypt in 1956. Peres claimed that Nasser was a genocidal maniac intent upon not only destroying Israel, but also exterminating its people, and as such, Israel wanted a war before Egypt received even more Soviet weapons, and there was still a possibility of victory for the Jewish state.


Frustration of British influence in the Middle East
Throughout 1955 and 1956, Nasser pursued a number of policies that would frustrate British aims throughout the Middle East, and result in increasing hostility between Britain and Egypt. Nasser saw Iraq's inclusion in the Baghdad Pact as indicating that the United States and Britain had sided with his much hated archenemy Nuri al-Said's efforts to be the leader of the Arab world, and much of the motivation for Nasser's turn to an active anti-Western policy starting in 1955 was due to his displeasure with the Baghdad Pact. For Nasser, attendance at such events as the Bandung conference in April 1955 served as both the means of striking a posture as a global leader, and of playing hard to get in his talks with the Americans, especially his demand that the United States sell him vast quantities of arms.
Nasser ""played on the widespread suspicion that any Western defence pact was merely veiled colonialism and that Arab disunity and weakness—especially in the struggle with Israel—was a consequence of British machinations."" He also began to align Egypt with the kingdom of Saudi Arabia—whose rulers were hereditary enemies of the Hashemites—in an effort to frustrate British efforts to draw Syria, Jordan and Lebanon into the orbit of the Baghdad Pact. Nasser struck a further blow against Britain by negotiating an arms deal with communist Czechoslovakia in September 1955.


Egyptian policies in 1956


Nasser and Jordan
Nasser frustrated British attempts to draw Jordan into the pact by sponsoring demonstrations in Amman, leading King Hussein of Jordan in the Arabization of the Jordanian Army command to dismiss the British commander of the Arab Legion, John Bagot Glubb (known to the Arabs as Glubb Pasha) in March 1956. After one round of bloody rioting in December 1955 and another in March 1956 against Jordan joining the Baghdad Pact, both instigated by the Cairo-based Voice of the Arabs radio station, Hussein believed his throne was in danger.


Nasser and Britain
British Prime Minister Anthony Eden was especially upset at the sacking of Glubb Pasha, and as one British politician recalled:

For Eden ... this was the last straw.... This reverse, he insisted was Nasser's doing.... Nasser was our Enemy No. 1 in the Middle East and he would not rest until he destroyed all our friends and eliminated the last vestiges of our influence.... Nasser must therefore be ... destroyed.
After the sacking of Glubb Pasha, which he saw as a grievous blow to British influence, Eden became consumed with an obsessional hatred for Nasser, and from March 1956 onwards, was in private committed to the overthrow of Nasser. The American historian Donald Neff wrote that Eden's often hysterical and overwrought views towards Nasser almost certainly reflected the influence of the amphetamines to which Eden had become addicted following a botched operation in 1953 together with the related effects of sustained sleep deprivation (Eden slept on average about 5 hours per night in early 1956).
Britain was eager to tame Nasser and looked towards the United States for support. However, Eisenhower strongly opposed British-French military action. The United States, opposed to foreign intervention in Egypt, initially blocked British access to IMF help, pressuring the United Kingdom to withdraw its troops. When the British government, left with no choice, acceded to US demands, the IMF extended its largest-ever loan to a member (an immediate $561 million drawing to replenish the UK's reserves, with an additional $739 million ""stand-by"" loan to be provided on an as-needed basis). Smaller loans were extended to France, Israel, and Egypt. America's closest Arab ally, Saudi Arabia, was just as fundamentally opposed to the Hashemite-dominated Baghdad Pact as Egypt, and the U.S. was keen to increase its own influence in the region. The failure of the Baghdad Pact aided such a goal by reducing Britain's dominance over the region. ""Great Britain would have preferred to overthrow Nasser; America, however uncomfortable with the 'Czech arms deal', thought it wiser to propitiate him.""


American financing for Egypt's Aswan Dam
On 16 May 1956, Nasser officially recognized the People's Republic of China, which angered the U.S. and Secretary Dulles, a sponsor of the Republic of China. This move, coupled with the impression that the project was beyond Egypt's economic capabilities, caused Eisenhower to withdraw all American financial aid for the Aswan Dam project on 19 July.
The Eisenhower administration believed that if Nasser were able to secure Soviet economic support for the high dam, that would be beyond the capacity of the Soviet Union to support, and in turn would strain Soviet–Egyptian relations. Eisenhower wrote in March 1956 that ""If Egypt finds herself thus isolated from the rest of the Arab world, and with no ally in sight except Soviet Russia, she would very quickly get sick of the prospect and would join us in the search for a just and decent peace in the region"". Dulles told his brother, CIA director Allen Dulles, ""If they [the Soviets] do make this offer we can make a lot of use of it in propaganda within the satellite bloc. You don't get bread because you are being squeezed to build a dam"".
Finally, the Eisenhower administration had become very annoyed at Nasser's efforts to play the United States off against the Soviet Union, and refused to finance the Aswan high dam. As early as September 1955, when Nasser announced the purchase of the Soviet military equipment via Czechoslovakia, Dulles had written that competing for Nasser's favor was probably going to be ""an expensive process"", one that Dulles wanted to avoid as much as possible.


Nasser–US negotiations
In January 1956, to end the incipient arms race in the Middle East (set off by the Soviet Union selling Egypt arms on a scale unlimited by the Tripartite Declaration and with France doing likewise with Israel), which he saw as opening the Near East to Soviet influence, Eisenhower launched a major effort to make peace between Egypt and Israel. Eisenhower sent out his close friend Robert B. Anderson to serve as a secret envoy who would permanently end the Arab–Israeli dispute. During his meetings with Nasser, Anderson offered large quantities of American aid in exchange for a peace treaty with Israel. Nasser demanded Palestinian refugees be given the opportunity to choose between repatriation or resettlement in Arab countries, wanted to annex the southern half of Israel and rejected direct talks with Israel. Given Nasser's territorial and refugee-related demands, the Israeli Prime Minister David Ben-Gurion suspected that Nasser was not interested in a settlement, insteading demanding face-to-face negotiations with Nasser, starting with lower-level negotiations, and weapons from the US. Nasser was unwilling to accept direct negotiations, citing possible assassinations such as the assassination of King Abduallah.
A second round of secret diplomacy by Anderson in February 1956 was equally unsuccessful. Nasser sometimes suggested during his talks with Anderson that he was interested in peace with Israel if only the Americans would supply him with unlimited quantities of military and economic aid. In case of Israeli acceptance to the Palestinian right of return and to Egypt annexing the southern half of Israel, Egypt would not accept a peace settlement. The United States or the United Nations would have to present the Israeli acceptance to all Arabs as a basis for peace settlements. It is not clear if Nasser was sincerely interested in peace, or just merely saying what the Americans wanted to hear in the hope of obtaining American funding for the Aswan high dam and American weapons. The truth will likely never be known as Nasser was an intensely secretive man, who managed to hide his true opinions on most issues from both contemporaries and historians. However, the British historian P. J. Vatikitos noted that Nasser's determination to promote Egypt as the world's foremost anti-Zionist state as a way of reinforcing his claim to Arab leadership meant that peace was unlikely.
Hasan Afif El-Hasan says that in 1955–1956 the Americans proposed to Nasser that he solve the Arab–Israeli conflict peacefully in exchange for American finance of the High Dam on the Nile river, but Nasser rejected the offer because it would mean siding with the West (as opposed to remaining neutral) in the Cold War. Since the alternative to a peace agreement was a war with unpredictable consequences, Nasser's refusal to accept the proposal was irrational, according to el-Hasan.


Nationalisation of the Suez Canal

Nasser's response was the nationalisation of the Suez Canal. On 26 July 1956, in a speech in Alexandria, Nasser gave a riposte to Dulles. During his speech he deliberately pronounced the name of Ferdinand de Lesseps, the builder of the canal, a code-word for Egyptian forces to seize control of the canal and implement its nationalisation. He announced that the Nationalization Law had been published, that all assets of the Suez Canal Company had been frozen, and that stockholders would be paid the price of their shares according to the day's closing price on the Paris Stock Exchange. That same day, Egypt closed the canal to Israeli shipping. Egypt also closed the Straits of Tiran to Israeli shipping, and blockaded the Gulf of Aqaba, in contravention of the Constantinople Convention of 1888. Many argued that this was also a violation of the 1949 Armistice Agreements.
According to the Egyptian historian Abd al-Azim Ramadan, the events leading up to the nationalisation of the Suez Canal Company, as well as other events during Nasser's rule, showed Nasser to be far from a rational, responsible leader. Ramadan notes Nasser's decision to nationalise the Suez Canal without political consultation as an example of his predilection for solitary decision-making.


British response
The nationalisation surprised Britain and its Commonwealth. There had been no discussion of the canal at the Commonwealth Prime Ministers' Conference in London in late June and early July.: 7–8  Egypt's action, however, threatened British economic and military interests in the region. Prime Minister Eden was under immense domestic pressure from Conservative MPs who drew direct comparisons between the events of 1956 and those of the Munich Agreement in 1938. Since the U.S. government did not support the British protests, the British government decided in favour of military intervention against Egypt to keep the oil supply flowing and avoid the complete collapse of British influence in the region.
Eden was hosting a dinner for King Feisal II of Iraq and his Prime Minister, Nuri es-Said, when he learned the canal had been nationalised. They both unequivocally advised Eden to ""hit Nasser hard, hit him soon, and hit him by yourself""—a stance shared by the vast majority of the British people in subsequent weeks. ""There is a lot of humbug about Suez,"" Guy Millard, one of Eden's private secretaries, later recorded. ""People forget that the policy at the time was extremely popular."" Leader of the Opposition Hugh Gaitskell was also at the dinner. He immediately agreed that military action might be inevitable, but warned Eden would have to keep the Americans closely informed. After a session of the House of Commons expressed anger against the Egyptian action on 27 July, Eden justifiably believed that Parliament would support him; Gaitskell spoke for his party when he called the nationalisation a ""high-handed and totally unjustifiable step"".: 8–9  When Eden made a ministerial broadcast on the nationalisation, Labour declined its right to reply.
However, in the days that followed, Gaitskell's support became more cautious. On 2 August he said of Nasser's behaviour, ""It is all very familiar. It is exactly the same that we encountered from Mussolini and Hitler in those years before the war"". He cautioned Eden, however, that ""[w]e must not, therefore, allow ourselves to get into a position where we might be denounced in the Security Council as aggressors, or where the majority of the Assembly was against us"". He had earlier warned Eden that Labour might not support Britain acting alone against Egypt.: 8–9  In two letters to Eden sent on 3 and 10 August 1956, Gaitskell condemned Nasser but again warned that he would not support any action that violated the United Nations Charter. In his letter of 10 August, Gaitskell wrote:

Lest there should be any doubt in your mind about my personal attitude, let me say that I could not regard an armed attack on Egypt by ourselves and the French as justified by anything which Nasser has done so far or as consistent with the Charter of the United Nations. Nor, in my opinion, would such an attack be justified in order to impose a system of international control over the Canal-desirable though this is. If, of course, the whole matter were to be taken to the United Nations and if Egypt were to be condemned by them as aggressors, then, of course, the position would be different. And if further action which amounted to obvious aggression by Egypt were taken by Nasser, then again it would be different. So far what Nasser has done amounts to a threat, a grave threat to us and to others, which certainly cannot be ignored; but it is only a threat, not in my opinion justifying retaliation by war.
Two dozen Labour MPs issued a statement on 8 August stating that forcing Nasser to denationalise the canal against Egypt's wishes would violate the UN charter. Other opposition politicians were less conditional in their support. Former Labour Foreign Minister Herbert Morrison hinted that he would support unilateral action by the government.: 9–10  Jo Grimond, who became Leader of the Liberal Party that November, thought if Nasser went unchallenged the whole Middle East would go his way.
In Britain, the nationalisation was perceived as a direct threat to British interests. In a letter to the British Ambassador on 10 September 1956, Ivone Kirkpatrick, the Permanent Under-Secretary at the Foreign Office wrote:

If we sit back while Nasser consolidates his position and gradually acquires control of the oil-bearing countries, he can and is, according to our information, resolved to wreck us. If Middle Eastern oil is denied to us for a year or two, our gold reserves will disappear. If our gold reserves disappear, the sterling area disintegrates. If the sterling area disintegrates and we have no reserves, we shall not be able to maintain a force in Germany, or indeed, anywhere else. I doubt whether we shall be able to pay for the bare minimum necessary for our defence. And a country that cannot provide for its defence is finished.
Direct military intervention, however, ran the risk of angering Washington and damaging Anglo-Arab relations. As a result, the British government concluded a secret military pact with France and Israel that was aimed at regaining control over the Suez Canal.


French response
The French Prime Minister Guy Mollet, outraged by Nasser's move, determined that Nasser would not get his way. French public opinion very much supported Mollet, and apart from the French Communist Party, all of the criticism of his government came from the right, who very publicly doubted that a socialist like Mollet had the guts to go to war with Nasser. During an interview with publisher Henry Luce, Mollet held up a copy of Nasser's book The Philosophy of the Revolution and said: ""This is Nasser's Mein Kampf. If we're too stupid not to read it, understand it and draw the obvious conclusions, then so much the worse for us.""

On 29 July 1956, the French Cabinet decided upon military action against Egypt in alliance with Israel, and Admiral Nomy of the French Naval General Staff was sent to Britain to inform the leaders of that country of France's decision, and to invite them to co-operate if interested. At the same time, Mollet felt very much offended by what he considered to be the lackadaisical attitude of the Eisenhower administration to the nationalisation of the Suez Canal Company. This was especially the case because earlier in 1956 the Soviet Foreign Minister Vyacheslav Molotov had offered the French a deal whereby if Moscow ended its support of the FLN in Algeria, Paris would remain in NATO but become ""semi-neutralist"" in the Cold War.
Given the way that Algeria (which the French considered an integral part of France) had become engulfed in a spiral of increasing violence that French leaders longed to put an end to, the Mollet administration had felt tempted by Molotov's offer, but in the end, Mollet, a firm Atlanticist, had chosen to remain faithful to NATO. In Mollet's view, his fidelity to NATO had earned him the right to expect firm American support against Egypt, and when that support proved not forthcoming, he became even more determined that if the Americans were not willing to do anything about Nasser, then France would act.


Commonwealth response
Among the ""White Dominions"" of the British Commonwealth, Canada had few ties with the Suez Canal and twice had refused British requests for peacetime military aid in the Middle East. It had little reaction to the seizure before military action. By 1956 the Panama Canal was much more important than Suez to Australia and New Zealand; the following year two experts would write that it ""is not vital to the Australian economy"". The memory, however, of the two nations fighting in two world wars to protect a canal which many still called their ""lifeline"" to Britain or ""jugular vein"", contributed to Australian Prime Minister Robert Menzies and New Zealand Prime Minister Sidney Holland supporting Britain in the early weeks following the seizure. On 7 August Holland hinted to his parliament that New Zealand might send troops to assist Britain, and received support from the opposition. On 13 August, Menzies, who had travelled to London from the United States after hearing of the nationalisation and became an informal member of the British Cabinet discussing the issue, spoke on the BBC in support of the Eden government's position on the canal. He called the dispute over the canal ""a crisis more grave than any since the Second World War ended"".: 13–16, 56–58, 84  An elder statesman of the Commonwealth who felt that Nasser's actions threatened trading nations like Australia, he argued publicly that Western powers had built the canal but that Egypt was now seeking to exclude them from a role in its ownership or management. South Africa's Johannes Strijdom stated ""it is best to keep our heads out of the beehive"". His government saw Nasser as an enemy but would benefit economically and geopolitically from a closed canal, and diplomatically from not opposing a nation's right to govern its internal affairs.: 16–18 
The ""non-white Dominions"" saw Egypt's seizing of the canal as an admirable act of anti-imperialism, and Nasser's Arab nationalism as similar to Asian nationalism. Indian Prime Minister Jawaharlal Nehru was with Nasser when he learned of the Anglo-American withdrawal of aid for the Aswan Dam. As India was a major user of the canal, however, he remained publicly neutral other than warning that any use of force, or threats, could be ""disastrous"". Suez was also very important to the Dominion of Ceylon's economy, and it was renegotiating defence treaties with Britain, so its government was not as vocal in supporting Egypt as it would have likely been otherwise. Pakistan was also cautious about supporting Egypt given their rivalry as leading Islamic nations, but its government did state that Nasser had the right to nationalise.: 18–24, 79 


Western diplomacy
On 1 August 1956, a tripartite meeting was opened at 10 Downing Street between British Foreign Secretary Selwyn Lloyd, U.S. Ambassador Robert D. Murphy and French Foreign Affairs Minister Christian Pineau.

Almost immediately after the nationalisation, Eisenhower suggested to Eden a conference of maritime nations that used the canal. The British preferred to invite the most important countries, but the Americans believed that inviting as many as possible amid maximum publicity would affect world opinion. Invitations went to the eight surviving signatories of the Constantinople Convention and the 16 other largest users of the canal: Australia, Ceylon, Denmark, Egypt, Ethiopia, France, West Germany, Greece, India, Indonesia, Iran, Italy, Japan, the Netherlands, New Zealand, Norway, Pakistan, Portugal, Soviet Union, Spain, Sweden, Turkey, the United Kingdom, and the United States. All except Egypt—which sent an observer, and used India and the Soviet Union to represent its interests—and Greece accepted the invitation, and the 22 nations' representatives met in London from 16 to 23 August.: 81–89 
Fifteen of the nations supported the American-British-French position of international operation of the canal; Pakistan chose its western allies over its sympathy for Egypt's anti-western position despite resulting great domestic controversy. Ceylon, Indonesia, and the Soviet Union supported India's competing proposal—which Nasser had preapproved—of international supervision only. India criticised Egypt's seizure of the canal, but insisted that its ownership and operation now not change. The majority of 18 chose five nations to negotiate with Nasser in Cairo led by Menzies, while their proposal for international operation of the canal would go to the Security Council.: 81–89 
