Title,Article,Tags,Personas,Summary,Meeting_Plan,Meeting
When Israel refused to withdraw its troops from the Gaza Strip and Sharm el-Sheikh, Eisenhower declared, ""We must not allow Europe to go flat on its back for the want of oil."" He sought UN-backed efforts to impose economic sanctions on Israel until it fully withdrew from Egyptian territory. Senate Majority Leader Lyndon B. Johnson and minority leader William Knowland objected to American pressure on Israel. Johnson told the Secretary of State John Foster Dulles that he wanted him to oppose ""with all its skill"" any attempt to apply sanctions on Israel.
Dulles rebuffed Johnson's request, and informed Eisenhower of the objections made by the Senate. Eisenhower was ""insistent on applying economic sanctions"" to the extent of cutting off private American assistance to Israel which was estimated to be over $100 million a year. Ultimately, the Democratic Party-controlled Senate would not co-operate with Eisenhower's position on Israel. Eisenhower finally told Congress he would take the issue to the American people, saying, ""America has either one voice or none, and that voice is the voice of the President—whether everybody agrees with him or not."" The President spoke to the nation by radio and television where he outlined Israel's refusal to withdraw, explaining his belief that the UN had ""no choice but to exert pressure upon Israel"".


Responses in the Muslim world
The attack on Egypt greatly offended many in the Muslim world. In Pakistan, 300,000 people took part in a rally in Lahore to show solidarity with Egypt, and a violent mob in Karachi chanting anti-British slogans burned down the British High Commission. In Syria, the government blew up the Kirkuk–Baniyas pipeline, which had allowed Iraqi oil to reach tankers in the Mediterranean, to punish Iraq for supporting the invasion and to cut Britain off from one of its main routes for taking delivery of Iraqi oil. King Saud of Saudi Arabia imposed a total oil embargo on Britain and France.


Responses elsewhere in Asia
China made strong statements in support of Egypt, condemned France and Britain, but avoided referencing Israel in its condemnations.: xxxvii 


U.N. General Assembly Resolution 997

On 30 October, the Security Council held a meeting, at the request of the United States, when it submitted a draft resolution calling upon Israel immediately to withdraw its armed forces behind the established armistice lines. It was not adopted because of British and French vetoes. A similar draft resolution sponsored by the Soviet Union was also rejected. On 31 October, also as planned, France and the UK launched an air attack against targets in Egypt, which was followed shortly by a landing of their troops at the northern end of the canal zone. Later that day, considering the grave situation created by the actions against Egypt, and with lack of unanimity among the permanent members preventing it from exercising its primary responsibility to maintain international peace and security, the Security Council passed Resolution 119; it decided to call an emergency special session of the General Assembly for the first time, as provided in the 1950 ""Uniting for Peace"" resolution, in order to make appropriate recommendations to end the fighting.

The emergency special session was convened 1 November; the same day Nasser requested diplomatic assistance from the U.S., without requesting the same from the Soviet Union; he was at first sceptical of the efficacy of U.S. diplomatic efforts at the UN, but later gave full credit to Eisenhower's role in stopping the war.
In the early hours of 2 November, the General Assembly adopted the United States' proposal for Resolution 997 (ES-I); the vote was 64 in favour and 5 opposed (Australia, New Zealand, Britain, France, and Israel) with 6 abstentions. It called for an immediate ceasefire, the withdrawal of all forces behind the armistice lines, an arms embargo, and the reopening of the Suez Canal, which was now blocked. The Secretary-General was requested to observe and report promptly on compliance to both the Security Council and General Assembly, for further action as deemed appropriate in accordance with the UN Charter.
Over the next several days, the emergency special session consequently adopted a series of enabling resolutions, which established the first United Nations Emergency Force (UNEF), on 7 November by Resolution 1001. This proposal of the emergency force and the resulting cease-fire was made possible primarily through the efforts of Lester B. Pearson, the Secretary of External Affairs of Canada, and Dag Hammarskjöld, the Secretary-General of the United Nations. Britain and France agreed to withdraw from Egypt within a week; Israel did not.
The role of Nehru, both as Indian Prime minister and a leader of the Non Aligned Movement was significant; the Indian historian Inder Malhotra wrote that ""Now Nehru—who had tried to be even-handed between the two sides—denounced Eden and co-sponsors of the aggression vigorously. He had a powerful, if relatively silent, ally in the U.S. president Dwight Eisenhower who went to the extent of using America's clout in the IMF to make Eden and Mollet behave"". The Indian historian Inder Malhotra wrote about Nehru's role that: ""So the Suez War ended in Britain's humiliation. Eden lost his job. Nehru achieved his objective of protecting Egypt's sovereignty and Nasser's honour"".


Condemnation of the U.N. in West Germany
A rare example of support for the Anglo-French actions against Egypt came from West Germany. Though his Cabinet was divided, West Germany's Chancellor Konrad Adenauer was furious with the United States for its ""chumminess with the Russians"" as Adenauer called the U.S. refusal to intervene in Hungary and voting with the Soviet Union at the UN Security Council. Adenauer told his Cabinet on 7 November that Nasser was a pro-Soviet force that needed to be cut down to size, and in his view the attack on Egypt was completely justified.
What appalled Adenauer about the crisis was that the United States had come out against the attack on Egypt and voted with the Soviet Union at Security Council against Britain and France, which led Adenauer to fear that the United States and Soviet Union would ""carve up the world"" according to their own interests with no thought for the interests of European states. Adenauer was especially worried by the fact that the American embassy in Bonn would not provide a clear answer as to what was the American policy in response to the Bulganin letters. Adenauer maintained to his Cabinet that the French had every right to invade Egypt because of Nasser's support for the FLN in Algeria, but the British were partly to blame because they ""inexplicably"" shut down their Suez Canal base in 1954.
Subsequently, the traditionally Francophile Adenauer drew closer to Paris. On 5–6 November 1956, he refused to cancel a planned visit to Paris, and his summit with Mollet was clearly meant to be seen as a gesture of moral support. One of Adenauer's aides, Fritz von Eckardt, commented regarding the opening ceremony in Paris where Mollet and Adenauer stood side by side that the national anthems were played ""[i]n the most serious hour France had experienced since the end of the war[;] the two governments were standing shoulder by shoulder"". During the summit in Paris, Mollet commented to Adenauer that a Soviet nuclear strike could destroy Paris at any moment, which added considerably to the tension and helped to draw the French and Germans closer.


Post-invasion Israeli initiatives
On 7 November, David Ben-Gurion addressed the Knesset and declared a great victory, saying that the 1949 armistice agreement with Egypt was dead and buried, and that the armistice lines were no longer valid and could not be restored. Under no circumstances would Israel agree to the stationing of UN forces on its territory or in any area it occupied.: 104–117  He also made an oblique reference to his intention to annex the Sinai Peninsula. Isaac Alteras writes that Ben-Gurion 'was carried away by the resounding victory against Egypt' and while 'a statesman well known for his sober realism, [he] took flight in dreams of grandeur.'
The speech marked the beginning of a four-month-long diplomatic struggle, culminating in withdrawal from all territory, under conditions far less palatable than those envisioned in the speech, but with conditions for sea access to Eilat and a UNEF presence on Egyptian soil. The speech immediately drew increased international pressure on Israel to withdraw. That day in New York, the emergency session passed Resolution 1002, again calling for the immediate withdrawal of Israeli troops to behind the armistice lines, and for the immediate withdrawal of British and French troops from Egyptian territory. After a long Israeli cabinet meeting late on 8 November, Ben-Gurion informed Eisenhower that Israel declared its willingness to accept withdrawal of Israeli forces from Sinai, 'when satisfactory arrangements are made with the international force that is about to enter the canal zone'.


Soviet response
Although the Soviet Union's position in the crisis was as helpless as was the United States' regarding Hungary's uprising, Premier Nikolai Bulganin threatened to intervene on the Egyptian side, and to launch rocket attacks on Britain, France and Israel. Bulganin accused Ben-Gurion of supporting European colonialism, and Mollet of hypocrisy for leading a socialist government while pursuing a right-wing foreign policy.
The Soviet threat to send troops to Egypt to fight the Allies led Eisenhower to fear that this might be the beginning of World War III. One of Eisenhower's aides Emmet Hughes recalled that the reaction at the White House to the Bulganin letters was ""sombre"" as there was fear that this was the beginning to the countdown to World War III, a war that if it occurred would kill hundreds of millions of people. In private, Eisenhower told Undersecretary of State Herbert Hoover Jr. of his fears that:

The Soviet Union might be ready to undertake any wild adventure. They are as scared and furious as Hitler was in his last days. There's nothing more dangerous than a dictatorship in that frame of mind.
If the Soviet Union did go to war with NATO allies Britain and France, then the United States would be unable to remain neutral, because the United States' obligations under NATO would come into effect, requiring them to go to war with the Soviet Union in defence of Britain and France. Likewise, if the Soviet Union attacked Israel, though there was no formal American commitment to defend Israel, the Eisenhower administration would come under heavy domestic pressure to intervene. From Eisenhower's viewpoint, it was better to end the war against Egypt rather than run the risk of this escalating into the Third World War, in case Khrushchev was serious about going to war in defence of Egypt as he insisted in public that he was.
Eisenhower's reaction to these threats from the Soviet Union was: ""If those fellows start something, we may have to hit 'em—and, if necessary, with everything in the bucket."" Eisenhower immediately ordered Lockheed U-2 flights over Syria and Israel to search for any Soviet air forces on Syrian bases, so the British and French could destroy them. He told Hoover and CIA director Allen Dulles, ""If the Soviets attack the French and British directly, we would be in a war and we would be justified in taking military action even if Congress were not in session."" The Americans excluded Israel from the guarantee against Soviet attack, however, alarming the Israeli government. The U-2 showed that Soviet aircraft were not in Syria despite the threats.
Khrushchev often claimed to possess a vast arsenal of nuclear-tipped ICBMs, and while disclaiming any intention of starting a war, maintained that he would be more than happy to turn a conventional war into a nuclear one if war did come. U-2 flights over the Soviet Union, which were intended to discover if the country really did have the nuclear arsenal that it claimed to have, only started in July 1956, and it was not until February 1959 that it firmly established that Khrushchev had vastly exaggerated his nuclear strength.
The supposedly huge Soviet arsenal of ICBMs, with which Khrushchev would wipe out the cities of Britain, France, Israel, and if necessary the United States consisted only of four Semyorka missiles stationed at a swamp south of Arkhangelsk. From the viewpoint of Eisenhower, in 1956 he had no way of knowing for certain whether Khrushchev's nuclear braggadocio was for real or not.
Earlier in 1956, Dulles had warned Eisenhower that Khrushchev was ""the most dangerous person to lead the Soviet Union since the October Revolution"" as Khrushchev was ""not a coldly calculating person, but rather one who reacted emotionally. He was obviously intoxicated much of the time and could be expected to commit irrational acts."" Khrushchev later admitted in his memoirs that he was not seriously ""thinking of going to war"" in November 1956 as he claimed at the time as he lacked the necessary ICBMs to make good his threats.


Economic pressure on Britain and France
The United States also put financial pressure on the UK to end the invasion. Because the Bank of England had lost $45 million between 30 October and 2 November, and Britain's oil supply had been restricted by the closing of the Suez Canal, the British sought immediate assistance from the IMF, but it was denied by the United States. Eisenhower in fact ordered his Secretary of the Treasury, George M. Humphrey, to prepare to sell part of the US Government's Sterling Bond holdings. The UK government considered invading Kuwait and Qatar if oil sanctions were put in place by the US.
Britain's Chancellor of the Exchequer, Harold Macmillan, advised his Prime Minister, Anthony Eden, that the United States was fully prepared to carry out this threat. He also warned his Prime Minister that Britain's foreign exchange reserves simply could not sustain the devaluation of the pound that would come after the United States' actions; and that within weeks of such a move, the country would be unable to import the food and energy supplies needed to sustain the population on the islands. However, there were suspicions in the Cabinet that Macmillan had deliberately overstated the financial situation in order to force Eden out. What Treasury officials had told Macmillan was far less serious than what he told the Cabinet.
In concert with U.S. actions, Saudi Arabia started an oil embargo against Britain and France. The U.S. refused to fill the gap until Britain and France agreed to a rapid withdrawal. Other NATO members refused to sell oil they received from Arab nations to Britain or France.


Ceasefire

Because the British government faced political and economic pressure, the Prime Minister, Anthony Eden, announced a cease fire on 6 November, warning neither France nor Israel beforehand. Troops were still in Port Said and on operational manoeuvres when the order came from London. Port Said had been overrun, and the military assessment was that the Suez Canal could have been completely taken within 24 hours. Eisenhower initially agreed to meet with Eden and Mollet to resolve their differences, but then cancelled the proposed meeting after Secretary of State Dulles advised him it risked inflaming the Middle Eastern situation further.
Eisenhower was not in favour of an immediate withdrawal of British, French and Israeli troops until the US ambassador to the United Nations, Henry Cabot Lodge Jr. pushed for it. Eden's predecessor Winston Churchill commented on 22 November, ""I cannot understand why our troops were halted. To go so far and not go on was madness."" Churchill further added that while he might not have dared to begin the military operation, nevertheless once having ordered it he would certainly not have dared to stop it before it had achieved its objective. Without further guarantee, the Anglo-French Task Force had to finish withdrawing by 22 December 1956, to be replaced by Danish and Colombian units of the UNEF.
The Israelis refused to host any UN force on Israeli-controlled territory and withdrew from the Sinai and Gaza in March 1957. Before the withdrawal the Israeli forces systematically destroyed infrastructure in the Sinai peninsula such as roads, railways and telephone lines, and all houses in the villages of Abu Ageila and El Quseima. Before the railway was destroyed, Israeli troops confiscated Egyptian National Railways equipment including six locomotives and a 30-ton breakdown crane for use by Israel Railways.
The UNEF was formed by forces from countries that were not part of the major alliances, NATO and the Warsaw Pact. Canadian Armed Forces troops participated in later years, since Canada had spearheaded the idea of a neutral force. By 24 April 1957, the canal was fully reopened to shipping.


Aftermath

The conflict resulted in a military victory for the Coalition, but a political victory for Egypt. Egypt maintained control of the canal.
In retirement, Anthony Eden, the British Prime Minister at the time, maintained that the military response had prevented a much larger war in the Middle East. In the context of the massive armament of Egypt via Czechoslovakia, Israel had been expecting an Egyptian invasion in either March or April 1957, as well as a Soviet invasion of Syria. The crisis may also have hastened decolonisation, as many of the remaining British and French colonies gained independence over the next few years. Some argued that the imposed ending to the Crisis led to over-hasty decolonisation in Africa, increasing the chance of civil wars and military dictatorships in newly independent countries.
The fight over the canal also laid the groundwork for the Six-Day War in 1967 due to the lack of a peace settlement following the 1956 war and rising of tensions between Egypt and Israel. Additionally, the Soviet Union was able to avoid most repercussions from its concurrent violent suppression of the rebellion in Hungary, and were able to present an image at the United Nations as a defender of small powers against imperialism.
As a direct result of the Crisis and in order to prevent further Soviet expansion in the region, Eisenhower asked Congress on 5 January 1957 for authorisation to use military force if requested by any Middle Eastern nation to check aggression and, secondly, to set aside $200 million to help Middle Eastern countries that desired aid from the United States. Congress granted both requests and this policy became known as the Eisenhower Doctrine.
The Soviet Union made major gains with regards to influence in the Middle East. As American historian John Lewis Gaddis wrote:

When the British-French-Israeli invasion forced them to choose, Eisenhower and Dulles came down, with instant decisiveness, on the side of the Egyptians. They preferred alignment with Arab nationalism, even if it meant alienating pro-Israeli constituencies on the eve of a presidential election in the United States, even if it meant throwing the NATO alliance into its most divisive crisis yet, even if it meant risking whatever was left of the Anglo-American 'special relationship', even if it meant voting with the Soviet Union in the United Nations Security Council at a time when the Russians, themselves, were invading Hungary and crushing—far more brutally than anything that happened in Egypt—a rebellion against their own authority there. The fact that the Eisenhower administration itself applied crushing economic pressure to the British and French to disengage from Suez, and that it subsequently forced an Israeli pull-back from the Sinai as well—all of this, one might thought, would won the United States the lasting gratitude of Nasser, the Egyptians and the Arab world. Instead, the Americans lost influence in the Middle East as a result of Suez, while the Russians gained it.

Nikita Khrushchev's much publicised threat expressed through letters written by Nikolai Bulganin to begin rocket attacks on 5 November on Britain, France, and Israel if they did not withdraw from Egypt was widely believed at the time to have forced a ceasefire. Accordingly, it enhanced the prestige of the Soviet Union in Egypt, the Arab world, and the Third World, who believed the USSR was prepared to launch a nuclear attack on Britain, France, and Israel for the sake of Egypt. Though Nasser in private admitted that it was American economic pressure that had saved him, it was Khrushchev, not Eisenhower, whom Nasser publicly thanked as Egypt's saviour and special friend. Khrushchev boasted in his memoirs:

Our use of international influence to halt England, France and Israel's aggression against Egypt in 1956 was a historic turning point...Previously they had apparently thought that we were bluffing, when we openly said that the Soviet Union possessed powerful rockets. But then they saw that we really had rockets. And this had its effect.
Khrushchev took the view that the Suez crisis had been a great triumph for Soviet nuclear brinkmanship, arguing publicly and privately that his threat to use nuclear weapons was what had saved Egypt. Khrushchev claimed in his memoirs:

The governments of England and France knew perfectly well that Eisenhower's speech condemning their aggression was just a gesture for the sake of public appearances. But when we delivered our own stern warning to the three aggressors, they knew we weren't playing games with public opinion. They took us seriously.
The conclusion that Khrushchev drew from the Suez crisis, which he saw as his own personal triumph, was that the use of nuclear blackmail was a very effective tool for achieving Soviet foreign policy goals. Therefore, a long period of crises began, starting with the Berlin crisis, beginning later in November 1958, and culminating in the Cuban Missile Crisis of 1962. U.S. Secretary of State John Foster Dulles perceived a power vacuum in the Middle East, and he thought the United States should fill it. His policies, which ultimately led to the Eisenhower Doctrine, were based on the assumption that Nasser and other Arab leaders shared America's fear of the Soviet Union, which was emphatically not the case. In fact, Nasser never wanted Egypt to be aligned with one single superpower, and instead preferred the Americans and Soviets vying for his friendship.
Nasser saw the Eisenhower Doctrine as a heavy-handed American attempt to dominate the Middle East (a region that Nasser believed he ought to dominate),  and led him to ally Egypt with the Soviet Union as an effective counter-weight. It was only with the quiet abandonment of the Eisenhower Doctrine in a National Security Council review in mid-1958 that Nasser started pulling away from the Soviet Union to resume his preferred role as an opportunist who tried to use both superpowers to his advantage, playing on their animosity.
The American historian Arthur L. Herman said that the episode ruined the usefulness of the United Nations to support American geopolitical aims.


Military thought

