Title,Article,Tags,Personas,Summary,Meeting_Plan,Meeting
International legal issues of cyber attacks are complicated in nature. There is no global base of common rules to judge, and eventually punish, cybercrimes and cybercriminals - and where security firms or agencies do locate the cybercriminal behind the creation of a particular piece of malware or form of cyber attack, often the local authorities cannot take action due to lack of laws under which to prosecute.[217][218] Proving attribution for cybercrimes and cyberattacks is also a major problem for all law enforcement agencies. ""Computer viruses switch from one country to another, from one jurisdiction to another – moving around the world, using the fact that we don't have the capability to globally police operations like this. So the Internet is as if someone [had] given free plane tickets to all the online criminals of the world.""[217] The use of techniques such as dynamic DNS, fast flux and bullet proof servers add to the difficulty of investigation and enforcement.

The role of the government is to make regulations to force companies and organizations to protect their systems, infrastructure and information from any cyberattacks, but also to protect its own national infrastructure such as the national power-grid.[219]

The government's regulatory role in cyberspace is complicated. For some, cyberspace was seen as a virtual space that was to remain free of government intervention, as can be seen in many of today's libertarian blockchain and bitcoin discussions.[220]

Many government officials and experts think that the government should do more and that there is a crucial need for improved regulation, mainly due to the failure of the private sector to solve efficiently the cybersecurity problem. R. Clarke said during a panel discussion at the RSA Security Conference in San Francisco, he believes that the ""industry only responds when you threaten regulation. If the industry doesn't respond (to the threat), you have to follow through.""[221] On the other hand, executives from the private sector agree that improvements are necessary, but think that government intervention would affect their ability to innovate efficiently. Daniel R. McCarthy analyzed this public-private partnership in cybersecurity and reflected on the role of cybersecurity in the broader constitution of political order.[222]

On 22 May 2020, the UN Security Council held its second ever informal meeting on cybersecurity to focus on cyber challenges to international peace. According to UN Secretary-General António Guterres, new technologies are too often used to violate rights.[223]

Many different teams and organizations exist, including:

On 14 April 2016, the European Parliament and the Council of the European Union adopted the General Data Protection Regulation (GDPR). The GDPR, which came into force on 25 May 2018, grants individuals within the European Union (EU) and the European Economic Area (EEA) the right to the protection of personal data. The regulation requires that any entity that processes personal data incorporate data protection by design and by default. It also requires that certain organizations appoint a Data Protection Officer (DPO).

Most countries have their own computer emergency response team to protect network security.

Since 2010, Canada has had a cybersecurity strategy.[229][230] This functions as a counterpart document to the National Strategy and Action Plan for Critical Infrastructure.[231] The strategy has three main pillars: securing government systems, securing vital private cyber systems, and helping Canadians to be secure online.[230][231] There is also a Cyber Incident Management Framework to provide a coordinated response in the event of a cyber incident.[232][233]

The Canadian Cyber Incident Response Centre (CCIRC) is responsible for mitigating and responding to threats to Canada's critical infrastructure and cyber systems. It provides support to mitigate cyber threats, technical support to respond & recover from targeted cyber attacks, and provides online tools for members of Canada's critical infrastructure sectors.[234] It posts regular cybersecurity bulletins[235] & operates an online reporting tool where individuals and organizations can report a cyber incident.[236]

To inform the general public on how to protect themselves online, Public Safety Canada has partnered with STOP.THINK.CONNECT, a coalition of non-profit, private sector, and government organizations,[237] and launched the Cyber Security Cooperation Program.[238][239] They also run the GetCyberSafe portal for Canadian citizens, and Cyber Security Awareness Month during October.[240]

Public Safety Canada aims to begin an evaluation of Canada's cybersecurity strategy in early 2015.[231]

Australian federal government announced an $18.2 million investment to fortify the cybersecurity resilience of small and medium enterprises (SMEs) and enhance their capabilities in responding to cyber threats. This financial backing is an integral component of the soon-to-be-unveiled 2023-2030 Australian Cyber Security Strategy, slated for release within the current week. A substantial allocation of $7.2 million is earmarked for the establishment of a voluntary cyber health check program, facilitating businesses in conducting a comprehensive and tailored self-assessment of their cybersecurity upskill.

This avant-garde health assessment serves as a diagnostic tool, enabling enterprises to ascertain the robustness of Australia's cyber security regulations. Furthermore, it affords them access to a repository of educational resources and materials, fostering the acquisition of skills necessary for an elevated cybersecurity posture. This groundbreaking initiative was jointly disclosed by Minister for Cyber Security Clare O'Neil and Minister for Small Business Julie Collins.[241]

Some provisions for cybersecurity have been incorporated into rules framed under the Information Technology Act 2000.[242]

The National Cyber Security Policy 2013 is a policy framework by the Ministry of Electronics and Information Technology (MeitY) which aims to protect the public and private infrastructure from cyberattacks, and safeguard ""information, such as personal information (of web users), financial and banking information and sovereign data"". CERT- In is the nodal agency which monitors the cyber threats in the country. The post of National Cyber Security Coordinator has also been created in the Prime Minister's Office (PMO).

The Indian Companies Act 2013 has also introduced cyber law and cybersecurity obligations on the part of Indian directors. Some provisions for cybersecurity have been incorporated into rules framed under the Information Technology Act 2000 Update in 2013.[243]

Following cyberattacks in the first half of 2013, when the government, news media, television stations, and bank websites were compromised, the national government committed to the training of 5,000 new cybersecurity experts by 2017. The South Korean government blamed its northern counterpart for these attacks, as well as incidents that occurred in 2009, 2011,[244] and 2012, but Pyongyang denies the accusations.[245]

The United States has its first fully formed cyber plan in 15 years, as a result of the release of this National Cyber plan.[246] In this policy, the US says it will: Protect the country by keeping networks, systems, functions, and data safe; Promote American wealth by building a strong digital economy and encouraging strong domestic innovation; Peace and safety should be kept by making it easier for the US to stop people from using computer tools for bad things, working with friends and partners to do this; and increase the United States' impact around the world to support the main ideas behind an open, safe, reliable, and compatible Internet.[247]

The new U.S. cyber strategy[248] seeks to allay some of those concerns by promoting responsible behavior in cyberspace, urging nations to adhere to a set of norms, both through international law and voluntary standards. It also calls for specific measures to harden U.S. government networks from attacks, like the June 2015 intrusion into the U.S. Office of Personnel Management (OPM), which compromised the records of about 4.2 million current and former government employees. And the strategy calls for the U.S. to continue to name and shame bad cyber actors, calling them out publicly for attacks when possible, along with the use of economic sanctions and diplomatic pressure.[249]

The 1986 18 U.S.C. § 1030, the Computer Fraud and Abuse Act is the key legislation. It prohibits unauthorized access or damage of protected computers as defined in 18 U.S.C. § 1030(e)(2). Although various other measures have been proposed[250][251] – none have succeeded.

In 2013, executive order 13636 Improving Critical Infrastructure Cybersecurity was signed, which prompted the creation of the NIST Cybersecurity Framework.

In response to the Colonial Pipeline ransomware attack[252] President Joe Biden signed Executive Order 14028[253] on May 12, 2021, to increase software security standards for sales to the government, tighten detection and security on existing systems, improve information sharing and training, establish a Cyber Safety Review Board, and improve incident response.

The General Services Administration (GSA) has[when?] standardized the penetration test service as a pre-vetted support service, to rapidly address potential vulnerabilities, and stop adversaries before they impact US federal, state and local governments. These services are commonly referred to as Highly Adaptive Cybersecurity Services (HACS).

The Department of Homeland Security has a dedicated division responsible for the response system, risk management program and requirements for cybersecurity in the United States called the National Cyber Security Division.[254][255] The division is home to US-CERT operations and the National Cyber Alert System.[255] The National Cybersecurity and Communications Integration Center brings together government organizations responsible for protecting computer networks and networked infrastructure.[256]

The third priority of the FBI is to: ""Protect the United States against cyber-based attacks and high-technology crimes"",[257] and they, along with the National White Collar Crime Center (NW3C), and the Bureau of Justice Assistance (BJA) are part of the multi-agency task force, The Internet Crime Complaint Center, also known as IC3.[258]

In addition to its own specific duties, the FBI participates alongside non-profit organizations such as InfraGard.[259][260]

The Computer Crime and Intellectual Property Section (CCIPS) operates in the United States Department of Justice Criminal Division. The CCIPS is in charge of investigating computer crime and intellectual property crime and is specialized in the search and seizure of digital evidence in computers and networks.[261] In 2017, CCIPS published A Framework for a Vulnerability Disclosure Program for Online Systems to help organizations ""clearly describe authorized vulnerability disclosure and discovery conduct, thereby substantially reducing the likelihood that such described activities will result in a civil or criminal violation of law under the Computer Fraud and Abuse Act (18 U.S.C. § 1030).""[262]

The United States Cyber Command, also known as USCYBERCOM, ""has the mission to direct, synchronize, and coordinate cyberspace planning and operations to defend and advance national interests in collaboration with domestic and international partners.""[263] It has no role in the protection of civilian networks.[264][265]

The U.S. Federal Communications Commission's role in cybersecurity is to strengthen the protection of critical communications infrastructure, to assist in maintaining the reliability of networks during disasters, to aid in swift recovery after, and to ensure that first responders have access to effective communications services.[266]

The Food and Drug Administration has issued guidance for medical devices,[267] and the National Highway Traffic Safety Administration[268] is concerned with automotive cybersecurity. After being criticized by the Government Accountability Office,[269] and following successful attacks on airports and claimed attacks on airplanes, the Federal Aviation Administration has devoted funding to securing systems on board the planes of private manufacturers, and the Aircraft Communications Addressing and Reporting System.[270] Concerns have also been raised about the future Next Generation Air Transportation System.[271]

The US Department of Defense (DoD) issued DoD Directive 8570 in 2004, supplemented by DoD Directive 8140, requiring all DoD employees and all DoD contract personnel involved in information assurance roles and activities to earn and maintain various industry Information Technology (IT) certifications in an effort to ensure that all DoD personnel involved in network infrastructure defense have minimum levels of IT industry recognized knowledge, skills and abilities (KSA). Andersson and Reimers (2019) report these certifications range from CompTIA's A+ and Security+ through the ICS2.org's CISSP, etc.[272]

Computer emergency response team is a name given to expert groups that handle computer security incidents. In the US, two distinct organizations exist, although they do work closely together.

In the context of U.S. nuclear power plants, the U.S. Nuclear Regulatory Commission (NRC) outlines cybersecurity requirements under 10 CFR Part 73, specifically in §73.54.[274]

The Nuclear Energy Institute's NEI 08-09 document, Cyber Security Plan for Nuclear Power Reactors,[275]  outlines a comprehensive framework for cybersecurity in the nuclear power industry. Drafted with input from the U.S. NRC, this guideline is instrumental in aiding licensees to comply with the Code of Federal Regulations (CFR), which mandates robust protection of digital computers and equipment and communications systems at nuclear power plants against cyber threats.[276]

There is growing concern that cyberspace will become the next theater of warfare. As Mark Clayton from The Christian Science Monitor wrote in a 2015 article titled ""The New Cyber Arms Race"":

In the future, wars will not just be fought by soldiers with guns or with planes that drop bombs. They will also be fought with the click of a mouse a half a world away that unleashes carefully weaponized computer programs that disrupt or destroy critical industries like utilities, transportation, communications, and energy. Such attacks could also disable military networks that control the movement of troops, the path of jet fighters, the command and control of warships.[277]
This has led to new terms such as cyberwarfare and cyberterrorism. The United States Cyber Command was created in 2009[278] and many other countries have similar forces.

There are a few critical voices that question whether cybersecurity is as significant a threat as it is made out to be.[279][280][281]

Cybersecurity is a fast-growing field of IT concerned with reducing organizations' risk of hack or data breaches.[282] According to research from the Enterprise Strategy Group, 46% of organizations say that they have a ""problematic shortage"" of cybersecurity skills in 2016, up from 28% in 2015.[283] Commercial, government and non-governmental organizations all employ cybersecurity professionals. The fastest increases in demand for cybersecurity workers are in industries managing increasing volumes of consumer data such as finance, health care, and retail.[284] However, the use of the term cybersecurity is more prevalent in government job descriptions.[285]

Typical cybersecurity job titles and descriptions include:[286]

Student programs are also available for people interested in beginning a career in cybersecurity.[290][291] Meanwhile, a flexible and effective option for information security professionals of all experience levels to keep studying is online security training, including webcasts.[292][293] A wide range of certified courses are also available.[294]

In the United Kingdom, a nationwide set of cybersecurity forums, known as the U.K Cyber Security Forum, were established supported by the Government's cybersecurity strategy[295] in order to encourage start-ups and innovation and to address the skills gap[296] identified by the U.K Government.

In Singapore, the Cyber Security Agency has issued a Singapore Operational Technology (OT) Cybersecurity Competency Framework (OTCCF). The framework defines emerging cybersecurity roles in Operational Technology. The OTCCF was endorsed by the Infocomm Media Development Authority (IMDA). It outlines the different OT cybersecurity job positions as well as the technical skills and core competencies necessary. It also depicts the many career paths available, including vertical and lateral advancement opportunities.[297]

The following terms used with regards to computer security are explained below:

Since the Internet's arrival and with the digital transformation initiated in recent years, the notion of cybersecurity has become a familiar subject in both our professional and personal lives. Cybersecurity and cyber threats have been consistently present for the last 60 years of technological change. In the 1970s and 1980s, computer security was mainly limited to academia until the conception of the Internet, where, with increased connectivity, computer viruses and network intrusions began to take off. After the spread of viruses in the 1990s, the 2000s marked the institutionalization of organized attacks such as distributed denial of service.[301] This led to the formalization of cybersecurity as a professional discipline.[302]

The April 1967 session organized by Willis Ware at the Spring Joint Computer Conference, and the later publication of the Ware Report, were foundational moments in the history of the field of computer security.[303] Ware's work straddled the intersection of material, cultural, political, and social concerns.[303]

A 1977 NIST publication[304] introduced the CIA triad of confidentiality, integrity, and availability as a clear and simple way to describe key security goals.[305] While still relevant, many more elaborate frameworks have since been proposed.[306][307]

However, in the 1970s and 1980s, there were no grave computer threats because computers and the internet were still developing, and security threats were easily identifiable. More often, threats came from malicious insiders who gained unauthorized access to sensitive documents and files. Although malware and network breaches existed during the early years, they did not use them for financial gain. By the second half of the 1970s, established computer firms like IBM started offering commercial access control systems and computer security software products.[308]

One of the earliest examples of an attack on a computer network was the computer worm Creeper written by Bob Thomas at BBN, which propagated through the ARPANET in 1971.[309] The program was purely experimental in nature and carried no malicious payload. A later program, Reaper, was created by Ray Tomlinson in 1972 and used to destroy Creeper.[citation needed]

Between September 1986 and June 1987, a group of German hackers performed the first documented case of cyber espionage.[310] The group hacked into American defense contractors, universities, and military base networks and sold gathered information to the Soviet KGB. The group was led by Markus Hess, who was arrested on 29 June 1987. He was convicted of espionage (along with two co-conspirators) on 15 Feb 1990.

In 1988, one of the first computer worms, called the Morris worm, was distributed via the Internet. It gained significant mainstream media attention.[311]

Netscape started developing the protocol SSL, shortly after the National Center for Supercomputing Applications (NCSA) launched Mosaic 1.0, the first web browser, in 1993.[312][313] Netscape had SSL version 1.0 ready in 1994, but it was never released to the public due to many serious security vulnerabilities.[312] However, in 1995, Netscape launched Version 2.0.[314]

The National Security Agency (NSA) is responsible for the protection of U.S. information systems and also for collecting foreign intelligence.[315] The agency analyzes commonly used software and system configurations to find security flaws, which it can use for offensive purposes against competitors of the United States.[316]

NSA contractors created and sold click-and-shoot attack tools to US agencies and close allies, but eventually, the tools made their way to foreign adversaries.[317] In 2016, NSAs own hacking tools were hacked, and they have been used by Russia and North Korea.[citation needed] NSA's employees and contractors have been recruited at high salaries by adversaries, anxious to compete in cyberwarfare.[citation needed] In 2007, the United States and Israel began exploiting security flaws in the Microsoft Windows operating system to attack and damage equipment used in Iran to refine nuclear materials. Iran responded by heavily investing in their own cyberwarfare capability, which it began using against the United States.[316]
