Title,Article,Tags,Personas,Summary,Meeting_Plan,Meeting
As the human component of cyber risk is particularly relevant in determining the global cyber risk[96] an organization is facing, security awareness training, at all levels, not only provides formal compliance with regulatory and industry mandates but is considered essential[97] in reducing cyber risk and protecting individuals and companies from the great majority of cyber threats.

The focus on the end-user represents a profound cultural change for many security practitioners, who have traditionally approached cybersecurity exclusively from a technical perspective, and moves along the lines suggested by major security centers[98] to develop a culture of cyber awareness within the organization, recognizing that a security-aware user provides an important line of defense against cyber attacks.

Related to end-user training, digital hygiene or cyber hygiene is a fundamental principle relating to information security and, as the analogy with personal hygiene shows, is the equivalent of establishing simple routine measures to minimize the risks from cyber threats. The assumption is that good cyber hygiene practices can give networked users another layer of protection, reducing the risk that one vulnerable node will be used to either mount attacks or compromise another node or network, especially from common cyberattacks.[99] Cyber hygiene should also not be mistaken for proactive cyber defence, a military term.[100]

The most common acts of digital hygiene can include updating malware protection, cloud back-ups, passwords, and ensuring restricted admin rights and network firewalls.[101] As opposed to a purely technology-based defense against threats, cyber hygiene mostly regards routine measures that are technically simple to implement and mostly dependent on discipline[102] or education.[103] It can be thought of as an abstract list of tips or measures that have been demonstrated as having a positive effect on personal or collective digital security. As such, these measures can be performed by laypeople, not just security experts.

Cyber hygiene relates to personal hygiene as computer viruses relate to biological viruses (or pathogens). However, while the term computer virus was coined almost simultaneously with the creation of the first working computer viruses,[104] the term cyber hygiene is a much later invention, perhaps as late as 2000[105] by Internet pioneer Vint Cerf. It has since been adopted by the Congress[106] and Senate of the United States,[107] the FBI,[108] EU institutions[99] and heads of state.[100]

Responding to attempted security breaches is often very difficult for a variety of reasons, including:

Where an attack succeeds and a breach occurs, many jurisdictions now have in place mandatory security breach notification laws.

The growth in the number of computer systems and the increasing reliance upon them by individuals, businesses, industries, and governments means that there are an increasing number of systems at risk.

The computer systems of financial regulators and financial institutions like the U.S. Securities and Exchange Commission, SWIFT, investment banks, and commercial banks are prominent hacking targets for cybercriminals interested in manipulating markets and making illicit gains.[109] Websites and apps that accept or store credit card numbers, brokerage accounts, and bank account information are also prominent hacking targets, because of the potential for immediate financial gain from transferring money, making purchases, or selling the information on the black market.[110] In-store payment systems and ATMs have also been tampered with in order to gather customer account data and PINs.

The UCLA Internet Report: Surveying the Digital Future (2000) found that the privacy of personal data created barriers to online sales and that more than nine out of 10 internet users were somewhat or very concerned about credit card security.[111]

The most common web technologies for improving security between browsers and websites are named SSL (Secure Sockets Layer), and its successor TLS (Transport Layer Security), identity management and authentication services, and domain name services allow companies and consumers to engage in secure communications and commerce. Several versions of SSL and TLS are commonly used today in applications such as web browsing, e-mail, internet faxing, instant messaging, and VoIP (voice-over-IP). There are various interoperable implementations of these technologies, including at least one implementation that is open source. Open source allows anyone to view the application's source code, and look for and report vulnerabilities.

The credit card companies Visa and MasterCard cooperated to develop the secure EMV chip which is embedded in credit cards. Further developments include the Chip Authentication Program where banks give customers hand-held card readers to perform online secure transactions. Other developments in this arena include the development of technology such as Instant Issuance which has enabled shopping mall kiosks acting on behalf of banks to issue on-the-spot credit cards to interested customers.

Computers control functions at many utilities, including coordination of telecommunications, the power grid, nuclear power plants, and valve opening and closing in water and gas networks. The Internet is a potential attack vector for such machines if connected, but the Stuxnet worm demonstrated that even equipment controlled by computers not connected to the Internet can be vulnerable. In 2014, the Computer Emergency Readiness Team, a division of the Department of Homeland Security, investigated 79 hacking incidents at energy companies.[112]

The aviation industry is very reliant on a series of complex systems which could be attacked.[113] A simple power outage at one airport can cause repercussions worldwide,[114] much of the system relies on radio transmissions which could be disrupted,[115] and controlling aircraft over oceans is especially dangerous because radar surveillance only extends 175 to 225 miles offshore.[116] There is also potential for attack from within an aircraft.[117]

Implementing fixes in aerospace systems poses a unique challenge because efficient air transportation is heavily affected by weight and volume. Improving security by adding physical devices to airplanes could increase their unloaded weight, and could potentially reduce cargo or passenger capacity.[118]

In Europe, with the (Pan-European Network Service)[119] and NewPENS,[120] and in the US with the NextGen program,[121] air navigation service providers are moving to create their own dedicated networks.

Many modern passports are now biometric passports, containing an embedded microchip that stores a digitized photograph and personal information such as name, gender, and date of birth. In addition, more countries[which?] are introducing facial recognition technology to reduce identity-related fraud. The introduction of the ePassport has assisted border officials in verifying the identity of the passport holder, thus allowing for quick passenger processing.[122] Plans are under way in the US, the UK, and Australia to introduce SmartGate kiosks with both retina and fingerprint recognition technology.[123] The airline industry is moving from the use of traditional paper tickets towards the use of electronic tickets (e-tickets). These have been made possible by advances in online credit card transactions in partnership with the airlines. Long-distance bus companies[which?] are also switching over to e-ticketing transactions today.

The consequences of a successful attack range from loss of confidentiality to loss of system integrity, air traffic control outages, loss of aircraft, and even loss of life.

Desktop computers and laptops are commonly targeted to gather passwords or financial account information or to construct a botnet to attack another target. Smartphones, tablet computers, smart watches, and other mobile devices such as quantified self devices like activity trackers have sensors such as cameras, microphones, GPS receivers, compasses, and accelerometers which could be exploited, and may collect personal information, including sensitive health information. WiFi, Bluetooth, and cell phone networks on any of these devices could be used as attack vectors, and sensors might be remotely activated after a successful breach.[124]

The increasing number of home automation devices such as the Nest thermostat are also potential targets.[124]

Today many healthcare providers and health insurance companies use the internet to provide enhanced products and services. Examples are the use of tele-health to potentially offer better quality and access to healthcare, or fitness trackers to lower insurance premiums.[citation needed] Patient records are increasingly being placed on secure in-house networks, alleviating the need for extra storage space.[125]

Large corporations are common targets. In many cases attacks are aimed at financial gain through identity theft and involve data breaches. Examples include the loss of millions of clients' credit card and financial details by Home Depot,[126] Staples,[127] Target Corporation,[128] and Equifax.[129]

Medical records have been targeted in general identify theft, health insurance fraud, and impersonating patients to obtain prescription drugs for recreational purposes or resale.[130] Although cyber threats continue to increase, 62% of all organizations did not increase security training for their business in 2015.[131]

Not all attacks are financially motivated, however: security firm HBGary Federal had a serious series of attacks in 2011 from hacktivist group Anonymous in retaliation for the firm's CEO claiming to have infiltrated their group,[132][133] and Sony Pictures was hacked in 2014 with the apparent dual motive of embarrassing the company through data leaks and crippling the company by wiping workstations and servers.[134][135]

Vehicles are increasingly computerized, with engine timing, cruise control, anti-lock brakes, seat belt tensioners, door locks, airbags and advanced driver-assistance systems on many models. Additionally, connected cars may use WiFi and Bluetooth to communicate with onboard consumer devices and the cell phone network.[136] Self-driving cars are expected to be even more complex. All of these systems carry some security risks, and such issues have gained wide attention.[137][138][139]

Simple examples of risk include a malicious compact disc being used as an attack vector,[140] and the car's onboard microphones being used for eavesdropping. However, if access is gained to a car's internal controller area network, the danger is much greater[136] – and in a widely publicized 2015 test, hackers remotely carjacked a vehicle from 10 miles away and drove it into a ditch.[141][142]

Manufacturers are reacting in numerous ways, with Tesla in 2016 pushing out some security fixes over the air into its cars' computer systems.[143] In the area of autonomous vehicles, in September 2016 the United States Department of Transportation announced some initial safety standards, and called for states to come up with uniform policies.[144][145][146]

Additionally, e-Drivers' licenses are being developed using the same technology. For example, Mexico's licensing authority (ICV) has used a smart card platform to issue the first e-Drivers' licenses to the city of Monterrey, in the state of Nuevo León.[147]

Shipping companies[148] have adopted RFID (Radio Frequency Identification) technology as an efficient, digitally secure, tracking device. Unlike a barcode, RFID can be read up to 20 feet away. RFID is used by FedEx[149] and UPS.[150]

Government and military computer systems are commonly attacked by activists[151][152][153] and foreign powers.[154][155][156][157] Local and regional government infrastructure such as traffic light controls, police and intelligence agency communications, personnel records, as well as student records.[158]

The FBI, CIA, and Pentagon, all utilize secure controlled access technology for any of their buildings. However, the use of this form of technology is spreading into the entrepreneurial world. More and more companies are taking advantage of the development of digitally secure controlled access technology. GE's ACUVision, for example, offers a single panel platform for access control, alarm monitoring and digital recording.[159]

The Internet of things (IoT) is the network of physical objects such as devices, vehicles, and buildings that are embedded with electronics, software, sensors, and network connectivity that enables them to collect and exchange data.[160] Concerns have been raised that this is being developed without appropriate consideration of the security challenges involved.[161][162]

While the IoT creates opportunities for more direct integration of the physical world into computer-based systems,[163][164]
it also provides opportunities for misuse. In particular, as the Internet of Things spreads widely, cyberattacks are likely to become an increasingly physical (rather than simply virtual) threat.[165] If a front door's lock is connected to the Internet, and can be locked/unlocked from a phone, then a criminal could enter the home at the press of a button from a stolen or hacked phone. People could stand to lose much more than their credit card numbers in a world controlled by IoT-enabled devices. Thieves have also used electronic means to circumvent non-Internet-connected hotel door locks.[166]

An attack aimed at physical infrastructure or human lives is often called a cyber-kinetic attack. As IoT devices and appliances become more widespread, the prevalence and potential damage of cyber-kinetic attacks can increase substantially.

Medical devices have either been successfully attacked or had potentially deadly vulnerabilities demonstrated, including both in-hospital diagnostic equipment[167] and implanted devices including pacemakers[168] and insulin pumps.[169] There are many reports of hospitals and hospital organizations getting hacked, including ransomware attacks,[170][171][172][173] Windows XP exploits,[174][175] viruses,[176][177] and data breaches of sensitive data stored on hospital servers.[178][171][179][180] On 28 December 2016 the US Food and Drug Administration released its recommendations for how medical device manufacturers should maintain the security of Internet-connected devices – but no structure for enforcement.[181][182]

In distributed generation systems, the risk of a cyber attack is real, according to Daily Energy Insider. An attack could cause a loss of power in a large area for a long period of time, and such an attack could have just as severe consequences as a natural disaster. The District of Columbia is considering creating a Distributed Energy Resources (DER) Authority within the city, with the goal being for customers to have more insight into their own energy use and giving the local electric utility, Pepco, the chance to better estimate energy demand. The D.C. proposal, however, would ""allow third-party vendors to create numerous points of energy distribution, which could potentially create more opportunities for cyber attackers to threaten the electric grid.""[183]

Perhaps the most widely known digitally secure telecommunication device is the SIM (Subscriber Identity Module) card, a device that is embedded in most of the world's cellular devices before any service can be obtained. The SIM card is just the beginning of this digitally secure environment.

The Smart Card Web Servers draft standard (SCWS) defines the interfaces to an HTTP server in a smart card.[184] Tests are being conducted to secure OTA (""over-the-air"") payment and credit card information from and to a mobile phone. 
Combination SIM/DVD devices are being developed through Smart Video Card technology which embeds a DVD-compliant optical disc into the card body of a regular SIM card.

Other telecommunication developments involving digital security include mobile signatures, which use the embedded SIM card to generate a legally binding electronic signature.

Serious financial damage has been caused by security breaches, but because there is no standard model for estimating the cost of an incident, the only data available is that which is made public by the organizations involved. ""Several computer security consulting firms produce estimates of total worldwide losses attributable to virus and worm attacks and to hostile digital acts in general. The 2003 loss estimates by these firms range from $13 billion (worms and viruses only) to $226 billion (for all forms of covert attacks). The reliability of these estimates is often challenged; the underlying methodology is basically anecdotal.""[185]

However, reasonable estimates of the financial cost of security breaches can actually help organizations make rational investment decisions. According to the classic Gordon-Loeb Model analyzing the optimal investment level in information security, one can conclude that the amount a firm spends to protect information should generally be only a small fraction of the expected loss (i.e., the expected value of the loss resulting from a cyber/information security breach).[186]

As with physical security, the motivations for breaches of computer security vary between attackers. Some are thrill-seekers or vandals, some are activists, others are criminals looking for financial gain. State-sponsored attackers are now common and well resourced but started with amateurs such as Markus Hess who hacked for the KGB, as recounted by Clifford Stoll in The Cuckoo's Egg.

Attackers motivations can vary for all types of attacks from pleasure to political goals.[15] For example, hacktivists may target a company or organization that carries out activities they do not agree with. This would be to create bad publicity for the company by having its website crash.

High capability hackers, often with larger backing or state sponsorship, may attack based on the demands of their financial backers. These attacks are more likely to attempt more serious attack. An example of a more serious attack was the 2015 Ukraine power grid hack, which reportedly utilised the spear-phising, destruction of files, and denial-of-service attacks to carry out the full attack.[187][188]

Additionally, recent attacker motivations can be traced back to extremist organizations seeking to gain political advantage or disrupt social agendas.[189] The growth of the internet, mobile technologies, and inexpensive computing devices have led to a rise in capabilities but also to the risk to environments that are deemed as vital to operations. All critical targeted environments are susceptible to compromise and this has led to a series of proactive studies on how to migrate the risk by taking into consideration motivations by these types of actors. Several stark differences exist between the hacker motivation and that of nation state actors seeking to attack based on an ideological preference.[190]

A key aspect of threat modeling for any system is identifying the motivations behind potential attacks and the individuals or groups likely to carry them out. The level and detail of security measures will differ based on the specific system being protected. For instance, a home personal computer, a bank, and a classified military network each face distinct threats, despite using similar underlying technologies.[191]

Computer security incident management is an organized approach to addressing and managing the aftermath of a computer security incident or compromise with the goal of preventing a breach or thwarting a cyberattack. An incident that is not identified and managed at the time of intrusion typically escalates to a more damaging event such as a data breach or system failure. The intended outcome of a computer security incident response plan is to contain the incident, limit damage and assist recovery to business as usual. Responding to compromises quickly can mitigate exploited vulnerabilities, restore services and processes and minimize losses.[192]
Incident response planning allows an organization to establish a series of best practices to stop an intrusion before it causes damage. Typical incident response plans contain a set of written instructions that outline the organization's response to a cyberattack. Without a documented plan in place, an organization may not successfully detect an intrusion or compromise and stakeholders may not understand their roles, processes and procedures during an escalation, slowing the organization's response and resolution.

There are four key components of a computer security incident response plan:

Some illustrative examples of different types of computer security breaches are given below.

In 1988, 60,000 computers were connected to the Internet, and most were mainframes, minicomputers and professional workstations. On 2 November 1988, many started to slow down, because they were running a malicious code that demanded processor time and that spread itself to other computers – the first internet computer worm.[194] The software was traced back to 23-year-old Cornell University graduate student Robert Tappan Morris who said ""he wanted to count how many machines were connected to the Internet"".[194]

In 1994, over a hundred intrusions were made by unidentified crackers into the Rome Laboratory, the US Air Force's main command and research facility. Using trojan horses, hackers were able to obtain unrestricted access to Rome's networking systems and remove traces of their activities. The intruders were able to obtain classified files, such as air tasking order systems data and furthermore able to penetrate connected networks of National Aeronautics and Space Administration's Goddard Space Flight Center, Wright-Patterson Air Force Base, some Defense contractors, and other private sector organizations, by posing as a trusted Rome center user.[195]

In early 2007, American apparel and home goods company TJX announced that it was the victim of an unauthorized computer systems intrusion[196] and that the hackers had accessed a system that stored data on credit card, debit card, check, and merchandise return transactions.[197]

In 2010, the computer worm known as Stuxnet reportedly ruined almost one-fifth of Iran's nuclear centrifuges.[198] It did so by disrupting industrial programmable logic controllers (PLCs) in a targeted attack. This is generally believed to have been launched by Israel and the United States to disrupt Iran's nuclear program[199][200][201][202] – although neither has publicly admitted this.

In early 2013, documents provided by Edward Snowden were published by The Washington Post and The Guardian[203][204] exposing the massive scale of NSA global surveillance. There were also indications that the NSA may have inserted a backdoor in a NIST standard for encryption.[205] This standard was later withdrawn due to widespread criticism.[206] The NSA additionally were revealed to have tapped the links between Google's data centers.[207]

A Ukrainian hacker known as Rescator broke into Target Corporation computers in 2013, stealing roughly 40 million credit cards,[208] and then Home Depot computers in 2014, stealing between 53 and 56 million credit card numbers.[209] Warnings were delivered at both corporations, but ignored; physical security breaches using self checkout machines are believed to have played a large role. ""The malware utilized is absolutely unsophisticated and uninteresting,"" says Jim Walter, director of threat intelligence operations at security technology company McAfee – meaning that the heists could have easily been stopped by existing antivirus software had administrators responded to the warnings. The size of the thefts has resulted in major attention from state and Federal United States authorities and the investigation is ongoing.

In April 2015, the Office of Personnel Management discovered it had been hacked more than a year earlier in a data breach, resulting in the theft of approximately 21.5 million personnel records handled by the office.[210] The Office of Personnel Management hack has been described by federal officials as among the largest breaches of government data in the history of the United States.[211] Data targeted in the breach included personally identifiable information such as Social Security numbers, names, dates and places of birth, addresses, and fingerprints of current and former government employees as well as anyone who had undergone a government background check.[212][213] It is believed the hack was perpetrated by Chinese hackers.[214]

In July 2015, a hacker group is known as The Impact Team successfully breached the extramarital relationship website Ashley Madison, created by Avid Life Media. The group claimed that they had taken not only company data but user data as well. After the breach, The Impact Team dumped emails from the company's CEO, to prove their point, and threatened to dump customer data unless the website was taken down permanently.[215] When Avid Life Media did not take the site offline the group released two more compressed files, one 9.7GB and the second 20GB. After the second data dump, Avid Life Media CEO Noel Biderman resigned; but the website remained to function.

In June 2021, the cyber attack took down the largest fuel pipeline in the U.S. and led to shortages across the East Coast.[216]

