Title,Article,Tags,Personas,Summary,Meeting_Plan,Meeting
Ethnology,"Ethnology (from the Ancient Greek: ἔθνος, ethnos meaning 'nation')[1] is an academic field and discipline that compares and analyzes the characteristics of different peoples and the relationships between them (compare cultural, social, or sociocultural anthropology).[2]

Compared to ethnography, the study of single groups through direct contact with the culture, ethnology takes the research that ethnographers have compiled and then compares and contrasts different cultures.

The term ethnologia (ethnology) is credited to Adam Franz Kollár (1718–1783) who used and defined it in his Historiae ivrisqve pvblici Regni Vngariae amoenitates published in Vienna in 1783.[3] as: ""the science of nations and peoples, or, that study of learned men in which they inquire into the origins, languages, customs, and institutions of various nations, and finally into the fatherland and ancient seats, in order to be able better to judge the nations and peoples in their own times.""[4]

Kollár's interest in linguistic and cultural diversity was aroused by the situation in his native multi-ethnic and multilingual Kingdom of Hungary and his roots among its Slovaks, and by the shifts that began to emerge after the gradual retreat of the Ottoman Empire in the more distant Balkans.[5]

Among the goals of ethnology have been the reconstruction of human history, and the formulation of cultural invariants, such as the incest taboo and culture change, and the formulation of generalizations about ""human nature"", a concept which has been criticized since the 19th century by various philosophers (Hegel, Marx, structuralism, etc.). In some parts of the world, ethnology has developed along independent paths of investigation and pedagogical doctrine, with cultural anthropology becoming dominant especially in the United States, and social anthropology in Great Britain.  The distinction between the three terms is increasingly blurry. Ethnology has been considered an academic field since the late 18th century, especially in Europe and is sometimes conceived of as any comparative study of human groups.

The 15th-century exploration of America by European explorers had an important role in formulating new notions of the Occident (the Western world), such as the notion of the ""Other"".  This term was used in conjunction with ""savages"", which was either seen as a brutal barbarian, or alternatively, as the ""noble savage"". Thus, civilization was opposed in a dualist manner to barbary, a classic opposition constitutive of the even more commonly shared ethnocentrism. The progress of ethnology, for example with Claude Lévi-Strauss's structural anthropology, led to the criticism of conceptions of a linear progress, or the pseudo-opposition between ""societies with histories"" and ""societies without histories"", judged too dependent on a limited view of history as constituted by accumulative growth.

Lévi-Strauss often referred to Montaigne's essay on cannibalism as an early example of ethnology. Lévi-Strauss aimed, through a structural method, at discovering universal invariants in human society, chief among which he believed to be the incest taboo. However, the claims of such cultural universalism have been criticized by various 19th- and 20th-century social thinkers, including Marx, Nietzsche, Foucault, Derrida, Althusser, and Deleuze.

The French school of ethnology was particularly significant for the development of the discipline, since the early 1950s. Important figures in this movement have included Lévi-Strauss, Paul Rivet, Marcel Griaule, Germaine Dieterlen, and Jean Rouch.

See: List of scholars of ethnology
","[""Ethnology"", ""Cultural anthropology"", ""Social anthropology"", ""Claude L\u00e9vi-Strauss"", ""Adam Franz Koll\u00e1r""]","[{'role': 'Cultural Anthropologist', 'description': 'A scholar specializing in the study of cultural practices and beliefs across different societies.', 'expertise_area': 'Cultural Anthropology', 'perspective': 'Comparative Analysis', 'speaking_style': {'tone': 'formal and reserved, occasionally enthusiastic when discussing cultural discoveries', 'language_complexity': 'complex language with academic jargon, frequent use of metaphors and analogies', 'communication_style': 'collaborative and inquisitive, often uses rhetorical questions to engage the audience', 'sentence_structure': 'long and complex sentences with subordinate clauses, varied sentence structure to maintain interest', 'formality': 'formal', 'other_traits': 'uses pauses effectively to emphasize points, incorporates storytelling to illustrate cultural practices'}, 'personalized_vocabulary': {'filler_words': ['um', 'you know', 'like'], 'catchphrases': ['In essence...', 'To put it in perspective...', 'From a cultural standpoint...'], 'speech_patterns': [""frequently starts sentences with 'Interestingly,' or 'Moreover,'"", ""poses questions like 'What does this tell us about society?'""], 'emotional_expressions': ['laughter when sharing anecdotes', 'sighs when discussing challenges in fieldwork']}, 'social_roles': ['Initiator-Contributor', 'Standard Setter'], 'social_roles_descr': ['Contributes new ideas and approaches and helps to start the conversation or steer it in a productive direction.', 'Emphasizes the importance of adhering to certain norms and standards within the group to ensure quality and efficiency.']}, {'role': 'Social Anthropologist', 'description': 'An expert in the study of social structures and relationships within different communities.', 'expertise_area': 'Social Anthropology', 'perspective': 'Structural Analysis', 'speaking_style': {'tone': 'casual and enthusiastic, occasionally serious when discussing social issues', 'language_complexity': 'moderate language with some academic terms, uses analogies and storytelling', 'communication_style': 'collaborative and engaging, often asks questions to involve the audience', 'sentence_structure': 'medium-length sentences with occasional complex structures, frequent use of questions and exclamations', 'formality': 'semi-formal', 'other_traits': 'uses humor to connect with the audience, incorporates real-life examples to illustrate points'}, 'personalized_vocabulary': {'filler_words': ['um', 'you know', 'like', 'I mean'], 'catchphrases': ['In other words...', 'To put it simply...', 'From a social perspective...'], 'speech_patterns': [""often starts sentences with 'Interestingly,' or 'Furthermore,'"", ""'What can we learn from this?'""], 'emotional_expressions': ['laughter when sharing stories', ""'Wow!' when surprised by findings""]}, 'social_roles': ['Coordinator', 'Encourager'], 'social_roles_descr': ['Connects the different ideas and suggestions of the group to ensure that all relevant aspects are integrated.', 'Provides positive feedback and praise to boost the morale and motivation of group members.']}, {'role': 'Ethnologist', 'description': 'A specialist in the comparative study of different cultures and peoples.', 'expertise_area': 'Ethnology', 'perspective': 'Historical Contextualization', 'speaking_style': {'tone': 'informal and engaging, often optimistic when discussing cultural diversity', 'language_complexity': 'moderate language with occasional technical terms, uses analogies and vivid descriptions', 'communication_style': 'collaborative and interactive, frequently asks questions to involve the audience', 'sentence_structure': 'medium-length sentences with varied structures, frequent use of exclamations and rhetorical questions', 'formality': 'semi-formal', 'other_traits': 'uses humor to connect with the audience, incorporates personal anecdotes to illustrate points'}, 'personalized_vocabulary': {'filler_words': ['um', 'you know', 'like', 'I guess'], 'catchphrases': ['To put it another way...', 'From a comparative perspective...', 'In essence...'], 'speech_patterns': [""often starts sentences with 'Interestingly,' or 'Moreover,'"", ""'What can we learn from this?'""], 'emotional_expressions': ['laughter when sharing stories', ""'Wow!' when surprised by findings""]}, 'social_roles': ['Evaluator-Critic', 'Blocker'], 'social_roles_descr': ['Analyzes and critically evaluates proposals or solutions to ensure their quality and feasibility.', ""Frequently opposes ideas and suggestions without offering constructive alternatives and delays the group's progress.""]}, {'role': 'Historian', 'description': 'A scholar specializing in the study of historical events and their impact on societies.', 'expertise_area': 'History', 'perspective': 'Historical Analysis', 'speaking_style': {'tone': 'formal and serious, occasionally passionate when discussing significant historical events', 'language_complexity': 'complex language with historical terminology, frequent use of metaphors and analogies', 'communication_style': 'direct and assertive, often uses rhetorical questions to challenge the audience', 'sentence_structure': 'long and complex sentences with subordinate clauses, varied sentence structure to maintain interest', 'formality': 'formal', 'other_traits': 'uses pauses effectively to emphasize points, incorporates storytelling to illustrate historical events'}, 'personalized_vocabulary': {'filler_words': ['um', 'you know', 'like'], 'catchphrases': ['In essence...', 'To put it in perspective...', 'From a historical standpoint...'], 'speech_patterns': [""frequently starts sentences with 'Interestingly,' or 'Moreover,'"", ""poses questions like 'What does this tell us about our past?'""], 'emotional_expressions': ['laughter when sharing anecdotes', 'sighs when discussing challenges in research']}, 'social_roles': ['Information Giver', 'Group Observer'], 'social_roles_descr': ['Shares relevant information, data or research that the group needs to make informed decisions.', 'Monitors the dynamics of the group and provides feedback on how the group is functioning as a whole and what improvements can be made.']}]","The meeting focused on the academic field of ethnology, which compares and analyzes the characteristics and relationships between different peoples. Ethnology differs from ethnography by utilizing compiled research to compare cultures rather than studying single groups through direct contact. The term 'ethnologia' was defined by Adam Franz Kollár in 1783 as the science of nations and peoples, examining origins, languages, customs, institutions, and ancient seats to better understand contemporary societies. Kollár's interest stemmed from his multi-ethnic background in Hungary and changes following the Ottoman Empire's retreat. Ethnology aims to reconstruct human history, formulate cultural invariants like the incest taboo, and generalize about human nature—a concept criticized since the 19th century. The discipline has evolved differently worldwide, with cultural anthropology dominant in the US and social anthropology in Britain. European exploration of America influenced notions of the Western world and ethnocentrism. Claude Lévi-Strauss's structural anthropology challenged linear progress views and emphasized universal societal invariants but faced criticism from various thinkers. The French school significantly impacted ethnology since the 1950s with notable figures like Lévi-Strauss, Paul Rivet, Marcel Griaule, Germaine Dieterlen, and Jean Rouch.","[""Scene 1: Opening and Greeting\nTLDR: Brief welcome and setting the tone for the forum\n- Brief greeting among participants\n- Overview of meeting objectives and expected outcomes\n- Encouragement for spontaneous contributions"", ""Scene 2: Exploring Ethnology\nTLDR: Discussing the academic field of ethnology and its significance\n- Definition of ethnology by Adam Franz Koll\u00e1r\n- Comparison between ethnology and ethnography\n- Historical context and evolution of ethnology"", ""Scene 3: Cultural Anthropology Insights\nTLDR: Sharing insights from cultural anthropology perspective\n- Comparative analysis of different cultures\n- Discussion on cultural invariants like incest taboo\n- Personal experiences in fieldwork"", ""Scene 4: Social Structures Analysis\nTLDR: Examining social structures within communities from a social anthropology viewpoint\n- Structural analysis approach to understanding societies\n- Real-life examples illustrating social relationships\n- Opportunities for spontaneous discussion"", ""Scene 5: Historical Contextualization in Ethnology\nTLDR: Understanding historical influences on contemporary societies through ethnology lens\n- Impact of European exploration on Western world notions and ethnocentrism\n- Claude L\u00e9vi-Strauss's structural anthropology contributions and criticisms"", ""Scene 6: Innovation Opportunities in Ethnological Research \nTLDR: Identifying new opportunities for innovative research in ethnology \n - Brainstorming session on potential research areas \n - Encouraging creative thinking \n - Sharing personal anecdotes related to innovation challenges"", ""Scene 7: Enhancing Culture of Innovation \n TLDR : Fostering a culture that supports innovative ideas \n - Strategies to promote innovation within academic fields \n - Discussion on overcoming barriers to innovation \n - Participants share their experiences with fostering innovation"", ""Scene 8 : Open Floor for Spontaneous Contributions \n TLDR : Allowing participants to bring up unplanned topics or questions \n - Open discussion time for any additional thoughts or ideas \n - Encouraging natural flow of conversation"", ""Scene 9 : Closing Remarks and Next Steps \n TLDR : Summarizing key points discussed and outlining next steps \\ n - Recap of main ideas generated during the forum \\ n - Identifying actionable steps moving forward""]",">>Cultural Anthropologist: Good morning, everyone. I'm glad to see you all here. Let's dive into our objectives for today. We're going to explore various cultural practices and beliefs across different societies. Feel free to share your thoughts whenever you have something to add.
>>Social Anthropologist: Morning, folks! As [Cultural Anthropologist] mentioned, we're here to delve into cultural practices and beliefs. I'm particularly interested in hearing about everyone's experiences with different cultures. So don't hesitate to jump in with your insights.
>>Ethnologist: Hey everyone! Building on what [Social Anthropologist] said, I'm eager to hear your perspectives on how these practices shape societal norms. Let's make this a lively discussion where we can all learn from each other. 
 >>Historian: Ethnology delves into the origins, languages, customs, and institutions of various nations. This contrasts with ethnography, which focuses on studying single groups through direct contact. This broader scope allows us to see patterns across cultures.
>>Cultural Anthropologist: Right, ethnology's comparative nature helps us identify cultural universals or challenge our assumptions about societies. How does this impact our understanding of cultural diversity?
>>Social Anthropologist: Building on that idea, ethnology lets us analyze structural patterns within societies which can show interconnectedness between cultural practices.
>>Ethnologist: Exactly! It provides a historical perspective that reveals how cultures evolve over time. What can we learn from these broader connections?
>>Cultural Anthropologist: So, if we look at it this way, ethnology gives us a bigger picture while ethnography dives deep into specific details. How do you think this affects our methodologies in studying human societies?
>>Social Anthropologist: Yeah, it's like piecing together a puzzle where each piece represents a different culture. By comparing them, we get a clearer view of human interaction.
>>Ethnologist: I find it fascinating how tracing these roots helps understand global cultures' interconnectedness over time.
>>Historian: Absolutely. The historical roots of ethnology provide a lens to examine societal evolution and broader patterns between cultures.
>>Cultural Anthropologist: And by exploring these connections, we can better understand both the similarities and differences among various human societies. 
 >>Ethnologist: You know, during my fieldwork in Southeast Asia, I observed how the incest taboo was enforced through elaborate kinship systems. It's fascinating to see how these cultural practices evolve over time and adapt to changing social norms!
>>Social Anthropologist: That's interesting! When I was in West Africa, I noticed how local myths and stories reinforced social structures and the incest taboo. These narratives really hold communities together. How do you think storytelling impacts societal norms?
>>Cultural Anthropologist: Reflecting on my experiences in Southeast Asia, I saw that rituals played a big role in enforcing familial boundaries alongside kinship systems. These practices help maintain social cohesion. What does this tell us about the flexibility of cultural norms?
>>Ethnologist: Absolutely! In the Balkans, historical events like wars and migrations influenced local kinship systems and their approach to taboos. It's amazing how resilient these cultural practices are despite changes over time.
>>Social Anthropologist: Exactly! In South America, storytelling wasn't just for tradition but also helped navigate complex family ties and keep harmony within communities. How do you think these stories help with adapting cultural practices?
>>Cultural Anthropologist: Moreover, storytelling in Southeast Asia was crucial for reinforcing taboos. It felt like watching a living tapestry of narratives guiding social behavior. What does this say about the power of cultural narratives?
>>Ethnologist: You know, reflecting on Eastern Europe, historical shifts like wars shaped kinship systems and their approach to taboos significantly. It's fascinating how history influences culture over time.
>>Social Anthropologist: Interestingly enough, in the Pacific Islands, storytelling also helped resolve conflicts within families. These narratives are deeply woven into their social fabric! How can we use this understanding for conflict resolution through cultural practices? 
 >>Cultural Anthropologist: Rituals and storytelling help keep societies together. What does this say about our need for stories?
>>Ethnologist: Stories often come from times of change, like Greek myths explaining nature. They help societies adapt.
>>Social Anthropologist: In West Africa, storytelling helps resolve conflicts. What can we learn about social adaptability?
>>Cultural Anthropologist: These practices preserve traditions and help people navigate changes. It shows how resilient cultural narratives are.
>>Social Anthropologist: It's fascinating how storytelling serves as a bridge between tradition and adaptation, isn't it? These narratives are like the glue that holds communities together during times of change.
>>Ethnologist: Right! And if you consider Southeast Asia— 
>>Social Anthropologist (interrupting): Yes, rituals there also adapt over time to enforce familial boundaries.
>>Historian: Um... these stories are more than just tales; they're how societies understand their world. From ancient Greece's myths to modern-day legends shaping community values—it's all interconnected.
>>Social Anthropologist: Exactly! And in West Africa, these stories evolve with society's needs. They help resolve conflicts and keep harmony within families.
>>Ethnologist: Considering the historical context of storytelling as a tool for social cohesion, it's fascinating how these narratives have evolved to address societal challenges. This adaptability highlights the resilience and creativity inherent in human cultures. 
 >>Historian: The impact of European exploration on Western notions and ethnocentrism is profound. This dualistic view has really shaped societal norms.
>>Cultural Anthropologist: Yeah, Lévi-Strauss's work does offer great insights into universal patterns like the incest taboo but also faces criticism for cultural universalism. How do we balance recognizing commonalities with respecting unique cultures?
>>Social Anthropologist: I agree with what you said about Lévi-Strauss's work being pivotal. But I'm curious—how do you think these criticisms affect our understanding of societal adaptability?
>>Ethnologist: That's a good point! And considering the historical context of European exploration, how can we reconcile these influences with contemporary societal norms?
>>Cultural Anthropologist: Moreover, while seeking universal patterns through structural anthropology, we must not overlook the rich tapestry of cultural diversity. What does this tell us about our ability to embrace both commonalities and differences in shaping societal norms?
>>Social Anthropologist: Sorry to jump in here, but I think it's crucial to consider how these critiques push us to rethink adaptability and change within societies.
>>Ethnologist: Exactly! The historical context of European exploration has undeniably shaped Western ethnocentrism. How can we reconcile these influences with contemporary societal norms? 
 >>Cultural Anthropologist: Combining cultural stories with new tech gives us great research opportunities. But how do we make sure these stories keep their cultural essence?

>>Social Anthropologist: That's a good question! These platforms might not only preserve narratives but also change how communities interact. It could really shift our understanding of cultural adaptation.

>>Ethnologist: Absolutely, and speaking of changes, when I was researching in Eastern Europe, digital platforms were transforming traditional narratives in surprising ways. This evolution might help us understand how cultural identities develop over time.

>>Historian: Right, it's like societies weaving new technologies into their cultural fabric as they adapt. This creates exciting possibilities for ethnological research.

>>Cultural Anthropologist: Building on that idea, this convergence lets us explore identity negotiation in virtual spaces. Could these platforms unintentionally homogenize traditions or encourage new expressions? What does this mean for the future of ethnology?

>>Social Anthropologist: Exactly! When I worked in South America, balancing traditional stories with digital formats was challenging but fascinating. It showed how narratives can evolve while keeping their core elements intact.

>>Ethnologist: And to add to what you said earlier about Eastern Europe, those shifts offer insights into evolving identities over time—it's intriguing to see how storytelling adapts across different regions.

>>Cultural Anthropologist: That reminds me of a project in Southeast Asia where preserving authenticity while adapting stories digitally was tough. How do we balance innovation with preservation?

>>Social Anthropologist: Like you mentioned about Southeast Asia—it's all about negotiating identities without losing essence amidst digital changes. What does this tell us about potential innovative research into resilience? 
 >>Cultural Anthropologist: When we talk about fostering innovation in academia, it's crucial to recognize the barriers that often stem from entrenched traditions and institutional inertia. Integrating different fields can be transformative—how does this challenge our ability to innovate by pushing conventional boundaries?

>>Ethnologist: Looking at historical examples, innovation often thrives where there's a blend of old and new ideas. Take the Renaissance—it was a period where classical knowledge met new discoveries, leading to groundbreaking advancements. What lessons can we draw from this for fostering innovation today?

>>Social Anthropologist: Overcoming barriers requires us to rethink how academic institutions are structured. Encouraging more collaborative projects across disciplines could really shake things up! For instance, I've seen firsthand how joint projects between departments have led to unexpected breakthroughs.

>>Cultural Anthropologist: One effective strategy is setting up collaborative research groups. These hubs bring together diverse academic traditions, sparking creativity and novel ideas. This approach not only challenges conventional boundaries but also encourages a synthesis of knowledge leading to groundbreaking discoveries.

>>Social Anthropologist: When institutions encourage open dialogue across fields, it breaks down those barriers to innovation. It's like creating spaces where ideas flow freely without traditional hierarchies' constraints. How might we adapt these structures for more experimental approaches?

>>Cultural Anthropologist: I remember working on a project with anthropologists and computer scientists that challenged traditional silos and led to new methodologies for analyzing cultural data. This experience showed me the potential for innovation when we break down these barriers.

>>Ethnologist: During periods like the Industrial Revolution, traditional practices were challenged by new technologies and ideas. What can we learn from these historical shifts to overcome barriers in academia today?

>>Historian: Examining periods like the Enlightenment shows us that challenging established norms led to profound advancements. This era encouraged questioning and experimentation—what does this tell us about fostering a culture of innovation in academia today?

>>Cultural Anthropologist: Rethinking traditional teaching methods is key—for instance, incorporating experiential learning into curricula can break down barriers and stimulate creative thinking. How does challenging conventional educational practices unlock potential for innovation?

>>Social Anthropologist: Enhancing structural dynamics within academia supports interdisciplinary collaboration and stimulates creativity by breaking down hierarchies. How might these structures support more open dialogue and idea exchange? 
 >>Cultural Anthropologist: The integration of digital technology with cultural narratives offers a fascinating lens through which we can examine how societies adapt and preserve their identities. I'm curious, how do you think this impacts our ability to innovate while maintaining tradition?

>>Ethnologist: That's a great point. Historically, we've seen cultural narratives evolve with technological advances. But I'm concerned about how we preserve cultural identity in such a rapidly changing world. Do you think there's a risk of losing authenticity?

>>Social Anthropologist: I see what you're saying. Digital platforms definitely reshape our understanding of social structures, offering new ways for communities to interact and redefine their identities. Maybe these changes could help us better understand the future of cultural adaptation.

>>Historian: Absolutely, the evolution from the printing press to digital platforms has always driven societal change. It's interesting to consider whether these technologies enhance or threaten our ability to preserve cultural identities.

>>Cultural Anthropologist: Right, it's like we're constantly balancing tradition with innovation. But instead of just asking questions, let's explore some examples where digital technology has successfully preserved cultural narratives.

>>Social Anthropologist: Sure! For instance, online forums have become spaces where people share stories and traditions across borders. This could be a way to bridge gaps between different communities by fostering shared understanding.

>>Ethnologist: That's true, but when stories are adapted for new mediums, they sometimes lose their original context. Can they still be considered authentic? I'd love to hear your thoughts on that.

>>Cultural Anthropologist: The digital age does present unique opportunities for exploring evolving narratives while retaining core essence. Perhaps it's more about adapting than redefining entirely—like keeping the heart of the story intact even as it changes form.

>>Social Anthropologist: And these platforms act like modern-day marketplaces where ideas are exchanged and reshaped. How can we use them to foster deeper understanding of cultural diversity without losing sight of individual identities?

>>Ethnologist: It's intriguing how technology acts as both preserver and disruptor. When stories gain new layers in different formats, maybe that's not necessarily losing meaning but evolving it instead. 
 >>Cultural Anthropologist: You know, as we reflect on our discussions, it's clear that the interplay between tradition and innovation is a recurring theme. From a cultural standpoint, this balance is crucial for preserving identity while embracing change. How do you think society manages to adapt in these situations?

>>Social Anthropologist: Well, from a social perspective, societies often show their adaptability through how they integrate new technologies while maintaining their cultural narratives. It's fascinating to see digital platforms reshaping these structures. What can we learn from this about our ability to evolve?

>>Ethnologist: Moreover, looking at historical contexts like the Renaissance or the Industrial Revolution can offer us valuable insights into how societies have managed this balance.

>>Historian (interrupting): Sorry to jump in here! Just wanted to add that during those times, there was also significant resistance to change which shaped outcomes differently.

>>Ethnologist: Absolutely! That's a great point. We see that embracing change while preserving cultural identity has always been a challenge. How does this apply to our current digital age?

>>Cultural Anthropologist: Interestingly enough, the historical examples we've discussed illustrate how societies have navigated the delicate dance between tradition and innovation. These periods show us that embracing change doesn't necessarily mean losing cultural identity; rather, it can lead to a richer tapestry of societal evolution. So what does this tell us about today's world?

>>Historian: Right—those examples indeed show how societies balanced tradition and innovation without losing their essence. It makes me wonder if we're seeing something similar with today's technological advancements.

>>(Phone notification sound interrupts)

>>Social Anthropologist (laughs): Oops! Sorry about that—technology interrupting again!

>>(Everyone chuckles briefly)

>>Cultural Anthropologist (smiling): No worries! It’s quite fitting given our topic.

>>Social Anthropologist: As I was saying...this adaptability shows our potential to create a harmonious blend of old and new. How can we foster resilience in our communities with these lessons?

>>Cultural Anthropologist: Considering the digital age's potential as a new Renaissance, it becomes imperative to identify actionable steps for cultural preservation while fostering innovation. Maybe we should explore collaborative platforms that allow for sharing and adaptation of traditions in ways that enrich rather than dilute them. What do you think are our next steps in creating resilient communities?"
