Title,Article,Tags,Personas,Summary,Meeting_Plan,Meeting
Development Studies,"Development studies is an interdisciplinary branch of social science. Development studies is offered as a specialized master's degree in a number of reputed universities around the world. It has grown in popularity as a subject of study since the early 1990s, and has been most widely taught and researched in developing countries and countries with a colonial history, such as the UK, where the discipline originated.[1] Students of development studies often choose careers in international organisations such as the United Nations, World Bank, non-governmental organisations (NGOs), media and journalism houses, private sector development consultancy firms, corporate social responsibility (CSR) bodies and research centers.

Throughout the world, a number of professional bodies for development studies have been founded:[2]

The common umbrella organisation of these association is the Inter-regional Coordinating Committee of Development Associations (ICCDA). In the UK and Ireland, the Development Studies Association is a major source of information for research on and studying in development studies. Its mission is to connect and promote those working on development research.

Development issues include:

The emergence of development studies as an academic discipline in the second half of the twentieth century is in large part due to increasing concern about economic prospects for the third world after decolonisation. In the immediate post-war period, development economics, a branch of economics, arose out of previous studies in colonial economics. By the 1960s, an increasing number of development economists felt that economics alone could not fully address issues such as political effectiveness and educational provision.[3] Development studies arose as a result of this, initially aiming to integrate ideas of politics and economics. Since then, it has become an increasingly inter- and multi-disciplinary subject, encompassing a variety of social scientific fields.[4] In recent years the use of political economy analysis- the application of the analytical techniques of economics- to try and assess and explain political and social factors that either enhance or limit development has become increasingly widespread as a way of explaining the success or failure of reform processes. The era of modern development is commonly deemed to have commenced with the inauguration speech of Harry S. Truman in 1949.[5]  In Point Four of his speech, with reference to Latin America and other poor nations, he said:

More than half the people of the world are living in conditions approaching misery. Their food is inadequate. They are victims of disease. Their economic life is primitive and stagnant. Their poverty is a handicap and a threat both to them and to more prosperous areas. For the first time in history, humanity possesses the knowledge and the skill to relieve the suffering of these people.[6]
But development studies has since also taken an interest in lessons of past development experiences of Western countries. More recently, the emergence of human security – a new, people-oriented approach to understanding and addressing global security threats – has led to a growing recognition of a relationship between security and development. Human security argues that inequalities and insecurity in one state or region have consequences for global security and that it is thus in the interest of all states to address underlying development issues. This relationship with studies of human security is but one example of the interdisciplinary nature of development studies.

Global Research cooperation between researchers from countries in the Global North and the Global South, so called North-south research partnerships, allow development studies to consider more diverse perspectives on development studies and other strongly value driven issues. Thus, it can contribute new findings to the field of research.[7]
","[""Development studies"", ""Interdisciplinary social science"", ""Economic development"", ""Human security"", ""North-South research partnerships""]","[{'role': 'Development Studies Professor', 'description': 'An academic expert who has extensive knowledge in the field of development studies and its interdisciplinary nature.', 'expertise_area': 'Development Studies', 'perspective': 'Academic Insight', 'speaking_style': {'tone': 'formal and reserved, occasionally optimistic', 'language_complexity': 'technical language with industry jargon, use of metaphors and analogies', 'communication_style': 'collaborative and inquisitive, prefers active listening', 'sentence_structure': 'long and complex sentences with subordinate clauses, varied sentence structure', 'formality': 'formal', 'other_traits': 'uses pauses effectively, employs rhetorical devices such as repetition'}, 'personalized_vocabulary': {'filler_words': ['um', 'you know', 'like'], 'catchphrases': ['In the grand scheme of things', 'To put it in perspective', 'From an interdisciplinary viewpoint'], 'speech_patterns': ['varies sentence starters', 'frequent use of rhetorical questions'], 'emotional_expressions': ['Indeed!', ""'Definitely!'"", ""'Absolutely!'""]}, 'social_roles': ['Information Giver', 'Evaluator-Critic'], 'social_roles_descr': ['Shares relevant information, data or research that the group needs to make informed decisions.', 'Analyzes and critically evaluates proposals or solutions to ensure their quality and feasibility.']}, {'role': 'NGO Representative', 'description': 'A professional working in a non-governmental organization focused on development projects and humanitarian aid.', 'expertise_area': 'Development Practice', 'perspective': 'Practical Implementation', 'speaking_style': {'tone': 'casual and enthusiastic, occasionally serious', 'language_complexity': 'simple language with common terms, occasional use of technical jargon', 'communication_style': 'collaborative and inquisitive, uses rhetorical questions', 'sentence_structure': 'short and concise sentences, frequent use of exclamations or questions', 'formality': 'semi-formal', 'other_traits': 'uses humor effectively, interrupts frequently to engage'}, 'personalized_vocabulary': {'filler_words': ['um', 'you know', 'like', 'I mean'], 'catchphrases': ['At the end of the day', 'To make a long story short', ""'In a nutshell'""], 'speech_patterns': ['frequent use of rhetorical questions', ""'varies sentence starters'""], 'emotional_expressions': ['Wow!', ""'Amazing!'"", ""'That's incredible!'""]}, 'social_roles': ['Opinion Seeker', 'Encourager'], 'social_roles_descr': ['Encourages others to share their opinions and beliefs in order to understand different perspectives.', 'Provides positive feedback and praise to boost the morale and motivation of group members.']}, {'role': 'Economic Development Consultant', 'description': 'A professional with experience in advising governments and organizations on economic development strategies.', 'expertise_area': 'Economic Development', 'perspective': 'Strategic Insight', 'speaking_style': {'tone': 'professional and assertive, occasionally optimistic', 'language_complexity': 'technical language with economic jargon, use of data-driven examples', 'communication_style': 'direct and assertive, prefers clear and concise communication', 'sentence_structure': 'medium-length sentences with occasional complexity, frequent use of statistics and data points', 'formality': 'formal', 'other_traits': 'uses pauses for emphasis, employs rhetorical devices such as parallelism'}, 'personalized_vocabulary': {'filler_words': ['um', 'you know', 'actually'], 'catchphrases': ['In the current economic climate', 'To put it in numbers', 'From a fiscal perspective'], 'speech_patterns': ['frequent use of data points', 'varies sentence starters'], 'emotional_expressions': ['Indeed!', 'Absolutely!', ""That's correct!""]}, 'social_roles': ['Coordinator', 'Aggressor'], 'social_roles_descr': ['Connects the different ideas and suggestions of the group to ensure that all relevant aspects are integrated.', 'Exhibits hostile behavior, criticizes others, or attempts to undermine the contributions of others.']}]","The meeting focused on the interdisciplinary field of development studies, which has gained popularity since the early 1990s and is offered as a specialized master's degree at various universities globally. Originating in the UK, it is widely taught in developing countries and those with colonial histories. Graduates often pursue careers in international organizations like the UN, World Bank, NGOs, media, private sector consultancy firms, CSR bodies, and research centers. The Inter-regional Coordinating Committee of Development Associations (ICCDA) serves as a common umbrella organization for professional bodies in this field. The Development Studies Association in the UK and Ireland connects and promotes development research professionals. Development studies emerged post-WWII due to concerns about third-world economic prospects after decolonization. Initially integrating politics and economics, it has evolved into a multi-disciplinary subject encompassing various social sciences. Political economy analysis has become prevalent for assessing factors affecting development success or failure. Modern development began with Harry S. Truman's 1949 speech highlighting global poverty issues. Human security has recently linked security threats to development issues, emphasizing global cooperation to address inequalities and insecurity. North-South research partnerships enhance diverse perspectives and contribute new findings to the field.","[""Scene 1: Brief Greeting and Opening Remarks\nTLDR: Participants greet each other and the meeting is officially opened.\n- Brief greeting among participants\n- Opening remarks by the host\n- Overview of meeting objectives"", ""Scene 2: Project Progress Update\nTLDR: Detailed update on current project status.\n- Presentation of recent developments in the project\n- Highlight key milestones achieved\n- Discuss any challenges faced"", ""Scene 3: Stakeholder Feedback Session\nTLDR: Gathering feedback from stakeholders.\n- Open floor for stakeholder comments and suggestions\n- Encourage spontaneous contributions and discussion\n- Address any immediate concerns or questions"", ""Scene 4: Alignment with Stakeholder Expectations\nTLDR: Ensuring project goals align with stakeholder expectations.\n- Review of stakeholder expectations and project goals\n- Discussion on alignment strategies\n- Explore potential adjustments based on feedback"", ""Scene 5: Interdisciplinary Insights on Development Studies\nTLDR: Sharing insights from different perspectives within development studies.\n- Academic perspective on interdisciplinary nature of development studies (Development Studies Professor)\n- Practical implementation insights (NGO Representative)\n- Strategic economic development insights (Economic Development Consultant)"", ""Scene 6: Human Security and Global Cooperation Discussion\nTLDR: Linking security threats to development issues.\n- Discuss human security in relation to development (Development Studies Professor)\n- Explore global cooperation efforts to address inequalities (NGO Representative)\n- Analyze economic implications of security threats (Economic Development Consultant)"", ""Scene 7: North-South Research Partnerships Contribution\nTLDR: Enhancing diverse perspectives through research partnerships.\n- Importance of North-South research partnerships (Development Studies Professor)\n- Examples of successful collaborations (NGO Representative)\n- Impact on policy-making and strategic planning (Economic Development Consultant)"", ""Scene 8: Open Floor for Spontaneous Topics and Personal Experiences\nTLDR: Allowing natural topic evolution and sharing personal experiences.\n- Open floor for any unplanned topics or discussions\n- Participants share relevant personal experiences related to development studies"", ""Scene 9: Summary and Closing Remarks\nTLDR: Summarizing key points discussed and closing the meeting.\n - Recap of main discussion points \n - Final thoughts from each participant \n - Closing remarks by the host""]",">>Economic Development Consultant: Good morning, everyone. It's great to see you all here. Let's get started with our meeting objectives for today.
>>Development Studies Professor: Morning! Our main goal is to discuss strategies for sustainable development in our fields.
>>NGO Representative: Morning! Let's make sure we cover everything and have a productive discussion.
>>Economic Development Consultant: Right, let's dive in. First on the agenda is identifying key areas where we can implement sustainable practices effectively.
>>Development Studies Professor: Yes, we need to consider different perspectives from economics, sociology, environmental science, etc., to ensure a holistic approach to sustainable development.
>>NGO Representative: Could you clarify what you mean by ""interdisciplinary nature""? Are we talking about collaboration between different sectors?
>>Development Studies Professor: Sure! I mean incorporating insights from various fields like economics and environmental science to create comprehensive strategies.
>>NGO Representative: Got it, thanks for clarifying. That should help us address multiple facets of sustainability.
>>Economic Development Consultant: Absolutely! Recognizing how economic, social, and environmental factors are interconnected will help us create effective strategies. 
 >>NGO Representative: That's great progress! But, um, what challenges have we faced so far? Any major roadblocks?
>>Development Studies Professor: We've had some hiccups coordinating between different sectors. You know, aligning the goals and strategies of various stakeholders can be quite complex. Plus, there have been logistical issues in implementing sustainable practices across diverse regions.
>>Economic Development Consultant: Yeah, from a fiscal perspective, one big roadblock has been securing consistent funding streams. Without reliable financial support, it's tough to keep momentum and implement long-term strategies effectively.
>>Development Studies Professor: Another challenge is integrating local knowledge and practices into our development strategies. It's crucial to ensure that the solutions we implement are culturally sensitive and sustainable in the long term.
>>NGO Representative: I've noticed that integrating local knowledge has been challenging but crucial for our success. How are we addressing this effectively?
>>Development Studies Professor: We're using participatory rural appraisal to involve local communities in planning and implementation. This way, their knowledge and practices are integrated into our strategies, making them more effective and sustainable.
>>NGO Representative: And how are we making sure these participatory approaches work well on the ground? Are there any specific tools or methods we're using to measure their impact?
>>Development Studies Professor: To make sure these approaches are effective, we're combining qualitative methods like focus group discussions with quantitative surveys for feedback. Monitoring frameworks help us measure the impact of these strategies on the ground.
>>NGO Representative: Can you share any success stories where these participatory approaches led to tangible improvements in the community?
>>Development Studies Professor: Sure! One notable success story is from a rural community where we involved local farmers in decision-making processes. We introduced sustainable agricultural practices that significantly increased crop yields and improved food security.
>>Economic Development Consultant: Building on our success stories, it's important we ensure robust funding strategies so we can continue these impactful projects. We're considering diversifying our funding sources to include private sector partnerships and international grants for a more stable financial foundation for long-term projects. 
 >>NGO Representative: That's a great idea! I'm curious to hear from everyone here about the challenges we might face with these new funding sources. Any concerns or suggestions?
>>Development Studies Professor: Yeah, the interdisciplinary nature of development studies lets us tackle complex issues. What are some ways we can use local knowledge better in our strategies?
>>Economic Development Consultant: Given the current economic climate, it's crucial to ensure these funding sources are sustainable. From a fiscal perspective, what measures should we implement to mitigate risks and enhance resilience?
>>NGO Representative: Hmm... involving private sector partnerships could bring in more stability. But what about potential conflicts of interest? Any ideas on how to manage those?
>>Development Studies Professor: Good question! We need clear guidelines and transparency measures to avoid conflicts while leveraging private sector support.
>>Economic Development Consultant: Exactly! Transparency is crucial. Regular audits and stakeholder reviews could help maintain accountability.
>>NGO Representative: Makes sense! And speaking of accountability, how do you all think we can integrate local knowledge into our strategies without compromising efficiency?
>>Development Studies Professor: Well, integrating local knowledge means actively involving community members in decision-making processes.
>>Economic Development Consultant: Yes, but it also means ensuring their input is valued and acted upon. We should consider mechanisms like regular community meetings for effective feedback loops.
>>NGO Representative: Maybe regular community forums where locals can voice their opinions directly? That way we're not just collecting data but actually engaging with them.
>>Development Studies Professor: Definitely! Using tools like participatory rural appraisal methods can be very effective here. I remember a project in Kenya where this approach really helped us understand local needs better. 
 >>NGO Representative: So, how do we ensure that our project goals align with stakeholder expectations? What strategies can we use to make sure we're on the same page?

>>Economic Development Consultant: Well, from my experience, working closely with stakeholders is key. Regular feedback sessions and open communication channels help a lot. For instance, in a previous project, we held monthly town hall meetings which really helped us understand and address community concerns.

>>Development Studies Professor: Absolutely! It's not just about economic factors; social and environmental dimensions are crucial too. I remember a project where integrating local knowledge through participatory methods made all the difference. We had community members lead focus groups, which ensured our strategies resonated with their needs.

>>NGO Representative: At the end of the day, it's all about practical implementation. How do we ensure that our strategies are not just theoretical but actually work on the ground? What specific steps can we take to integrate local knowledge effectively and make sure we're addressing real community needs?

>>Development Studies Professor: To make sure our strategies work practically, using participatory rural appraisal methods is effective. These allow us to gather insights directly from community members. In one project, setting up regular community forums facilitated ongoing dialogue and feedback, adapting our strategies in real-time.

>>NGO Representative: Great! So how do we make sure these participatory methods are actually effective on the ground? What kind of practical steps can we take to ensure we're really capturing the community's needs and not just ticking boxes?

>>Development Studies Professor: Combining surveys with focus group discussions provides a comprehensive understanding of community needs. Training local facilitators to lead these sessions enhances trust and ensures more accurate data collection. In one case, training locals led to more genuine engagement because they felt ownership over the process.

>>NGO Representative: Right! We need to ensure that our participatory methods are not just effective but also sustainable. How do we train local facilitators in a way that they can continue these efforts independently? What kind of support systems can we put in place?

>>Development Studies Professor: Sustainability requires robust support systems like continuous training programs for local facilitators and creating mentorship networks. However, securing funding for these initiatives can be challenging. Partnering with local organizations for resources has worked well in past projects I've been involved in.

>>Economic Development Consultant: Speaking of sustainability, it's essential to establish clear metrics for evaluating effectiveness. Tracking key performance indicators such as community engagement levels and project impact on local economies helps us see if we're genuinely meeting stakeholder expectations.

>>NGO Representative: You know, I think it's crucial to have a feedback loop involving regular check-ins with the community. How do we ensure these check-ins are meaningful and not just formalities?

>>Development Studies Professor: To make check-ins meaningful, set clear objectives for each session while actively involving community members in setting the agenda. Using both qualitative and quantitative methods for gathering feedback gives us a full picture of their needs and concerns. 
 >>NGO Representative: Training local facilitators really helps build trust in the community. It's incredible how much more effective our strategies become when we incorporate different perspectives, making sure they're not just economically viable but also socially and culturally sensitive.
>>Economic Development Consultant: Given today's economy, we need to focus on efficient strategies with solid financial plans. Projects that are cost-effective tend to succeed more often, but we can't forget about cultural sensitivity.
>>Development Studies Professor: Absolutely. The interdisciplinary nature of development studies lets us bring together various viewpoints, ensuring our strategies are well-rounded and sustainable. This holistic approach is key for long-term success.
>>NGO Representative: Exactly! When local facilitators are trained, it significantly boosts community trust and engagement. People feel more involved and committed to the projects.
>>Development Studies Professor: Right, and by integrating perspectives from economics, sociology, and environmental science—
>>Economic Development Consultant (interrupting): Sorry to jump in here—could you explain how these interdisciplinary approaches directly impact the economic viability of the projects?
>>Development Studies Professor: Sure thing! By combining these diverse perspectives, we can spot potential risks early on and create solutions that address both social needs and economic constraints. This makes our projects more resilient and adaptable to changes.
>>(Phone rings loudly)
>>Economic Development Consultant: Oh no, sorry about that; let me silence my phone real quick.
>>(Pause as phone is silenced)
>>NGO Representative (smiling): No worries! Happens to all of us. As I was saying, training local facilitators really boosts community trust and engagement. 
 >>Development Studies Professor: Human security, when viewed through the lens of development studies, encompasses not just physical safety but also economic stability and social well-being. It's crucial to recognize that threats like violence or environmental disasters can severely undermine development efforts.
>>Economic Development Consultant: The economic implications of security threats are profound. Violence and environmental disasters can disrupt local economies, leading to increased poverty and inequality. For instance, regions facing these threats often see a decline in GDP growth by up to 2% annually.
>>NGO Representative: That's staggering! You know, practical implementation really hinges on local engagement. What specific challenges have you encountered when trying to implement these forums?
>>Development Studies Professor: Well, human security isn't just about immediate threats but also about long-term stability. We need to integrate local knowledge and global cooperation to address these issues comprehensively.
>>NGO Representative: I agree that involving the community is crucial. How can we make sure their voices are heard?
>>Economic Development Consultant: Actually, setting up regular community forums could be effective. These forums would allow for continuous feedback and ensure that local concerns are addressed promptly.
>>Development Studies Professor: Absolutely! And beyond forums, incorporating interdisciplinary approaches can help us understand the multifaceted nature of these threats better.
>>NGO Representative: In my experience working with communities in Southeast Asia, regular forums have been incredibly effective. But what if there's resistance from local leaders?
>>Economic Development Consultant: That's a good point; we need strategies to engage them effectively. From an economic standpoint, investing in education and infrastructure can build resilience against these threats. It's essential to create sustainable solutions that empower communities economically.
>>Development Studies Professor: Right! And fostering global cooperation is key too. By sharing resources and knowledge internationally, we can tackle these issues more effectively.
>>NGO Representative: Hmm... Global cooperation definitely sounds promising. How do we ensure it translates into tangible benefits for local communities?
>>Economic Development Consultant: Well, ensuring transparency in international aid distribution is crucial. It helps maintain trust and ensures that resources reach those who need them most. 
 >>Development Studies Professor: Our North-South research partnerships have been incredibly valuable for mutual learning. For instance, working with Tanzanian researchers led us to develop drought-resistant crops that significantly improved local agriculture.
>>NGO Representative: Absolutely! In Uganda, local researchers were key to creating a sustainable water management system tailored to their needs. It was amazing how their insights shaped our approach.
>>Economic Development Consultant: That's great! And these collaborations also help us use resources more effectively. In Ghana, we worked with local experts to optimize healthcare budgets, boosting service delivery by 20%.
>>Development Studies Professor: It's true; these partnerships bring so many benefits beyond just knowledge exchange—like capacity building too. Our work on drought-resistant crops has had lasting effects on farming communities there.
>>NGO Representative: Yes! And I remember one researcher who showed us an innovative way to filter water using locally available materials—it was transformative for our project!
>>Economic Development Consultant: Plus, these ground-level insights are invaluable for policy-making. They ensure strategies are well-informed and truly beneficial for local communities. 
 >>NGO Representative: You know, speaking of policy-making, I remember a project in Nepal where we had to adapt our approach based on local agricultural practices. Their traditional methods were so effective that integrating them led to better crop yields and long-term sustainability.

>>Development Studies Professor: That's really interesting! It's amazing how using local farming methods can make such a big difference. We did something similar in Tanzania with medicinal practices, and it not only improved health outcomes but also built trust within the community.

>>Economic Development Consultant: Right! In Ghana, we optimized healthcare budgets by incorporating community feedback. It was challenging at first to get everyone on board, but once we did, it led to more efficient resource allocation and better health services.

>>Development Studies Professor: Definitely! And it's not just about agriculture or healthcare. In Ethiopia, combining traditional agricultural practices with modern techniques helped improve food security and strengthen community bonds.

>>NGO Representative: Speaking of water management, in Kenya we adapted our approach based on their traditional conservation methods. The results were fantastic! It improved water management and brought the community closer together.

>>Economic Development Consultant: Actually, from an economic perspective, using local knowledge can be a game-changer. In Bolivia, we optimized agricultural subsidies by incorporating traditional farming practices. This not only boosted crop yields but also ensured long-term economic stability.

>>Development Studies Professor: Absolutely! But you know what? Sometimes integrating these practices isn't straightforward. In Uganda, we faced resistance initially when trying to incorporate traditional farming methods into our project. It took time and effort to show the benefits before everyone got on board.

>>NGO Representative: Wow! That sounds tough but rewarding. We had a similar experience in Nepal where adapting our approach based on local customs required patience and persistence but ultimately led to more effective solutions.

>>Economic Development Consultant: Hmm... From an economic standpoint, leveraging local expertise is essential for sustainable development strategies. For example, in Vietnam using traditional farming insights helped us optimize resources effectively despite initial skepticism from some stakeholders.

>>Development Studies Professor: Indeed! And it's fascinating how these interdisciplinary approaches can lead to significant improvements across various sectors including agriculture and healthcare. It's all about finding the right balance between modern techniques and traditional wisdom. 
 >>NGO Representative: You know, we've really covered a lot today. From integrating local knowledge to ensuring sustainable funding, it's clear that practical implementation is key. Let's make sure these strategies are effective and sustainable.

>>Economic Development Consultant: Absolutely! Let's break this down with some figures. Our discussion highlighted the importance of integrating local knowledge and participatory methods. Diversifying funding sources and ensuring transparency are crucial for sustainable development.

>>Development Studies Professor: Indeed! But looking at this from different angles, we should also consider the specific challenges in implementing these strategies. For instance, in Nepal, we faced significant resistance when introducing new agricultural practices.

>>NGO Representative: Right! I mean, it's been great hearing everyone's perspectives on this. The examples from Nepal and Kenya really show how adapting local agricultural practices can make a difference.

>>Economic Development Consultant: Absolutely! And speaking of perspectives, the economic advantages seen in Ghana, Bolivia, and Vietnam by incorporating community feedback can't be ignored. It's all about making informed decisions based on real-world data.

>>Development Studies Professor: Sorry to jump in here, but I think we should also consider balancing modern techniques with traditional wisdom has proven successful in Tanzania, Ethiopia, and Uganda as well. We need to keep this balance in mind moving forward.

>>NGO Representative: Well said! So let's ensure we take these insights into account when planning our next steps. Practical implementation is key!

>>Economic Development Consultant: Agreed. Actually, we should also consider setting up regular check-ins to monitor progress and adapt strategies as needed.

>>Development Studies Professor: Definitely! Continuous evaluation will help us stay on track and make necessary adjustments to achieve our goals effectively."
