Title,Article,Tags,Personas,Summary,Meeting_Plan,Meeting
Cancel_Culture,"Cancel culture is a cultural phenomenon in which an individual thought to have acted or spoken in an unacceptable manner is ostracized, boycotted, shunned or fired, often aided by social media. This shunning may extend to social or professional circles—whether on social media or in person—with most high-profile incidents involving celebrities. Those subject to this ostracism are said to have been ""canceled"".
The term ""cancel culture"" came into circulation in 2018 and has mostly negative connotations. The term ""call-out culture"" is used by some for the same concept.
Some critics argue that cancel culture has a chilling effect on public discourse, that it is unproductive, that it does not bring real social change, that it causes intolerance, or that it amounts to cyberbullying. Others argue that the term is used to attack efforts to promote accountability or give disenfranchised people a voice, and to attack language that is itself free speech. Still others question whether cancel culture is an actual phenomenon, arguing that boycotting has existed long before the origin of the term ""cancel culture"".
While the careers of some public figures have been impacted by boycotts—widely described as ""cancellation""—others who complained of cancellation successfully continued their careers.


Origins
The 1981 Chic album Take It Off includes the song ""Your Love Is Cancelled"", which compares a breakup to the cancellation of TV shows. The song was written by Nile Rodgers following a bad date Rodgers had with a woman who expected him to misuse his celebrity status on her behalf. ""Your Love Is Cancelled"" inspired screenwriter Barry Michael Cooper to include a reference to a woman being canceled in the 1991 film New Jack City. This usage introduced the term to African-American Vernacular English, where it became more common.
By 2015, the concept of canceling had become widespread on Black Twitter to refer to a personal decision, sometimes seriously and sometimes in jest, to stop supporting a person or work. According to Jonah Engel Bromwich of The New York Times, this usage of the word ""cancellation"" indicates ""total disinvestment in something (anything)"". After numerous cases of online shaming gained wide notoriety, the use of the term ""cancellation"" increased to describe a widespread, outraged, online response to a single provocative statement, against a single target. Over time, as isolated instances of cancellation became more frequent and the mob mentality more apparent, commentators began seeing a ""culture"" of outrage and cancellation.
In October 2017, sexual assault allegations against film producer Harvey Weinstein led to the cancellation of his projects, his expulsion from the Academy of Motion Picture Arts and Sciences, and legal consequences, including a conviction on charges of rape and sexual assault. These events contributed to the rise of the #MeToo movement, where individuals shared their own allegations of sexual assault, leading to the cancellation of the careers of those accused. In November 2017, comedian Louis C.K. admitted to sexual misconduct allegations and, as a result, his shows were canceled, distribution deals were terminated, and he was dropped by his agency and management. After a period away from show business, Louis C.K. returned to work in 2018 and won a Grammy award in 2022. However, many people in the entertainment industry said that it was inappropriate to support his career or award him a Grammy due to his past misconduct.

Conversations about ""cancel culture"" increased in late 2019. In the 2020s, the phrase became a shorthand nom de guerre employed by spectators to refer to what they perceived to be disproportionate reactions to politically incorrect speech. In 2020, Ligaya Mishan wrote in The New York Times:""The term is shambolically applied to incidents both online and off that range from vigilante justice to hostile debate to stalking, intimidation and harassment. ... Those who embrace the idea (if not the precise language) of canceling seek more than pat apologies and retractions, although it's not always clear whether the goal is to right a specific wrong or redress a larger imbalance of power.""
""Call-out culture"" has been in use as part of the #MeToo movement. The #MeToo movement encouraged women (and men) to call out their abusers on a forum where the accusations would be heard, especially against very powerful individuals.


Academic, philosophical, and legal perspectives
An article written by Pippa Norris, a professor at Harvard University, states that the controversies surrounding cancel culture are between those who argue it gives a voice to those in marginalized communities and those who argue that cancel culture is dangerous because it prevents free speech and/or the opportunity for open debate. Norris emphasizes the role of social media in contributing to the rise of cancel culture. Additionally, online communications studies have demonstrated the intensification of cultural wars through activists that are connected through digital and social networking sites. Norris also mentions that the spiral of silence theory may contribute to why people are hesitant to voice their minority views on social media sites and fear that their views and opinions, specifically political opinions, will be chastised because their views violate the majority group's norms and understanding.
In the book The Coddling of the American Mind (2018), social psychologist Jonathan Haidt and Greg Lukianoff, president of the Foundation for Individual Rights and Expression, argue that call-out culture arises on college campuses from what they term ""safetyism""—a moral culture in which people are unwilling to make tradeoffs demanded by the practical or moral concerns of others. Keith Hampton, professor of media studies at Michigan State University, contends that the practice contributes to political polarization in the United States but does not lead to changes in opinion. Cancel culture has been described by media studies scholar Eve Ng as ""a collective of typically marginalized voices 'calling out' and emphatically expressing their censure of a powerful figure"". Cultural studies scholar Frances E. Lee states that call-out culture leads to self-policing of ""wrong, oppressive, or inappropriate"" opinions. According to Lisa Nakamura, University of Michigan professor of media studies, canceling someone is a form of ""cultural boycott"" and cancel culture is the ""ultimate expression of agency"", which is ""born of a desire for control [as] people have limited power over what is presented to them on social media"" and a need for ""accountability which is not centralized"".
Some academics have proposed alternatives and improvements to cancel culture. Clinical counsellor Anna Richards, who specializes in conflict mediation, says that ""learning to analyze our own motivations when offering criticism"" helps call-out culture work productively. Professor Joshua Knobe, of the Philosophy Department at Yale, contends that public denunciation is not effective, and that society is too quick to pass judgement against those they view as public offenders or personae non gratae. Knobe says that these actions have the opposite effect on individuals, and that it is best to bring attention to the positive actions in which most of society participates.
Former US Secretary of Labor Eugene Scalia wrote in a 2021 Harvard Journal of Law and Public Policy article that cancel culture is a form of free speech, and is therefore protected under the First Amendment to the United States Constitution. According to Scalia, cancel culture can interfere with the right to counsel, since some lawyers would not be willing to risk their personal and professional reputation on controversial topics.
In 2023, American conservatives and anti-trans activists engaged in a boycott of Bud Light over its hiring of transgender TikTok personality Dylan Mulvaney. The incident is seen an example of cancel culture and consumer backlash. The Harvard Business Review cited the incident as an example of an attempt to ""resonate with younger, more socially-conscious audiences"", but that it ""generated downstream adjustments from retailers and distributors"" that negatively hurt the product's performance. It highlighted the incident as making consumer brand marketing departments fearful of taking a stand on social issues.
Ng defines cancel culture as ""the withdrawal of any kind of support (viewership, social media follows, purchases of products endorsed by the person, etc.) for those who are assessed to have said or done something unacceptable or highly problematic, generally from a social justice perspective especially alert to sexism, heterosexism, homophobia, racism, bullying, and related issues."" There are different perspectives on the morality of cancellations. On the one hand, there is the view that cancel culture imposes punishments that are not proportional to the offenses or alleged offenses. This is closely related to John Stuart Mill's criticism of public shaming: he argued in On Liberty that society ""practises a social tyranny more formidable than many kinds of political oppression, since, though not usually upheld by such extreme penalties, it leaves fewer means of escape, penetrating much more deeply into the details of life, and enslaving the soul itself."" Martha Nussbaum similarly says that cancel culture represents the ""justice of the mob,"" but this alleged justice is not ""deliberative, impartial or neutral."" On the other hand, there are those who defend the value of shaming as constructive, if done right; people who defend this view maintain that cancel culture often shames people counter-productively but that it can be tweaked or altered in order to be a valuable tool for people's improvement. For instance, holding people accountable for things that they have done wrong can be a powerful way of correcting bad behavior, but it has to be paired with a belief in the possibility of redemption. People who take this approach often agree with Plato that shame is an important feeling that can lead to moral improvements. Everyone in this debate agrees that it is important to avoid what Nussbaum calls a ""spoiled identity"": to have a spoiled identity is to have the public image of someone who is irredeemable and unwelcome in a community.


Reactions
The expression ""cancel culture"" has mostly negative connotations and is used in debates on free speech and censorship.


Criticism
In July 2020, former U.S. President Barack Obama criticized cancel culture and ""woke"" mentality on social media, saying: ""people who do really good stuff have flaws. People who you are fighting may love their kids and, you know, share certain things with you."" U.S. President Donald Trump criticized cancel culture in a speech in July 2020, comparing it to totalitarianism and saying that it is a political weapon used to punish and shame dissenters by driving them from their jobs and demanding submission. He was subsequently criticized as being hypocritical for having attempted to cancel a number of people and companies in the past himself. Trump made similar claims during the 2020 Republican National Convention when he stated that the goal of cancel culture is to make decent Americans live in fear of being fired, expelled, shamed, humiliated, and driven from society.
Pope Francis said that cancel culture is ""a form of ideological colonization, one that leaves no room for freedom of expression"", saying that it ""ends up cancelling all sense of identity"". Patrisse Khan-Cullors, the co-founder of the Black Lives Matter movement, states that social activism does not just involve going online or going to a protest to call someone out, but is work entailing strategy sessions, meetings, and getting petitions signed. UK Prime Minister Rishi Sunak included cancel culture, where one group ""are trying to impose their views on the rest of us"", among the contemporary dangers of the modern world.
Philosopher Slavoj Žižek states that, ""cancel culture, with its implicit paranoia, is a desperate and obviously self-defeating attempt to compensate for the very real violence and intolerance that sexual minorities have long suffered. But it is a retreat into a cultural fortress, a pseudo-'safe space' whose discursive fanaticism merely strengthens the majority's resistance to it.""
Lisa Nakamura, a professor at the University of Michigan, describes cancel culture as ""a cultural boycott"" and says it provides a culture of accountability. Meredith Clark, an assistant professor at the University of Virginia, states that cancel culture gives power to disenfranchised voices. Osita Nwanevu, a staff writer for The New Republic, states that people are threatened by cancel culture because it is a new group of young progressives, minorities, and women who have ""obtained a seat at the table"" and are debating matters of justice and etiquette.


Open letter

Dalvin Brown, writing in USA Today, has described an open letter signed by 153 public figures and published in Harper's Magazine as marking a ""high point"" in the debate on the topic. The letter set out arguments against ""an intolerance of opposing views, a vogue for public shaming and ostracism, and the tendency to dissolve complex policy issues in a blinding moral certainty"".
A response letter, ""A More Specific Letter on Justice and Open Debate"", was signed by over 160 people in academia and media. It criticized the Harper's letter as a plea to end cancel culture by successful professionals with large platforms who wanted to exclude others who have been ""canceled for generations"". The writers ultimately stated that the Harper's letter was intended to further silence already marginalized people. They wrote: ""It reads as a caustic reaction to a diversifying industry—one that's starting to challenge diversifying norms that have protected bigotry.""


Criticism of ""cancel culture"" as a concept
A number of professors, politicians, journalists, and activists have questioned the validity of cancel culture as an actual phenomenon. Connor Garel, writing for Vice, states that cancel culture ""rarely has any tangible or meaningful effect on the lives and comfortability of the cancelled"". Danielle Kurtzleben, a political reporter for NPR, wrote in 2021 that overuse of the phrase ""cancel culture"" in American politics, particularly by Republicans, has made it ""arguably background noise"". Per Kurtzleben and others, the term has undergone semantic bleaching to lose its original meaning.
Historian C. J. Coventry argues that the term is incorrectly applied, and that the label has been used to avoid accountability for historical instances of injustice. Another historian, David Olusoga, made a similar argument, and argued that the phenomenon of cancellation is not limited to the left. Indigenous governance professor and activist Pamela Palmater writes in Maclean's magazine that, ""cancel culture is the dog whistle term used by those in power who don't want to be held accountable for their words and actions—often related to racism, misogyny, homophobia or the abuse and exploitation of others.""
Sarah Manavis wrote for the New Statesman magazine that while free speech advocates are more likely to make accusations of cancel culture, criticism is part of free speech and rarely results in consequences for those in power who are criticized. She argues that social media is an extension and reincarnation of a longer tradition of expression in a liberal society, ""a new space for historical power structures to be solidified"" and that online criticism by people who do not hold actual power in society tends not to affect existing power structures. She adds that most prominent people who criticized public opinion as canceling still have highly profitable businesses.


Consequence culture
Some media commentators including LeVar Burton and Sunny Hostin have stated that ""cancel culture"" should be renamed ""consequence culture"". The terms have different connotations: ""cancel culture"" focusing on the effect whereby discussion is limited by a desire to maintain one certain viewpoint, whereas ""consequence culture"" focuses on the idea that those who write or publish opinions or make statements should bear some responsibility for the effects of these on people.


American public opinion
A survey conducted in September 2020 on 10,000 Americans by Pew Research Center asked a series of different questions in regard to cancel culture, specifically on who has heard of the term cancel culture and how Americans define cancel culture. At that time, 44% of Americans said that they have at least heard a fair amount about the new phrase, while 22% have heard a great deal and 32% said they have heard nothing at all. 43% Americans aged 18–29 have heard a great deal about cancel culture, compared to only 12% of Americans over the age of 65 who say they have heard a great deal. Additionally, within that same study, the 44% of Americans who had heard a great deal about cancel culture, were then asked how they defined cancel culture. 49% of those Americans state that it describes actions people take to hold others accountable, 14% describe cancel culture as censorship of speech or history, and 12% define it as mean-spirited actions taken to cause others harm. It was found that men were more likely to have heard or know of cancel culture, and that those who identify with the Democratic Party (46%) are no more likely to know the term than those in the Republican Party (44%).
A poll of American registered voters conducted by Morning Consult in July 2020 showed that cancel culture, defined as ""the practice of withdrawing support for (or canceling) public figures and companies after they have done or said something considered objectionable or offensive"", was common: 40% of respondents said they had withdrawn support from public figures and companies, including on social media, because they had done or said something considered objectionable or offensive, with 8% having engaged in this often. Behavior differed according to age, with a majority (55%) of voters 18 to 34 years old saying they have taken part in cancel culture, while only about a third (32%) of voters over 65 said they had joined a social media pile-on. Attitude towards the practice was mixed, with 44% of respondents saying they disapproved of cancel culture, 32% who approved, and 24% who did not know or had no opinion. Furthermore, 46% believed cancel culture had gone too far, with only 10% thinking it had not gone far enough. Additionally, 53% believed that people should expect social consequences for expressing unpopular opinions in public, such as those that may be construed as deeply offensive to other people.
A March 2021 poll by the Harvard University Center for American Political Studies and the Harris Poll found that 64% of respondents viewed ""a growing cancel culture"" as a threat to their freedom, while the other 36% did not. 36% of respondents said that cancel culture is a big problem, 32% called it a moderate problem, 20% called it a small problem, and 13% said it is not a problem. 54% said they were concerned that if they expressed their opinions online, they would be banned or fired, while the other 46% said they were not concerned.
A November 2021 Hill/HarrisX poll found that 71% of registered voters strongly or somewhat felt that cancel culture went too far, with similar numbers of Republicans (76%), Democrats (70%), and independents (68%) saying so. The same poll found that 69% of registered voters felt that cancel culture unfairly punishes people for their past actions or statements, compared to 31% who said it did not. Republicans were more likely to agree with the statement (79%), compared to Democrats (65%) and independents (64%).
In a January 2022 Knight-IPSOS Study involving 4,000 participants, most Americans surveyed said that some speech should be prohibited. Specifically, they stated that ""a variety of private and public institutions should prohibit racist speech"". However, most also noted that these same institutions should not ban political views that are offensive.
A March 2022 New York Times/Siena College survey of 1,000 Americans found that 84 percent of adults said it is a ""very serious"" or ""somewhat serious"" problem that some Americans do not speak freely in everyday situations because of fear of retaliation or harsh criticism. The survey also found that 46 percent of respondents said they felt less free to talk about politics compared to a decade ago, and that only 34 percent of Americans said they believed that all Americans enjoyed freedom of speech completely.


In popular media
The American animated television series South Park mocked cancel culture with its own ""#CancelSouthPark"" campaign; in promotion of the show's twenty-second season (2018). In the season's third episode, ""The Problem with a Poo"", there are references to the 2017 documentary The Problem with Apu, the cancellation of Roseanne after a controversial tweet by Roseanne Barr, and the Brett Kavanaugh Supreme Court nomination.
In 2019, cancel culture was a primary theme in the stand-up comedy show Sticks & Stones by Dave Chappelle.
The 2022 film Texas Chainsaw Massacre satirizes cancel culture, with Leatherface killing an individual who threatens to cancel him.
The 2022 film Tár was interpreted by several critics as exploring themes regarding cancel culture.
The 2023 film Dream Scenario criticizes cancel culture. The film's creator, Kristoffer Borgli, stated that he conceived the screenplay after reading about university educators who were fired for expressing personal opinions.


See also


Notes


References


Further reading
Bouvier, Gwen (2020). ""Racist Call-Outs and Cancel Culture on Twitter: The Limitations of the Platform's Ability to Define Issues of Social Justice"". Discourse, Context & Media. 38. Elsevier BV: 100431. doi:10.1016/j.dcm.2020.100431. ISSN 2211-6958. S2CID 225015791.
Clark, Meredith D. (2020). ""Drag Them: A Brief Etymology of So-Called 'Cancel Culture'"". Communication and the Public. 5 (3–4). SAGE Publications: 88–92. doi:10.1177/2057047320961562. ISSN 2057-0473. S2CID 228076523.
""The Callout"". Invisibilia. NPR. April 13, 2018. Retrieved March 11, 2021.
Kurtzleben, Danielle (February 10, 2021). ""When Republicans Attack 'Cancel Culture,' What Does It Mean?"". Morning Edition. NPR. Retrieved February 17, 2021.
Masnick, Mike (March 21, 2022). ""The 'Culture of Free Speech' Includes Criticism of Others' Speech; Get Over It"". Techdirt. Retrieved December 20, 2022.
Norris, Pippa (August 21, 2021) [15 Aug 2020]. ""Closed Minds? Is a 'Cancel Culture' Stifling Academic Freedom and Intellectual Debate in Political Science?"". HKS Working Paper No. RWP20-025. doi:10.2139/ssrn.3671026. ISSN 1556-5068. S2CID 225517117. SSRN 3671026.","[""Cancel culture"", ""Social media"", ""Accountability"", ""#MeToo movement"", ""Free speech""]","[{'role': 'Social Media Expert', 'description': 'A professional who understands the dynamics and impact of social media on public opinion and behavior.', 'expertise_area': 'Social Media', 'perspective': 'Digital Influence', 'speaking_style': {'tone': 'casual and enthusiastic, often optimistic with a touch of humor', 'language_complexity': 'simple language with common terms, occasional use of social media jargon', 'communication_style': 'collaborative and inquisitive, often uses rhetorical questions to engage others', 'sentence_structure': 'varied sentence length, frequent use of exclamations and questions', 'formality': 'semi-formal', 'other_traits': 'uses pauses effectively to emphasize points, occasionally interrupts to clarify or add information'}, 'personalized_vocabulary': {'filler_words': ['um', 'you know', 'like'], 'catchphrases': [""Let's dive in!"", 'Stay tuned!', ""That's trending!""], 'speech_patterns': [""starts sentences with 'So,' or 'Well,'"", ""poses questions like 'What do you think?' or 'Isn't it?'""], 'emotional_expressions': ['laughter', 'Wow!', 'Amazing!']}, 'social_roles': ['Initiator-Contributor', 'Information Giver'], 'social_roles_descr': ['Contributes new ideas and approaches and helps to start the conversation or steer it in a productive direction.', 'Shares relevant information, data or research that the group needs to make informed decisions.']}, {'role': 'Cultural Critic', 'description': 'An expert in cultural studies who analyzes societal trends and their implications.', 'expertise_area': 'Cultural Studies', 'perspective': 'Societal Impact', 'speaking_style': {'tone': 'formal and reserved, often serious with occasional sarcasm', 'language_complexity': 'complex language with academic terms, frequent use of metaphors and analogies', 'communication_style': 'analytical and reflective, prefers active listening and thoughtful responses', 'sentence_structure': 'long and complex sentences with subordinate clauses, infrequent use of exclamations or questions', 'formality': 'formal', 'other_traits': 'uses rhetorical devices effectively, rarely interrupts but uses pauses to gather thoughts'}, 'personalized_vocabulary': {'filler_words': ['um', 'well', 'you see'], 'catchphrases': ['In essence...', 'From a cultural perspective...', 'This illustrates...'], 'speech_patterns': [""begins sentences with 'Interestingly,' or 'Moreover,'"", ""poses questions like 'How does this impact society?' or 'What are the implications?'""], 'emotional_expressions': ['sighs', 'Indeed!', 'Fascinating!']}, 'social_roles': ['Opinion Giver', 'Evaluator-Critic'], 'social_roles_descr': ['Shares his or her views and beliefs on topics under discussion.', 'Analyzes and critically evaluates proposals or solutions to ensure their quality and feasibility.']}, {'role': 'Legal Expert', 'description': 'A lawyer specializing in free speech and constitutional law, providing insights on the legal aspects of cancel culture.', 'expertise_area': 'Law', 'perspective': 'Legal Framework', 'speaking_style': {'tone': 'formal and assertive, often serious with a touch of optimism', 'language_complexity': 'technical language with legal jargon, frequent use of precise terminology and definitions', 'communication_style': 'direct and assertive, prefers clear and concise arguments, uses rhetorical questions to challenge others', 'sentence_structure': 'long and complex sentences with multiple clauses, frequent use of questions for clarification', 'formality': 'formal', 'other_traits': 'uses pauses effectively to emphasize points, rarely interrupts but interjects when necessary'}, 'personalized_vocabulary': {'filler_words': ['um', 'you know', 'actually'], 'catchphrases': ['From a legal standpoint...', 'In accordance with...', 'This precedent shows...'], 'speech_patterns': [""begins sentences with 'Legally speaking,' or 'Furthermore,'"", ""'poses questions like 'How does this align with the constitution?' or 'What are the legal ramifications?'""], 'emotional_expressions': ['Indeed!', ""'Absolutely!'""]}, 'social_roles': ['Coordinator', 'Blocker'], 'social_roles_descr': ['Connects the different ideas and suggestions of the group to ensure that all relevant aspects are integrated.', ""Frequently opposes ideas and suggestions without offering constructive alternatives and delays the group's progress.""]}, {'role': 'Psychologist', 'description': 'A mental health professional who studies the psychological effects of social phenomena like cancel culture.', 'expertise_area': 'Psychology', 'perspective': 'Mental Health Impact', 'speaking_style': {'tone': 'empathetic and calm, often reassuring with a touch of seriousness', 'language_complexity': 'moderate language with psychological terms, occasional use of analogies and storytelling', 'communication_style': 'collaborative and supportive, prefers active listening and empathetic responses', 'sentence_structure': 'medium length sentences with clear structure, occasional use of questions for clarification', 'formality': 'semi-formal', 'other_traits': 'uses pauses effectively to allow reflection, rarely interrupts but interjects gently when necessary'}, 'personalized_vocabulary': {'filler_words': ['um', 'you know', 'I mean'], 'catchphrases': ['From a psychological perspective...', 'This suggests that...', ""It's important to consider...""], 'speech_patterns': [""begins sentences with 'Interestingly,' or 'Moreover,'"", ""poses questions like 'How does this affect mental health?' or 'What are the psychological implications?'""], 'emotional_expressions': ['laughter', 'Indeed!', 'Absolutely!']}, 'social_roles': ['Encourager', 'Harmonizer'], 'social_roles_descr': ['Provides positive feedback and praise to boost the morale and motivation of group members.', 'Mediates in conflicts and ensures that tensions in the group are reduced to promote a harmonious working environment.']}]","The meeting focused on the cultural phenomenon of cancel culture, where individuals are ostracized or boycotted for perceived unacceptable behavior, often amplified by social media. The term gained prominence in 2018 and is associated with negative connotations. Critics argue that cancel culture stifles public discourse, promotes intolerance, and amounts to cyberbullying, while supporters believe it holds people accountable and gives marginalized voices a platform. Historical origins trace back to African-American Vernacular English and Black Twitter. High-profile cases like Harvey Weinstein's cancellation contributed to the rise of movements like #MeToo. Academic perspectives highlight the role of social media in intensifying cultural wars and political polarization. Some propose alternatives to improve call-out culture's productivity. Public opinion surveys reveal mixed attitudes towards cancel culture, with significant concern over its impact on free speech. Prominent figures such as Barack Obama and Donald Trump have criticized it, while others defend its role in promoting accountability. The concept remains contentious, with debates on its validity and consequences continuing.","[""Scene 1: Opening and Greeting\nTLDR: Brief welcome and setting the tone for the meeting\n- Welcome participants\n- Quick overview of meeting objectives\n- Mention the importance of spontaneous discussion"", ""Scene 2: Project Progress Update\nTLDR: Update stakeholders on current project status\n- Highlight key milestones achieved\n- Discuss any challenges faced and solutions implemented\n- Invite brief comments or questions from participants"", ""Scene 3: Cancel Culture Overview\nTLDR: Introduction to cancel culture and its relevance to the project\n- Define cancel culture and its historical origins\n- Discuss high-profile cases like Harvey Weinstein and #MeToo movement impact\n- Open floor for initial reactions from participants"", ""Scene 4: Social Media Impact Discussion\nTLDR: Explore how social media amplifies cancel culture effects\n- Social Media Expert shares insights on digital influence and trends\n- Cultural Critic provides perspective on societal implications\n- Encourage spontaneous contributions from other participants"", ""Scene 5: Legal Framework Analysis\nTLDR: Examine legal aspects related to cancel culture and free speech concerns\n- Legal Expert discusses constitutional law implications and precedents \n- Psychologist highlights mental health impacts of public shaming \n- Open discussion for differing viewpoints among participants"", ""Scene 6: Stakeholder Feedback Collection \nTLDR: Gather feedback from stakeholders on project alignment with expectations \n - Ask stakeholders for their thoughts on current progress \n - Discuss any concerns or suggestions they may have \n - Allow time for personal experiences relevant to the topic"", ""Scene 7: Alignment with Stakeholder Expectations \n TLDR : Ensure project goals align with stakeholder expectations moving forward \n - Summarize key points discussed during the meeting \n - Confirm mutual understanding of next steps \n - Encourage final thoughts or off-topic moments before closing"", ""Scene 8 : Closing Remarks \n TLDR : Wrap up the meeting with a positive note and thank participants for their contributions \\ n - Thank everyone for their participation and valuable input \\ n - Recap main takeaways from the discussion\\ n - Outline follow-up actions if necessary""]",">>Social Media Expert: Hey everyone! Welcome to our meeting. Today, we've got some really interesting topics lined up. Let's keep the discussion lively and engaging. So, what do you all think about the impact of cancel culture on digital influence?
>>Cultural Critic: Cancel culture is like a modern way of controlling society. It shows how quickly public opinion can change and affect people deeply. What do you think this means for us as a society?
>>Legal Expert: From a legal standpoint, cancel culture is tricky because it often skips important steps like ensuring fairness and protecting people's rights.
>>Psychologist: Yeah, and psychologically, it can be really damaging. The fear of being canceled can cause a lot of stress and anxiety, making people afraid to speak their minds.
>>Social Media Expert: Totally! It's crazy how fast things blow up online. Sometimes I wonder if we're too quick to judge without knowing all the facts. Anyone else feel that way?
>>Cultural Critic: Absolutely! It's like we use public shaming to make everyone conform. This definitely affects how freely people express themselves.
>>Legal Expert: Sorry to jump in, but when you say ""public shaming,"" are you talking about viral social media posts or something more organized?
>>Cultural Critic: Good point! I mean both—those viral posts and also more coordinated efforts to discredit someone publicly.
>>Legal Expert: Got it! Legally speaking, cancel culture often bypasses proper channels for justice. How do we make sure accusations are backed up before taking drastic actions?
>>Psychologist: Exactly! And this fear can lead to serious mental health issues like depression and low self-esteem. It makes me wonder how this impacts people's relationships and their sense of security. 
 >>Social Media Expert: So, um, moving on to our project update, we've hit some major milestones recently! We've successfully launched the new social media campaign, and the engagement metrics are through the roof. The audience response has been overwhelmingly positive, and the reach is beyond our expectations.
>>Cultural Critic: Navigating diverse societal norms has been quite challenging. We need to pay close attention to details and keep adapting constantly.
>>Legal Expert: The successful launch is commendable, but we must ensure our content complies with legal standards regarding cultural sensitivity, free speech protections, intellectual property laws, and privacy regulations.
>>Psychologist: Absolutely! You know, it's important to consider the mental health impact of navigating these challenges. The stress and anxiety from ensuring cultural sensitivity and legal compliance can be significant for our team.
>>Cultural Critic: Additionally, we should consider specific strategies for maintaining positive engagement across different cultural contexts.
>>Psychologist (interrupting): Sorry to jump in here—I'm concerned about how these challenges might affect our team's workload and mental health.
>>Legal Expert: Good point! We need to ensure that while we focus on compliance, we're also mindful of not overburdening our team with additional tasks. 
 >>Cultural Critic: The Harvey Weinstein case and the #MeToo movement really show how cancel culture can drive change. It's amazing how collective action holds people accountable.
>>Social Media Expert: I agree with you, Cultural Critic. Social media played a huge role in amplifying voices during #MeToo. Public opinion shifted so fast! What do you think about digital platforms' role in this?
>>Legal Expert: That's a good point, Social Media Expert. These cases show big consequences for our legal system and highlight why due process is important. How does this align with our constitutional protections?
>>Psychologist: From a psychological perspective, cancel culture's impact on mental health is profound. Those who are canceled often experience severe anxiety and depression, leading to long-term emotional distress.
>>Social Media Expert: Cancel culture on social media is definitely a double-edged sword. It empowers marginalized voices but can also lead to mob mentality and unfair consequences. Isn't it fascinating how quickly public opinion shifts?
>>Cultural Critic: The societal impact of cancel culture goes beyond individual cases like Weinstein. It reflects a broader shift in how communities enforce norms and values through digital platforms, raising questions about balancing collective accountability with personal redemption.
>>Legal Expert: While cancel culture drives social change, it risks bypassing established legal frameworks, potentially undermining constitutional protections.
>>Psychologist: Absolutely! The psychological toll of cancel culture can be immense. Individuals facing public shaming often experience heightened anxiety and depression, which can lead to long-term emotional distress.
>>Social Media Expert: So true! The #MeToo movement shows how digital platforms drive social change by holding powerful figures accountable quickly. What do you think about balancing empowering voices with avoiding mob mentality? 
 >>Social Media Expert: Cancel culture is like a double-edged sword. It empowers marginalized voices but can turn into a mob mentality where due process gets ignored. What do you think about its impact on marginalized voices?

>>Cultural Critic: I agree; it's empowering but also dangerous because it bypasses traditional norms enforcement. From a cultural perspective, cancel culture shows how digital platforms amplify collective actions quickly. This raises big questions about public discourse and individual freedom.

>>Legal Expert: That's true; it raises serious legal issues around due process and protecting individual rights. Rapid actions on social media can undermine fairness in our legal system, leading to significant consequences for those involved.

>>Psychologist: Absolutely! The mental health impact of cancel culture is huge. People who get canceled often face severe anxiety and depression, which can lead to long-term emotional distress.

>>Social Media Expert: It's amazing how quickly public opinion shifts—everyone has a megaphone! But isn't it also empowering for marginalized voices?

>>Cultural Critic: Yes, it's empowering but also risky because it can lead to digital vigilantism instead of structured accountability. This phenomenon underscores power dynamics in our digital age, raising critical questions about balancing accountability with potential unjust punishment.

>>Legal Expert: Furthermore, the lack of due process and potential defamation claims show significant legal ramifications for individuals involved. How does this align with our constitutional protections against unjust punishment?

>>Psychologist: And let's not forget the mental health toll it takes on individuals. The fear of being canceled leads to heightened anxiety and insecurity which have long-lasting effects on mental health. 
 >>Legal Expert: You know, legally speaking, cancel culture often skips over due process, which is really important in our legal system. Without formal procedures, individuals are deprived of their constitutional rights to fair treatment.

>>Social Media Expert: I agree with what the Legal Expert said about due process being ignored. But it's interesting how cancel culture on social media can give marginalized voices a platform but also create this mob mentality where due process gets ignored. It's crazy how fast opinions change online these days!

>>Cultural Critic: That's an interesting point from the Social Media Expert about amplifying voices. However, we need to consider if this amplification leads to fair outcomes. Cancel culture acts like modern social control through public shaming and ostracism. It really makes you think about accountability versus punishment.

>>Psychologist: From a psychological standpoint, the effects of being publicly shamed can be really tough—leading to anxiety and depression. The constant fear of being canceled can lead to chronic stress and feelings of isolation. We need to address not just the legal implications but also provide mental health support for those affected.

>>Legal Expert: Actually, the absence of due process in cancel culture can lead to significant constitutional violations. This precedent shows that individuals are often deprived of their rights to fair treatment and protection under the law.

>>Social Media Expert: Right! And while it gives marginalized voices a platform, it risks creating a mob mentality where due process is ignored.

>>Cultural Critic: Moreover, you see, the societal implications of cancel culture are profound. It serves as a mechanism for enforcing collective norms yet often bypasses traditional forms of justice and accountability.

>>Psychologist: Indeed! The psychological toll is often underestimated. We need comprehensive support systems for those affected by public scrutiny. 
 >>Social Media Expert: Considering the feedback we've gathered so far, how do you all feel about our project's alignment with expectations? Any concerns or suggestions?
>>Cultural Critic: I think our project fits well with societal expectations overall. But we should consider how cancel culture might affect our team's morale and productivity. We need a balanced approach that supports compliance while also protecting mental well-being.
>>Legal Expert: That's a good point. Legally, we must ensure our project respects free speech and due process rights amidst cancel culture pressures. What are the potential legal risks if team members feel forced to conform?
>>Psychologist: Absolutely! The fear of being canceled can lead to anxiety and stress among team members, impacting their productivity and well-being. How can we support them while keeping our project aligned with societal expectations?
>>Social Media Expert: Right! So how do we balance these concerns? Any ideas on strategies that address both societal expectations and team well-being?
>>Cultural Critic: Maybe we could implement some guidelines that encourage open dialogue without fear of backlash. This way, everyone feels safe to express their ideas.
>>Legal Expert: I agree. We should also review our policies to ensure they protect individual rights while promoting respectful communication.
>>Psychologist: And perhaps offer mental health resources or workshops to help the team manage stress and anxiety related to these issues.
>>Social Media Expert: Great suggestions! Let's summarize these points and develop a plan that incorporates open dialogue guidelines, policy reviews, and mental health support systems. Any other thoughts before we wrap up? 
 >>Psychologist: Um, it's crucial to consider the mental health impact of these changes. Ensuring our team feels supported through open dialogue and access to resources can really make a difference.

>>Cultural Critic: We need to make sure our project goals match what our stakeholders expect. It's important to find a balance between societal norms and ensuring everyone's well-being.

>>Social Media Expert: So, you know, to wrap things up, we've discussed several key initiatives including developing guidelines for open dialogue and offering mental health resources. What do you think about these next steps?

>>Legal Expert: Actually, could we clarify how these guidelines will be implemented? Are we looking at workshops or online resources?

>>Cultural Critic: Moreover, um, integrating mental health resources and open dialogue guidelines is essential. From a cultural perspective, this approach not only aligns with societal expectations but also fosters a supportive environment that mitigates the adverse effects of cancel culture.

>>Social Media Expert: Well, it looks like we've covered a lot today! We've agreed on some great next steps including developing guidelines for open dialogue through workshops or online resources, reviewing policies to protect individual rights, and offering mental health support. 
 >>Psychologist: Um, it's crucial to recognize the positive impact these steps can have on our team's mental health. Offering support and fostering open dialogue will help alleviate stress and anxiety, ensuring everyone feels heard and valued.
>>Cultural Critic: Absolutely. We've seen some big changes in how we approach societal norms and mental well-being. By encouraging open conversations and providing support, we're not just addressing immediate concerns but also setting a standard for future interactions.
>>Social Media Expert: Yeah, it's been a productive discussion today! We've touched on the impact of cancel culture from various angles—psychological effects, legal implications. Let's make sure we follow through with those guidelines for open dialogue and mental health support. What do you think should be our first step?
>>Legal Expert: I agree, we've made significant progress here. Developing guidelines through workshops or online resources is a solid start. We should also review policies to protect individual rights more thoroughly.
>>Psychologist: Right! And offering mental health support will be key in maintaining a healthy environment for everyone involved.
>>Cultural Critic: Indeed, today's discussions have highlighted how complex cancel culture is and its societal impact. Maybe we could start by creating a task force to focus on cultural sensitivity training alongside mental health initiatives?
>>Social Media Expert: Exactly! We've covered so much ground today. How about we assign specific roles? For instance, I can handle the social media guidelines part while others focus on policy reviews or workshop planning.
>>Legal Expert: Sounds good to me. Let's set up a timeline for these tasks—maybe aim to have initial drafts ready by next month?
>>Psychologist: Perfect! I'll coordinate with our wellness team to integrate mental health resources into the plan."
