original_scene,refined_scene,ai_feedback,finalized_scene
"
>>Esports Commentator: Hey everyone! How's it going? Did anyone catch the latest patch notes for League of Legends? Some crazy changes coming up!
>>Game Developer: Hey! I'm doing great, thanks for asking. How about you? Ready to press start and dive into some epic gaming discussions today?
>>Market Analyst: Hey everyone! I'm doing well, thanks for asking. Did you all see the latest sales figures for the new Call of Duty? Fascinating! The trend indicates a significant spike in digital downloads compared to physical copies.
>>Game Developer: Hey, I'm doing great! Did you guys see the new trailer for that upcoming RPG? The graphics look absolutely stunning. It's like they've taken a page out of The Witcher 3's book!
>>Market Analyst: Hmm, I did catch that trailer! The level of detail is impressive. By the way, speaking of trends, have you noticed how indie games are gaining traction? According to the data, there's been a significant increase in their market share over the past few years.
>>Game Developer: Hey, did anyone else notice how the new RPG trailer's lighting effects are almost on par with real-time ray tracing? It's like we're stepping into a whole new level of immersion!
>>Market Analyst: Indeed! The indie game market is fascinating. From a market perspective, the data shows that these smaller studios are capturing a significant portion of the audience by offering unique and innovative gameplay experiences. It's like they're filling a niche that larger developers sometimes overlook.
>>Game Developer: Hey, did anyone else notice how the new RPG trailer's lighting effects are almost on par with real-time ray tracing? It's like we're stepping into a whole new level of immersion!
>>Market Analyst: Hey everyone! I'm doing well, thanks for asking. Did you all see the latest sales figures for the new Call of Duty? Fascinating! The trend indicates a significant spike in digital downloads compared to physical copies.
>>Game Developer: Hey, did anyone else notice how the new RPG trailer's lighting effects are almost on par with real-time ray tracing? It's like we're stepping into a whole new level of immersion!
>>Market Analyst: Hey everyone! I'm doing well, thanks for asking. Did you all see the latest sales figures for the new Call of Duty? Fascinating! The trend indicates a significant spike in digital downloads compared to physical copies.
>>Game Developer: Hey everyone! How's it going? Did anyone catch the latest patch notes for League of Legends? Some crazy changes coming up!
>>Market Analyst: Hey everyone! I'm doing well, thanks for asking. Did you all see the latest sales figures for the new Call of Duty? Fascinating! The trend indicates a significant spike in digital downloads compared to physical copies.
>>Game Developer: Hey everyone! How's it going? Did anyone catch the latest patch notes for League of Legends? Some crazy changes coming up!
>>Market Analyst: Hey everyone! I'm doing well, thanks for asking. Did you all see the latest sales figures for the new Call of Duty? Fascinating! The trend indicates a significant spike in digital downloads compared to physical copies.
>>Game Developer: Hey everyone! How's it going? Did anyone catch the latest patch notes for League of Legends? Some crazy changes coming up!
>>Market Analyst: Hey everyone! I'm doing well, thanks for asking. Did you all see the latest sales figures for the new Call of Duty? Fascinating! The trend indicates a significant spike in digital downloads compared to physical copies.
>>Game Developer: Hey everyone! How's it going? Did anyone catch the latest patch notes for League of Legends? Some crazy changes coming up!
>>Market Analyst: Hey everyone! I'm doing well, thanks for asking. Did you all see the latest sales figures for the new Call of Duty? Fascinating! The trend indicates a significant spike in digital downloads compared to physical copies.
>>Game Developer: Hey everyone! How's it going? Did anyone catch the latest patch notes for League of Legends? Some crazy changes coming up!
>>Market Analyst: Hey everyone! I'm doing well, thanks for asking. Did you all see the latest sales figures for the new Call of Duty? Fascinating! The trend indicates a significant spike in digital downloads compared to physical copies.
>>Game Developer: Hey everyone! How's it going? Did anyone catch the latest patch notes for League of Legends? Some crazy changes coming up!
>>Market Analyst: Hey everyone! I'm doing well, thanks for asking. Did you all see the latest sales figures for the new Call of Duty? Fascinating! The trend indicates a significant spike in digital downloads compared to physical copies.
>>Game Developer: Hey everyone! How's it going? Did anyone catch the latest patch notes for League of Legends? Some crazy changes coming up!
>>Market Analyst: Hey everyone! I'm doing well, thanks for asking. Did you all see the latest sales figures for the new Call of Duty? Fascinating! The trend indicates a significant spike in digital downloads compared to physical copies.
>>Game Developer: Hey everyone! How's it going? Did anyone catch the latest patch notes for League of Legends? Some crazy changes coming up!
>>Market Analyst: Hey everyone! I'm doing well, thanks for asking. Did you all see the latest sales figures for the new Call of Duty? Fascinating! The trend indicates a significant spike in digital downloads compared to physical copies.
>>Game Developer: Hey everyone! How's it going? Did anyone catch the latest patch notes for League of Legends? Some crazy changes coming up!
>>Market Analyst: Hey everyone! I'm doing well, thanks for asking. Did you all see the latest sales figures for the new Call of Duty? Fascinating! The trend indicates a significant spike in digital downloads compared to physical copies.
>>Game Developer: Hey everyone! How's it going? Did anyone catch the latest patch notes for League of Legends? Some crazy changes coming up!
>>Market Analyst: Hey everyone! I'm doing well, thanks for asking. Did you all see the latest sales figures for the new Call of Duty? Fascinating! The trend indicates a significant spike in digital downloads compared to physical copies.
>>Game Developer: Hey everyone! How's it going? Did anyone catch the latest patch notes for League of Legends? Some crazy changes coming up!
>>Market Analyst: Hey everyone! I'm doing well, thanks for asking. Did you all see the latest sales figures for the new Call of Duty? Fascinating! The trend indicates a significant spike in digital downloads compared to physical copies.
>>Game Developer: Hey everyone! How's it going? Did anyone catch the latest patch notes for League of Legends? Some crazy changes coming up!
>>Market Analyst: Hey everyone! I'm doing well, thanks for asking. Did you all see the latest sales figures for the new Call of Duty? Fascinating! The trend indicates a significant spike in digital downloads compared to physical copies.
>>Game Developer: Hey everyone! How's it going? Did anyone catch the latest patch notes for League of Legends? Some crazy changes coming up!
>>Market Analyst: Hey everyone! I'm doing well, thanks for asking. Did you all see the latest sales figures for the new Call of Duty? Fascinating! The trend indicates a significant spike in digital downloads compared to physical copies.
>>Game Developer: Hey everyone! How's it going? Did anyone catch the latest patch notes for League of Legends? Some crazy changes coming up!
>>Market Analyst: Hey everyone! I'm doing well, thanks for asking. Did you all see the latest sales figures for the new Call of Duty? Fascinating! The trend indicates a significant spike in digital downloads compared to physical copies.",">>Esports Commentator: Hey everyone! How's it going? Did anyone catch the latest patch notes for League of Legends? Some crazy changes coming up!

>>Game Developer: Hey! I'm doing great, thanks. How about you? Ready to press start and dive into some epic gaming discussions today?

>>Market Analyst: Hi all! I'm doing well, thanks. Did you see the latest sales figures for the new Call of Duty? Fascinating stuff! There's been a significant spike in digital downloads compared to physical copies.

>>Game Developer: Oh yeah, I saw that. By the way, did you guys check out the new trailer for that upcoming RPG? The graphics are stunning. It's like they've taken a page out of The Witcher 3's book!

>>Esports Commentator: Yeah, I caught that trailer too. The level of detail is insane. And speaking of trends, have you noticed how indie games are gaining traction lately?

>>Market Analyst: Absolutely! Indie games are really making waves. According to recent data, there's been a significant increase in their market share over the past few years.

>>Game Developer: Totally agree. And did anyone else notice how the lighting effects in that RPG trailer are almost on par with real-time ray tracing? We're stepping into a whole new level of immersion here!

>>Esports Commentator: For sure! It's amazing how far game graphics have come. But hey, what do you think about those League patch notes? Some big changes ahead.

>>Market Analyst: Indeed, it's interesting to see how these updates impact player behavior and engagement metrics. Speaking of which, have any of you looked at the recent player retention stats for Fortnite?

>>Game Developer: Not yet, but now I'm curious. You know, it's fascinating how these updates can make or break a game's popularity.

>>Esports Commentator: Uh-huh, exactly! And sometimes it's just one small tweak that makes all the difference.","1. **Issue Description:** Overly formal and repetitive greetings.
   **Reasoning:** The repeated ""Hey! I'm doing great, thanks. How about you?"" and similar responses feel scripted and lack the natural flow of a conversation.
   **Suggested Improvement:** Simplify the greetings to make them more casual and varied. For example, ""Hey! Doing well, how about you?"" or ""Hi everyone! Ready to dive in?""

2. **Issue Description:** Repetitive acknowledgment of topics.
   **Reasoning:** The dialogue repeatedly acknowledges topics without adding new information, making it feel redundant (e.g., multiple mentions of seeing trailers or patch notes).
   **Suggested Improvement:** Combine acknowledgments with additional insights or questions to keep the conversation dynamic. For example, ""Yeah, I saw that trailer too. What did you think about the character design?""

3. **Issue Description:** Forced transitions between topics.
   **Reasoning:** The transitions between different game-related topics feel abrupt and forced, lacking smooth conversational flow (e.g., jumping from graphics discussion to League patch notes).
   **Suggested Improvement:** Use natural segues that connect the topics more fluidly. For instance, ""Speaking of impressive graphics, have you seen the latest updates in League? Some big changes there too.""

4. **Issue Description:** Unrealistic level of enthusiasm for every topic.
   **Reasoning:** Every participant shows an equal level of high enthusiasm for each topic discussed, which feels unnatural as people usually have varying interests.
   **Suggested Improvement:** Vary the levels of interest shown by participants to reflect more realistic interactions. For example, one person might be more excited about indie games while another is more focused on sales figures.

5. **Issue Description:** Lack of personal opinions or experiences.
   **Reasoning:** The dialogue lacks personal anecdotes or opinions that would make it feel more authentic and engaging (e.g., how they personally felt about a game update).
   **Suggested Improvement:** Include personal experiences or opinions to add depth to the conversation. For example, ""I tried out those new patch changes last night; it's really shaking up my usual strategy.""

6. **Issue Description:** Excessive use of technical jargon without context.
   **Reasoning:** Terms like ""real-time ray tracing"" are used without much context or explanation, which can feel unnatural unless all participants are equally knowledgeable.
   **Suggested Improvement:** Provide brief explanations or context when using technical terms to ensure clarity and inclusivity in the conversation. For example, ""The lighting effects are almost on par with real-time ray tracing – that's a technique that makes lighting look incredibly realistic.""",">>Esports Commentator: Hey everyone! How's it going? Did anyone catch the latest patch notes for League of Legends? Some crazy changes coming up!

>>Game Developer: Hey! Doing well, how about you? Ready to dive into some epic gaming discussions today?

>>Market Analyst: Hi all! I'm good, thanks. Did you see the latest sales figures for the new Call of Duty? Fascinating stuff! There's been a significant spike in digital downloads compared to physical copies.

>>Game Developer: Oh yeah, I saw that. And speaking of new releases, did you guys check out the trailer for that upcoming RPG? The graphics are stunning. It's like they've taken a page out of The Witcher 3's book!

>>Esports Commentator: Yeah, I saw it too. What did you think about the character design? It looks pretty detailed.

>>Market Analyst: Absolutely! Indie games are really making waves too. According to recent data, there's been a significant increase in their market share over the past few years.

>>Game Developer: Totally agree. And those lighting effects in that RPG trailer – they're almost on par with real-time ray tracing. That's a technique that makes lighting look incredibly realistic. We're stepping into a whole new level of immersion here!

>>Esports Commentator: For sure! It's amazing how far game graphics have come. Speaking of impressive graphics, have you seen the latest updates in League? Some big changes there too.

>>Market Analyst: Indeed, it's interesting to see how these updates impact player behavior and engagement metrics. By the way, have any of you looked at the recent player retention stats for Fortnite?

>>Game Developer: Not yet, but now I'm curious. You know, it's fascinating how these updates can make or break a game's popularity.

>>Esports Commentator: Uh-huh, exactly! Sometimes it's just one small tweak that makes all the difference."
