original_scene,refined_scene,ai_feedback,finalized_scene
"
>>Environmental Policy Expert: Good morning, everyone. It's great to see familiar faces here. Today, we aim to discuss our strategies for implementing effective environmental policies that address climate change and promote sustainability.
>>Climate Scientist: Good morning, everyone. It's great to see familiar faces here. Today, we aim to discuss our strategies for implementing effective environmental policies that address climate change and promote sustainability.
>>Renewable Energy Specialist: Good morning, everyone! It's great to see familiar faces here. Today, we aim to discuss our strategies for implementing effective environmental policies that address climate change and promote sustainability.
>>Sociologist: Good morning, everyone! It's wonderful to see all of you here. Today, we aim to discuss our strategies for implementing effective environmental policies that address climate change and promote sustainability.
>>Public Health Expert: Good morning, everyone! It's wonderful to see all of you here. Today, we aim to discuss our strategies for implementing effective environmental policies that address climate change and promote sustainability.",">>Environmental Policy Expert: Good morning, everyone. It's great to see familiar faces here. Today, we aim to discuss our strategies for implementing effective environmental policies that address climate change and promote sustainability.

>>Climate Scientist: Morning, everyone. Um, it's good to see you all again. We're here to talk about how we can effectively tackle climate change through policy and sustainable practices.

>>Renewable Energy Specialist: Hey folks! Great to see you all. You know, today we're diving into how we can push forward with environmental policies that really make a difference in combating climate change.

>>Sociologist: Hi everyone! It's wonderful to be here with all of you. Like, let's focus on discussing strategies that will help us implement effective policies for climate change and sustainability.

>>Public Health Expert: Good morning! It's fantastic to see everyone here. Um, let's get started on figuring out the best ways to address climate change through solid environmental policies and sustainable actions.","1. **Issue Description:** Repetitive greetings and introductions.
   **Reasoning:** Each participant's greeting is very similar, with slight variations in wording but essentially conveying the same message. In a typical meeting, participants would not all repeat the same introductory remarks.
   **Suggested Improvement:** Have each participant provide a unique perspective or comment related to their expertise after a brief greeting. This will add variety and depth to the conversation.

2. **Issue Description:** Overly formal language from multiple participants.
   **Reasoning:** The language used by several participants feels overly formal and scripted, which is not typical in casual or semi-formal meetings where conversational tone is more common.
   **Suggested Improvement:** Use more natural, conversational language that reflects how people typically speak in meetings. For example:
   - Environmental Policy Expert: ""Good morning, everyone! Great to see you all here. Let's dive into our strategies for tackling climate change.""
   - Climate Scientist: ""Morning! Glad to be back with you all. Let's talk about effective policies for climate change.""
   - Renewable Energy Specialist: ""Hey folks! Excited to discuss how we can push forward with impactful environmental policies.""
   - Sociologist: ""Hi everyone! Looking forward to discussing strategies for implementing effective climate policies.""
   - Public Health Expert: ""Good morning! Let's get started on finding the best ways to address climate change.""

3. **Issue Description:** Lack of specific contributions from each expert.
   **Reasoning:** Each participant repeats the general goal of discussing environmental policies without adding any specific insights or points related to their field of expertise.
   **Suggested Improvement:** Encourage each participant to briefly mention a key point or question related to their area of expertise right after their greeting:
   - Environmental Policy Expert: ""Good morning, everyone! Great to see you all here. I'm looking forward to discussing policy frameworks that can drive sustainability.""
   - Climate Scientist: ""Morning! Glad to be back with you all. I want us to consider recent data on carbon emissions trends.""
   - Renewable Energy Specialist: ""Hey folks! Excited to discuss how renewable energy initiatives can lead our efforts against climate change.""
   - Sociologist: ""Hi everyone! Looking forward to exploring how social behaviors impact policy effectiveness.""
   - Public Health Expert: ""Good morning! Let's get started on finding ways environmental policies can improve public health outcomes.""

4. **Issue Description:** Unnatural use of filler words (""Um"").
   **Reasoning:** The repeated use of filler words like ""Um"" by multiple participants feels forced and unnatural in this context.
   **Suggested Improvement:** Remove unnecessary filler words or replace them with natural pauses or transitions:
    - Climate Scientist: ""Morning, everyone. It's good to see you all again...""
    - Public Health Expert: ""Good morning! It's fantastic to see everyone here...""",">>Environmental Policy Expert: Good morning, everyone! Great to see you all here. I'm looking forward to discussing policy frameworks that can drive sustainability.

>>Climate Scientist: Morning! Glad to be back with you all. I want us to consider recent data on carbon emissions trends.

>>Renewable Energy Specialist: Hey folks! Excited to discuss how renewable energy initiatives can lead our efforts against climate change.

>>Sociologist: Hi everyone! Looking forward to exploring how social behaviors impact policy effectiveness.

>>Public Health Expert: Good morning! Let's get started on finding ways environmental policies can improve public health outcomes."
