original_scene,refined_scene,ai_feedback,finalized_scene
"
>>Educator: Hey everyone, it's great to see you all here! Let's kick off today's meeting with a focus on collaboration. We're aiming to explore how education can drive social change, so feel free to share your thoughts openly. Education is the key!
>>Historian: Historically speaking, Mandela's journey from a cattle-boy to the first black president of South Africa is indeed a testament to the transformative power of education and activism. His life encapsulates the struggle against apartheid and highlights the importance of reconciliation in building a democratic society. What can we learn from this remarkable legacy?
>>Political Scientist: Politically speaking, Mandela's approach to governance, emphasizing reconciliation and inclusivity, offers valuable lessons for future leaders. Governance is about creating a framework where all voices are heard and respected. What does this mean for our current political challenges?
>>Human Rights Activist: Absolutely! From an ethical standpoint, Mandela's emphasis on reconciliation and inclusivity is a powerful reminder that human rights are universal. How can we ensure justice for all in our current political landscape?
>>Cultural Anthropologist: Culturally speaking, Mandela's roots in the Thembu royal family and his upbringing in traditional Xhosa customs deeply influenced his leadership style. You see, this cultural heritage instilled values of community and respect for all voices, which he carried into his political life. How do you think these cultural aspects shaped his approach to reconciliation?
>>Sociologist: Sociologically speaking, Mandela's activism was a catalyst for social movements that reshaped South African society. His legacy shows us the incredible power of collective action in transforming communities. What does this tell us about our capacity to drive social change today?
>>Historian: From a historical perspective, Mandela's life is a profound illustration of resilience and the pursuit of justice. His ability to transition from armed resistance to peaceful negotiation underscores the dynamic nature of leadership in times of societal upheaval. What can we learn from his adaptability in addressing our current challenges?
>>Human Rights Activist: Absolutely! From an ethical standpoint, Mandela's emphasis on reconciliation and inclusivity is a powerful reminder that human rights are universal. How can we ensure justice for all in our current political landscape?
>>Cultural Anthropologist: Culturally speaking, Mandela's upbringing in the Thembu royal family and his immersion in Xhosa traditions provided him with a deep sense of community and respect for all voices. This cultural foundation was crucial in shaping his approach to leadership and reconciliation. How do you think these values influenced his ability to unite diverse groups?
>>Historian: From a historical perspective, Mandela's life is a profound illustration of resilience and the pursuit of justice. His ability to transition from armed resistance to peaceful negotiation underscores the dynamic nature of leadership in times of societal upheaval. What can we learn from his adaptability in addressing our current challenges?
>>Human Rights Activist: Absolutely! From an ethical standpoint, Mandela's emphasis on reconciliation and inclusivity is a powerful reminder that human rights are universal. How can we ensure justice for all in our current political landscape?
>>Cultural Anthropologist: Culturally speaking, Mandela's upbringing in the Thembu royal family and his immersion in Xhosa traditions provided him with a deep sense of community and respect for all voices. This cultural foundation was crucial in shaping his approach to leadership and reconciliation. How do you think these values influenced his ability to unite diverse groups?
>>Sociologist: Well, Mandela's activism really highlights the power of social movements in driving change. You know, his ability to unite people across different backgrounds shows us that collective action can reshape society. What does this tell us about our capacity to transform communities today?
>>Political Scientist: Indeed! Mandela's approach to governance, emphasizing reconciliation and inclusivity, offers valuable lessons for future leaders. Governance is about creating a framework where all voices are heard and respected. What does this mean for our current political challenges?
>>Historian: Historically speaking, Mandela's ability to transition from armed resistance to peaceful negotiation is a testament to his adaptability and strategic acumen. His leadership during the tumultuous times of apartheid offers profound lessons on resilience and the pursuit of justice. What can we learn from his approach in addressing our current challenges?
>>Human Rights Activist: Absolutely! From an ethical standpoint, Mandela's emphasis on reconciliation and inclusivity is a powerful reminder that human rights are universal. How can we ensure justice for all in our current political landscape?
>>Cultural Anthropologist: You see, Mandela's cultural heritage is like a tapestry woven with threads of community and respect. These values were not just part of his upbringing but became the cornerstone of his leadership style. How do you think these cultural influences helped him navigate the complexities of reconciliation?
>>Historian: From a historical perspective, Mandela's ability to transition from armed resistance to peaceful negotiation is a testament to his adaptability and strategic acumen. His leadership during the tumultuous times of apartheid offers profound lessons on resilience and the pursuit of justice. What can we learn from his approach in addressing our current challenges?
>>Political Scientist: From a governance perspective, Mandela's emphasis on reconciliation and inclusivity is crucial for addressing our current political challenges. Governance is about creating a framework where all voices are heard and respected. What does this mean for our future?
>>Human Rights Activist: You see, Mandela's legacy is a testament to the power of ethical leadership in promoting social justice. His emphasis on reconciliation and inclusivity reminds us that human rights are universal. How can we ensure these principles guide our actions today?
>>Historian: From a historical perspective, Mandela's life is a profound illustration of resilience and the pursuit of justice. His ability to transition from armed resistance to peaceful negotiation underscores the dynamic nature of leadership in times of societal upheaval. What can we learn from his adaptability in addressing our current challenges?
>>Political Scientist: Indeed! Mandela's governance model, which prioritized inclusivity and reconciliation, is a blueprint for addressing our current political challenges. In the realm of politics, creating frameworks where diverse voices are heard is crucial. What does this mean for our future leadership strategies?
>>Human Rights Activist: You see, Mandela's legacy is a testament to the power of ethical leadership in promoting social justice. His emphasis on reconciliation and inclusivity reminds us that human rights are universal. How can we ensure these principles guide our actions today?
>>Historian: Historically speaking, Mandela's ability to transition from armed resistance to peaceful negotiation is a testament to his adaptability and strategic acumen. His leadership during the tumultuous times of apartheid offers profound lessons on resilience and the pursuit of justice. What can we learn from his approach in addressing our current challenges?
>>Political Scientist: From a governance perspective, Mandela's emphasis on reconciliation and inclusivity is crucial for addressing our current political challenges. Governance is about creating a framework where all voices are heard and respected. What does this mean for our future?
>>Human Rights Activist: You see, Mandela's legacy is a testament to the power of ethical leadership in promoting social justice. His emphasis on reconciliation and inclusivity reminds us that human rights are universal. How can we ensure these principles guide our actions today?
>>Historian: From a historical perspective, Mandela's life is a profound illustration of resilience and the pursuit of justice. His ability to transition from armed resistance to peaceful negotiation underscores the dynamic nature of leadership in times of societal upheaval. What can we learn from his adaptability in addressing our current challenges?
>>Political Scientist: Politically speaking, Mandela's governance model, which prioritized inclusivity and reconciliation, is a blueprint for addressing our current political challenges. In the realm of politics, creating frameworks where diverse voices are heard is crucial. What does this mean for our future leadership strategies?
>>Historian: From a historical perspective, Mandela's life is a profound illustration of resilience and the pursuit of justice. His ability to transition from armed resistance to peaceful negotiation underscores the dynamic nature of leadership in times of societal upheaval. What can we learn from his adaptability in addressing our current challenges?
>>Human Rights Activist: Absolutely! Mandela's legacy is a testament to the power of ethical leadership in promoting social justice. His emphasis on reconciliation and inclusivity reminds us that human rights are universal. How can we ensure these principles guide our actions today?
>>Sociologist: Wow! Mandela's activism really shows us the power of social movements in reshaping society. Like, his ability to unite people across different backgrounds is a testament to how collective action can drive change. What does this tell us about our capacity to transform communities today?
>>Historian: Historically speaking, Mandela's journey from armed resistance to peaceful negotiation is a testament to his adaptability and strategic acumen. His leadership during the tumultuous times of apartheid offers profound lessons on resilience and the pursuit of justice. What can we learn from his approach in addressing our current challenges?
>>Political Scientist: Politically speaking, Mandela's governance model, which prioritized inclusivity and reconciliation, is a blueprint for addressing our current political challenges. In the realm of politics, creating frameworks where diverse voices are heard is crucial. What does this mean for our future leadership strategies?
>>Human Rights Activist: Absolutely! Mandela's legacy is a testament to the power of ethical leadership in promoting social justice. His emphasis on reconciliation and inclusivity reminds us that human rights are universal. How can we ensure these principles guide our actions today?
>>Sociologist: Sociologically speaking, Mandela's activism is a testament to the power of social movements in reshaping society. His ability to unite people across different backgrounds shows us that collective action can drive change. What does this tell us about our capacity to transform communities today?
>>Historian: From a historical perspective, Mandela's life is a profound illustration of resilience and the pursuit of justice. His ability to transition from armed resistance to peaceful negotiation underscores the dynamic nature of leadership in times of societal upheaval. What can we learn from his adaptability in addressing our current challenges?
>>Human Rights Activist: Absolutely! Mandela's legacy is a testament to the power of ethical leadership in promoting social justice. His emphasis on reconciliation and inclusivity reminds us that human rights are universal. How can we ensure these principles guide our actions today?
>>Cultural Anthropologist: Culturally speaking, Mandela's upbringing in the Thembu royal family and his immersion in Xhosa traditions provided him with a deep sense of community and respect for all voices. This cultural foundation was crucial in shaping his approach to leadership and reconciliation. How do you think these values influenced his ability to unite diverse groups?
>>Historian: From a historical perspective, Mandela's journey is not just about overcoming apartheid but also about the profound resilience and adaptability he demonstrated throughout his life. His ability to transition from armed resistance to peaceful negotiation underscores the dynamic nature of leadership in times of societal upheaval. What can we learn from his approach in addressing our current challenges?",">>Educator: Hey everyone, great to see you all here! Let's kick off today's meeting with a focus on collaboration. We're aiming to explore how education can drive social change, so feel free to share your thoughts openly. Education is the key!

>>Historian: You know, Mandela's journey from a cattle-boy to the first black president of South Africa is indeed a testament to the transformative power of education and activism. His life encapsulates the struggle against apartheid and highlights the importance of reconciliation in building a democratic society. What can we learn from this remarkable legacy?

>>Political Scientist: Actually, Mandela's approach to governance, emphasizing reconciliation and inclusivity, offers valuable lessons for future leaders. Governance is about creating a framework where all voices are heard and respected. How does this relate to our current political challenges?

>>Human Rights Activist: Well, Mandela's emphasis on reconciliation and inclusivity is a powerful reminder that human rights are universal. How can we ensure justice for all in our current political landscape?

>>Cultural Anthropologist: You see, Mandela's roots in the Thembu royal family and his upbringing in traditional Xhosa customs deeply influenced his leadership style. This cultural heritage instilled values of community and respect for all voices, which he carried into his political life. How do you think these cultural aspects shaped his approach to reconciliation?

>>Sociologist: Like, Mandela's activism was a catalyst for social movements that reshaped South African society. His legacy shows us the incredible power of collective action in transforming communities. What does this tell us about our capacity to drive social change today?

>>Historian: From a historical perspective, um...Mandela's life illustrates resilience and the pursuit of justice. His ability to transition from armed resistance to peaceful negotiation underscores dynamic leadership during societal upheaval. What can we learn from his adaptability in addressing our current challenges?

>>Political Scientist: Indeed! Politically speaking, Mandela's governance model prioritized inclusivity and reconciliation—it's like a blueprint for addressing our current political challenges. In politics, creating frameworks where diverse voices are heard is crucial. What does this mean for future leadership strategies?

>>Human Rights Activist: Absolutely! You see, Mandela's legacy is a testament to ethical leadership promoting social justice. His emphasis on reconciliation reminds us that human rights are universal principles guiding our actions today.

>>Cultural Anthropologist: Culturally speaking—well—Mandela's upbringing provided him with community values crucial in shaping his approach to leadership and reconciliation. How do you think these values influenced his ability to unite diverse groups?

>>Sociologist: Wow! Like I said earlier...Mandela’s activism really shows us how collective action can reshape society across different backgrounds—a testament indeed! What does this tell us about transforming communities today?","1. **Issue Description:** Repetitive content and lack of progression in the discussion.
   **Reasoning:** Several participants repeat similar points about Mandela's emphasis on reconciliation and inclusivity without adding new insights or advancing the conversation. This can make the dialogue feel stagnant and unrealistic, as real meetings typically build on previous comments to deepen the discussion.
   **Suggested Improvement:** Encourage each participant to introduce new perspectives or expand on previous points with additional context or examples. For instance, after discussing Mandela's approach to governance, someone could explore specific policies he implemented or compare his strategies to other leaders.

2. **Issue Description:** Overly formal language and structured responses.
   **Reasoning:** The dialogue feels scripted due to the formal tone and structured nature of each response. In real meetings, participants often speak more casually and may interrupt or respond directly to each other's points rather than delivering monologues.
   **Suggested Improvement:** Incorporate more natural conversational elements such as interjections, informal language, and direct responses. For example:
   - ""That's a great point about Mandela's governance model! I think we can learn a lot from how he handled conflicts.""
   - ""I agree with what you said earlier about collective action reshaping society. It's really inspiring!""

3. **Issue Description:** Lack of interaction between participants.
   **Reasoning:** Each participant speaks independently without acknowledging or building on others' contributions, which is uncommon in real meetings where dialogue is more interactive.
   **Suggested Improvement:** Include interactions where participants refer to each other's comments, ask questions, or express agreement/disagreement. For example:
   - ""I see your point about Mandela's cultural heritage influencing his leadership style. How do you think this compares to other leaders we've studied?""
   - ""That's interesting! Can you elaborate on how Mandela's approach might be applied in today's political landscape?""

4. **Issue Description:** Unrealistic portrayal of diverse professional backgrounds speaking uniformly.
   **Reasoning:** Despite their varied expertise (educator, historian, political scientist, etc.), all participants discuss Mandela in a similar manner without showcasing their unique perspectives based on their fields.
   **Suggested Improvement:** Highlight distinct viewpoints that reflect each participant's background:
   - Educator: ""From an educational standpoint, Mandela’s story shows us how education can empower individuals to drive social change.""
   - Historian: ""Historically speaking, Mandela’s transition from armed resistance to peaceful negotiation is fascinating.""
   - Political Scientist: ""Politically, his governance model offers lessons for creating inclusive frameworks.""

5. **Issue Description:** Unnatural repetition by Sociologist.
   **Reasoning:** The Sociologist repeats almost identical statements twice (""Like I said earlier...""). This redundancy feels forced and unnatural in a typical meeting setting.
   **Suggested Improvement:** Ensure each contribution adds new information or perspective:
   - First statement: ""Mandela’s activism was a catalyst for social movements that reshaped South African society.""
   - Second statement: ""His legacy demonstrates the power of collective action in driving social change across different communities.""

By addressing these issues with more dynamic interactions and varied perspectives reflective of each participant's expertise, the meeting scene will feel more realistic and engaging.",">>Educator: Hey everyone, great to see you all here! Let's kick off today's meeting with a focus on collaboration. We're aiming to explore how education can drive social change, so feel free to share your thoughts openly. Education is the key!

>>Historian: You know, Mandela's journey from a cattle-boy to the first black president of South Africa is indeed a testament to the transformative power of education and activism. His life encapsulates the struggle against apartheid and highlights the importance of reconciliation in building a democratic society. What can we learn from this remarkable legacy?

>>Political Scientist: That's a great point about Mandela's governance model! I think we can learn a lot from how he handled conflicts. His approach emphasized reconciliation and inclusivity, which offers valuable lessons for future leaders. Governance is about creating frameworks where all voices are heard and respected. How does this relate to our current political challenges?

>>Human Rights Activist: Absolutely! Mandela's emphasis on reconciliation reminds us that human rights are universal principles guiding our actions today. But beyond that, his policies aimed at addressing inequality were crucial too. How can we ensure justice for all in our current political landscape?

>>Cultural Anthropologist: I see your point about Mandela's cultural heritage influencing his leadership style. His roots in the Thembu royal family and upbringing in traditional Xhosa customs instilled values of community and respect for all voices, which he carried into his political life. How do you think these cultural aspects shaped his approach compared to other leaders we've studied?

>>Sociologist: Like Mandela’s activism was a catalyst for social movements that reshaped South African society. His legacy shows us the incredible power of collective action in transforming communities across different backgrounds. What does this tell us about our capacity to drive social change today?

>>Historian: From a historical perspective, um...Mandela's life illustrates resilience and the pursuit of justice through dynamic leadership during societal upheaval. His ability to transition from armed resistance to peaceful negotiation underscores adaptability—something we need now more than ever.

>>Political Scientist: Indeed! Politically speaking, Mandela's governance model prioritized inclusivity and reconciliation—it's like a blueprint for addressing our current political challenges. In politics, creating frameworks where diverse voices are heard is crucial.

>>Human Rights Activist: That's interesting! Can you elaborate on how Mandela's approach might be applied in today's political landscape? Ethical leadership promoting social justice seems more important than ever.

>>Cultural Anthropologist: Culturally speaking—well—Mandela's upbringing provided him with community values crucial in shaping his approach to leadership and reconciliation. These values influenced his ability to unite diverse groups effectively.

>>Sociologist: Wow! Like I said earlier...Mandela’s activism really shows us how collective action can reshape society across different backgrounds—a testament indeed! What does this tell us about transforming communities today?"
