Title,Article,Tags,Personas,Summary,Meeting_Plan,Meeting
Street Art,"Als Streetart (auch: Street Art, seltener, da missverständlich, Straßenkunst; vgl. dort) werden verschiedene, meist nicht kommerzielle Formen von Kunst im öffentlichen Raum bezeichnet, die nach der Absicht der Ersteller durchaus dauerhaft dort verbleiben sollten.
Unter Streetart versteht man selbstautorisiert angebrachte Zeichen aller Art im urbanen Raum, die mit einem weiteren Personenkreis kommunizieren wollen. Die engere oder weitere Auffassung des Begriffes Streetart ist an deren kommerzielle Verwertbarkeit geknüpft. Im Gegensatz zu Graffiti überwiegt oft der Bildteil – bis hin zu großen Wandmalereien (Murals) auf Hausfassaden –, nicht das kunstvolle Schreiben/Malen des eigenen Namens.


Entstehung und Ursprünge

Streetart umfasst als Begriff seit 2005 verschiedene Techniken, Materialien, Gegenstände und Formen der Kunst im öffentlichen Raum. Demnach lassen sich mehrere Kunstbewegungen anführen, die Einfluss auf die Gestaltung der Street Art haben.
1968 entstand eines der ersten großen europäischen Wallpaintings in Hamburg an der Großen Freiheit durch Werner Nöfer und Dieter Glasmacher. Das riesige Wandbild (ca. 700 m²) befindet sich an der Südseite des Gruenspan, einer berühmten Diskothek. Die Wandmalerei steht mittlerweile unter Denkmalschutz. Sie gilt als Vorläufer der Streetart-Bewegung.
Ab etwa 2000 ist Street Art eine Bewegung, davor betrieben nur einzelne Künstler, was seit etwa 2005 Street Art genannt wird. Davor konkurrierten Begriffe wie Postgraffiti oder Urban Art mit Street Art.
Neben den autorisierten Kratzarbeiten aus Pompeji ist einer der ersten bekannten Schriftzüge im städtischen Raum Kyselak von Joseph Kyselak, der seinen Namen auf Wanderschaften im 19. Jh. an den Wänden hinterließ. Ähnlich wie bei dem Slogan Kilroy was here aus den 1940er und 1950er Jahren (mit Wurzeln im Ersten Weltkrieg) handelt es sich um die frühe Graffiti, die entweder in die Wand geritzt oder auf die Wand mit Farbe aufgetragen wurden. Das American Graffiti beziehungsweise Style Writing unterscheidet sich im engeren Sinne von Street Art. Als Überbegriff über Street Art, Graffiti und Kunst im öffentlichen Raum oder Public Art fungiert heute oft Urban Art. In den Medien und Künstlerinterviews werden Street Art, Public Art, Urban Art und Graffiti oft nicht unterschieden.
Viele Street-Artisten kommen aus der Graffitiszene oder Punkszene. Neben Graffiti wird Außenwerbung als nächster Verwandter der Street Art bezeichnet. Im Zuge der industriellen Revolution entstand ein Markt für Werbung in Form von gemalter Reklame an Häuserfassaden. Ebenso wie die Plakat- und Fassadenwerbung hat Propaganda-Kunst stilistische Wirkung auf Street Art. Shepard Fairey nutzt beispielsweise Militärkunst als Stilmittel in seinen Arbeiten.


Künstlerische Spezifik
Die Künstler bedienen sich verschiedener Medien (Marker, Pinsel und Malerrollen, Sprühdosen, Aufkleber, Poster etc.), um ihre Werke zu präsentieren. Häufig werden Wände bemalt und beklebt, doch auch Stromkästen, Laternen, Verkehrsschilder, Telefonzellen, Mülleimer, Ampeln und andere Stadtmöbel, sowie Bürgersteige und Straßen an sich und sogar Bäume – im Prinzip alle erdenklichen Untergründe – werden gestaltet. Dabei beschränkt sich die Streetart im Regelfall auf die Gestaltung von vorhandenen Flächen. Da sich die Techniken der Streetart mit denen des Graffiti oftmals überschneiden, ist es heutzutage schwierig, zwischen den beiden Begriffen zu unterscheiden.
Obwohl auch Auftragsarbeiten durch private Grundstückseigentümer oder auch Gemeinden wie etwa Blek le Rat, Tribute to Tom Waits in Wiesbaden (1983) entstehen, sind die Werke meist illegal angebracht. Deshalb ziehen es die meisten Künstler vor, anonym zu bleiben – oft kennen sich Mitglieder der Szene nur mit ihren Pseudonymen.
Die Motivation liegt für viele im Spaß an der Sache und der Möglichkeit, das eigene Umfeld auf selbstbestimmte und/oder kreative Weise visuell mitzugestalten (vergleiche Reclaim the Streets), sowie einen künstlerischen Gegenpol zur omnipräsenten Werbung oder Gentrifizierung zu schaffen; für viele spielt wohl auch der egozentrische Hang, seinen (Künstler-)Namen möglichst oft zu verbreiten, eine Rolle (siehe Joseph Kyselak). Streetart wendet sich inhaltlich oft gegen Konsumismus, Kapitalismus und Öffentliche Ordnung. Die meisten Künstler verzichten jedoch auf eine konkrete Botschaft – „the medium is the message“ (nach Marshall McLuhan).
Bedeutende Künstler dieses Genres sind unter anderem Keith Haring, Harald Naegeli, Werner Nöfer, Blek le Rat, Miss.Tic, Banksy, Blu, Os Gêmeos & Nina, John Fekner und Klaus Paier.


Bildbeispiele verschiedener Techniken


Kommerzialisierung

In jüngster Zeit werden Ausdrucksmittel der Streetart auch von Unternehmen sowohl in ihrer Stilistik als auch in ihrer Gesamtheit als Werbemittel aufgegriffen, um ihren Produkten ein jugendkulturelles Image zu geben. Am weitesten verbreitet ist dabei das Anbringen von Werbeaufklebern, welches ursprünglich aus der Stickerkunst-Szene hervorgegangen ist. Viele Shops aus der alternativen Szene verteilen gratis Sticker an ihre Kunden, um zufriedene Kunden zum „Werbung machen“ zu bewegen. Besonders der Sportartikelhersteller Nike ist für wildplakatierte Werbeaufkleber und großflächige Wandmalereien bekannt, die zunächst nicht als kommerzielle Werbung wahrgenommen werden. Auch der Pocket Web-Anbieter Ogo war zeitweise stark mit seinem Guerilla-Marketing in Form von Graffiti, Stickern und Paste-Ups im öffentlichen Stadtbild präsent.
Seitens der Firma Sony wurde gar eine Streetart-Galerie zur Vermarktung der PSP in Berlin-Mitte eingerichtet, was besonders von der umliegenden Kunstszene als Ärgernis betrachtet wurde.
In der Streetart-Szene wird diese Form der Werbung häufig als Vereinnahmung einer jugendkulturellen Identität kritisiert und stößt vor allem auf Widerstand, da der Ursprung von Streetart unter anderem als Kampf gegen Kapitalismus und Konsumgesellschaft sowie die Hinwegsetzung über die Privatisierung urbaner Räume verstanden wird.
Allerdings wird der Diskurs um die Kommerzialisierung von Streetart auch kritisch kommentiert. So ist laut dem Sozialwissenschaftler Hans-Christian Psaar die Beziehung zwischen Markt und Streetart komplexer, als es im Ausverkauf von Streetart an große Konzerne vermittelt wird. Der Soziologe Jens Thomas macht vor allem auf den Umstand aufmerksam, dass ein „konsum- und gesellschaftskritisches Selbstverständnis“ von Streetart-Akteuren durch Medien und Konzerne vermittelt wird. Antikapitalistische Attitüden könnten selbst „kapitalistisch konnotiert“ sein, da „Abgrenzung“ als Gut produziert werde.


Streetart in den sozialen Medien

Waren es früher noch Graffiti- und Streetart-Magazine wie zum Beispiel Backspin, die für eine Verbreitung der Kunst im öffentlichen Raum sorgten und zumeist nur das Szene-Klientel bedienten, so zeigt sich in den letzten Jahren mit Aufkommen des Web 2.0 eine exponentielle Verbreitung der Kunstform im Internet und besonders in den sozialen Medien. Die Bedeutsamkeit dieser Kooperation zwischen Streetart und Social Media offenbart sich vor allem, wenn man bei Google nach der Begriffskombination „Streetart Facebook“ sucht. Mit ungefähr 346.000.000 Treffern (Stand 22. Februar 2018) verdeutlicht dies die zunehmende Relevanz von Social Media und Streetart.
Die wohl bekannteste Internetplattform für Streetart im deutschsprachigen Raum befindet sich folglich ebenfalls auf Facebook. Die Seite „Streetart in Germany“, von Timo Schaal ins Leben gerufen, ist mittlerweile der „Hotspot im Social Web für alle Streetart-Begeisterten“. Hier ist es auch nicht mehr alleine der Seitenbetreiber, der sich um den Inhalt und die Veröffentlichung der Bilder kümmert. Fans aus aller Welt, aber auch Künstler tun ihr Übriges und liefern damit ein Musterbeispiel für die Möglichkeiten, die das Web 2.0 bietet.
Fest steht: Streetart-Künstler haben das Internet für sich entdeckt. Bedenkt man die Herkunft und eigentliche Intention der Kunstform Streetart (respektive Graffiti), lassen sich hierbei sicherlich Ansatzpunkte finden, weshalb diese Kooperation immer weiter intensiviert wird. Werke werden zwar einer breiten Öffentlichkeit zugänglich gemacht (Städte / Internet), dies jedoch möglichst verborgen im Schutz der Nacht bzw. der Masse. Denn auch im Internet geben die Künstler selten ihre Identität preis. Bekanntestes Beispiel hierfür ist sicherlich der Streetartist Banksy. Die Ikone des Streetart ist seit jeher bemüht, seine Identität geheim zu halten. Die Folge, die gesamte Kunstwelt fragt sich, wer ist dieser geniale Streetart-Künstler. Zudem fördert das mysteriöse Vorgehen Banksys sicherlich auch seinen Hype.
Eine weitere Gemeinsamkeit von Social Media und Streetart liegt laut Banksy auch in der eigentlichen Kernintention: „kostenlose Kunst für jedermann, die zum Nachdenken anregt“. Dabei werden vor allem sozialkritische Themen aufgegriffen. Der Artist Above beschäftigte sich z. B. in einem kurzen Zeitraffer-Film mit den sozialen Medien und hinterfragte diese, da sie einen immer größer werdenden Teil unseres Leben einnehmen. Hierbei verfremdete er bekannte mediale Logos und Phrasen und drückte ihnen seinen künstlerischen Stempel auf. So sprühte er unter anderem verschiedene, in Facebook immer wiederkehrende Phrasen auf eine Wand: „#my life sucks #im bored #waste of time #imLonely #irony #reblog this shit #wtf #wish you were here #LOL #lmfao #stupid“.
Die Kombination von sozialen Medien und Streetart hat mittlerweile auch das mobile Web erreicht. So haben es sich drei junge Leute aus Istanbul zur Aufgabe gemacht, eine mobile Plattform für Streetart in ihrer türkischen Heimatstadt zu schaffen. Die Kooperation des Künstlers, des Designers und des Softwareprogrammierers ging so weit, dass es mittlerweile eine Streetart-App für Istanbul gibt. Diese stellt die Kunstwerke vor und lokalisiert sie auf Karten. Synchron werden die Bilder auf Facebook, Twitter und Instagram online gestellt und im Netz verbreitet. Von einer Gruppe Streetart-Künstlern aus Antwerpen und Heerlen gibt es seit Anfang 2017 die „Street Art Cities“, eine inzwischen auf weltweit über 900 Städte angewachsene internationale digitale Community, die ständig weiter wächst. Auf einer Weltkarten-Map können die einzelnen Städte angeklickt werden. Fotografierte Kunstwerke, Künstler und Routen werden aufgeführt und beschrieben. Jede Stadt hat lokale „Street Art Hunter“.
Streetart lässt sich schwierig in Kunstmuseen ausstellen. Fotografien werden der Streetart bedingt gerecht, da sie die Dimensionen und das meist entscheidende Umfeld, in denen sie zu finden sind, nicht vermitteln können. Das virtuelle Museum – Universal Museum of Art hat sich dieses Problem angenommen und entwickelte eine Streetart Ausstellung „A Walk Into Street Art“, bei der eine virtuelle Kunstausstellung mit berühmten Motiven des Streetarts besucht werden kann, die die Werke möglichst in ihrem natürlichen freien Umfeld und in ihren Dimensionen wiedergibt. Künstler wie Banksy, JR, Jef Aérosol, Vhils, Shepard Fairey, Keith Haring etc. sind hier vertreten.


Ausstellungen in Deutschland
Die Kunsthalle Hamburg zeigt im Jahre 2023 eine umfangreiche Ausstellung von Werner Nöfer, u. a. mit Entwürfen seiner zahlreichen Wandbilder ab 1968 im öffentlichen Raum. Er gilt als zeitlich erster und wichtigster Protagonist von Urban- und Streetart.
Urban Art wird auch in Völklingen bei der UrbanArt Biennale gezeigt. Ausstellungsort ist das Europäische Zentrum für Kunst und Industriekultur im UNESCO-Weltkulturerbe Völklinger Hütte im saarländischen Völklingen. Die erste Ausstellung fand im Jahr 2011 statt. Weitere Ausstellungen in den Jahren 2013, 2015, 2017, 2019, 2022, 2024.


Dokumentarfilme (Auswahl)
Rash (2005), ein abendfüllender Dokumentarfilm von Mutiny Media, der den kulturellen Wert von australischer Straßenkunst und Graffiti untersucht.
Bomb It (2008), ein Dokumentarfilm über Graffiti und Straßenkunst auf der ganzen Welt.
Exit Through the Gift Shop (2010), ein vom Künstler Banksy erstellter Dokumentarfilm über Thierry Guetta.
Style Wars (1983), eine PBS-Dokumentation über Graffiti-Künstler in New York City mit Seen, Kase2, Dez und DONDI.
Obey Giant (2017), eine Dokumentation über das Leben und die Karriere des Straßenkünstlers, Illustrators, Grafikdesigners, Aktivisten und Gründers von OBEY Clothing, Shepard Fairey.


Philatelistisches
Mit dem Erstausgabetag 7. Oktober 2021 gab die Deutsche Post AG in der Serie Street Art unter dem Titel: 1010 - Tropfen und Ringe   ein Postwertzeichen im Nennwert von 80 Eurocent heraus. Der Entwurf stammt von der Grafikerin Bettina Walter aus Bonn. Mit dem Erstausgabetag 3. Februar 2023 gab die Deutsche Post AG in der Briefmarkenserie Street Art ein weiteres Postwertzeichen im Nennwert von 160 Eurocent mit dem Motiv Pfau und Kranich des Künstlers Christoph Ganter alias JEROO heraus. Der Entwurf stammt von der Grafikerin Bettina Walter aus Bonn.


Siehe auch
Liste von Graffiti- und Streetart-Künstlern
Wandmalerei
Zeitgenössische Kunst


Literatur
Michael Naumann „Werner Nöfer - Straßenkunst“ ZEIT Magazin 3/1970
Horst Schmidt Brümmer: „Die bemalte Stadt - Initiativen zur Veränderung der Strassen in USA / Beispiele in Europa“, Verlag M.DuMont Schauberg, Köln 1973, ISBN 3-7701-0719-5
Jörgen Bracker: „Die Veränderung der Republik oder eine Theorie der Baukunst“, Katalog des Museums für Hamburgische Geschichte „Das Strassenmuseum“ zur Ausstellung Werner Nöfer (S. 28–39) Hamburg 1998, ISBN 3-00-002497-2
Ulrich Behm: Sachbeschädigung und Verunstaltung. Duncker & Humblot, Berlin 1984, ISBN 3-428-05644-2.
Ulrich Blanché: Something to s(pr)ay: Der Street Artivist Banksy: Eine kunstwissenschaftliche Untersuchung. Tectum Verlag, 2010, ISBN 978-3-8288-2283-2.
Sandra Maria Geschke: Straße als kultureller Aktionsraum: Interdisziplinäre Betrachtungen des Straßenraumes an der Schnittstelle zwischen Theorie und Praxis. VS Verlag für Sozialwissenschaften, Wiesbaden 2009, ISBN 978-3-531-16212-6.
Katja Glaser: Street Art und neue Medien. Akteure – Praktiken – Ästhetiken. Transcript Verlag, Bielefeld 2017, ISBN 978-3-8376-3535-5.
Christian Heinicke, Daniela Krause: Street Art. Die Stadt als Spielplatz. Tilsner, Bugrim 2006, ISBN 3-86546-040-2.
Marcel Hennes, Alexandra Pätzold, Gerhard Pätzold (Hrsg.): Streetart Marburg. Jonas Verlag für Kunst und Literatur, Marburg 2009, ISBN 978-3-89445-406-7.
Christian Hundertmark: The Art of Rebellion I/II. Publikat-Verlag, Aschaffenburg 2003, ISBN 3-9807478-3-2 bzw. ISBN 3-9809909-4-X.
Kai Jakob: Street Art in Berlin - Version 7.0. Jaron Verlag, Berlin 2015, ISBN 978-3-89773-778-5.
Katrin Klitzke, Christian Schmidt (Hrsg.): Street Art. Legenden zur Straße. Verlag Archiv der Jugendkulturen e. V., 2009, ISBN 978-3-940213-44-0.
Uwe Lewitzky: Kunst für alle? - Kunst im öffentlichen Raum zwischen Partizipation, Intervention und Neuer Urbanität. Transcript Verlag, Bielefeld 2005, ISBN 3-89942-285-6.
Christoph Mangler: Berlin City Language. Prestel, 2006, ISBN 3-7913-3610-X. (engl.)
Michael Naumann: „Werner Nöfer - Strassenkunst“ ZEIT Magazin 3/1970.
Julia Reinecke: Street-Art - Eine Subkultur zwischen Kunst und Kommerz. Transcript Verlag, Bielefeld 2007, ISBN 978-3-89942-759-2.
Jan P. Schildwächter, Britt Eggers: Street Art Hamburg. Junius, Hamburg 2007, ISBN 978-3-88506-582-1.
Kai Hendrik Schlusche: Graffiti unter der Autobahn; Die Bridge-Gallery in Lörrach. Verlag Waldemar Lutz, Lörrach 2011, ISBN 978-3-922107-91-0, S. 112. 
Nora Schmidt: Das Trottoir als Galerie. Ein Beitrag zur soziologischen Theorie der Street Art. Verlag Dr. Kovac, Hamburg 2009, ISBN 978-3-8300-4433-8. 
Horst Schmidt-Brümmer: Venice, California. Gegen Kultur durch Fantasie. Ernst Wasmuth, Tübingen 1972, ISBN 3-8030-0121-8.
Robert Sommer: Street Art. Links, New York/ London 1975, ISBN 0-8256-3044-4.
Johannes Stahl: Street Art. Königswinter 2009, ISBN 978-3-8480-0075-3.
Bernhard van Treeck, Sibylle Metze-Prou: Pochoir - die Kunst des Schablonengraffiti. Schwarzkopf & Schwarzkopf, Berlin 2000, ISBN 3-89602-327-6.
Bernhard van Treeck: Street Art Berlin. Schwarzkopf & Schwarzkopf, Berlin 1999, ISBN 3-89602-191-5.
Bernhard van Treeck: Street Art Köln. Edition Aragon, Moers 1996, ISBN 3-89535-434-1.
Claudia Walde: Sticker City: Paper Graffiti Art (Street Graphics/Street Art). Thames & Hudson, London 2007, ISBN 978-0-500-28668-5.
André Lindhorst, Rik Reinking: Fresh Air Smells Funny: an exhibition with selected urban artists. Ausstellungskatalog. 1. Auflage. Kehrer Verlag Heidelberg 2008, ISBN 978-3-939583-94-3.
Ingo Clauß, Stephen Riolo, Sotirios Bahtsetzis: Urban Art: Werke aus der Sammlung Reinking. Ausstellungskatalog. 1. Auflage. Hatje Cantz, Ostfildern 2009, ISBN 978-3-7757-2503-3.
Claudia Willms: Sprayer im White Cube. 1. Auflage. Tectum Verlag Marburg 2010, ISBN 978-3-8288-2473-7.
Kai Hendrik Schlusche: StreetArt Basel und Region. Die Hot-Spots im Dreiländereck. 1. Auflage. Verlag Gudberg Nerger, Hamburg, 2015, ISBN 978-3-945772-00-3.
Jörg Schilling „Nöfers Arbeiten im öffentlichen Raum“ Schaff-Verlag Hamburg 2023, ISBN 978-3-944405-65-0


Weblinks

Streetartfinder.de – Projekt der Uni Regensburg zur Erfassung, Lokalisierung und Kategorisierung von Streetart
Unurth – Globales Streetart-Archiv (englisch)
Homepage Street Art Museum Amsterdam
streetpins.com – Internationale Streetart-Community und Photoarchiv
UrbanArt Biennale
Zur strafrechtlichen Relevanz
– in Deutschland: § 303 und § 304 StGB
– in Österreich: §§ 125, 126 StGB: (online)
– in der Schweiz: Artikel 144 StGB: Online


Einzelnachweise","[""Street Art"", ""Urban Art"", ""Graffiti"", ""Public Art"", ""Social Media and Street Art""]","[{'role': 'Kunsthistoriker', 'description': 'Ein Experte für die Geschichte und Entwicklung von Kunstbewegungen, insbesondere Street Art.', 'expertise_area': 'Kunstgeschichte', 'perspective': 'Historische Analyse', 'speaking_style': {'tone': 'enthusiastisch und leidenschaftlich, gelegentlich humorvoll', 'language_complexity': 'komplexe Sprache mit Fachbegriffen aus der Kunstgeschichte, häufige Verwendung von Metaphern und Analogien', 'communication_style': 'kollaborativ und neugierig, stellt oft rhetorische Fragen', 'sentence_structure': 'lange und komplexe Sätze mit Nebensätzen, häufige Verwendung von Ausrufezeichen', 'formality': 'semi-formal', 'other_traits': 'verwendet Pausen effektiv, neigt dazu, Geschichten zu erzählen'}, 'personalized_vocabulary': {'filler_words': ['Ähm', 'Also', 'Halt'], 'catchphrases': ['Das ist wirklich faszinierend!', 'Kunst ist die Seele der Gesellschaft.', 'Man muss das im Kontext sehen.'], 'speech_patterns': ['beginnt oft mit einer Frage oder einem Zitat', 'stellt Verbindungen zwischen verschiedenen Kunstbewegungen her'], 'emotional_expressions': ['Lachen', 'Seufzen', 'Wow!']}, 'social_roles': ['Information Giver', 'Evaluator-Critic'], 'social_roles_descr': ['Shares relevant information, data or research that the group needs to make informed decisions.', 'Analyzes and critically evaluates proposals or solutions to ensure their quality and feasibility.']}, {'role': 'Street Artist', 'description': 'Ein aktiver Street Artist, der eigene Werke im urbanen Raum schafft und die Szene gut kennt.', 'expertise_area': 'Praktische Kunst', 'perspective': 'Künstlerische Praxis', 'speaking_style': {'tone': 'locker und enthusiastisch, gelegentlich sarkastisch', 'language_complexity': 'einfache Sprache mit umgangssprachlichen Ausdrücken, gelegentliche Verwendung von Metaphern', 'communication_style': 'direkt und durchsetzungsfähig, oft provokativ', 'sentence_structure': 'kurze und prägnante Sätze, häufige Verwendung von Fragen', 'formality': 'informal', 'other_traits': 'neigt dazu, häufig zu unterbrechen, verwendet Pausen zur Betonung'}, 'personalized_vocabulary': {'filler_words': ['Ähm', 'Also', 'Na ja'], 'catchphrases': ['Das ist der Hammer!', 'Street Art ist Freiheit.', 'Man muss es einfach machen!'], 'speech_patterns': ['beginnt oft mit einer provokativen Aussage oder Frage', 'stellt direkte Verbindungen zu aktuellen Ereignissen her'], 'emotional_expressions': ['Lachen', 'Wow!', 'Unglaublich!']}, 'social_roles': ['Initiator-Contributor', 'Opinion Giver'], 'social_roles_descr': ['Contributes new ideas and approaches and helps to start the conversation or steer it in a productive direction.', 'Shares his or her views and beliefs on topics under discussion.']}, {'role': 'Sozialwissenschaftler', 'description': 'Ein Forscher, der sich mit den sozialen und kulturellen Auswirkungen von Street Art auf urbane Gemeinschaften beschäftigt.', 'expertise_area': 'Sozialwissenschaften', 'perspective': 'Gesellschaftliche Analyse', 'speaking_style': {'tone': 'analytisch und sachlich, gelegentlich optimistisch', 'language_complexity': 'mittlere Komplexität mit sozialwissenschaftlichen Fachbegriffen, gelegentliche Verwendung von Analogien', 'communication_style': 'kollaborativ und fragend, bevorzugt aktives Zuhören', 'sentence_structure': 'mittellange Sätze mit klarer Struktur, gelegentliche Verwendung von Fragen', 'formality': 'semi-formal bis formal', 'other_traits': 'verwendet Pausen zur Reflexion, neigt dazu, Statistiken und Daten zu zitieren'}, 'personalized_vocabulary': {'filler_words': ['Ähm', 'Also', 'Nun'], 'catchphrases': ['Das ist eine interessante Perspektive.', 'Soziale Dynamiken sind entscheidend.', 'Man muss die Gemeinschaft verstehen.'], 'speech_patterns': ['beginnt oft mit einer Beobachtung oder einem Faktum; stellt Verbindungen zwischen sozialen Theorien her'], 'emotional_expressions': ['Lachen', 'Seufzen', 'Interessant!']}, 'social_roles': ['Coordinator', 'Group Observer'], 'social_roles_descr': ['Connects the different ideas and suggestions of the group to ensure that all relevant aspects are integrated.', 'Monitors the dynamics of the group and provides feedback on how the group is functioning as a whole and what improvements can be made.']}, {'role': 'Medienexperte', 'description': 'Ein Fachmann für die Rolle und den Einfluss von sozialen Medien auf Kunst und Kultur.', 'expertise_area': 'Medienwissenschaften', 'perspective': 'Digitale Verbreitung und Einfluss', 'speaking_style': {'tone': 'informativ und leidenschaftlich, gelegentlich humorvoll', 'language_complexity': 'mittlere bis komplexe Sprache mit Fachbegriffen aus der Medienwelt, häufige Verwendung von Analogien und Beispielen', 'communication_style': 'kollaborativ und diskussionsfreudig, stellt oft rhetorische Fragen', 'sentence_structure': 'lange und gut strukturierte Sätze mit Nebensätzen, gelegentliche Verwendung von Ausrufezeichen oder Fragen', 'formality': 'semi-formal bis formal', 'other_traits': 'verwendet Pausen zur Betonung, neigt dazu, Statistiken und Fallstudien zu zitieren'}, 'personalized_vocabulary': {'filler_words': ['Ähm', 'Also', 'Nun ja'], 'catchphrases': ['Das ist wirklich spannend!', 'Medien sind die Brücke zur Welt.', 'Man muss das im digitalen Kontext sehen.'], 'speech_patterns': ['beginnt oft mit einer aktuellen Nachricht oder einem Trend; stellt Verbindungen zwischen verschiedenen Medienplattformen her'], 'emotional_expressions': ['Lachen', 'Seufzen', 'Wow!']}, 'social_roles': ['Information Seeker', 'Encourager'], 'social_roles_descr': ['Asks questions to gain clarity and obtain information from others.', 'Provides positive feedback and praise to boost the morale and motivation of group members.']}, {'role': 'Kulturkritiker', 'description': 'Ein Experte, der sich mit der kritischen Analyse von Kunst und ihrer Rolle in der Gesellschaft beschäftigt.', 'expertise_area': 'Kulturwissenschaften', 'perspective': 'Kritische Reflexion', 'speaking_style': {'tone': 'kritisch und nachdenklich, gelegentlich ironisch', 'language_complexity': 'komplexe Sprache mit kritischen Fachbegriffen, häufige Verwendung von Metaphern und philosophischen Analogien', 'communication_style': 'analytisch und diskussionsfreudig, stellt oft provokative Fragen', 'sentence_structure': 'lange und komplexe Sätze mit mehreren Nebensätzen, gelegentliche Verwendung von rhetorischen Fragen', 'formality': 'formal bis semi-formal', 'other_traits': 'verwendet Pausen zur Betonung, neigt dazu, historische Bezüge herzustellen'}, 'personalized_vocabulary': {'filler_words': ['Ähm', 'Also', 'Ehrlich gesagt'], 'catchphrases': ['Das ist eine tiefgründige Analyse!', 'Kunst spiegelt die Gesellschaft wider.', 'Man muss das kritisch betrachten.'], 'speech_patterns': ['beginnt oft mit einer kritischen Beobachtung oder einem Zitat', 'stellt Verbindungen zwischen Kunst und gesellschaftlichen Trends her'], 'emotional_expressions': ['Lachen', 'Seufzen', 'Interessant!']}, 'social_roles': ['Evaluator-Critic', 'Aggressor'], 'social_roles_descr': ['Analyzes and critically evaluates proposals or solutions to ensure their quality and feasibility.', 'Exhibits hostile behavior, criticizes others, or attempts to undermine the contributions of others.']}, {'role': 'Stadtplaner', 'description': 'Ein Fachmann, der sich mit der Gestaltung und Entwicklung urbaner Räume beschäftigt.', 'expertise_area': 'Stadtplanung', 'perspective': 'Raumgestaltung und öffentliche Nutzung', 'speaking_style': {'tone': 'pragmatisch und lösungsorientiert, gelegentlich optimistisch', 'language_complexity': 'mittlere Komplexität mit stadtplanerischen Fachbegriffen, gelegentliche Verwendung von Analogien', 'communication_style': 'direkt und kooperativ, bevorzugt klare Anweisungen', 'sentence_structure': 'kurze bis mittellange Sätze mit klarer Struktur, häufige Verwendung von Fragen zur Klärung', 'formality': 'semi-formal bis formal', 'other_traits': 'verwendet Pausen zur Betonung, neigt dazu, visuelle Darstellungen zu nutzen'}, 'personalized_vocabulary': {'filler_words': ['Ähm', 'Also', 'Genau'], 'catchphrases': ['Das ist eine praktische Lösung!', 'Stadtplanung ist der Schlüssel zur Zukunft.', 'Man muss die Infrastruktur berücksichtigen.'], 'speech_patterns': ['beginnt oft mit einer praktischen Beobachtung oder einem Vorschlag', 'stellt Verbindungen zwischen urbanen Trends und Planungsstrategien her'], 'emotional_expressions': ['Lachen', 'Seufzen', 'Interessant!']}, 'social_roles': ['Implementer', 'Compromiser'], 'social_roles_descr': ['Puts plans and decisions of the group into action and ensures practical implementation.', 'Helps the group find a middle ground when there are differences of opinion and encourages compromise in order to move forward.']}]","Die Sitzung konzentrierte sich auf die Entwicklung und Bedeutung der Streetart als Kunstform im öffentlichen Raum. Es wurde festgestellt, dass Streetart seit 2005 verschiedene Techniken und Materialien umfasst und ihren Ursprung in den Graffiti- und Punkszenen hat. Die Teilnehmer erörterten die historische Entwicklung, beginnend mit einem großen Wandgemälde in Hamburg 1968, das als Vorläufer der Bewegung gilt. Ein weiterer Schwerpunkt lag auf der künstlerischen Spezifik, wobei betont wurde, dass Streetart oft illegal angebracht wird und Künstler anonym bleiben möchten. Die Diskussion um die Kommerzialisierung von Streetart zeigte eine kritische Haltung gegenüber der Vereinnahmung durch Unternehmen wie Nike und Sony. Es wurde hervorgehoben, dass diese Form der Werbung häufig als Widerspruch zur antikapitalistischen Natur von Streetart gesehen wird. Zudem wurde die Rolle sozialer Medien bei der Verbreitung von Streetart thematisiert, wobei Plattformen wie Facebook eine zentrale Rolle spielen. Abschließend wurden aktuelle Ausstellungen in Deutschland sowie bedeutende Dokumentarfilme über Streetart vorgestellt. Es wurde vereinbart, die weitere Beobachtung der Kommerzialisierung und ihre Auswirkungen auf die Szene zu verfolgen.","[""Scene 1: Warm Welcome\nTLDR: Brief greeting among participants to set a collaborative tone.\n- Exchange of casual greetings and light banter\n- Quick recap of the meeting objectives and expected outcomes\n- Encouragement for open-mindedness and creativity"", ""Scene 2: Historical Context of Street Art\nTLDR: Discuss the origins and evolution of street art.\n- Kunsthistoriker shares insights on historical milestones like Hamburg 1968\n- Street Artist adds personal anecdotes about early influences in graffiti and punk scenes\n- Open floor for spontaneous contributions on historical perspectives"", ""Scene 3: Techniques and Materials in Street Art\nTLDR: Explore various techniques used in street art since 2005.\n- Discussion on different materials and methods employed by artists\n- Participants share personal experiences with specific techniques\n- Opportunity for disagreement and resolution regarding artistic practices"", ""Scene 4: The Anonymity of Artists\nTLDR: Delve into why many street artists prefer to remain anonymous.\n- Street Artist explains the allure of anonymity in urban art spaces\n- Kulturkritiker offers critical reflection on societal implications of anonymity\n- Spontaneous discussion on personal experiences related to artist identity"", ""Scene 5: Commercialization Concerns\nTLDR: Examine the impact of commercialization by companies like Nike and Sony.\n- Kulturkritiker critiques corporate involvement in street art as contradictory to its nature\n- Sozialwissenschaftler presents data on social impacts of commercialization\n- Open debate with differing opinions encouraged"", ""Scene 6: Social Media's Role in Street Art Spread \nTLDR: Analyze how platforms like Facebook influence street art dissemination.\n- Medienexperte discusses digital trends affecting urban art visibility \n- Stadtplaner considers implications for public space planning \n- Participants share stories about social media interactions with their work"", ""Scene 7: Current Exhibitions & Documentaries \nTLDR: Highlight recent exhibitions in Germany and notable documentaries. \n- Kunsthistoriker introduces key exhibitions showcasing street art \n- Medienexperte recommends documentaries that capture the essence of urban art \n - Brief off-topic moments allowed for sharing favorite films or exhibits"", ""Scene 8: Future Observations & Closing Remarks \n TLDR : Conclude with thoughts on future commercialization impacts. \n - Agreement to monitor ongoing changes within the scene \\ n - Final reflections from each participant, encouraging continued collaboration""]",">>Kunsthistoriker: Hallo zusammen! Ich freue mich, dass wir heute hier sind, um über die faszinierende Welt der Street Art zu sprechen. Also, ich denke, es ist wichtig, dass wir offen und kreativ an das Thema herangehen. Kunst ist schließlich die Seele der Gesellschaft!

>>Street Artist: Ja, genau! Street Art bringt Farbe ins Stadtbild und eröffnet neue Möglichkeiten. Es ist eine spannende Form des Ausdrucks.

>>Sozialwissenschaftler: Spannend zu sehen, wie Street Art nicht nur die Stadt belebt, sondern auch soziale Dynamiken beeinflusst. Zum Beispiel gibt es Projekte in Berlin, die Nachbarschaften zusammenbringen.

>>Medienexperte: Das stimmt! Und durch Plattformen wie Instagram können diese Diskussionen global geführt werden. Das zeigt doch den Einfluss von Technologie auf Kunst.

>>Kulturkritiker: Interessant! Während wir über die Rolle von Street Art sprechen, sollten wir auch kritisch reflektieren, wie diese Kunstform oft kommerziell genutzt wird. Ehrlich gesagt stellt sich da die Frage: Inwieweit beeinflusst dies ihre Authentizität?

>>Stadtplaner: Genau das brauchen wir in unseren Städten – lebendige Räume und Gemeinschaften. Aber was du sagst über Kommerzialisierung ist wichtig; es kann sowohl positive als auch negative Auswirkungen haben.

>>Street Artist: Na ja, ich finde es klasse, dass wir hier zusammenkommen. Es ist ja nicht nur Kunst; es ist eine Möglichkeit für uns Künstlerinnen und Künstler, unsere Stimme zu erheben.

>>Sozialwissenschaftler: Absolut! Und diese Stimme kann Diskussionen anregen und Menschen verbinden – ein echtes soziales Phänomen.

>>Medienexperte: Das ist interessant, was du sagst über soziale Interaktion. Die globale Reichweite durch soziale Medien verstärkt diesen Effekt noch weiter.

>>Kulturkritiker: Ja genau! Aber man darf nicht vergessen – ursprünglich war Street Art ein Ausdruck des Widerstands gegen Konsumismus und Kapitalismus.

>>Kunsthistoriker: Wie der Kulturkritiker erwähnt hat – diese Entwicklung spiegelt sich auch historisch wider in früheren Bewegungen und gesellschaftlichen Trends. 
 >>Street Artist: Also, wenn wir über die Ursprünge von Street Art sprechen, muss man einfach die Graffiti- und Punk-Szene erwähnen. Das war der Hammer! Ich erinnere mich noch an die ersten Tags in den 80ern – das war pure Freiheit. Man hat einfach gemacht, was einem in den Sinn kam!

>>Sozialwissenschaftler: Interessant! Wie haben sich die gesellschaftlichen Bewegungen der 60er und 70er Jahre auf die Entwicklung von Street Art ausgewirkt? Diese Zeit war geprägt von Protesten und einem starken Wunsch nach Veränderung, was sicherlich auch Einfluss auf die Kunst hatte.

>>Kunsthistoriker: Ja, genau! Und wenn wir über diese Zeit sprechen, sollten wir auch Künstler wie Keith Haring erwähnen, der mit seinen Arbeiten eine Brücke zwischen Popkultur und sozialem Aktivismus geschlagen hat. Seine Werke sind ein hervorragendes Beispiel dafür, wie Kunst als Ausdruck des Widerstands genutzt wurde.

>>Medienexperte: Seit dem Aufkommen des Web 2.0 hat sich die Verbreitung und Wahrnehmung von Street Art drastisch verändert. Künstler können ihre Werke nun weltweit teilen und eine viel größere Reichweite erzielen. Was denkt ihr darüber?

>>Kulturkritiker: Ehrlich gesagt, sollten wir auch die kritische Reflexion der gesellschaftlichen Einflüsse nicht vergessen. Die Bewegung war oft ein Spiegelbild der sozialen Spannungen und des Widerstands gegen etablierte Normen.

>>Stadtplaner: Absolut! In vielen Städten wurden durch Street Art ganze Viertel revitalisiert. Projekte wie das Wynwood Walls in Miami zeigen, wie Kunst zur Belebung urbaner Räume beitragen kann.

>>Street Artist: Na ja, ich erinnere mich an die ersten illegalen Murals – das war pure Rebellion und hat den urbanen Raum komplett neu definiert! Es ging darum, sichtbar zu werden und gehört zu werden.

>>Sozialwissenschaftler: Genau! Diese Kunstform hat nicht nur visuell verändert, sondern auch neue Kommunikationswege eröffnet. Sie spiegelt oft soziale Themen wider und beeinflusst damit den urbanen Raum direkt.

>>Kunsthistoriker: Die frühen Graffiti-Bewegungen waren oft eine Reaktion auf soziale Spannungen. Diese Kunstform war ein Ausdruck des Widerstands und der Selbstbestimmung – aber es gibt so viele Facetten davon!

>>Medienexperte: Früher war es schwer, internationale Anerkennung zu erlangen; heute kann ein Werk in Berlin innerhalb von Sekunden in New York gesehen werden. Das ist wirklich beeindruckend!

>>Street Artist: Und dadurch haben sich ganz neue Möglichkeiten für Kollaborationen ergeben – Künstler aus verschiedenen Teilen der Welt können jetzt zusammenarbeiten!

>>Kulturkritiker: Interessant! Aber wir müssen auch über die kommerzielle Vereinnahmung durch große Konzerne sprechen – das ist ein Verrat an den ursprünglichen Idealen dieser Bewegung. 
 >>Street Artist: Ich liebe es einfach, wie man mit Dosen sprühen kann! Da steckt so viel Energie drin. Aber was denkt ihr über die Kombination von traditionellen Maltechniken und modernen Materialien? Ich habe neulich ein Projekt gemacht, wo wir alte Freskotechniken mit Sprühdosen kombiniert haben – das war echt der Wahnsinn!

>>Kunsthistoriker: Das klingt spannend! Wenn ich an die Wandmalereien in Pompeji denke, da gibt es eine Technik namens Enkaustik, bei der Farben mit heißem Wachs aufgetragen werden. Diese Methode könnte heute neu interpretiert werden, um moderne Kunstwerke zu schaffen. Es zeigt, wie sich historische Techniken weiterentwickeln können.

>>Sozialwissenschaftler: Interessant! Was du gesagt hast, Street Artist, erinnert mich daran, wie solche Projekte Gemeinschaften zusammenbringen können. In einem Stadtteil hier wurde ein Mural geschaffen, das lokale Geschichten erzählt und die Menschen wirklich miteinander verbunden hat.

>>Medienexperte: Ja genau! Und wenn wir über digitale Plattformen sprechen – Künstler können ihre Werke weltweit teilen und direktes Feedback erhalten. Das verändert nicht nur die Reichweite sondern auch die Interaktion zwischen Künstlern und Publikum. Wie siehst du das in deinem Projekt?

>>Street Artist: Absolut! Die Reaktionen online waren überwältigend und haben uns geholfen, neue Ideen zu entwickeln. Es ist faszinierend zu sehen, wie digitaler Austausch die Kreativität beflügeln kann.

>>Kulturkritiker: Spannend! Moderne Materialien reflektieren oft gesellschaftliche Themen kritisch. Ein Beispiel wäre ein Projekt in Berlin, wo recycelte Materialien verwendet wurden – das hat nicht nur ästhetisch beeindruckt sondern auch eine starke Botschaft vermittelt.

>>Stadtplaner: Genau! Solche Projekte beeinflussen auch den urbanen Raum stark. In einem Viertel hier wurde durch ein großes Mural der öffentliche Raum neu belebt und hat das Gefühl der Gemeinschaft gestärkt.

>>Kunsthistoriker: Das zeigt doch wunderbar, wie sich Geschichte und Moderne verbinden lassen. Durch solche Initiativen wird Kunst lebendig gehalten und gleichzeitig weiterentwickelt. 
 >>Street Artist: Also, die Anonymität ist für viele von uns wie ein Schutzschild. Es geht darum, frei zu sein und sich nicht ständig rechtfertigen zu müssen. Man kann einfach machen, was man will, ohne dass jemand einem auf die Finger schaut.

>>Kulturkritiker: Interessant! Ehrlich gesagt könnte man die Anonymität der Künstler auch als eine Art Spiegel der Gesellschaft betrachten. Sie zeigt uns, wie sehr wir in einer Welt leben, in der Identität und Kontrolle oft überbewertet werden.

>>Sozialwissenschaftler: Genau, und diese Perspektive zeigt den Widerstand gegen Kontrolle und Überwachung. Man muss die Gemeinschaft verstehen, um zu erkennen, wie diese Freiheit durch Anonymität ermöglicht wird.

>>Kunsthistoriker: Absolut! Wenn man die Anonymität der Street Artists im historischen Kontext betrachtet, sieht man...

>>Medienexperte (unterbricht lachend): Entschuldigung, aber hat jemand einen Stift? Ich wollte mir das gerade notieren.

>>Street Artist: Das ist wirklich interessant! Na ja, Anonymität gibt uns die Freiheit, unsere Kunst ohne Einschränkungen zu gestalten. Es ist wie ein Spiel mit der Gesellschaft – man kann sich ausdrücken und gleichzeitig die Kontrolle umgehen.

>>Medienexperte: Das stimmt! Wenn man bedenkt, wie digitale Plattformen den anonymen Austausch fördern... 
 >>Kulturkritiker: Ich finde es widersprüchlich, dass große Firmen wie Nike und Sony Street Art kommerzialisieren. Ursprünglich war Street Art doch ein Ausdruck des Widerstands gegen Kapitalismus und Konsumgesellschaft. Das sollten wir kritisch betrachten.

>>Street Artist: Na ja, ich sehe die Kommerzialisierung als echte Herausforderung. Street Art steht für Freiheit, und wenn große Firmen das vereinnahmen, geht ein Stück dieser Freiheit verloren. Aber vielleicht kann man es auch als Chance sehen, mehr Sichtbarkeit zu bekommen.

>>Sozialwissenschaftler: Wie der Medienexperte schon sagte, die digitale Verbreitung hat eine globale Bühne geschaffen. Ich habe selbst gesehen, wie diese Kommerzialisierung Künstlern neue Chancen eröffnet hat – sie können ihre Werke einem breiteren Publikum präsentieren.

>>Medienexperte: Genau! Die digitalen Medien haben Street Art weltweit sichtbar gemacht. Aber wir müssen uns fragen, wie das die Authentizität beeinflusst.

>>Kunsthistoriker: Das ist wirklich faszinierend! Wenn wir über Kommerzialisierung sprechen, sollten wir auch die historische Entwicklung der Kunst im öffentlichen Raum berücksichtigen. Schon in der industriellen Revolution wurde Werbung an Hausfassaden angebracht – aber kann Street Art ihre ursprüngliche Botschaft bewahren?

>>Street Artist: Also ehrlich gesagt sehe ich das so: Street Art ist wie ein freier Raum in der Stadt – wir müssen darauf achten, dass wir ihn nicht verlieren.

>>Sozialwissenschaftler: Interessant! Laut einer Umfrage fühlen sich viele Menschen durch die kommerzielle Nutzung stärker mit ihrer urbanen Umgebung verbunden. Es scheint also auch eine Brücke zwischen verschiedenen sozialen Gruppen schlagen zu können.

>>Kulturkritiker: Ja genau! Aber könnte die Kommerzialisierung vielleicht auch neue Formen des Widerstands inspirieren? Das wäre spannend zu beobachten.

>>Medienexperte: Nun ja... digitale Plattformen haben es Künstlern ermöglicht global zu verbreiten – aber wie beeinflusst das Authentizität?

>>Street Artist: Na ja... es geht darum Balance zu finden zwischen Kommerzialisierung und Authentizität!

>>Kulturkritiker: Zusammenfassend sollten wir die Balance zwischen Sichtbarkeit und Authentizität weiter erforschen. 
 >>Medienexperte: Also, wenn wir über die digitale Verbreitung von Street Art sprechen, müssen wir bedenken, wie Plattformen wie Facebook nicht nur die Sichtbarkeit erhöhen, sondern auch eine neue Form der Interaktion zwischen Künstlern und Publikum schaffen. Das ist wirklich spannend! Man kann sagen, dass Medien die Brücke zur Welt sind und Street Art dadurch eine globale Bühne erhält.

>>Stadtplaner: Entschuldigung, darf ich kurz einhaken? Ich finde es interessant, aber wie können wir sicherstellen, dass diese Kunstform weiterhin zugänglich bleibt und gleichzeitig den urbanen Raum bereichert? Vielleicht könnten lokale Initiativen helfen?

>>Kunsthistoriker: Ja, das ist ein guter Punkt. Die historische Entwicklung von Street Art zeigt uns ja schon einiges. Früher waren Graffiti-Magazine wichtig für den Austausch. Heute bieten soziale Medien ähnliche Möglichkeiten. Aber ich frage mich auch, ob diese digitale Sichtbarkeit vielleicht den rebellischen Geist der Kunst verändert.

>>Street Artist: Absolut! Soziale Medien sind wie ein riesiges Megafon für uns Künstler. Man kann seine Werke zeigen und direktes Feedback bekommen – das ist der Hammer! Aber manchmal habe ich Bedenken wegen des kommerziellen Aspekts. Was denkt ihr dazu?

>>Sozialwissenschaftler: Interessant! Ich stimme zu und frage mich auch, wie soziale Medien die soziale Dynamik von Street Art beeinflussen könnten. Könnte es sein, dass durch diese digitale Sichtbarkeit lokale Interaktionen verändert werden oder sogar neue Formen der Zusammenarbeit entstehen? Hat jemand Beispiele dafür gesehen?

>>Kulturkritiker: Ehrlich gesagt müssen wir kritisch hinterfragen, ob diese Plattformen nicht nur Sichtbarkeit bieten. Die digitale Welt kann den rebellischen Geist der Street Art verwässern und sie in eine kommerzielle Richtung drängen.

>>Medienexperte: Nun ja, das stimmt teilweise. Aber man könnte auch argumentieren, dass durch soziale Medien mehr Menschen Zugang zu dieser Kunstform haben und sie dadurch an Bedeutung gewinnt. Vielleicht sollten wir überlegen, wie man diesen Zugang positiv nutzen kann.

>>Stadtplaner: Genau! Es geht darum herauszufinden, wie wir diesen Zugang nutzen können ohne den Charakter der Kunst zu verlieren. Vielleicht durch gezielte Projekte in städtischen Räumen?

>>Street Artist: Also ehrlich gesagt finde ich es spannend zu sehen wie meine Arbeiten weltweit geteilt werden können. Aber manchmal habe ich Bedenken wegen des kommerziellen Aspekts – wird dadurch etwas vom ursprünglichen Geist verloren? Was meint ihr dazu?

>>Sozialwissenschaftler: Ähm... Ich denke tatsächlich darüber nach... Vielleicht schafft es neue Verbindungen zwischen Künstlern und Stadtbewohnern? Das wäre doch interessant!

>>Kunsthistoriker: Absolut faszinierend! Wenn man bedenkt welche Rolle Graffiti-Magazine früher hatten... Soziale Medien sind quasi deren moderne Version – sie ermöglichen Austausch von Ideen und Techniken auf globaler Ebene! 
 >>Medienexperte: Also, wenn wir über Dokumentarfilme sprechen, die den urbanen Geist einfangen, dann ist 'Exit Through the Gift Shop' von Banksy wirklich spannend! Er zeigt nicht nur die Kunst selbst, sondern auch die Dynamiken und Persönlichkeiten dahinter. Man muss das im digitalen Kontext sehen – wie diese Filme durch Streaming-Dienste eine neue Reichweite bekommen haben!

>>Street Artist: Ja, 'Exit Through the Gift Shop' ist echt der Hammer! Aber wenn wir über Ausstellungen sprechen, dann darf man die UrbanArt Biennale in Völklingen nicht vergessen. Da sieht man, wie Street Art im großen Stil präsentiert wird – das ist Freiheit pur!

>>Kunsthistoriker: Absolut! Die Biennale bietet eine tolle Chance, die Vielfalt der urbanen Kunst zu sehen. Ich war letztes Jahr dort und es hat mich wirklich beeindruckt. Es zeigt auch, wie sich Street Art historisch entwickelt hat.

>>Sozialwissenschaftler: Das klingt spannend! Und solche Filme und Ausstellungen helfen Künstlern und bringen Leute zusammen. Sie fördern den Dialog innerhalb der Gemeinschaft und schaffen ein Bewusstsein für soziale Themen.

>>Kulturkritiker: Ehrlich gesagt, ich sehe das etwas kritisch. Die Ausstellung in Völklingen ist ein Paradebeispiel dafür, wie Street Art kommerziell vereinnahmt wird. Man muss aufpassen – oft geht es mehr um Marketing als um echte Kunst.

>>Stadtplaner (unterbricht): Entschuldigung, das bringt mich auf einen anderen wichtigen Punkt – wie können wir diese Events besser zugänglich machen? Vielleicht sollten wir darüber nachdenken...

>>Kunsthistoriker: Gute Frage! Wenn wir über die Biennale sprechen sollten wir auch überlegen, wie solche Veranstaltungen für alle zugänglich gemacht werden können. Sie sind nicht nur Plattformen für aktuelle Künstler sondern auch ein Spiegel der Entwicklung von Street Art als Kunstform.

>>Street Artist: Na ja klar! Die Biennale ist schon ein Highlight aber man darf nicht vergessen dass Street Art auch außerhalb solcher Events lebt. Die kleinen spontanen Werke in der Stadt sind oft die wahren Schätze – das ist Freiheit pur!

>>Sozialwissenschaftler: Interessant! Wenn wir über gesellschaftliche Auswirkungen sprechen sollten wir bedenken wie solche Ausstellungen und Dokumentarfilme den Zugang zu Street Art für verschiedene soziale Gruppen beeinflussen können. Sie dienen sowohl als Brücke zur Kunst als auch zur sozialen Diskussion. 
 >>Stadtplaner: Also, wir sollten wirklich darauf achten, wie diese Kunstwerke den urbanen Raum bereichern und für alle zugänglich bleiben. Das ist wichtig für die Umsetzung!

>>Kunsthistoriker: Das erinnert mich an die Pop-Art der 60er Jahre – sie wurde stark kommerzialisiert und hat dennoch ihren rebellischen Geist bewahrt. Man muss das im historischen Kontext sehen. Die Kommerzialisierung von Street Art könnte ähnliche Wege gehen.

>>Street Artist: Na ja, die Kommerzialisierung ist echt ein zweischneidiges Schwert. Einerseits bringt sie mehr Sichtbarkeit und Möglichkeiten für Künstler, andererseits kann sie den rebellischen Geist verwässern. Wir könnten zum Beispiel Workshops oder Community-Projekte organisieren, um den Spirit zu erhalten.

>>Sozialwissenschaftler: Interessant! Es wäre spannend zu sehen, wie sich die Balance zwischen Authentizität und kommerziellen Interessen entwickelt. Vielleicht können wir uns Beispiele aus anderen Städten anschauen, wie Berlin oder New York?

>>Medienexperte: Soziale Medien werden eine entscheidende Rolle spielen! Sie können helfen, den rebellischen Geist der Kunst zu bewahren und gleichzeitig neue kommerzielle Möglichkeiten schaffen. Man muss das im digitalen Kontext betrachten.

>>Kulturkritiker: Ehrlich gesagt sehe ich hier eine Gefahr der Verwässerung des ursprünglichen Geistes durch kommerzielle Interessen. Aber vielleicht kann sich Street Art anpassen und trotzdem gedeihen? Was denkt ihr über Projekte wie Banksy’s Dismaland?

>>Stadtplaner: Genau! Und dabei sollten wir auch die öffentliche Nutzung im Auge behalten – es ist wichtig, dass solche Kunstwerke für alle zugänglich sind und den urbanen Raum bereichern.

>>Kunsthistoriker: Wenn wir die Zukunft betrachten, müssen wir uns fragen: Wird der rebellische Geist durch kommerzielle Interessen verdrängt oder kann er sich anpassen? Wie bei der Pop-Art könnte er bestehen bleiben.

>>Street Artist: Street Art ist Freiheit! Wir müssen einfach weiter beobachten und sicherstellen, dass dieser Spirit nicht verloren geht. Vielleicht könnten lokale Initiativen helfen?

>>Sozialwissenschaftler: Das ist eine interessante Perspektive. Ich denke wirklich, dass wir die sozialen Dynamiken weiterhin beobachten sollten – um zu verstehen, wie sich die Kommerzialisierung auf Authentizität auswirkt. Ein Blick auf andere Bewegungen könnte hilfreich sein."
