Title,Article,Tags,Personas,Summary,Meeting_Plan,Meeting
Impressionismus,"Impressionismus (von lateinisch impressio ‚Eindruck‘; über das französische impressionnisme) ist eine Stilrichtung in der Kunstgeschichte, die durch die stimmungsvolle Darstellung von flüchtigen Momentaufnahmen einer Szenerie gekennzeichnet ist. Sie entstand aus einer Bewegung innerhalb der Malerei in Frankreich in der zweiten Hälfte des 19. Jahrhunderts. Der Begriff Impressionismus wurde auch auf bestimmte Stilrichtungen in der Musik, in der Literatur, im Film und in der Fotografie übertragen.


Begriff
Schon 1861 bezeichnete Théophile Gautier Daubignys Malweise, die er als zu flüchtig empfand, als „Impression“. Der Begriff Impressionismus bzw. französisch impressionnisme, abgeleitet von lateinisch impressio ‚Eindruck‘, etablierte sich als kunstwissenschaftlicher Begriff 1874, als ihn einige Rezensenten aufgriffen, um die Werke der jungen Künstler in der am 15. April 1874 eröffneten Ausstellung am Boulevard des Capucines 35 zu beschreiben. Der progressiv-radikale Journalist und Kunstkritiker Jules-Antoine Castagnary, der schon die Rolle seines Freundes Gustave Courbet in der Pariser Kommune verteidigt hatte, erörterte in seinem Aufsatz unter anderem die Frage, wie die Künstlergruppe zu nennen sei. Mit Verweis auf Monets Gemälde Impression – soleil levant (Impressions – Sonnenaufgang) kommentierte er: „Wollte man sie mit einem erläuternden Wort charakterisieren, müsste man den neuen Begriff Impressionisten schaffen. Sie sind Impressionisten in dem Sinn, dass sie nicht eine Landschaft wiedergeben, sondern den von ihr hervorgerufenen Eindruck.“
In der kunsthistorischen Literatur wird oftmals der Kunstkritiker Louis Leroy als Schöpfer des Begriffs Impressionismus genannt. Dieser veröffentlichte am 25. April 1874 einen Artikel in der Satirezeitschrift Le Charivari und leitete aus Monets Gemälde die abschätzig gemeinte Bezeichnung ab. Wie Ian Dunlop jedoch anmerkt, ist der Begriff des Impressionismus bereits in den 1860er und 1870er Jahren gebräuchlich und vor Monet schon im Zusammenhang mit anderen Landschaftsmalern genutzt worden.  In der Folge verwendeten zahlreiche Künstler diese Bezeichnung, die bei den Vorbereitungen zur dritten Impressionisten-Ausstellung im Jahr 1877 auch offiziell Verwendung fand.


Sozialhistorischer Hintergrund
Vor allem der deutsche Impressionismus wurde von einigen Sozial- und Kunsthistorikern als Dekadenzphänomen interpretiert, so zuerst von Karl Lamprecht und Eckart von Sydow. Lamprecht zufolge lässt er sich als ästhetische Reaktion auf den Naturalismus verstehen, gegen dessen „wahrheitssuchenden Aktivismus“ und dessen allzu plakative Aussagen sich eine Abneigung des Genuss und Entspannung suchenden Bürgertums entwickelte, das nicht mehr den „Elan der Gründerzeit“ aufbrachte, sondern sich im Geschäft von seinen Prokuristen vertreten ließ und stattdessen gemütliches Behagen und Zerstreuung suchte. Damit einher ging die Wiederentdeckung der differenzierten Genusskulturen des Hellenismus und des Rokoko sowie der burgundisch-flämischen Kultur, die die „Sehnsucht nach schönerem Leben“ verkörperte.


Impressionismus in der Malerei

Das Gemälde Impression — soleil levant (1872) von Claude Monet gab der Bewegung ihren Namen. Sie zeichnete sich jedoch weitaus früher ab. Bereits die Arbeiten Édouard Manets aus den 1860er Jahren zeigen grundlegende Elemente des beginnenden Bruchs mit der akademischen Lehrmeinung – etwa Musik in den Tuilerien. Die erste Gruppenausstellung der Impressionisten fand 1874 im Atelier des Pariser Fotografen Nadar statt.
Die Darstellung des Lichts und der atmosphärischen Bedingungen wurde im Impressionismus zur malerischen Hauptaufgabe. Farbe wurde als Folge von Licht und Atmosphäre gesehen und als Träger des Lichts wiedergegeben. Der teilweise Verzicht auf Schwarz und erdige Farbtöne ließ die Farbpalette aufhellen.

Die Künstler lösten sich von der malerischen Abbildungsfunktion. Unmittelbarkeit der Momentaufnahme und Zufälligkeit des Bildausschnittes sind charakterisierende Merkmale impressionistischer Bilder. Durch die Fotografie angeregt wurde auch der Verzicht auf Vollständigkeit zugunsten der Erzeugung von Stimmungen. Dieses Ziel erreichten radikale Impressionisten wie Gustave Caillebotte (Die Parkettschleifer) durch Nutzung fotografischer Stilmittel wie z. B. von Moment- und Bewegungsaufnahmen, extremen Perspektiven und Verzerrungen, selektiven Ausschnitten und Unschärfen.

Neue Erkenntnisse ergaben sich durch die moderne Farbtheorie Chevreuls. Die industrielle Fertigung von Ölfarben in verschließbaren Bleituben (statt in Schweinsblasen), patentiert im Jahr 1841 durch den amerikanischen Maler John Goffe Rand, ermöglichte die Freiluftmalerei. Diese neue malerische Praxis, die mit einer neuen Welt- und Lebensanschauung zusammenhing, verbreitete sich um 1900 in ganz Europa. Von dort gelangte sie auch zum amerikanischen Kontinent (William Merritt Chase, Childe Hassam, Mary Cassatt) und bis nach Australien (Charles Conder).

Der deutsche Impressionismus stellt hingegen einen Sonderweg dar. Er entwickelt sich aus dem Realismus bzw. Naturalismus durch „allmähliche Verfeinerung derselben stilistischen Mittel, und zwar nach der Seite des Sensualistischen hin, wodurch alle ideellen Faktoren […] hinfällig werden“ und man sich stattdessen auf den Seheindruck beschränkt. So werde Max Liebermann durch die „Auflockerung seiner malerischen Technik und eine Vorliebe für lichtdurchrieselte Blätterdächer langsam zum Impressionisten […], ohne dabei seine naturalistischen Errungenschaften aufzugeben.“ Das wirke bei „unimpressionistischen“ Themen oft aufgesetzt. Anders als in Frankreich entstünden „Mischprodukte“, denen es an Strahlkraft fehle. Auch Lovis Corinth begann mit realistischen, bei religiösen Stoffen symbolistischen Gemälden; seine impressionistischen Arbeiten verweisen bereits auf den Expressionismus. Max Slevogt, der dritte bedeutende deutsche Impressionist, wurde zunächst von Manet und später – vor allem bei seiner Landschaftsmalerei – durch das Licht und die Farben während einer Ägyptenreise angeregt.
In der Künstlerkolonie Worpswede bei Bremen entwickelt sich Ende der 1880er Jahre aus der naturalistischen Landschafts- und Freilichtmalerei eine impressionistische Malerschule um Otto Modersohn, Fritz Overbeck und Heinrich Vogeler.
Viele Künstler aus nordischen Ländern hielten sich in den 1870er und 1880er Jahren in Frankreich auf. Auf
Basis dieser Erfahrung entstanden Künstlerkolonien, die durch Naturalismus und Impressionismus geprägt waren, so zum Beispiel die Skagener Künstlerkolonie an der jütländischen Nordspitze oder die Fleksumer Gruppe in Norwegen.
Unter den italienischen Impressionisten ragt Francesco Filippini (1853–1895) durch seine originelle Sicht- und Malweise heraus.


Impressionismus in der Musik

Während viele Naturalisten wie Heinrich Hart Musik als Ausdrucksmittel eines „wahrheitssuchenden Aktionismus“ ablehnten, galt den Impressionisten das „gegenstandslose Vorsichhinträumen“ zu fein abgestuften farbigen Akkorden oft als Genuss. So spricht man in der Musik vor und um die Wende zum 20. Jahrhundert ebenfalls vom Stil des Impressionismus, auf den bereits Wagners Oper Tristan und Isolde verwiesen hat.
Als Begründer gilt vor allem Claude Debussy (1862–1918), der sich gegen die Bezeichnung als Impressionist wehrte. Musik ist für ihn „Klang- und Farbkunst“. So entstehen in seinen Werken impressionistische Klangbilder, in denen die Atmosphäre und die Stimmung, basierend auf Klangfarben, musikalisch dargestellt werden.
Debussys melodische Motive entwickeln sich selten und werden nicht kontrapunktisch verarbeitet oder durchgeführt, wie das sonst meist der Fall war. Vielmehr tauchen sie für einen kurzen Augenblick auf, zeigen sich in schnell wechselnder Harmonik und werden direkt wieder abgelöst. Inspiriert wurde er dabei von der Naturwahrnehmung, aber auch von asiatischer Musik, die er auf der Weltausstellung 1889 in Paris kennengelernt hatte.
Ein wichtiger Zeitgenosse Debussys war Maurice Ravel (1875–1937), dessen impressionistische Instrumentationsstudie für großes Orchester, Boléro, besonders beliebt ist. Durch Künstler wie Cyril Scott (1879–1970) oder John Ireland (1879–1962) wurde auch der englische Impressionismus geprägt und weiterentwickelt.


Impressionismus in der Literatur

Der Begriff Impressionismus wird in der deutschen Literaturwissenschaft als literarhistorischer Ordnungsbegriff verwendet, allerdings ohne durchgehenden fachwissenschaftlichen Konsens, da er oft als zu „unpräzise“ empfunden wird. Die impressionistische Literatur ist in Zusammenhang mit der Abkehr vom Naturalismus zu sehen. Einige ihrer Werke werden auch der folgenden Epoche des Symbolismus zugerechnet und umgekehrt.
Anders als im Naturalismus erscheint die Realität in der impressionistischen Literatur immer durch den Filter der subjektiven Wahrnehmung gebrochen. Sie versucht nicht, objektive Realitäten zu beschreiben, sondern vergängliche Stimmungen festzuhalten und emotionale „Landschaften“, das verwirrende Großstadtleben oder auch Personen mit ihren Zweifeln und Ambiguitäten zu beschreiben, was an die Stelle chronologischen Erzählens oder breiter Charaktergemälde und Naturschilderungen tritt. Eine wichtige Technik ist der innere Monolog. Beispiele impressionistischer Literatur sind Joseph Conrads Roman „Herz der Finsternis“ (1899), Arthur Schnitzlers Novelle „Lieutenant Gustl“ (1900), Herman Bangs Personencharakteristiken oder die sensualistischen Gedichte von Detlev von Liliencron. Auch das Werk von Marcel Proust und Henry James wird oft dem Impressionismus zugeordnet.


Impressionismus in der Fotografie

Ende des 19. Jahrhunderts erkämpften sich eine Reihe von Fotografen einen Kunstanspruch, indem sie die ihre Umwelt mit ihren Mitteln in Szene setzten. Die Piktorialisten setzten, inspiriert durch Vordenker wie Antoine Claudet und Peter Henry Emerson, systematisch die Unschärfe als Stilmittel ein. Robert Demachy setzte mit seinen Gummi-Bichromatdrucken Ballettaufnahmen in Szene, die in Stil und Stimmung große Ähnlichkeit mit Gemälden von Edgar Degas aufwiesen. Neben Demachys Bildern besitzen unter anderen Werke der Piktorialisten Heinrich Kühn, Alfred Stieglitz, Gertrude Käsebier, Edward Steichen, Adolphe de Meyer, Mary Devens und Alvin Langdon Coburn eine impressionistische Anmutung.
Umgekehrt wirkte die Fotografie befruchtend auf die Malerei des Impressionismus zurück. Zufällig wirkende Kompositionen mit angeschnittenen Menschen, Wagen und Tieren hielten ihren Einzug. Demachy hatte die Ballettszenen von Degas nachempfunden. Degas seinerseits setzte die Schnappschuss-Wirkung, die absichtsvolle Zufälligkeit von Bildausschnitt und Komposition, als Stilmittel in seinen Gemälden ein. Gustave Caillebotte, der 1876 zum ersten Mal seine Gemälde bei der zweiten Impressionisten-Ausstellung zeigte, warfen seine Kritiker vor, die Wirklichkeit „fotografisch“, also zu realistisch wiederzugeben. Er nahm Techniken und Themen vorweg, die sich erst in den 1920er-Jahren als „Neues Sehen“ in der Fotografie etablierten. Fotografen wie André Kertész, Wols und László Moholy-Nagy weisen eine besondere Nähe zu Caillebottes Werk auf. Ihre Bilder greifen zum Teil dieselben Motive auf oder zeigen einen Ausschnitt aus der gleichen Perspektive. So gibt es zum Beispiel Aufnahmen von Straßen und Plätzen in einer steilen Draufsicht, wie sie schon auf den Gemälden Caillebottes zu finden sind.
Allgemein spricht man heute von impressionistischer Fotografie, wenn zur Erzielung optischer Effekte und Stimmungen bestimmte Techniken verwendet werden wie die bewusste Bewegung der Kamera während einer Langzeitbelichtung, z. B. bei Verfolgung eines bewegten Objekts. Auch durch eine weit geöffnete Blende, durch die nur eine Ebene des Bildes scharf gezeichnet wird und z. B. Zweige im Vordergrund oder der gesamte Hintergrund unscharf erscheinen, oder auch durch die Wahl spezifische Filter können impressionistische Effekte erzielt werden.


Impressionismus im Film

Der Film beeinflusste schon früh die impressionistische Malerei, die immer mehr die Perspektive der Fotografie einnahm und zufällige Bewegung oder Vorübergehendes wie z. B. wechselnde Beleuchtung einzufangen suchte.
Der impressionistische Film im engeren Sinne ist ein ästhetisches Konzept in der Filmkunst, das vor allem mit französischen Filmen der 1920er-Jahre in Verbindung gebracht wird. Die Erzählweise war oft nicht-linear und assoziativ (wie schon in Charles Sheelers und Paul Strands experimentellem Kurzfilm Manhatta von 1921). Zu den Stilmitteln gehörten schnelle Schnitte und Einstellungswechsel, Doppelbelichtung, Weichzeichner und eine bewusste Unschärfe des Materials. Regisseure wie Germaine Dulac, Louis Delluc, Jean Epstein, Abel Gance, Marcel L’Herbier und Dimitri Kirsanoff bezogen sich in diesen Werken auf die impressionistische Malerei des 19. Jahrhunderts und auf die Musik des Impressionismus. Zu den impressionistischen Regisseuren zählte auch der in Europa tätige Brasilianer Alberto Cavalcanti. Der Begriff wurde durch Filmhistoriker wie Henri Langlois und Georges Sadoul etabliert.


Literatur
Iris Schaefer, Caroline von Saint-George, Katja Lewerentz: Impressionismus – Wie das Licht auf die Leinwand kam. Katalog anlässlich der gleichnamigen Ausstellung im Wallraf-Richartz-Museum & Fondation Corboud Köln, Milano 2008, ISBN 978-88-6130-611-0.
Wolf Arnold: Auf den Spuren des Impressionismus. Eine Reise durch Frankreich. Fischer, Frankfurt/M. 2008, ISBN 978-3-8301-1168-9.
Nathalia Brodskaya: Impressionismus. Parkstone Books, New York 2007, ISBN 978-1-85995-652-6.
Norma Broude (Hrsg.): Impressionismus. Eine internationale Kunstbewegung, 1860–1920 („World impressionism“). Dumont, Köln 2005, ISBN 3-8321-7454-0.
Lukas Gloor, Dieter Pfister, Stefan Streiff: Impressionismus in der Schweiz – eine Kunstreise nach Basel, Baden, Zürich, Winterthur. Vernissage-Verlag, Heidelberg 2000
Jean Cassou: Les impressionnistes et leur époque, Essay, Paris 1953, deutsch Die Impressionisten und ihre Zeit, Berlin 1953, Stuttgart 1957.
Richard Hamann, Jost Hermand: Impressionismus. (=Epochen deutscher Kultur von 1870 bis zur Gegenwart. Band 3.) München, 2. Aufl. 1974.
John Rewald: Die Geschichte des Impressionismus. Schicksal und Werk der Maler einer großen Epoche der Kunst. Dumont, Köln 2006, ISBN 3-8321-7689-6.
Sue Roe: Das private Leben der Impressionisten („The private lives of the impressionists“). Edition Parthas, Berlin 2007, ISBN 978-3-86601-664-4.
Maurice Sérullaz (Hrsg.): Lexikon des Impressionismus. Mit einer Auflistung von Ausstellungen bzw. bedeutenden Retrospektiven, Glossar, Abbildungsverzeichnis, Namensregister und Fotonachweis („Encyclopédie de impressionisme“). Edition von Nottbeck, Köln 1977, ISBN 3-8046-0011-5.
Ingo F. Walther: Malerei des Impressionismus. 1860–1920. Taschen-Verlag, Köln 2006, ISBN 3-8228-5051-9.
Claire A. Willsdon: In den Gärten des Impressionismus („In the gardens of impressionism“). Belser, Stuttgart 2004, ISBN 3-7630-2432-8.


Dokumentation
1874: Geburtsstunde des Impressionismus. Regie: Hugues Nancy und Julien Johan, ARTE F, Frankreich, 96 Minuten, 2023


Hörbücher
Camille Monet und die Anderen – Die Modelle der Impressionisten, ISBN 3-936301-06-9, Eine Koproduktion mit der Kunsthalle Bremen.


Weblinks

Impressionismus: Webseite des Deutschen Historischen Museums. Archivlink abgerufen am 30. März 2025.
Online-Publikation zum Forschungsprojekt Maltechnik des Impressionismus und Postimpressionismus
Suche nach Impressionismus im Online-Katalog der Staatsbibliothek zu Berlin – Preußischer Kulturbesitz
Suche nach Impressionismus. In: Deutsche Digitale Bibliothek


Einzelnachweise","[""Impressionism"", ""Art History"", ""Claude Monet"", ""19th Century French Art"", ""Cultural Influence""]","[{'role': 'Art Historian', 'description': 'A scholar specializing in 19th-century French art movements, with a focus on Impressionism.', 'expertise_area': 'Art History', 'perspective': 'Historical Contextualization', 'speaking_style': {'tone': 'Enthusiastic and passionate, with a touch of nostalgia when discussing historical art movements.', 'language_complexity': 'Complex language with a preference for artistic jargon and vivid metaphors; often uses storytelling to illustrate points.', 'communication_style': 'Collaborative and inquisitive, frequently poses rhetorical questions to engage others in discussion.', 'sentence_structure': 'Long and complex sentences with subordinate clauses; frequent use of exclamations to emphasize excitement.', 'formality': 'Semi-formal, balancing scholarly precision with approachable enthusiasm.', 'other_traits': 'Uses pauses effectively to allow reflection; occasionally interrupts when particularly excited about a topic.'}, 'personalized_vocabulary': {'filler_words': ['Ähm', 'Also', 'Halt'], 'catchphrases': ['Das ist faszinierend!', 'Im Kontext der Kunstgeschichte betrachtet...', '...wie Monet es sah'], 'speech_patterns': [""Begins sentences with 'Interessant ist...', 'Man könnte sagen...'"", '...und das führt uns zu...'], 'emotional_expressions': ['Lachen', ""'Unglaublich!'"", ""'Wunderbar!'""]}, 'social_roles': ['Information Giver', 'Opinion Seeker'], 'social_roles_descr': ['Shares relevant information, data or research that the group needs to make informed decisions.', 'Encourages others to share their opinions and beliefs in order to understand different perspectives.']}, {'role': 'Cultural Analyst', 'description': 'An expert in analyzing the cultural impact and influence of art movements across different societies.', 'expertise_area': 'Cultural Studies', 'perspective': 'Cross-Cultural Influence', 'speaking_style': {'tone': 'Analytical and insightful, with a touch of optimism when discussing cultural impacts.', 'language_complexity': 'Moderately complex language with a preference for sociological terms and analogies; occasionally uses storytelling to highlight cultural narratives.', 'communication_style': 'Collaborative and reflective, often encourages dialogue by asking open-ended questions.', 'sentence_structure': 'Varied sentence lengths, often starting with context-setting phrases; uses questions to provoke thought.', 'formality': 'Semi-formal, maintaining professionalism while being approachable.', 'other_traits': 'Uses pauses effectively to emphasize key points; rarely interrupts but interjects thoughtfully.'}, 'personalized_vocabulary': {'filler_words': ['Na ja', 'Eigentlich', 'Tja'], 'catchphrases': ['Das ist bemerkenswert!', '...im kulturellen Kontext betrachtet', '...wie sich das widerspiegelt'], 'speech_patterns': ['Interessant zu sehen ist...', '...und das bringt uns zu der Frage...', '...was bedeutet das für...'], 'emotional_expressions': ['Seufzen', ""'Erstaunlich!'"", ""'Beeindruckend!'""]}, 'social_roles': ['Coordinator', 'Group Observer'], 'social_roles_descr': ['Connects the different ideas and suggestions of the group to ensure that all relevant aspects are integrated.', 'Monitors the dynamics of the group and provides feedback on how the group is functioning as a whole and what improvements can be made.']}, {'role': 'Art Critic', 'description': 'A professional critic who evaluates and interprets art movements, focusing on the aesthetic and philosophical aspects of Impressionism.', 'expertise_area': 'Art Criticism', 'perspective': 'Aesthetic Evaluation', 'speaking_style': {'tone': 'Formal and reserved, with a touch of seriousness when critiquing art; occasionally sarcastic when discussing less favorable aspects.', 'language_complexity': 'Highly complex language with a preference for philosophical terms and aesthetic jargon; frequently uses analogies and detailed descriptions.', 'communication_style': 'Direct and assertive, often provides strong opinions; prefers active listening but interjects to clarify points.', 'sentence_structure': 'Long and complex sentences with multiple subordinate clauses; frequent use of rhetorical questions to challenge perspectives.', 'formality': 'Formal, maintaining a professional demeanor throughout discussions.', 'other_traits': 'Uses pauses effectively to emphasize critiques; rarely interrupts but does so when necessary to correct misunderstandings.'}, 'personalized_vocabulary': {'filler_words': ['Ähm', 'Also', 'Nun'], 'catchphrases': ['Das ist bedenklich!', '...im philosophischen Sinne betrachtet', '...wie es sich ästhetisch darstellt'], 'speech_patterns': ['Interessant zu bemerken ist...', '...und das führt uns zu der Frage...', '...was bedeutet das für die Kunstwelt?'], 'emotional_expressions': ['Lachen', ""'Erstaunlich!'"", ""'Beeindruckend!'""]}, 'social_roles': ['Evaluator-Critic', 'Aggressor'], 'social_roles_descr': ['Analyzes and critically evaluates proposals or solutions to ensure their quality and feasibility.', 'Exhibits hostile behavior, criticizes others, or attempts to undermine the contributions of others.']}, {'role': 'Museum Curator', 'description': 'A curator specializing in Impressionist art, responsible for organizing exhibitions and educating the public about art movements.', 'expertise_area': 'Museum Studies', 'perspective': 'Public Engagement', 'speaking_style': {'tone': 'Warm and engaging, with a touch of enthusiasm when discussing exhibitions; occasionally humorous to lighten the mood.', 'language_complexity': 'Moderately complex language with a preference for curatorial terms and vivid imagery; often uses storytelling to connect with the audience.', 'communication_style': 'Collaborative and informative, encourages interaction by asking questions and inviting opinions.', 'sentence_structure': 'Varied sentence lengths, often using descriptive phrases; frequent use of questions to engage the audience.', 'formality': 'Semi-formal, balancing professionalism with an approachable demeanor.', 'other_traits': 'Uses pauses effectively to allow contemplation; occasionally interrupts to clarify or expand on points.'}, 'personalized_vocabulary': {'filler_words': ['Ähm', 'Also', 'Genau'], 'catchphrases': ['Das ist spannend!', '...im Kontext der Ausstellung betrachtet', '...wie es sich im Raum präsentiert'], 'speech_patterns': ['Interessant zu sehen ist...', '...und das führt uns zu...', '...was bedeutet das für die Besucher?'], 'emotional_expressions': ['Lächeln', ""'Fantastisch!'"", ""'Beeindruckend!'""]}, 'social_roles': ['Initiator-Contributor', 'Standard Setter'], 'social_roles_descr': ['Contributes new ideas and approaches and helps to start the conversation or steer it in a productive direction.', 'Emphasizes the importance of adhering to certain norms and standards within the group to ensure quality and efficiency.']}, {'role': 'Art Educator', 'description': 'An experienced educator who specializes in teaching art history to students and the general public.', 'expertise_area': 'Education', 'perspective': 'Educational Simplification', 'speaking_style': {'tone': 'Friendly and encouraging, with a touch of enthusiasm when discussing art history; occasionally humorous to engage students.', 'language_complexity': 'Moderately complex language with a preference for educational terms and vivid imagery; often uses analogies and storytelling to make concepts accessible.', 'communication_style': 'Collaborative and interactive, frequently asks questions to involve the audience; prefers active listening but interjects to clarify points.', 'sentence_structure': 'Varied sentence lengths, often using descriptive phrases; frequent use of questions to stimulate thinking.', 'formality': 'Semi-formal, balancing professionalism with an approachable demeanor suitable for educational settings.', 'other_traits': 'Uses pauses effectively to allow contemplation; occasionally interrupts to provide additional insights or explanations.'}, 'personalized_vocabulary': {'filler_words': ['Ähm', 'Also', 'Genau'], 'catchphrases': ['Das ist interessant!', '...im Kontext der Kunstgeschichte betrachtet', '...wie es sich in der Geschichte darstellt'], 'speech_patterns': ['Interessant zu sehen ist...', '...und das führt uns zu...', '...was bedeutet das für die Schüler?'], 'emotional_expressions': ['Lächeln', ""'Fantastisch!'"", ""'Beeindruckend!'""]}, 'social_roles': ['Implementer', 'Encourager'], 'social_roles_descr': ['Puts plans and decisions of the group into action and ensures practical implementation.', 'Provides positive feedback and praise to boost the morale and motivation of group members.']}, {'role': 'Art Collector', 'description': 'A passionate collector of Impressionist art, with insights into the market trends and valuation of artworks.', 'expertise_area': 'Art Market', 'perspective': 'Market Dynamics', 'speaking_style': {'tone': 'Passionate and enthusiastic, with a touch of excitement when discussing market trends; occasionally humorous to lighten the mood.', 'language_complexity': 'Moderately complex language with a preference for market-related terms and vivid imagery; often uses analogies and storytelling to illustrate points.', 'communication_style': 'Collaborative and informative, encourages interaction by asking questions and inviting opinions; occasionally assertive when discussing valuations.', 'sentence_structure': 'Varied sentence lengths, often using descriptive phrases; frequent use of questions to engage the audience.', 'formality': 'Semi-formal, balancing professionalism with an approachable demeanor suitable for discussions about art collection.', 'other_traits': 'Uses pauses effectively to allow contemplation; occasionally interrupts to clarify or expand on points.'}, 'personalized_vocabulary': {'filler_words': ['Ähm', 'Also', 'Genau'], 'catchphrases': ['Das ist faszinierend!', '...im Kontext des Kunstmarktes betrachtet', '...wie es sich im Wert darstellt'], 'speech_patterns': ['Interessant zu sehen ist...', '...und das führt uns zu...', '...was bedeutet das für die Sammler?'], 'emotional_expressions': ['Lächeln', ""'Fantastisch!'"", ""'Beeindruckend!'""]}, 'social_roles': ['Opinion Giver', 'Compromiser'], 'social_roles_descr': ['Shares his or her views and beliefs on topics under discussion.', 'Helps the group find a middle ground when there are differences of opinion and encourages compromise in order to move forward.']}]","Das Treffen konzentrierte sich auf die Definition und Entwicklung des Impressionismus als bedeutende Stilrichtung in der Kunstgeschichte. Der Begriff wurde erstmals 1874 von Kunstkritikern verwendet, um Werke junger Künstler zu beschreiben, inspiriert durch Monets Gemälde ""Impression – soleil levant"". Die Bewegung entstand aus einer Abkehr vom Naturalismus und betonte flüchtige Momentaufnahmen und atmosphärische Darstellungen. In der Malerei führte dies zu einer neuen Farbtheorie und Freiluftmalerei, während in Deutschland eine besondere Ausprägung des Impressionismus beobachtet wurde.

Der Impressionismus beeinflusste auch andere Kunstformen wie Musik, Literatur, Fotografie und Film. In der Musik wird Claude Debussy als Hauptvertreter genannt, dessen Werke Klangfarben und Stimmungen betonen. Literarisch wird der Impressionismus mit subjektiver Wahrnehmung und emotionalen Landschaften verbunden. Fotografisch nutzten Piktorialisten Unschärfe als Stilmittel, während im Film impressionistische Techniken wie schnelle Schnitte und Doppelbelichtung eingesetzt wurden.

Es wurde festgestellt, dass der deutsche Impressionismus einen Sonderweg darstellt, indem er sich aus dem Realismus entwickelt hat. Die internationale Verbreitung des Impressionismus um 1900 führte zur Bildung von Künstlerkolonien in Europa und Amerika. Abschließend wurde die Bedeutung des Impressionismus für die moderne Kunst hervorgehoben.","[""Scene 1: Brief Greeting and Setting the Tone\nTLDR: Participants greet each other briefly and set the tone for the meeting.\n- Quick hellos and warm welcomes\n- Overview of meeting objectives\n- Reminder of expected outcomes"", ""Scene 2: Defining Impressionism\nTLDR: Discuss the definition and historical context of Impressionism.\n- Art Historian provides a brief history\n- Cultural Analyst adds cross-cultural perspectives\n- Open floor for spontaneous contributions"", ""Scene 3: Development and Techniques in Painting\nTLDR: Explore how Impressionism evolved in painting techniques.\n- Museum Curator discusses new color theories and plein air painting\n- Art Critic evaluates aesthetic aspects\n- Personal experiences with Impressionist exhibitions"", ""Scene 4: Influence on Other Art Forms\nTLDR: Examine how Impressionism influenced music, literature, photography, and film.\n- Art Educator talks about Debussy\u2019s musical impressionism\n- Cultural Analyst discusses literary connections\n- Spontaneous discussion on photographic techniques"", ""Scene 5: German Impressionism vs. French Impressionism\nTLDR: Compare German and French approaches to Impressionism.\n- Art Historian explains German special path from realism to impressionism\n- Open debate among participants on differences and similarities"", ""Scene 6: International Spread of Impressionism Around 1900\nTLDR: Discuss the global spread of Impressionist art around 1900.\n- Museum Curator talks about artist colonies in Europe and America\n- Art Collector shares insights on market trends during this period"", ""Scene 7: Modern Relevance of Impressionism\nTLDR: Highlight the significance of Impressionism for modern art.\n- Art Critic evaluates its lasting impact on contemporary aesthetics\n- Cultural Analyst reflects on cultural influences today"", ""Scene 8: Decision-Making Moment - Evaluating Options & Weighing Pros/Cons \nTLDR: Reach a consensus or make a definitive decision regarding key points discussed.\n - Summarize main points from previous scenes \n - Evaluate options based on pros/cons \n - Assign action items with responsibilities""]",">>Museum Curator: Hallo zusammen! Ich freue mich, dass wir heute hier sind, um unsere nächste Ausstellung zu planen. Unser Ziel ist es, die Besucher mit der faszinierenden Welt des Impressionismus vertraut zu machen und dabei neue Wege der Interaktion zu erkunden.

>>Art Historian: Was ich besonders spannend finde, ist, dass der Impressionismus nicht nur eine visuelle Revolution darstellte. Er war auch eine philosophische Herausforderung an die konventionellen Wahrnehmungen und Erwartungen der Kunstwelt. Das ist wirklich außergewöhnlich!

>>Cultural Analyst: Ja, das stimmt. Der Impressionismus hat nicht nur die Kunstwelt revolutioniert, sondern auch tiefgreifende kulturelle Veränderungen bewirkt. Es ist interessant zu sehen, wie sich diese Bewegung in verschiedenen Ländern unterschiedlich entwickelt hat und dabei lokale Traditionen beeinflusst und integriert wurden. Was denkt ihr darüber?

>>Art Critic: Nun ja, das stimmt schon. Man könnte auch sagen, dass diese Bewegung eine Art Spiegel für die gesellschaftlichen Umbrüche jener Zeit war. Das gibt zu denken.

>>Art Collector (unterbricht): Darf ich kurz unterbrechen? Ich wollte fragen - haben wir schon darüber nachgedacht, wie wir den Einfluss auf den Kunstmarkt in unserer Ausstellung darstellen können? Der Wert von Impressionistenwerken hat sich enorm entwickelt.

>>Museum Curator: Gute Frage! Ja, das sollten wir definitiv berücksichtigen. Vielleicht könnten wir einen Abschnitt einfügen, der sich speziell mit dem Marktwert dieser Werke beschäftigt.

>>Cultural Analyst (fortsetzt): Und das bringt uns zu der Frage: Wie können wir diese vielfältigen Einflüsse in unserer Ausstellung hervorheben? 
 >>Art Historian: Der Impressionismus war nicht nur eine künstlerische Revolution, sondern auch eine Reaktion auf die gesellschaftlichen Umbrüche des 19. Jahrhunderts! Diese Bewegung spiegelte den Wunsch nach einem neuen Lebensgefühl wider, weg von der strengen akademischen Tradition hin zu einer freieren und unmittelbaren Ausdrucksweise. Das ist wirklich faszinierend!

>>Art Critic: Wenn wir den Impressionismus philosophisch betrachten, sehen wir eine radikale Abkehr von der traditionellen Kunstauffassung. Die Künstler wollten nicht einfach nur die Realität abbilden, sondern den flüchtigen Eindruck eines Moments einfangen und damit eine tiefere emotionale Resonanz erzeugen. Das ist bedenklich!

>>Cultural Analyst: Im kulturellen Kontext betrachtet, ist der Impressionismus mehr als nur eine künstlerische Bewegung; er spiegelt globale Veränderungen wider. Interessant ist, wie sich diese Stilrichtung in verschiedenen Ländern unterschiedlich entwickelt hat und dabei lokale Traditionen beeinflusst und integriert wurden. Was bedeutet das für die heutige Kunstszene?

>>Museum Curator: Genau! Wenn wir den Impressionismus im Kontext unserer Ausstellung betrachten, sehen wir seine transformative Wirkung auf die Wahrnehmung von Kunst. Durch interaktive Elemente können wir Besucher dazu einladen, die Kunstwerke aus verschiedenen Perspektiven zu erleben.

>>Art Educator: Der Impressionismus hat nicht nur die Kunstwelt revolutioniert, sondern auch einen neuen Zugang zur Bildung ermöglicht. Durch anschauliche Beispiele können wir Schülern und der Öffentlichkeit ein tieferes Verständnis für diese Bewegung vermitteln.

>>Art Collector: Es ist auch interessant zu sehen, wie der Einfluss des Impressionismus auf den Kunstmarkt wirkt. Werke von Monet oder Renoir haben enorm an Wert gewonnen! Was bedeutet das für Sammler heute?

>>Art Historian: Halt mal! Der Einfluss des Impressionismus erstreckt sich über Malerei hinaus auf Musik und Literatur. Diese Bewegung etablierte eine neue Art des Sehens und Fühlens in der Kunstwelt.

>>Cultural Analyst: Ja genau! Der Impressionismus hat als kulturelle Brücke fungiert und westliche sowie östliche Einflüsse miteinander verschmolzen – besonders sichtbar in Japan oder den USA.

>>Museum Curator: Durch gezielte Raumgestaltung können wir Besuchern ermöglichen, diese flüchtigen Momente selbst zu erleben und ihre eigene emotionale Resonanz zu finden.

>>Art Critic: Diese Bewegung hat die Kunstwelt herausgefordert mit ihrer Fähigkeit flüchtige Eindrücke einzufangen – was bedeutet das für heutige Künstler? Vielleicht sollten sie sich mehr darauf konzentrieren, wie sie solche Momente in ihren eigenen Werken festhalten können. 
 >>Museum Curator: Also, die Freiluftmalerei hat wirklich eine neue Dimension in der Kunst eröffnet. Künstler konnten das Licht und die Atmosphäre direkt einfangen, was eine ganz andere Farbpalette ermöglichte. Vielleicht könnten wir in unserer Ausstellung interaktive Elemente einbauen, damit Besucher diesen Prozess selbst erleben können.

>>Art Historian: Genau! Die Freiluftmalerei war nicht nur technisch innovativ, sondern auch philosophisch wegweisend. Monet sah das flüchtige Licht als lebendige Momentaufnahme der Natur – einfach faszinierend! Wie könnte man diese Philosophie den Besuchern näherbringen? Vielleicht durch spezielle Lichtinstallationen?

>>Cultural Analyst: Wenn wir den globalen Einfluss des Impressionismus betrachten, sehen wir eine bemerkenswerte Adaption dieser Techniken weltweit. Zum Beispiel haben Künstler wie Childe Hassam in Amerika und Tom Roberts in Australien ihre eigene kulturelle Perspektive eingebracht. Wie können wir diese globale Vernetzung in unserer Ausstellung hervorheben?

>>Art Educator: Das ist spannend! Wenn wir Schülern die Freiluftmalerei und neuen Farbtheorien zeigen, können sie verstehen, wie revolutionär diese Techniken waren. Durch einfache Lernmethoden könnten wir ihnen helfen, komplexe Konzepte besser zu begreifen. Ich habe gesehen, wie begeistert Kinder sind, wenn sie selbst malen dürfen.

>>Art Critic: Nun ja, die ästhetischen Aspekte der Freiluftmalerei sind durchaus interessant. Diese Techniken erlaubten es Künstlern wie Monet tatsächlich das flüchtige Licht einzufangen – aber ist das immer gelungen? Zum Beispiel finde ich Monets ""Impression, Sonnenaufgang"" besonders gelungen im Einfangen des Lichts, während andere Werke manchmal weniger überzeugend wirken.

>>Museum Curator: Interessant ist auch die industrielle Fertigung von Ölfarben in verschließbaren Bleituben – sie hat den Künstlern eine neue Freiheit gegeben! Vielleicht sollten wir diesen Aspekt stärker betonen und zeigen, wie er die Arbeitsweise der Künstler verändert hat.

>>Cultural Analyst: Eigentlich ist es erstaunlich zu sehen, wie der Impressionismus nicht nur Malerei beeinflusst hat. Musik und Fotografie wurden ebenfalls berührt. Multimediale Installationen könnten dies verdeutlichen und ein umfassendes Erlebnis bieten. Ich erinnere mich an eine Ausstellung mit Debussys Musik im Hintergrund – das war magisch!

>>Art Collector: Genau! Die neuen Farbtheorien haben auch den Kunstmarkt verändert. Sammler mussten ihre Strategien anpassen; zum Beispiel stieg die Nachfrage nach Werken mit innovativen Farbnutzungen enorm an. Wir könnten historische Verkaufsdaten präsentieren und zeigen, wie sich Trends entwickelt haben.

>>Art Educator: Und was haltet ihr davon? Könnten interaktive Workshops helfen? So könnten Besucher selbst experimentieren und verstehen! Ich habe gute Erfahrungen mit solchen Workshops gemacht; sie sind sehr beliebt bei Jung und Alt.

>>Museum Curator: Das klingt nach einer großartigen Idee! Vielleicht könnten solche Workshops Teil unserer Ausstellung werden und so einen praktischen Zugang zur Kunst ermöglichen. 
 >>Cultural Analyst: Na ja, es ist wirklich faszinierend, wie der Impressionismus die Literatur beeinflusst hat. Autoren wie Arthur Schnitzler und Joseph Conrad haben versucht, flüchtige Stimmungen und subjektive Wahrnehmungen in ihren Werken festzuhalten. Das zeigt wirklich, wie stark der Einfluss war!

>>Art Historian: Ja, das stimmt! Der Einfluss des Impressionismus auf die Fotografie ist ebenfalls bemerkenswert. Fotografen wie Robert Demachy und Alfred Stieglitz haben impressionistische Techniken übernommen, um flüchtige Momente und Stimmungen einzufangen. Das eröffnet eine ganz neue visuelle Sprache.

>>Art Critic: Nun, wenn wir über Fotografie sprechen, stellt sich die Frage: Ist die bewusste Unschärfe wirklich eine ästhetische Bereicherung oder nur ein Versuch, Malerei nachzuahmen? Interessant zu bemerken ist jedoch, dass Fotografen wie Stieglitz nicht nur flüchtige Momente festhalten wollten.

>>Museum Curator: Genau! Und das zeigt sich auch im Film. Die französischen Filme der 1920er Jahre haben impressionistische Techniken übernommen – schnelle Schnitte und bewusste Unschärfe –, um flüchtige Momente zu erzeugen. Besonders spannend finde ich dabei Regisseure wie Jean Epstein und Abel Gance, die diese Techniken meisterhaft eingesetzt haben.

>>Art Educator: Also, wenn wir über den Einfluss auf die Musik sprechen, müssen wir unbedingt Claude Debussy erwähnen. Seine Werke sind wie musikalische Gemälde – sie fangen flüchtige Momente und Stimmungen ein. Ich finde Debussys Werke besonders faszinierend wegen ihrer Fähigkeit zur emotionalen Tiefe.

>>Cultural Analyst: Tja, das bringt uns zu der Frage: Wie hat diese Bewegung die Erzählweise in anderen Kunstformen verändert? Es scheint so viele Verbindungen zwischen den verschiedenen Medien zu geben. Was denkt ihr darüber?

>>Art Collector: Ähm, genau! Und wenn man bedenkt, wie der Impressionismus auch den Kunstmarkt beeinflusst hat... Diese Techniken haben definitiv dazu beigetragen, neue Trends zu setzen.

>>Art Historian: Unglaublich! Auch im Film sehen wir diesen Einfluss deutlich. Die französischen Filme der 1920er Jahre nutzen impressionistische Techniken für ihre Erzählweise – das zeigt doch wirklich den weitreichenden Einfluss dieser Bewegung!

>>Cultural Analyst: Eigentlich ist es erstaunlich zu sehen, wie der Impressionismus nicht nur die Erzählweise in der Literatur verändert hat sondern auch eine neue visuelle Sprache in Fotografie und Film geschaffen hat.

>>Art Critic: Interessant zu bemerken ist jedoch... Wenn wir über bewusste Unschärfe als ästhetische Bereicherung sprechen – schafft sie wirklich eine innovative visuelle Sprache oder versucht sie lediglich Malerei nachzuahmen?

>>Museum Curator: Genau! Und das zeigt sich auch im Film. Die französischen Filme der 1920er Jahre haben impressionistische Techniken übernommen – schnelle Schnitte und bewusste Unschärfe –, um flüchtige Momente zu erzeugen. Das ist spannend! 
 >>Art Historian: Interessant ist, dass der deutsche Impressionismus einen ganz eigenen Weg gegangen ist! Während die französischen Impressionisten oft den flüchtigen Eindruck einer Szenerie festhalten wollten, entwickelte sich der deutsche Impressionismus aus dem Realismus und Naturalismus heraus. Künstler wie Max Liebermann gelangten durch eine allmähliche Verfeinerung ihrer Technik zum Impressionismus, ohne ihre naturalistischen Wurzeln völlig aufzugeben. Diese Entwicklung beeinflusst die Wahrnehmung von Licht und Farbe in den jeweiligen Kunstwerken. Was denkt ihr darüber?

>>Cultural Analyst: Genau, wenn wir den deutschen Impressionismus im kulturellen Kontext betrachten, sehen wir, wie sich diese Einflüsse in der Darstellung von Licht und Farbe widerspiegeln. Aber es geht auch um mehr als nur Technik – es verändert die Art und Weise, wie Künstler ihre Umgebung wahrnehmen. Vielleicht sollten wir auch über die gesellschaftlichen Auswirkungen dieser Kunst sprechen.

>>Art Critic: Das stimmt! Die Mischung aus Realismus und Impressionismus führt zu einer ästhetischen Vielfalt, die in der französischen Variante nicht so ausgeprägt ist. Diese Unterschiede beeinflussen nicht nur Licht und Farbe, sondern auch das emotionale Erlebnis des Betrachters. Welche Rolle spielt dabei die Philosophie der Künstler?

>>Museum Curator: Spannend! Wenn wir diese Unterschiede im Kontext unserer Ausstellung betrachten, könnten interaktive Elemente helfen, den Besuchern diese Techniken erlebbar zu machen. Vielleicht könnten spezielle Installationen oder Workshops dazu beitragen.

>>Art Educator: Ja, das wäre großartig für Schüler! Visuelle Hilfsmittel wie Diagramme oder interaktive Modelle könnten helfen, diese Unterschiede verständlich zu machen. Wie können wir solche Ansätze in unseren Lehrplänen integrieren?

>>Art Collector: Faszinierend! Auf dem Kunstmarkt sieht man deutliche Unterschiede zwischen deutschem und französischem Impressionismus bei der Wertschätzung der Werke. Deutsche Werke werden oft als weniger kommerziell angesehen – was bedeutet das für Sammler? Könnte dies ein Vorteil sein?

>>Art Historian: Der französische Impressionismus wird oft als visuelle Poesie betrachtet; er fängt flüchtige Momente ein und betont subjektive Wahrnehmungen des Künstlers. Diese Herangehensweise ermöglicht eine gewisse Freiheit in der Darstellung von Licht und Farbe – etwas eingeschränkt durch realistische Wurzeln im deutschen Impressionismus. Wie können wir diese unterschiedlichen Ansätze so präsentieren dass sie sowohl Eigenheiten als auch Gemeinsamkeiten hervorheben?

>>Cultural Analyst: Es ist wirklich erstaunlich, wie deutscher Impressionismus durch seine realistischen Wurzeln eine andere Art von Licht hervorbringt. Diese Mischung bietet eine einzigartige Perspektive auf die Weltanschauung der Künstler.

>>Museum Curator: Und genau da liegt unsere Herausforderung – wie vermitteln wir Besuchern diese Unterschiede wirklich erlebbar? Vielleicht mit speziellen Installationen oder Workshops um Wirkung des Lichts direkt erfahrbar zu machen.

>>Art Educator: Fantastisch! Um Schülern Unterschiede verständlich zu machen könnten visuelle Hilfsmittel wie Diagramme & interaktive Modelle verwendet werden. 
 >>Museum Curator: Es ist wirklich faszinierend zu sehen, wie sich Künstlerkolonien entwickelt haben und welche Inspiration sie den Künstlern boten. Diese Gemeinschaften haben die Kunstwelt enorm bereichert!

>>Art Historian: Ja, der Impressionismus hatte seine Wurzeln in Frankreich, aber er verbreitete sich schnell über Europa und Amerika. Diese Bewegung war wie ein lebendiger Fluss von Ideen und Techniken, der Künstlerkolonien inspirierte und neue Märkte erschloss.

>>Art Collector: Genau! Besonders spannend ist im Kontext des Kunstmarktes betrachtet die Art und Weise, wie der Impressionismus um 1900 neue Märkte erschloss. Die Nachfrage nach diesen Werken stieg enorm an. Was denkt ihr darüber?

>>Cultural Analyst: Bemerkenswert ist auch, wie der Impressionismus kulturelle Barrieren überwunden hat und weltweit Einfluss genommen hat. Diese Bewegung inspirierte Künstler weltweit dazu, ihre eigenen Traditionen mit neuen Techniken zu verbinden.

>>Art Critic: Absolut! Die Künstlerkolonien in Europa und Amerika waren Orte des Austauschs und der ästhetischen Innovation. Besonders interessant ist, wie diese Gemeinschaften auch soziale Strukturen beeinflussten.

>>Art Educator: Das wäre eine großartige Möglichkeit für Schüler selbst Freiluftmalerei auszuprobieren. Durch anschauliche Beispiele und interaktive Workshops können Schüler weltweit die Techniken besser verstehen.

>>Museum Curator: Genau! Interaktive Workshops wären perfekt dafür.

>>Art Historian: Das stimmt! Und wenn wir über die globale Verbreitung des Impressionismus sprechen sollten wir auch die Rolle der Künstlerkolonien in Skandinavien nicht vergessen. Diese Orte waren kreative Schmelztiegel wo lokale Traditionen mit neuen Techniken verschmolzen.

>>Cultural Analyst: Tja... erstaunlich zu sehen wie diese Vielfalt nicht nur die Kunstwelt bereichert hat sondern auch neue Perspektiven eröffnet hat. Was sind eure Gedanken dazu? 
 >>Art Critic: Wenn man darüber nachdenkt, hat der Impressionismus die moderne Kunstwelt stark beeinflusst. Die Art und Weise, wie Künstler flüchtige Eindrücke und subjektive Wahrnehmungen festhalten, ist immer noch aktuell. Das gibt einem zu denken!

>>Art Historian: Ja, das stimmt. Der Impressionismus hat nicht nur die Malerei verändert, sondern auch andere Kunstformen wie Musik und Literatur beeinflusst. Man könnte sagen, dass diese Bewegung eine Verbindung zwischen verschiedenen Kunstformen geschaffen hat... Was denkst du dazu?

>>Cultural Analyst: Interessant! Diese Bewegung hat wirklich viel bewirkt. Sie hat nicht nur die Malerei geprägt, sondern auch die kulturelle Entwicklung beeinflusst. Wie seht ihr den Einfluss auf heutige globale Kunstpraktiken?

>>Museum Curator: Genau! Wenn wir den Impressionismus als eine Art Verbindung betrachten, stellt sich die Frage: Wie können wir diese globale Vernetzung in unseren Ausstellungen nutzen? Vielleicht durch interaktive Elemente oder multimediale Installationen? Was meint ihr?

>>Art Educator: Das klingt spannend! Ich denke, wenn wir Schülern zeigen könnten, wie der Impressionismus das Verständnis von Licht und Farbe verändert hat... vielleicht durch praktische Workshops? Hast du da Erfahrungen gesammelt?

>>Art Collector: Also ich finde es faszinierend zu sehen, wie der Markt für impressionistische Werke immer noch floriert. Aber könnte man wirklich sagen, dass diese Bewegung weiterhin Barrieren überwindet? Oder ist das eher ein nostalgischer Blick auf vergangene Zeiten?

>>Cultural Analyst: Eigentlich ist es erstaunlich! Der Einfluss des Impressionismus inspiriert Künstler weltweit. Aber was bedeutet das konkret für die heutige globale Kunstszene? Gibt es aktuelle Beispiele dafür?

>>Museum Curator: Gute Frage! Interaktive Elemente könnten helfen den Einfluss des Impressionismus so zu präsentieren. Vielleicht durch immersive Erlebnisse? Hat jemand von euch schon mal so etwas umgesetzt?

>>Art Critic: Nun ja... wenn man bedenkt wie stark der Eindruck des Flüchtigen heute noch wirkt... Es bleibt spannend zu beobachten. Aber ich frage mich manchmal, ob wir dem nicht zu viel Bedeutung beimessen. 
 >>Museum Curator: Ich denke, wir sollten die interaktiven Elemente in der Ausstellung definitiv einplanen. Vielleicht könnten wir eine Art ""Malworkshop"" anbieten, bei dem Besucher ihre eigenen impressionistischen Werke schaffen können. Das wäre spannend und würde ihnen helfen, die Techniken besser zu verstehen.
>>Cultural Analyst: Ja, das klingt interessant! Und es wäre auch spannend zu sehen, wie der Impressionismus andere Kunstformen beeinflusst hat. Vielleicht könnten wir Musikstücke oder literarische Texte einbeziehen, um diese Vielfalt zu zeigen.
>>Art Historian: Genau! Der Impressionismus war nicht nur eine künstlerische Bewegung, sondern auch eine gesellschaftliche Veränderung. Wir könnten historische Kontexte bieten, die zeigen, wie Künstler auf ihre Zeit reagiert haben. Das könnte den Besuchern helfen, die revolutionären Aspekte besser zu begreifen.
>>Art Critic: Da stimme ich zu. Aber ich frage mich, ob wir genug Budget für all diese interaktiven und immersiven Erlebnisse haben? Es ist wichtig, dass sie nicht nur ästhetisch ansprechend sind, sondern auch tiefgründig und durchdacht.
>>Art Educator: Absolut! Praktische Workshops für Schüler sind ebenfalls wichtig. Sie könnten zum Beispiel lernen, wie man mit Licht und Schatten spielt – das ist ja ein Kernelement des Impressionismus.
>>Art Collector: Ich finde die Idee mit den Workshops großartig! Sie könnten auch dazu beitragen, das Interesse am Markt für impressionistische Werke weiter anzukurbeln. Aber vielleicht sollten wir überlegen, welche Zielgruppe wir damit erreichen wollen?
>>Cultural Analyst: Gute Frage! Wenn wir Workshops planen, sollten sie sowohl lehrreich als auch inspirierend sein. Vielleicht können wir verschiedene Altersgruppen ansprechen und sicherstellen, dass jeder etwas davon mitnimmt.
>>Museum Curator: Genau! Und durch immersive Erlebnisse könnten wir den globalen Einfluss des Impressionismus noch stärker betonen – vielleicht durch virtuelle Realität oder ähnliche Technologien?
>>Art Historian: Das wäre wirklich innovativ! Aber ich mache mir Sorgen über die technische Umsetzung solcher Ideen. Wir müssen sicherstellen, dass alles reibungslos funktioniert und keine technischen Probleme auftreten."
