Title,Article,Tags,Personas,Summary,Meeting_Plan,Meeting
Napoleonische Kriege,"Als Koalitionskriege (unter Ausschluss des ersten Koalitionskrieges auch Napoleonische Kriege genannt) werden die von 1792 bis 1815 dauernden kriegerischen Auseinandersetzungen zwischen Frankreich und seinen europäischen Machtrivalen bezeichnet. Sie bilden eine Serie von Konflikten, die ursprünglich durch die Französische Revolution hervorgerufen wurden. Wechselnde Bündnisse (Koalitionen) europäischer Mächte führten auf verschiedenen Schauplätzen mehrere (teils ineinander übergehende) Kriege gegen die Französische Republik beziehungsweise das Kaiserreich Napoleon Bonapartes und dessen Verbündete. Französische Truppen hielten in dieser Zeit einige Gegenden dauerhaft besetzt (Napoleonische Besetzung).
Mit den Koalitionskriegen war die Zeit der Kabinettskriege beendet.


Einteilung
Die Kriege lassen sich begrifflich in folgender Weise einteilen:

die Revolutionskriege (1792–1802): erste und zweite Koalition;
die Napoleonischen Kriege (1800–1814), zu denen der Russlandfeldzug 1812 und die Befreiungskriege (1813–1815) gezählt werden können: zweite bis sechste Koalition;
die Kriegsereignisse um die Herrschaft der Hundert Tage nach Napoleons Rückkehr aus der Verbannung (1815): siebte Koalition.
In DDR-Geschichtsbüchern wurden gelegentlich auch über Napoleons Machtübernahme (1799, offizielles Ende der Revolution) und das mit seiner Kaiserkrönung verbundene Ende der Ersten Französischen Republik hinaus jene Kriege bis zur Katastrophe Preußens weiterhin als Revolutionskriege bezeichnet (somit bis zur vierten Koalition), da die revolutionären Errungenschaften der französischen Fremdherrschaft noch bis zum Frieden von Tilsit 1807 überwogen hätten. Mit dem Widerstand der Spanier hätten demnach 1808 die Befreiungskriege begonnen.


Zeitleiste


Die erste Koalition

Die erste Koalition (1792–1797) europäischer Mächte wollte versuchen, die Französische Revolution und ihre Auswirkungen einzudämmen oder gar ganz rückgängig zu machen. Allerdings begann Frankreich den Krieg mit der Kriegserklärung vom 20. April 1792.
Die Koalition begann 1791 mit der Pillnitzer Deklaration, in der sich Österreich und Preußen zu einem gemeinsamen Vorgehen gegen das revolutionäre Frankreich entschlossen. Der Koalition schlossen sich nacheinander weitere wichtige Mächte Europas an: erst das Königreich Sardinien-Piemont, nach der Hinrichtung des französischen Königs Ludwig XVI. auch das Königreich Großbritannien, Spanien und das Königreich Neapel. Die Niederlande erhielten wegen ihrer Unterstützung für Großbritannien 1793 eine französische Kriegserklärung.
Frankreich beantwortete die Bedrohungen von außen mit den Mitteln der Levée en masse, Terror im Inneren und neuen, durch die Umwälzungen in der Armee entstandenen Techniken und Taktiken. Die Kriegsführung der Franzosen war größtenteils erfolgreich. Es gelang ihnen, ihre Gegner nach und nach mittels Friedensverträgen aus dem Krieg auszuschließen: Im Mai 1795 ging die aus den inzwischen französisch besetzten Niederlanden entstandene Batavische Republik ein Bündnis mit Frankreich ein; im Frühjahr 1795 schlossen Preußen und Spanien mit Frankreich den Frieden von Basel; 1796 wurde Sardinien-Piemont während des Italienfeldzuges durch Napoleon Bonaparte zum Frieden gezwungen.
Am 17. Oktober 1797 beendete der Frieden von Campo Formio zwischen Frankreich und dem militärisch geschlagenen Österreich den Ersten Koalitionskrieg. Das linke Rheinufer wurde von Frankreich annektiert. Großbritannien verblieb als einzige europäische Macht mit Frankreich im Kriegszustand. Zu dem für den Rastatter Kongress vorgesehenen Friedensschluss mit dem römisch-deutschen Reich kam es aufgrund des Ausbruchs des Zweiten Koalitionskriegs nicht mehr.


Die zweite Koalition

Die zweite Koalition (1799–1802) aus Großbritannien, Österreich, Russland, dem Osmanischen Reich, Portugal, Neapel und dem Kirchenstaat gegen Frankreich scheiterte ebenso. Preußen unter seinem neuen König Friedrich Wilhelm III. blieb in diesem Konflikt neutral. Napoleon beherrschte Frankreich seit seiner Rückkehr von der Ägyptischen Expedition 1799. Während Napoleon in Ägypten gegen Briten und Osmanen gekämpft hatte, waren mehrere Schlachten in der Schweiz (Besetzung Zürichs) und in Italien von der Koalition gewonnen worden, die französischen Tochterrepubliken in Italien und der Schweiz standen vor dem Zusammenbruch. Russland zog sich jedoch bald darauf aus der Koalition zurück und kehrte zur bewaffneten Neutralität zurück; die britischen Handlungsmöglichkeiten waren aufgebraucht oder noch in Ägypten gebunden. Die Österreicher standen dem zurückgekehrten Napoleon bei der Schlacht bei Marengo am 14. Juni 1800 und Moreau bei der Schlacht von Hohenlinden am 3. Dezember allein gegenüber und unterlagen empfindlich; am 9. Februar 1801 wurde der Friede von Lunéville zwischen Frankreich und Österreich sowie dem Reich geschlossen.
Der Friede von Amiens (1802) brachte auch für die Briten das Ende der zweiten Koalition, derweil die Kampfhandlungen zwischen Frankreich und dem Vereinigten Königreich bereits am 18. Mai 1803 wieder aufgenommen wurden: Statt die Wiederherstellung der französischen Monarchie herbeizuführen, stand nun der Kampf gegen Napoleon im Vordergrund.
Der französische Senat verkündete die Verfassung für das von Napoleon Bonaparte angestrebte Kaiserreich Frankreich am 18. Mai 1804. Der neue Monarch krönte sich am 2. Dezember 1804 in der Kirche Notre-Dame de Paris zum Kaiser der Franzosen.


Die dritte Koalition

Die dritte Koalition gegen Frankreich (aus Österreich, dem erweiterten Großbritannien, Russland und Schweden) bestand ab 1805. Auf französischer Seite wurde der Plan entwickelt, in England einzumarschieren. Invasionstruppen von 150.000 Mann wurden bei Boulogne versammelt. Pierre de Villeneuve führte die vereinigte französisch-spanische Flotte nach Cádiz und verließ den Ort mit seiner Flotte dann Richtung Neapel am 19. Oktober. Bei der Schlacht von Trafalgar am 21. Oktober wurde er von Horatio Nelson vernichtend geschlagen und gefangen genommen. Großbritannien sicherte sich damit die nahezu uneingeschränkte Seeherrschaft, die es bis zum Ende der Koalitionskriege auch nicht mehr verlor.
Am 11. April 1805 hatten Großbritannien und Russland einen Vertrag unterzeichnet, um die Niederlande und die Schweiz zu befreien. Schweden schloss sich dem Bündnis an. Österreich trat am 9. August dieser Allianz bei, nachdem Genua annektiert worden und Napoleon zum König Italiens ausgerufen worden war. Das Königreich Neapel unterstützte das antinapoleonische Bündnis, während Preußen neutral bleiben wollte.
Im August verlangte Frankreich von Österreich, seine Garnisonen aus Tirol und Venetien abzuziehen, was der Kaiser in Wien am 27. August ablehnte. Napoleon Bonaparte ging Bündnisse mit Spanien und süddeutschen Herrschern ein (mit Bayern den Vertrag von Bogenhausen am 25. August, mit Baden am 5. September den Vertrag von Baden-Baden, mit Württemberg den Vertrag von Ludwigsburg am 5. Oktober). Die französische Armee zog im späten August von Boulogne nach Deutschland und überquerte mit der Hauptarmee am 25. September den Rhein.
Am 8. September 1805 waren unterdessen österreichische Truppen unter Karl Mack von Leiberich in Bayern eingedrungen, die den Auftrag hatten, an die Iller vorzustoßen und Ulm zu befestigen. Frankreich erklärte am 23. September Österreich den Krieg. Bei mehreren Gefechten (z. B. Schlacht von Elchingen) im Großraum von Ulm (8.–20. Oktober) besiegten die Franzosen 70.000 Österreicher. Die französische Armee rückte auf Wien vor. Die Schlacht von Austerlitz (die sogenannte Dreikaiserschlacht) am 2. Dezember brachte erneut eine schwere Niederlage für die vereinigte russische und österreichische Armee. Den Verlierern wurde der Pressburger Frieden auferlegt.


Die vierte Koalition

Die vierte Koalition aus Preußen und Russland, später um Großbritannien und Schweden erweitert, bestand von 1806 bis 1807. Nach dem Ende des Dritten Koalitionskrieges befand sich Frankreich weiterhin im Krieg mit Großbritannien und Russland. Um die Briten für einen Frieden zu gewinnen, bot Napoleon ihnen die Rückkehr des erst kurz zuvor im Vertrag von Schönbrunn an Preußen abgetretenen Kurhannover an. Zudem hatten im Juli 1806 sechzehn deutsche Staaten auf Initiative Napoleons den Rheinbund gegründet, der den Austritt aus dem Heiligen Römischen Reich und eine Konföderation mit Frankreich beinhaltete. Das Heilige Römische Reich wurde nach einem französischen Ultimatum formell am 6. August 1806 durch die Verzichtserklärung von Kaiser Franz II. aufgelöst. Preußen fühlte sich durch diese Entwicklungen brüskiert und beschloss, auch ohne greifbare Unterstützung – das verbündete Russland war noch nicht wieder kriegsbereit – gegen Frankreich Krieg zu führen. Dem Ultimatum an Frankreich, seine Truppen hinter den Rhein zurückzuziehen, folgte am 9. Oktober 1806 die Kriegserklärung. Napoleon hatte dies vorausgesehen und eine starke Armee an der Grenze Bayerns zu Thüringen versammelt.
Die norddeutschen Staaten und die Hansestädte verhielten sich neutral. Nur das Kurfürstentum Sachsen und das Herzogtum Sachsen-Weimar schlossen sich Preußen an. Preußen erklärte allein den Krieg. Das führte in der Schlacht bei Jena und Auerstedt am 14. Oktober 1806 zu einer schweren Niederlage Preußens. Am 27. Oktober hielt Napoleon Einzug in Berlin, während der preußische König Friedrich Wilhelm III. samt Hof und Familie nach Ostpreußen unterwegs war. Sachsen löste im Dezember sein Bündnis mit Preußen und trat, bei gleichzeitiger Erhebung zum Königreich, dem Rheinbund bei. Seine Truppen, wie auch die Sachsen-Weimars, kämpften im Frühjahr 1807 gegen Preußen.
Zum Jahresende 1806 griffen russische Truppen in den Krieg ein. Nach einigen unbedeutenden Gefechten (Schlacht von Pultusk) und dem überaus harten Wintereinbruch standen die Truppen sich im südlichen Ostpreußen gegenüber. Die vom preußischen Staat bei der Zweiten und Dritten Teilung Polens gewonnenen Gebiete waren nach dem Großpolnischen Aufstand im November 1806 abgefallen. Dort konstituierte sich, von Napoleon angestoßen, ein neues Staatsgebilde mit eigenen Militärverbänden, die 1807 unter französischem Kommando in die Kämpfe gegen Preußen eingriffen.
Nach der unentschiedenen Schlacht bei Preußisch Eylau (7. und 8. Februar 1807) kam es am 26. April 1807 zum Vertrag von Bartenstein, in dem sich Preußen und Russland verpflichteten, auf Gedeih und Verderb bis zum Sieg über Napoleon zusammenzuhalten. Kurz darauf traten das Vereinigte Königreich und Schweden dem Vertrag bei. Nachdem Napoleon am 14. Juni die Schlacht bei Friedland gewonnen hatte, begann die russische Seite am 19. Juni ohne Einbeziehung Preußens mit Waffenstillstandsverhandlungen. Am 7. Juli 1807 schlossen Zar Alexander I. und Napoleon den Frieden von Tilsit, in dem sich ein Bündnis gegen Großbritannien abzeichnete. Der am 9. Juli 1807 zwischen Frankreich und Preußen geschlossene Friedensvertrag war ein Diktatfrieden. Preußen verlor die Hälfte seines Territoriums, musste die daraus hervorgehenden französischen Satellitenstaaten, darunter das Herzogtum Warschau, anerkennen und blieb zunächst größtenteils französisch besetzt. Die Niederlage hatte in Preußen grundlegende Modernisierungen zur Folge, die Preußischen Reformen.
Im Frieden von Tilsit war Russland der Kontinentalsperre beigetreten, die Napoleon im Berliner Dekret vom 21. November 1806 über Großbritannien verhängt hatte. Großbritannien sah seine Seeherrschaft durch ein mögliches französisch-russisch-dänisches Bündnis gefährdet, entsandte eine Armee nach Seeland und erzwang Anfang September 1807 durch ein Bombardement Kopenhagens die Auslieferung der dänischen Flotte. Der Erfurter Kongress 1808 führte zu der Einigung zwischen Napoleon und Zar Alexander I. dahingehend, dass Russland Druck auf Schweden ausübte, sich dem Kontinentalsystem anzuschließen. Dies führte zum Russisch-Schwedischen Krieg von 1808 bis 1809 und der Teilung Schwedens am Bottnischen Meerbusen. Der östliche Teil wurde das russische Großfürstentum Finnland.Auch britische humanitäre Hilfe vermochte nicht, Schweden auf seiner antinapoleonischen Linie zu halten.


Der Krieg auf der Iberischen Halbinsel

Mit der französischen Expedition nach Portugal Ende 1807, mit der das Land zur Beteiligung an der Handelsblockade gegen Großbritannien gezwungen werden sollte, begannen die kriegerischen Auseinandersetzungen auf dem iberischen Kriegsschauplatz. Im Mai 1808 brach in Spanien ein Volksaufstand gegen die Franzosen aus. Die Erhebung von Joseph Bonaparte zum König von Spanien im Juli 1808 durch Napoleon löste einen Guerillakrieg aus.
Ab August 1808 operierte ein britisches Expeditionskorps unter der Führung von Wellington in Portugal und Spanien und unterstützte die portugiesischen und spanischen Kräfte im Kampf gegen die französischen Besatzungstruppen und ihre Verbündeten. Sowohl auf französischer wie auch auf britischer Seite (King’s German Legion) waren deutsche Kontingente vertreten. Die Auseinandersetzungen dauerten bis 1813/14 an.
Der Spanienkrieg, der auch als Spanischer Unabhängigkeitskrieg bezeichnet wird, gilt als der erste „Befreiungskrieg“ gegen Napoleons Vorherrschaft in Europa. Er übte eine nicht zu unterschätzende psychologische Wirkung auf die Bevölkerungen der übrigen Gebiete aus, die bei seinem Ausbruch zum französischen Machtbereich gehörten.


Die fünfte Koalition

Die fünfte Koalition gegen Frankreich bestand 1809 zwischen Großbritannien und Österreich. Während Frankreich mit den Truppen seiner Satellitenstaaten sich der Niederschlagung des Volkskrieges in Spanien (s. o.) widmete, eröffnete Österreich den Krieg am 9. April 1809. Ziel war die Beseitigung der Vorherrschaft Napoleons in Europa. Österreich wollte seinen Krieg als Befreiungsaktion nach spanischem Vorbild verstanden wissen und hoffte auf die Entstehung einer Volksbewegung, die Napoleon zum Rückzug aus Deutschland zwingen sollte. Hauptkriegsschauplatz war daher zunächst Süddeutschland. Zeitgleich fanden Offensiven gegen das Königreich Italien und gegen das Herzogtum Warschau statt. Nebenkriegsschauplätze waren die dalmatinische Küste, Franken und Sachsen. Neben dem Tiroler Volksaufstand, bei dem Tirol vom Frühjahr bis zum Herbst 1809 gegen die bayerisch-französische Besatzung verteidigt wurde, kam es in Norddeutschland zu vereinzelten Aufständen sowie zu Freischarenzügen Schills und des Herzogs von Braunschweig-Lüneburg. Einen Einfluss auf den Kriegsverlauf hatten letztere Ereignisse jedoch nicht.
Nach der verlorenen Schlacht von Abensberg und der Schlacht bei Eggmühl und den unglücklichen Kämpfen bei Regensburg hatte sich die Armee des Erzherzogs Karl nach Böhmen zurückgezogen und die Franzosen rückten am 13. Mai in Wien ein. Sie standen mit etwa 90.000 Mann auf dem rechten Ufer der Donau. Am linken Ufer stand, nach seinem Rückzug nach Böhmen an die Donau zurückgekehrt, Erzherzog Karl mit seiner Armee. In der folgenden Schlacht bei Aspern konnte dieser die Franzosen am weiteren Vormarsch hindern. Der österreichische Sieg bei Aspern wurde auch durch den Widerstand der österreichischen Verteidiger in Malborgeth und am Predil-Pass ermöglicht, die ein schnelles Vorrücken der Truppen von Vizekönig Eugen Beauharnais verhinderten. Die nachfolgende Schlacht bei Raab (Győr) und die endgültige Niederlage der Österreicher in der Schlacht bei Wagram führten im Juli zum Znaimer Waffenstillstand. Zwei Wochen später begann eine britische Armee ohne Kenntnis vom Waffenstillstand die Walcheren-Expedition, die wegen offensichtlicher Aussichtslosigkeit nach Anfangserfolgen im Spätherbst beendet wurde. Am 14. Oktober 1809 schlossen Österreich und Frankreich den Frieden von Schönbrunn.

Großbritannien war mit seiner Armee auf der iberischen Halbinsel der letzte Gegner Napoleons auf dem europäischen Kontinent. Die Seewege Europas sowie derjenige nach Indien (Mauritiusfeldzug) wurden von der britischen Flotte beherrscht, während Frankreich versuchte, die Wirtschaftsblockade gegen England durch die Kontrolle aller europäischen Festlandshäfen durchzusetzen.


Die sechste Koalition

Als Sechster Koalitionskrieg (1812–1814) lassen sich der Russlandfeldzug Napoleons und die Befreiungskriege zusammenfassen, wobei zu Beginn des Russlandfeldzuges noch nicht alle Koalitionspartner (Großbritannien, Russland, Preußen, Schweden, Österreich und zahlreiche deutsche Kleinstaaten) als Gegner Frankreichs beteiligt waren.


Russlandfeldzug

Die Grande Armée überschritt am 23. Juni 1812 mit rund 600.000 Mann (darunter 150.000 Soldaten aus Preußen, Österreich, Bayern und dem Rheinbund) die Memel. Die russischen Truppen zogen sich tief ins Landesinnere zurück und hinterließen verbrannte Erde, während Napoleons Nachschubwege immer länger und anfälliger für Partisanen wurden. Die Schlacht bei Borodino am 7. September brachte hohe Verluste auf beiden Seiten, aber keine Entscheidung. Auch nach der Einnahme Moskaus am 14. September verweigerte Alexander I. einen Friedensschluss.
Mitte Oktober befahl Napoleon den Rückzug seiner stark geschrumpften Armee, die bis dahin bereits 275.000 Tote und 200.000 Gefangene zu verzeichnen hatte. Die verbliebenen Soldaten, die von den Russen wieder auf die verwüstete Smolensk-Route gezwungen wurden, sahen sich ständigen Angriffen ausgesetzt, was ihre Zahl weiter dezimierte; am Ende zählte die Armee nur noch rund 10.000 Mann. Im Dezember kehrte Napoleon nach Paris zurück. Der russische Sieg über die Franzosen wurde von Pjotr Iljitsch Tschaikowski in der Ouvertüre 1812 künstlerisch verarbeitet.


Der Verlust Spaniens
In der Schlacht bei Vitoria am 21. Juni 1813 wurde die französische Herrschaft über Spanien endgültig gebrochen. Die Franzosen mussten sich über die Pyrenäen zurückziehen. Ludwig van Beethoven setzte der Schlacht zeitnah (Ende 1813) ein musikalisches Denkmal in seiner Komposition Wellingtons Sieg oder die Schlacht bei Vittoria.


Befreiungskriege in Mitteleuropa

Nach der Niederlage der Grande Armée in Russland begannen die Befreiungskriege. Preußen löste sich Ende Dezember 1812 in der Konvention von Tauroggen aus dem Bündnis mit Frankreich, verbündete sich im Februar 1813 im Vertrag von Kalisch mit Russland und nahm im März offen den Kampf gegen Frankreich und den Rheinbund auf. Wenig später trat Schweden unter Kronprinz Karl Johann der Allianz bei.
Unterdessen hatte sich in Norddeutschland, ausgehend von Ostpreußen, seit Januar 1813 eine vehement antifranzösische Stimmung ausgebreitet, die in eine offene Rebellion umschlug, als russische Reiterverbände über die Oder ausschwärmten. Ende Februar wurden davon auch die 1810 von Frankreich annektierten Hanseatischen Departements erfasst. Im März räumten die Franzosen Hamburg vor den anrückenden Russen. Im Mai schlug Napoleon in der Schlacht bei Großgörschen und in der Schlacht bei Bautzen die russisch-preußischen Truppen. Die Folge war Anfang Juni der Waffenstillstand von Pläswitz, der Österreich die Gelegenheit gab, im Friedenskongress von Prag einen Frieden zu vermitteln. Nachdem dies am Widerstand Napoleons gescheitert war, schloss Österreich sich dem preußisch-russisch-schwedischen Bündnis an. Bereits im Juli hatten sich die vier Verbündeten im Trachenberg-Plan auf eine gemeinsame Strategie geeinigt. Im Herbstfeldzug 1813 wurde Mitteldeutschland erneut zum Kriegsschauplatz.
In der kriegsentscheidenden Völkerschlacht bei Leipzig fügten im Oktober 1813 die verbündeten russischen, österreichischen, preußischen und schwedischen Truppen Napoleon eine Niederlage zu. Während der Rheinbund zerfiel, zogen sich die Franzosen nach Frankreich zurück. Es kam zum Vertrag von Chaumont am 9. März 1814, in dem die Verbündeten gelobten, niemals mit Napoleon Frieden zu schließen und die Bourbonen wieder auf den französischen Thron zu setzen.
Am 31. März nahmen die verbündeten Truppen Paris ein. Napoleon dankte am 6. April ab. Es folgte der Vertrag von Fontainebleau. Die Regentschaft der Bourbonen wurde wiederhergestellt und Napoleon nach Elba verbannt. Nach Beendigung der napoleonischen Herrschaft wurde von den Siegermächten der Wiener Kongress einberufen, um die Ordnung Europas nach alten, vorrevolutionären Maßstäben wiederherzustellen (Restauration).


Rückkehr und endgültige Niederlage Napoleons

Zu einem kurzen Nachspiel der Freiheitskriege kam es im Jahr 1815 (als der Kongress schon begonnen hatte), veranlasst durch Napoleons eigenmächtige Rückkehr aus der Verbannung („Herrschaft der Hundert Tage“). Nach rascher Neuorganisation der Grande Armée und einem letzten Sieg in der Schlacht bei Ligny wurde Napoleons Herrschaft durch seine Niederlage gegen das aus Briten, Niederländern und Deutschen zusammengesetzte alliierte Heer unter Arthur Wellesley, dem Duke of Wellington und die verbündete Streitmacht Preußens unter Gebhard Leberecht von Blücher in der Schlacht bei Waterloo endgültig beendet. Napoleon wurde auf Lebenszeit auf die britische Insel St. Helena verbannt.


Nachwirkungen

Die von Napoleon auf seinen Feldzügen eroberten europäischen Länder wurden auf Rechtsverkehr umgestellt – und einige blieben auch dabei, wie Deutschland. Die Länder der Donaumonarchie stellten nach Napoleons Rückzug freilich wieder auf den damals gewohnten Linksverkehr zurück. Die Napoleonischen Kriege haben auch Bedeutung als Anlass der ersten in der Reihe der größeren humanitären Hilfsaktionen der Geschichte mit transnationalem zivilgesellschaftlichen Gepräge.
Ab 1833 gründeten sich in den während der napoleonischen Herrschaft von Frankreich besetzten westdeutschen Ländern Veteranenvereine (die ersten Kriegervereine der deutschen Länder überhaupt), die besonders um die Jahrhundertmitte zahlreiche gleichartige Kriegerdenkmäler errichteten, die auch Napoleonsteine genannt werden. Sie stehen meist auf Friedhöfen und tragen die Namen und Lebensdaten der Veteranen. Die Steine drücken auch eine Verklärung der napoleonischen Herrschaft aus, die in diesen Regionen verbreitet war.


Kritik am Begriff „Napoleonische Kriege“
Der polnisch-britische Historiker Adam Zamoyski hält den Begriff Napoleonische Kriege angesichts der Tatsache, dass England zum einen aus wirtschaftlicher Motivation heraus Frankreich im Jahr 1803 den Krieg erklärte und zum anderen alle nachfolgenden Koalitionskriege von England diplomatisch initiiert und finanziert wurden, für „irreführend“. Er plädiert dafür, sie als „Englische Kriege“ zu bezeichnen. So hatte Großbritannien, um eine französische Invasion auf die britischen Inseln abzuwenden und den Krieg nach Mitteleuropa zu verlagern, ab Beginn der Koalitionskriege nach Staaten auf dem europäischen Festland gesucht, die bereit waren, gegen Bezahlung (je 1,25 Millionen britische Pfund für 100.000 Soldaten) Krieg gegen Napoleon bzw. Frankreich zu führen. Während der sechs Koalitionskriege zahlte Großbritannien deswegen 65,8 Millionen Pfund an die europäischen Kriegspartner.


Siehe auch
Liste preußischer Generale in den napoleonischen Kriegen


Literatur
Gunther E. Rothenberg: Die Napoleonischen Kriege. Brandenburgisches Verlagshaus, Berlin 2000, ISBN 3-89488-134-8.
Gerhard Bauer, Gorch Pieken, Matthias Rogg: Blutige Romantik. 200 Jahre Befreiungskriege. Essays. Militärhistorisches Museum der Bundeswehr, Sandstein Verlag, Dresden 2013, ISBN 978-3-95498-035-2.
Gerhard Bauer, Gorch Pieken, Matthias Rogg: Blutige Romantik. 200 Jahre Befreiungskriege. Katalog/Ausstellung 6. September 2013 bis 16. Februar 2014. Militärhistorisches Museum der Bundeswehr, Sandstein Verlag, Dresden 2013, ISBN 978-3-95498-036-9.
Frank Bauer: Kleine Reihe Geschichte der Befreiungskriege, 40 Hefte, Potsdam-Altenburg 2003–2015 (Edition König und Vaterland).
Ulrich Pfister: Gewalt, institutionelle Schocks und Entwicklung. Wirtschaftliche Folgen der Koalitions- und napoleonischen Kriege (1792–1815) in Deutschland. In: Vierteljahrschrift für Sozial- und Wirtschaftsgeschichte, Bd. 107, 2020, Heft 1, S. 9–46.


Weblinks

Literatur von und über Koalitionskriege im Katalog der Deutschen Nationalbibliothek
Marco Jorio: Campoformio, Frieden von. In: Historisches Lexikon der Schweiz.
Wilhelmshöher Kriegskarten (1594–1875) HStAM Bestand WHK. In: Archivinformationssystem Hessen (Arcinsys Hessen).


Einzelnachweise","[""Koalitionskriege"", ""Napoleonische Kriege"", ""Franz\u00f6sische Revolution"", ""Befreiungskriege"", ""Europ\u00e4ische Geschichte""]","[{'role': 'Historian', 'description': 'A scholar specializing in European history with a focus on the Napoleonic Wars.', 'expertise_area': 'European History', 'perspective': 'Historical Context', 'speaking_style': {'tone': 'formal and reserved, with occasional enthusiasm when discussing key historical events', 'language_complexity': 'complex language with technical terms related to history, frequent use of metaphors and analogies to explain concepts', 'communication_style': 'collaborative and inquisitive, often poses rhetorical questions to engage the audience', 'sentence_structure': 'long and complex sentences with subordinate clauses, varied sentence length depending on the topic', 'formality': 'formal', 'other_traits': 'uses pauses effectively to emphasize points, occasionally interrupts to correct misconceptions'}, 'personalized_vocabulary': {'filler_words': ['Ähm', 'Also', 'Nun', 'Ja'], 'catchphrases': ['Im Kontext der Geschichte...', '...wie Napoleon einst sagte', '...und das führt uns zu...'], 'speech_patterns': ['beginnt oft mit einer historischen Anekdote', '...was wir hier sehen ist...', '...man könnte argumentieren...'], 'emotional_expressions': ['Lachen bei humorvollen Anekdoten', 'Seufzen bei tragischen Ereignissen"", Exklamationen wie \'Unglaublich!\' und \'Faszinierend!\'""']}, 'social_roles': ['Coordinator', 'Evaluator-Critic'], 'social_roles_descr': ['Connects the different ideas and suggestions of the group to ensure that all relevant aspects are integrated.', 'Analyzes and critically evaluates proposals or solutions to ensure their quality and feasibility.']}, {'role': 'Military Strategist', 'description': 'An expert in military tactics and strategies, with a deep understanding of the battles and campaigns during the Napoleonic Wars.', 'expertise_area': 'Military History', 'perspective': 'Strategic Analysis', 'speaking_style': {'tone': 'serious and authoritative, with a touch of enthusiasm when discussing successful strategies', 'language_complexity': 'technical language with military jargon, uses analogies related to warfare and strategy', 'communication_style': 'direct and assertive, often uses rhetorical questions to challenge conventional thinking', 'sentence_structure': 'short and concise sentences for clarity, occasionally interspersed with longer explanations', 'formality': 'semi-formal', 'other_traits': 'uses pauses strategically to allow the audience to reflect, rarely interrupts but emphasizes key points'}, 'personalized_vocabulary': {'filler_words': ['Tja', 'Nun gut', 'Ehrlich gesagt'], 'catchphrases': ['Im Krieg ist alles möglich...', '...wie Clausewitz sagte', '...und das ist entscheidend'], 'speech_patterns': ['beginnt oft mit einer taktischen Analyse', '...was wir hier verstehen müssen ist...', '...man könnte sagen...'], 'emotional_expressions': ['Lachen bei erfolgreichen Manövern', ""'Beeindruckend!' bei cleveren Strategien"", ""'Erstaunlich!' bei unerwarteten Wendungen""]}, 'social_roles': ['Information Giver', 'Aggressor'], 'social_roles_descr': ['Shares relevant information, data or research that the group needs to make informed decisions.', 'Exhibits hostile behavior, criticizes others, or attempts to undermine the contributions of others.']}, {'role': 'Cultural Analyst', 'description': 'A specialist in cultural studies who examines the impact of the Napoleonic Wars on European societies and cultures.', 'expertise_area': 'Cultural Studies', 'perspective': 'Societal Impact', 'speaking_style': {'tone': 'casual and enthusiastic, with a touch of humor when discussing cultural impacts', 'language_complexity': 'moderate language with occasional use of technical terms related to cultural studies, frequent use of storytelling and analogies', 'communication_style': 'collaborative and inquisitive, often uses rhetorical questions to engage the audience and provoke thought', 'sentence_structure': 'varied sentence length with a mix of short and concise sentences for clarity, interspersed with longer explanations', 'formality': 'semi-formal', 'other_traits': 'uses pauses effectively to emphasize cultural nuances, occasionally interrupts to add personal anecdotes'}, 'personalized_vocabulary': {'filler_words': ['Ähm', 'Also', 'Na ja', 'Ehrlich gesagt'], 'catchphrases': ['Im kulturellen Kontext...', '...wie die Gesellschaft damals reagierte', '...und das zeigt uns...'], 'speech_patterns': ['beginnt oft mit einer kulturellen Anekdote', '...was wir hier beobachten ist...', '...man könnte meinen...'], 'emotional_expressions': ['Lachen bei humorvollen Geschichten', 'Seufzen bei tragischen kulturellen Veränderungen"", Exklamationen wie \'Unglaublich!\' und \'Beeindruckend!\'""']}, 'social_roles': ['Opinion Seeker', 'Encourager'], 'social_roles_descr': ['Encourages others to share their opinions and beliefs in order to understand different perspectives.', 'Provides positive feedback and praise to boost the morale and motivation of group members.']}]","Das Treffen konzentrierte sich auf die Napoleonischen Kriege, die von 1792 bis 1815 zwischen Frankreich und seinen europäischen Rivalen stattfanden. Diese Konflikte wurden durch die Französische Revolution ausgelöst und führten zu wechselnden Bündnissen europäischer Mächte gegen Frankreich. Die Kriege lassen sich in Revolutionskriege (1792–1802), Napoleonische Kriege (1800–1814) und die Herrschaft der Hundert Tage (1815) unterteilen. Wichtige Ereignisse umfassen den Russlandfeldzug 1812, die Befreiungskriege (1813–1815) und Napoleons endgültige Niederlage bei Waterloo. Der Begriff „Napoleonische Kriege“ wurde kritisch betrachtet; einige Historiker plädieren für „Englische Kriege“, da Großbritannien maßgeblich an der Finanzierung und Initiierung beteiligt war. Die Nachwirkungen dieser Kriege beinhalten bedeutende gesellschaftliche Veränderungen und humanitäre Hilfsaktionen.","[""Scene 1: Brief Greeting and Setting the Stage\nTLDR: Participants greet each other briefly and set the stage for the forum.\n- Brief greeting among participants\n- Overview of meeting objectives\n- Encouragement to think innovatively"", ""Scene 2: Historical Context of Napoleonic Wars\nTLDR: Historian provides a brief overview of the Napoleonic Wars.\n- Key events and timeline\n- Impact on European history\n- Open floor for spontaneous contributions"", ""Scene 3: Strategic Analysis of Military Campaigns\nTLDR: Military Strategist discusses key strategies and battles.\n- Analysis of major campaigns (e.g., Russia, Waterloo)\n- Successful tactics and lessons learned\n- Opportunities for participants to share insights"", ""Scene 4: Societal Impact and Cultural Changes\nTLDR: Cultural Analyst explores societal changes due to the wars.\n- Effects on European societies and cultures\n- Humanitarian actions post-war\n- Personal anecdotes related to cultural shifts"", ""Scene 5: Innovative Thinking in Historical Contexts\nTLDR: Discussion on how historical events can inspire innovation today.\n- Drawing parallels between past strategies and modern opportunities\n- Encouraging innovative ideas from historical analysis\n- Open discussion with spontaneous contributions"", ""Scene 6: Identifying New Opportunities from History Lessons\nTLDR: Brainstorming session on new opportunities inspired by historical lessons.\n- Collaborative idea generation based on historical insights\n- Identifying potential areas for innovation in various fields\n- Allowing natural topic evolution"", ""Scene 7: Enhancing Culture of Innovation through Historical Examples\nTLDR: Discussing ways to foster a culture of innovation using historical examples.\n- Strategies to encourage innovative thinking within organizations or teams\n- Sharing personal experiences related to fostering innovation\n- Brief off-topic moments for lighter conversation"", ""Scene 8: Conclusion and Next Steps \nTLDR: Summarizing key points discussed and outlining next steps. \n - Recap of generated ideas \n - Identified new opportunities \n - Plans for future forums or follow-up actions""]",">>Historian: Guten Morgen zusammen! Ich freue mich darauf, die Auswirkungen der Napoleonischen Kriege auf Europa zu diskutieren. Es gibt so viel zu entdecken.
>>Military Strategist: Ja, ich denke wir sollten nicht nur die militärischen Aspekte betrachten sondern auch die strategischen Entscheidungen analysieren, die den Verlauf dieser Konflikte beeinflusst haben. Welche taktischen Manöver waren besonders entscheidend?
>>Cultural Analyst: Genau! Diese Kriege brachten nicht nur militärische Umwälzungen sondern auch tiefgreifende gesellschaftliche Veränderungen mit sich. Sie dienten als Katalysator für soziale Umwälzungen und neue politische Ideen entstanden dadurch.
>>Historian: Richtig! Die politischen und gesellschaftlichen Strukturen wurden stark verändert durch diese Kriege. Welche Rolle spielten die Koalitionen dabei?
>>Military Strategist: Die wechselnden Bündnisse waren entscheidend für viele Schlachten und letztlich für das Schicksal Europas. Ein Paradebeispiel für strategisches Denken!
>>Cultural Analyst: Und wenn wir über gesellschaftliche Auswirkungen sprechen - es ist spannend zu sehen wie Kunst und Literatur jener Zeit diesen Wandel widerspiegeln und neue Ausdrucksformen entstanden sind. 
 >>Historian: Die Napoleonischen Kriege haben nicht nur militärische und politische Landschaften verändert, sondern auch tiefgreifende gesellschaftliche Umwälzungen ausgelöst. Napoleon sagte einmal, 'Die Welt ist ein Schauplatz des Wandels,' was die Veränderungen dieser Zeit gut zusammenfasst.
>>Military Strategist: Diese Kriege leiteten eine neue Ära der Kriegsführung ein, besonders durch die strategische Nutzung von Koalitionen und großen Armeen. Das war entscheidend für den Erfolg oder Misserfolg der Mächte.
>>Cultural Analyst: Ja, und die Auswirkungen auf die Gesellschaft waren enorm – von politischen Grenzen bis zum Alltag der Menschen. Man könnte sagen, es war eine kulturelle Revolution.
>>Historian: Genau! Und das hat auch die politische Landkarte Europas neu gezeichnet. Es ebnete den Weg für neue Nationalstaaten und stärkte die Idee der nationalen Identität.
>>Military Strategist: Das stimmt, und wie Clausewitz sagte, im Krieg ist alles möglich... Napoleons Fähigkeit, seine Gegner zu zwingen sich ihm anzuschließen oder gegen ihn zu kämpfen, war beeindruckend.
>>Cultural Analyst: Absolut! Und wenn wir über die Rolle der Frauen sprechen... viele mussten plötzlich neue Aufgaben übernehmen während ihre Männer im Krieg waren. Das war ein erster Schritt zur Emanzipation.
>>Historian: Diese gesellschaftlichen Veränderungen sind wirklich bemerkenswert. Es zeigt uns, wie tiefgreifend diese Konflikte waren. 
 >>Military Strategist: Tja, was wir hier verstehen müssen ist, dass Napoleons Russlandfeldzug ein Paradebeispiel für strategisches Versagen ist. Die Entscheidung, sich so tief ins Landesinnere zurückzuziehen und dabei die Nachschubwege zu vernachlässigen, führte letztlich zur Katastrophe.
>>Cultural Analyst: Ja, das stimmt. Und es war nicht nur ein militärisches Desaster. Die Menschen in Europa mussten sich mit den Folgen dieser Kriege auseinandersetzen. Man könnte sagen, dass diese Ereignisse große Veränderungen in der Gesellschaft ausgelöst haben.
>>Historian: Genau. Napoleons Russlandfeldzug hat die Machtverhältnisse in Europa stark verändert. Die Koalitionen und Bündnisse gegen Napoleon zeigten deutlich die geopolitischen Verschiebungen jener Zeit.
>>Military Strategist: Nun gut, der Russlandfeldzug zeigt uns eindrucksvoll, wie entscheidend die Logistik im Krieg ist. Napoleon unterschätzte die Herausforderungen des russischen Terrains und die Bedeutung der Nachschubwege. Eine bessere Planung hätte hier den Unterschied machen können.
>>Historian: Ja, und diese geopolitischen Konsequenzen waren enorm. Die verschiedenen europäischen Mächte mussten ihre Strategien ständig anpassen und neue Allianzen bilden.
>>Cultural Analyst: Richtig! Diese ständigen Veränderungen führten auch zu einem kulturellen Wandel. Zum Beispiel begannen Künstler und Schriftsteller, ihre Werke stärker auf nationale Identität auszurichten.
>>Military Strategist: Interessant! Wenn wir über Waterloo sprechen... Wellington und Blücher haben gezeigt, wie entscheidend es ist Kräfte zu bündeln und den Gegner koordiniert anzugreifen. Diese Zusammenarbeit war der Schlüssel zum Sieg.
>>Cultural Analyst: Das ist interessant! Waterloo hatte nicht nur militärische Bedeutung... Es führte auch zu einem kulturellen Umbruch in Europa. Viele Menschen begannen ihre Identität neu zu definieren.
>>Historian: Ja... Waterloo markierte das Ende einer Ära und zwang viele Nationen dazu ihre politischen und militärischen Strategien grundlegend zu überdenken. 
 >>Cultural Analyst: Also, was wir hier beobachten ist echt spannend – die Napoleonischen Kriege haben nicht nur militärisch und politisch alles auf den Kopf gestellt, sondern auch gesellschaftlich viel verändert. Besonders interessant finde ich die Rolle der Frauen damals, die sich stärker in sozialen und politischen Bewegungen engagierten.
>>Military Strategist: Ja genau! Und diese Veränderungen wurden durch strategische Entscheidungen noch verstärkt. Die Mobilisierung großer Teile der Bevölkerung hat echt einiges durcheinandergebracht und zu einer Umstrukturierung der sozialen Hierarchien geführt.
>>Historian: Richtig! Und das sieht man auch in den Medienformen dieser Zeit. Viele dieser Veränderungen wurden dokumentiert und beeinflusst durch Kunst und Literatur.
>>Cultural Analyst: Im kulturellen Kontext sehen wir auch, wie diese Werke die gesellschaftlichen Umwälzungen widerspiegeln. Man könnte meinen—
>>Military Strategist (unterbricht): Entschuldigung für das Unterbrechen! Das erinnert mich gerade an etwas – habt ihr schon mal darüber nachgedacht, wie diese künstlerischen Werke vielleicht sogar als Propaganda genutzt wurden?
>>Cultural Analyst: Interessanter Punkt! Ja, tatsächlich gibt es einige Beispiele dafür – zum Beispiel wurde Kunst oft verwendet um bestimmte Ideologien zu verbreiten oder den Patriotismus zu stärken.
>>Historian: Absolut, und im historischen Kontext sehen wir weiterhin diese tiefgreifenden Veränderungen durch verschiedene Medienformen. Es ist faszinierend zu beobachten, wie sich das alles entwickelt hat. 
 >>Military Strategist: Also, was wir hier wirklich beachten sollten, ist die Flexibilität in strategischen Bündnissen während der Napoleonischen Kriege. Diese Lektionen sind heute relevant, um neue Allianzen zu bilden und innovative Lösungen zu entwickeln. Was denkt ihr darüber?
>>Cultural Analyst: Ja, das stimmt. Wenn wir die gesellschaftlichen Veränderungen dieser Zeit betrachten, sehen wir nicht nur neue soziale Bewegungen, sondern auch eine Art kulturelle Renaissance. Diese könnten uns helfen, kreative Ansätze in Bildung und sozialem Miteinander zu entwickeln. Hat jemand konkrete Beispiele im Kopf?
>>Historian: Absolut! Die rasche Entwicklung von Kommunikations- und Transportmitteln damals war beeindruckend. Das könnte uns heute inspirieren, neue Wege in der globalen Vernetzung und Logistik zu finden. Vielleicht können wir über spezifische Technologien sprechen?
>>Military Strategist: Gute Idee! Napoleons Russlandfeldzug zeigt deutlich die Folgen mangelnder Vorbereitung. Im modernen Kontext bedeutet das für Unternehmen, ihre Lieferketten effizienter zu gestalten. Kennt jemand aktuelle Fallstudien dazu?
>>Cultural Analyst: Interessant! Ich denke an die sozialen Bewegungen nach den Kriegen, wie sie Innovationen vorangetrieben haben. Könnten diese historischen Lektionen auf moderne Bildungsreformen angewendet werden? Was meint ihr dazu?
>>Historian: Das ist ein guter Punkt über die gesellschaftlichen Umwälzungen; ich denke auch an die technologischen Innovationen dieser Zeit wie die Eisenbahn oder Telegrafie – sie revolutionierten Kommunikation und Transport.
>>Military Strategist: Genau! Und wenn wir über strategische Fehler sprechen, sollten wir auch andere historische Feldzüge analysieren – vielleicht gibt es Parallelen zur heutigen Unternehmensstrategie. 
 >>Historian: Die Napoleonischen Kriege haben nicht nur die Militärstrategien verändert, sondern auch die Gesellschaft stark beeinflusst. 

>>Cultural Analyst: Ja, das stimmt. Diese Konflikte haben politische Grenzen verschoben und soziale Strukturen verändert. Das hat neue Möglichkeiten für Innovationen in Bildung und sozialem Miteinander eröffnet.

>>Military Strategist: Genau, und wir dürfen nicht vergessen, dass die strategischen Bündnisse und Koalitionen während dieser Zeit entscheidend waren.

>>Historian (unterbricht): Entschuldigung! Ich wollte noch hinzufügen, dass auch Kommunikationstechnologien eine wichtige Rolle gespielt haben.

>>Military Strategist: Ja klar! Diese Flexibilität in den Allianzen könnte uns heute inspirieren, neue Wege der Zusammenarbeit zu finden.

>>Historian: Und diese neuen Kommunikations- und Transporttechnologien könnten uns heute helfen, unsere globale Vernetzung zu verbessern.

>>Cultural Analyst: Das führt uns zu einem weiteren wichtigen Aspekt – die kulturelle Renaissance, die durch diese Kriege ausgelöst wurde.

>>Military Strategist (überlappt): ...und das gilt auch für heutige Innovationsstrategien.

>>Historian (lächelt): Moment mal! Lasst uns einen Punkt nach dem anderen besprechen.

>>Cultural Analyst: Okay! Man könnte meinen... 
 >>Historian: Wenn wir über Innovation sprechen, können wir die Napoleonischen Kriege als ein Beispiel für strategische Anpassungen betrachten. Diese ständigen Veränderungen in den Koalitionen und die Notwendigkeit neuer militärischer Taktiken erforderten innovatives Denken. Diese Flexibilität ist auch heute entscheidend für den Erfolg von Organisationen.

>>Military Strategist: Ja, das stimmt. Die Napoleonischen Kriege waren nicht nur militärische Herausforderungen, sondern auch eine Plattform für strategische Innovationen. Die Fähigkeit, Schwächen der Gegner auszunutzen und sich anzupassen war entscheidend. Im Krieg ist alles möglich... das zeigt uns, wie wichtig es ist, flexibel zu bleiben.

>>Cultural Analyst: Genau! Im kulturellen Kontext haben die Napoleonischen Kriege nicht nur militärische Innovationen hervorgebracht, sondern auch tiefgreifende gesellschaftliche Veränderungen. Krisen führen oft zu neuen Ideen und Lösungen. Es ist faszinierend zu sehen, wie die Gesellschaft damals reagierte.

>>Historian: Das führt uns zu einem weiteren wichtigen Punkt: die Rolle der Kommunikationstechnologien während der Napoleonischen Kriege. Diese Technologien haben nicht nur militärische Operationen erleichtert, sondern auch den Informationsfluss innerhalb der Gesellschaft revolutioniert. Man könnte argumentieren, dass dies eine frühe Form von Netzwerken war.

>>Military Strategist: Interessant! Und diese frühen Kommunikationsnetzwerke ermöglichten schnellere Entscheidungen und Anpassungen auf dem Schlachtfeld – etwas, das moderne Organisationen ebenfalls nutzen können.

>>Cultural Analyst: Absolut! Und im kulturellen Kontext sehen wir ähnliche Muster. Die ständige Notwendigkeit zur Anpassung hat Kreativität gefördert – ein Beweis dafür wie Krisen oft als Katalysatoren wirken können.

>>Historian: Wenn wir über wirtschaftliche Innovation sprechen... während dieser Zeit wurden neue Finanzinstrumente entwickelt um umfangreiche Kriegsanstrengungen zu finanzieren – ein weiteres Beispiel dafür wie Krisen innovative Lösungen hervorbringen können.

>>Military Strategist: Das zeigt deutlich wie wichtig Flexibilität ist – sowohl damals als auch heute in modernen Organisationen.

>>Cultural Analyst: Richtig! Diese wirtschaftlichen Innovationen hatten tiefgreifende Auswirkungen auf die Gesellschaft – sie veränderten Handelsstrategien und förderten kreatives Denken unter extremem Druck. 
 >>Military Strategist: Also, was wir hier verstehen müssen, ist, dass die strategischen Bündnisse während der Napoleonischen Kriege entscheidend waren. Diese Allianzen haben nicht nur militärische Erfolge ermöglicht, sondern auch langfristige politische Veränderungen herbeigeführt. Für zukünftige Foren sollten wir uns darauf konzentrieren, wie diese historischen Lektionen auf moderne Kooperationsstrategien angewendet werden können.

>>Historian: Ja, das stimmt. Die Auswirkungen dieser Bündnisse waren wirklich weitreichend. Zum Beispiel hat die Allianz zwischen Großbritannien und Preußen den politischen Kurs Europas nachhaltig verändert. Vielleicht könnten wir untersuchen, welche modernen Parallelen es gibt und wie solche Kooperationen heute aussehen könnten.

>>Cultural Analyst: Das ist wirklich interessant! Und wenn man sich die kulturellen Auswirkungen ansieht – nicht nur in der Kunst und Literatur –, sieht man auch Veränderungen in den gesellschaftlichen Strukturen. Ich denke da an die Rolle der Frauen nach den Kriegen. Wie haben diese Veränderungen moderne Identitäten beeinflusst?

>>Military Strategist: Absolut! Und wenn wir über taktische Innovationen sprechen – viele der damals entwickelten Strategien sind heute noch relevant. Es wäre spannend zu sehen, wie solche Ansätze in aktuellen militärischen Operationen genutzt werden könnten.

>>Historian: Genau! Und um auf deine Frage einzugehen, ich denke, dass die politischen Veränderungen durch diese Allianzen auch neue Machtverhältnisse geschaffen haben. Ein gutes Beispiel ist das Wiener Kongresssystem nach Napoleons Niederlage.

>>Cultural Analyst: Ja, das führt uns zu einem wichtigen Punkt – wie tiefgreifend diese Kriege unsere Gesellschaft verändert haben. Das könnte ein guter Ausgangspunkt für zukünftige Diskussionen sein.

>>Military Strategist: Stimmt! Vielleicht sollten wir auch darüber sprechen, wie kreative Ausdrucksformen wie Kunst und Literatur moderne Identitäten beeinflusst haben und welche neuen Möglichkeiten sich daraus ergeben.

>>Historian: Das fasst es gut zusammen. Wir haben über strategische Bündnisse und ihre langfristigen politischen Auswirkungen sowie kulturelle Veränderungen durch die Napoleonischen Kriege gesprochen. Eine neue Möglichkeit wäre es zu untersuchen, wie kreative Ausdrucksformen moderne Identitäten beeinflusst haben und historische Lektionen auf heutige Kooperationsstrategien anzuwenden.

>>Cultural Analyst: Ehrlich gesagt finde ich es spannend zu sehen, wie tiefgreifend diese Kriege unsere Gesellschaft verändert haben. Das könnte ein guter Ausgangspunkt für zukünftige Diskussionen sein."
