Title,Article,Tags,Personas,Summary,Meeting_Plan,Meeting
Der Tourismus spielt eine besondere Rolle. Die Region Paris ist mit 42 Millionen Besuchern im Jahr das zahlenmäßig bedeutendste Ziel weltweit, davon besuchen 35 Millionen die Stadt Paris. Luxushotels berechneten 2011 durchschnittlich etwa den dreifachen Preis, der in Berlin gezahlt wird. Ausländische Touristen brachten 2016 Einnahmen ","[""Paris"", ""\u00cele-de-France"", ""Sehensw\u00fcrdigkeiten"", ""Geschichte von Paris"", ""Demografie""]","[{'role': 'Historian', 'description': 'A knowledgeable historian specializing in European history, particularly the history of Paris.', 'expertise_area': 'History', 'perspective': 'Historical Context', 'speaking_style': {'tone': 'formal and reserved, occasionally enthusiastic when discussing historical events', 'language_complexity': 'complex language with technical terms and historical jargon, frequent use of metaphors and analogies', 'communication_style': 'collaborative and inquisitive, often uses rhetorical questions to engage the audience', 'sentence_structure': 'long and complex sentences with subordinate clauses, varied sentence length depending on the topic', 'formality': 'formal', 'other_traits': 'uses pauses effectively to emphasize points, occasionally interrupts to correct inaccuracies'}, 'personalized_vocabulary': {'filler_words': ['Ähm', 'Also', 'Halt'], 'catchphrases': ['Im Grunde genommen', 'Wie Sie wissen', 'Es ist wichtig zu beachten'], 'speech_patterns': [""frequent use of introductory phrases like 'Lassen Sie uns betrachten'"", ""'Man könnte sagen' as a way to introduce opinions""], 'emotional_expressions': ['Lachen', ""'Unglaublich!'"", ""'Faszinierend!'""]}, 'social_roles': ['Information Giver', 'Evaluator-Critic'], 'social_roles_descr': ['Shares relevant information, data or research that the group needs to make informed decisions.', 'Analyzes and critically evaluates proposals or solutions to ensure their quality and feasibility.']}, {'role': 'Geographer', 'description': 'An expert in urban geography and demographics, focusing on the spatial and social dynamics of Paris.', 'expertise_area': 'Geography', 'perspective': 'Spatial Analysis', 'speaking_style': {'tone': 'casual and enthusiastic, with a touch of optimism when discussing urban dynamics', 'language_complexity': 'moderate complexity with occasional technical terms related to geography, uses storytelling to illustrate points', 'communication_style': 'collaborative and engaging, often poses rhetorical questions to provoke thought', 'sentence_structure': 'medium-length sentences with clear structure, frequent use of exclamations to emphasize key ideas', 'formality': 'semi-formal', 'other_traits': 'uses rhythm in speech for emphasis, occasionally pauses for dramatic effect'}, 'personalized_vocabulary': {'filler_words': ['Na ja', 'Ehrlich gesagt', 'Tja'], 'catchphrases': ['Im Großen und Ganzen', 'Das ist der springende Punkt', 'Es lässt sich nicht leugnen'], 'speech_patterns': [""often starts sentences with 'Interessanterweise'"", ""'Man könnte meinen' as a way to introduce hypotheses""], 'emotional_expressions': ['Lächeln', ""'Erstaunlich!'"", ""'Wunderbar!'""]}, 'social_roles': ['Coordinator', 'Blocker'], 'social_roles_descr': ['Connects the different ideas and suggestions of the group to ensure that all relevant aspects are integrated.', ""Frequently opposes ideas and suggestions without offering constructive alternatives and delays the group's progress.""]}, {'role': 'Cultural Expert', 'description': 'A specialist in French culture and arts, with a deep understanding of Parisian cultural landmarks and their significance.', 'expertise_area': 'Culture', 'perspective': 'Cultural Significance', 'speaking_style': {'tone': 'warm and engaging, often enthusiastic when discussing cultural topics', 'language_complexity': 'rich language with artistic vocabulary, frequent use of analogies and vivid descriptions', 'communication_style': 'collaborative and expressive, encourages dialogue and shares personal anecdotes', 'sentence_structure': 'varied sentence length with a mix of concise statements and elaborate descriptions', 'formality': 'semi-formal to informal depending on the audience', 'other_traits': 'uses rhetorical devices like repetition for emphasis, occasionally uses humor to lighten discussions'}, 'personalized_vocabulary': {'filler_words': ['Äh', 'Nun', 'Wissen Sie'], 'catchphrases': ['Im Herzen der Sache', 'Das ist von großer Bedeutung', 'Kunstvoll gesprochen'], 'speech_patterns': [""frequently begins with 'Interessant zu bemerken'"", ""'Man könnte sich vorstellen' as a way to introduce scenarios""], 'emotional_expressions': ['Lächeln', ""'Fantastisch!'"", ""'Beeindruckend!'""]}, 'social_roles': ['Opinion Giver', 'Encourager'], 'social_roles_descr': ['Shares his or her views and beliefs on topics under discussion.', 'Provides positive feedback and praise to boost the morale and motivation of group members.']}, {'role': 'Tourism Specialist', 'description': 'An expert in tourism management with insights into the attractions and visitor dynamics of Paris.', 'expertise_area': 'Tourism', 'perspective': 'Visitor Experience', 'speaking_style': {'tone': 'enthusiastic and welcoming, often optimistic when discussing tourism trends', 'language_complexity': 'moderate complexity with practical vocabulary, uses vivid descriptions and storytelling to engage listeners', 'communication_style': 'engaging and informative, encourages questions and feedback from the audience', 'sentence_structure': 'medium-length sentences with clear structure, frequent use of questions to involve participants', 'formality': 'semi-formal', 'other_traits': 'uses humor to make discussions lively, effectively uses pauses for emphasis'}, 'personalized_vocabulary': {'filler_words': ['Also', 'Genau', 'Ehrlich gesagt'], 'catchphrases': ['Das ist der Schlüssel zum Erfolg', 'Im Mittelpunkt steht', 'Es ist ein Muss'], 'speech_patterns': ['Oftmals beginnen wir mit', ""'Man könnte sich fragen' as a way to introduce inquiries""], 'emotional_expressions': ['Lachen', ""'Fantastisch!'"", ""'Unglaublich!'""]}, 'social_roles': ['Initiator-Contributor', 'Gatekeeper'], 'social_roles_descr': ['Contributes new ideas and approaches and helps to start the conversation or steer it in a productive direction.', 'Ensures that all group members have the opportunity to express their opinions and encourages participation.']}]","Das Treffen konzentrierte sich auf die Stadt Paris, ihre Bedeutung und Entwicklung. Paris ist die Hauptstadt Frankreichs und ein bedeutendes politisches, wirtschaftliches und kulturelles Zentrum. Mit über 2 Millionen Einwohnern ist sie eine der größten Städte Europas. Die Metropolregion umfasst mehr als 12 Millionen Menschen. Paris ist bekannt für seine hohe Bevölkerungsdichte und seine Rolle als Verkehrsknotenpunkt mit mehreren Flughäfen und Bahnhöfen. Die Stadt hat eine reiche Geschichte, die von der keltischen Siedlung Lutetia bis zur modernen Metropole reicht. Sehenswürdigkeiten wie der Eiffelturm und der Louvre ziehen jährlich Millionen Touristen an.

Die geografische Lage von Paris im Pariser Becken sowie das gemäßigte Klima wurden hervorgehoben. Die Seine teilt die Stadt in zwei Uferhälften, wobei das rechte Ufer für Handel und Finanzen bekannt ist, während das linke Ufer intellektuell geprägt ist. Historisch bedeutende Inseln wie Île de la Cité sind zentrale Bestandteile der Stadtentwicklung.

Paris spielt auch eine wichtige Rolle in der internationalen Politik mit Organisationen wie UNESCO und OECD vor Ort. Die Stadtregierung unter Bürgermeisterin Anne Hidalgo wurde ebenfalls thematisiert, ebenso wie die demografischen Herausforderungen durch Gentrifizierung und Einwanderung.","[""Scene 1: Warm Welcome\nTLDR: Brief greetings and setting the tone for collaboration.\n- Exchange of friendly hellos\n- Quick overview of meeting objectives\n- Encouragement for open dialogue and spontaneous contributions"", ""Scene 2: Historical Context of Paris\nTLDR: Discussing Paris' rich history from Lutetia to modern times.\n- Historian shares insights on historical evolution\n- Discussion on key historical landmarks like \u00cele de la Cit\u00e9\n- Participants share personal experiences related to Paris' history"", ""Scene 3: Geographical Significance\nTLDR: Exploring the spatial dynamics and demographics of Paris.\n- Geographer explains the city's layout and Seine division\n- Conversation about demographic challenges like gentrification\n- Spontaneous discussion on urban development trends"", ""Scene 4: Cultural Landmarks and Their Impact\nTLDR: Delving into the cultural significance of Parisian landmarks.\n- Cultural Expert highlights major attractions like the Louvre and Eiffel Tower\n- Sharing anecdotes about cultural events in Paris\n- Participants discuss their favorite cultural spots"", ""Scene 5: Tourism Dynamics in Paris\nTLDR: Understanding visitor experiences and tourism management.\n- Tourism Specialist talks about tourist attractions and visitor trends\n- Open floor for sharing memorable travel stories in Paris\n- Brainstorming ideas for enhancing virtual tourism experiences"", ""Scene 6: Political Influence and International Role\nTLDR: Examining Paris' role in global politics with organizations like UNESCO.\n- Discussion led by participants on political impact and international presence \n- Debate on current political challenges faced by the city government \n - Personal reflections on how politics shape urban life"", ""Scene 7: Wrap-Up & Next Steps \n TLDR : Summarizing key points discussed, planning future collaborations. \n - Recap of main takeaways from each segment \n - Setting action items for coordinated tasks/projects \n - Light-hearted closing remarks, encouraging continued engagement""]",">>Tourism Specialist: Hallo zusammen! Ich freue mich, dass wir heute hier sind, um über die faszinierende Welt des Tourismus zu sprechen. Im Mittelpunkt steht unsere Zusammenarbeit und der Austausch von Ideen.

>>Historian: Ja, genau. Die historische Bedeutung von Paris ist entscheidend für unser Thema. Zum Beispiel hat die Französische Revolution die Stadt nachhaltig geprägt und beeinflusst bis heute ihre kulturelle Vielfalt.

>>Geographer: Interessant! Und diese historische Entwicklung spiegelt sich auch in der urbanen Struktur wider. Die Dichte und das Layout der Stadt haben sich im Laufe der Jahrhunderte verändert und bieten ein spannendes Studienfeld.

>>Cultural Expert: Absolut, Paris ist wie ein lebendiges Museum. Nehmen wir den Louvre – er beherbergt nicht nur klassische Meisterwerke, sondern auch temporäre Ausstellungen, die moderne Kunst präsentieren.

>>Historian: Genau! Diese Mischung aus Geschichte und Moderne zeigt sich auch in den sozialen Strukturen der Stadt. Wie hat sich das auf die wirtschaftliche Entwicklung ausgewirkt?

>>Geographer: Das ist ein guter Punkt. Die urbane Dichte wirkt als sozialer Katalysator und beeinflusst das tägliche Leben stark. Es wäre interessant zu sehen, wie dies die Interaktion zwischen verschiedenen Kulturen fördert.

>>Cultural Expert: Ja, und diese Interaktionen führen oft zu neuen künstlerischen Bewegungen. Denken Sie an die Surrealisten im 20. Jahrhundert – sie fanden in Paris eine Plattform für ihre Innovationen.

>>Historian: Spannend! Vielleicht könnten wir untersuchen, wie solche Bewegungen durch historische Ereignisse inspiriert wurden? Das könnte uns helfen, aktuelle Trends besser zu verstehen.

>>Geographer: Gute Idee! Und vielleicht können wir auch analysieren, wie geografische Merkmale diese Entwicklungen begünstigt haben. 
 >>Historian: Die Île de la Cité ist wirklich das Herzstück von Paris. Ihre Entwicklung von einer keltischen Siedlung zu einem globalen Zentrum zeigt die faszinierende Reise durch die Zeit. Wusstet ihr, dass hier die ersten Pariser Stadtmauern standen?

>>Cultural Expert: Absolut spannend! Und wenn man sich die Kunst und Architektur ansieht, ist es wie ein lebendiges Geschichtsbuch. Die Kathedrale Notre-Dame erzählt Geschichten aus verschiedenen Epochen – habt ihr schon mal an einer Führung teilgenommen?

>>Geographer: Ja, und was ich besonders interessant finde, ist die urbane Struktur der Insel. Sie zeigt wunderbar, wie historische und moderne Strukturen überlagert sind. Habt ihr bemerkt, wie sich das auf den Verkehr auswirkt?

>>Tourism Specialist: Genau! Diese Mischung aus Geschichte und lebendiger Kultur macht jeden Besuch unvergesslich. Ich erinnere mich an meinen letzten Spaziergang dort – es fühlte sich an wie ein lebendiges Museum.

>>Historian: Das stimmt! Und ihre Entwicklung spiegelt nicht nur architektonische Veränderungen wider, sondern auch soziale Umbrüche. Zum Beispiel während der Französischen Revolution war sie ein zentraler Schauplatz.

>>Cultural Expert: Ja, diese Insel ist mehr als nur ein historisches Zentrum; sie ist eine Bühne für kulturelle Ereignisse. Wisst ihr noch das große Konzert vor der Notre-Dame letztes Jahr? Das war beeindruckend!

>>Geographer: Interessanterweise beeinflussen geografische Gegebenheiten stark die urbane Dynamik von Paris. Besonders auf der Île de la Cité sieht man das deutlich – einfach erstaunlich!

>>Tourism Specialist: Wenn man dort spazieren geht, fühlt es sich wirklich an wie ein lebendiges Museum! Diese historische Tiefe bereichert das touristische Erlebnis ungemein.

>>Historian: Lassen Sie uns betrachten... Wie diese Insel nicht nur Kontinuität symbolisiert sondern auch Transformation verkörpert – unglaublich!

>>Cultural Expert: Es gibt so viel zu entdecken! Die Kathedrale Notre-Dame allein erzählt Geschichten aus verschiedenen Epochen – beeindruckend! 
 >>Geographer: Das ist spannend, wie die Seine Paris in zwei unterschiedliche Hälften teilt. Rechts haben wir den Handel und die Finanzen, links das Quartier Latin als intellektuelles Zentrum. Diese Trennung hat echt soziale und kulturelle Auswirkungen!

>>Historian: Genau! Und wenn man sich die Geschichte anschaut, sieht man, dass diese Trennung schon bei den Römern begann und sich durch die Französische Revolution zog. Besonders interessant finde ich, wie politische Ereignisse diese Aufteilung verstärkt haben.

>>Cultural Expert: Ja, und heute beeinflusst diese Dynamik auch die Kunstszene. Im Quartier Latin gibt es viele kreative Zentren, wo Künstler aus aller Welt zusammenkommen. Hast du mal von der jährlichen Kunstmesse dort gehört?

>>Tourism Specialist: Absolut! Die zieht jedes Jahr Tausende an. Und das linke Ufer mit seinen künstlerischen Highlights ist ein Muss für jeden Besucher. Aber was denkt ihr über die touristische Entwicklung auf der anderen Seite der Seine?

>>Historian: Spannend ist auch zu sehen, wie während der Industrialisierung und Belle Époque Paris sich enorm verändert hat. Diese Transformationen haben sicherlich zur heutigen Stadtstruktur beigetragen.

>>Geographer: Stimmt! Und ehrlich gesagt zeigt sich Gentrifizierung besonders im 15. Arrondissement stark. Früher war es eher ein Arbeiterviertel; jetzt leben dort wohlhabendere Familien. Was meint ihr dazu? Könnte das andere Stadtteile beeinflussen?

>>Cultural Expert: Gute Frage! Vielleicht könnte man im Quartier Latin ähnliche Entwicklungen beobachten? Dort vereinen sich Kunst und Intellektualität auf eine Weise, die Raum für Austausch schafft.

>>Tourism Specialist: Genau! Diese Mischung bietet Touristen ein einzigartiges Erlebnis. Aber wie können wir sicherstellen, dass solche Viertel ihre Authentizität bewahren?

>>Historian: Faszinierend! Die räumliche Trennung durch die Seine spiegelt wirklich viele soziale und wirtschaftliche Entwicklungen wider.

>>Geographer: Na ja... Die hohe Bevölkerungsdichte von Paris führt natürlich zu Herausforderungen wie Gentrifizierung im 15. Arrondissement. Wie könnten wir diese Herausforderungen angehen? Vielleicht sollten wir darüber nachdenken, ob städtische Initiativen helfen könnten.

>>Cultural Expert: Ja genau! Das Quartier Latin zeigt wunderbar auf wie Kunst und Intellektualität zusammenkommen können.

>>Tourism Specialist: Vielleicht könnten wir eine Arbeitsgruppe bilden, um Lösungen für diese Themen zu entwickeln? Es wäre wichtig, konkrete Schritte zu planen. 
 >>Cultural Expert: Wissen Sie, der Louvre ist nicht nur ein Museum, sondern auch ein lebendiges Geschichtsbuch. Es bewahrt die Kunst und Kultur über Jahrhunderte hinweg. Und dann haben wir den Eiffelturm – ein Symbol für die industrielle Revolution und den Fortschritt des späten 19. Jahrhunderts.

>>Historian: Genau! Der Eiffelturm verkörpert die Innovationskraft dieser Ära. Aber lassen Sie uns nicht vergessen, dass Paris auch ein Zentrum des Exils war. Denken Sie an Persönlichkeiten wie Victor Hugo oder Heinrich Heine, die hier Zuflucht fanden und ihre Werke beeinflussten.

>>Geographer: Das ist wirklich spannend! Die urbane Struktur von Paris spiegelt diese Geschichte wider. Zum Beispiel das Quartier Latin – bekannt für seine intellektuelle und künstlerische Szene, wo viele Exilanten lebten.

>>Tourism Specialist: Ehrlich gesagt, Paris bietet eine unglaubliche Vielfalt an Erlebnissen! Neben den berühmten Sehenswürdigkeiten gibt es viele versteckte Juwelen wie das charmante Viertel Montmartre mit seinen kleinen Cafés und Galerien.

>>Cultural Expert: Was ich besonders faszinierend finde, sind die Straßenkünstler in Paris. Sie tragen zur kulturellen Lebendigkeit der Stadt bei und ziehen sowohl Einheimische als auch Touristen an.

>>Historian: Absolut! Diese Künstler sind Teil einer langen Tradition von Kreativität in Paris. Übrigens, wussten Sie, dass Picasso einige seiner bedeutendsten Werke hier geschaffen hat?

>>Geographer: Interessant! Und wenn man sich die Stadtlandschaft ansieht – sie verbindet sich nahtlos mit kulturellen Ereignissen wie dem jährlichen Jazz-Festival im Parc Floral de Paris.

>>Tourism Specialist: Genau! Viele Touristen sind überrascht von der Vielfalt der Erlebnisse abseits der ausgetretenen Pfade. Ich erinnere mich an einen Besucher, der begeistert war von einem kleinen Buchladen am Canal Saint-Martin.

>>Cultural Expert: Ja, diese Orte machen das Stadtbild lebendig und bieten eine einzigartige Atmosphäre für alle Besucher.

>>Historian: Unglaublich! Wenn wir über die kulturelle Bedeutung sprechen – diese Geschichten des Exils sind ebenso Teil der Landschaft wie Notre-Dame oder der Eiffelturm.

>>Geographer: Interessanterweise zeigt sich in der urbanen Struktur von Paris nicht nur ihre Geschichte; sie ist auch ein Katalysator für kulturelle Entwicklungen. Das macht sie zu einem lebendigen Kunstwerk! 
 >>Tourism Specialist: Also, Paris ist wirklich ein Paradies für Touristen! Die Vielfalt der Erlebnisse, von den versteckten Juwelen bis zu den Straßenkünstlern, macht die Stadt einzigartig. Diese Mischung aus bekannten Sehenswürdigkeiten und unerwarteten Entdeckungen ist entscheidend für den Erfolg im Tourismus.

>>Historian: Ja, das stimmt. Wenn wir uns die historische Entwicklung von Paris ansehen, als Stadt des Exils und der kulturellen Vielfalt, sehen wir, wie diese Geschichte das heutige touristische Erlebnis prägt. Viele dieser versteckten Juwelen haben ihre Wurzeln in dieser reichen Vergangenheit.

>>Geographer: Genau! Die urbane Struktur von Paris spielt eine große Rolle dabei. Die Dichte und Vielfalt der Stadtteile bieten nicht nur kulturelle, sondern auch soziale Dynamiken, die Besucher faszinieren. Zum Beispiel das Marais-Viertel mit seiner Mischung aus historischen Gebäuden und modernen Galerien.

>>Cultural Expert: Absolut! Es ist spannend zu sehen, wie die kulturelle Vielfalt von Paris durch seine Kunstszene und Straßenkünstler verstärkt wird. Diese lebendige Atmosphäre trägt wesentlich zur Anziehungskraft der Stadt bei.

>>Historian: Wenn wir über virtuelle Tourismus-Erfahrungen sprechen, sollten wir auch die historische Tiefe von Paris einbeziehen. Digitale Darstellungen könnten mehr als nur berühmte Sehenswürdigkeiten umfassen – wie wäre es mit virtuellen Spaziergängen durch historische Viertel mit interaktiven Anekdoten?

>>Geographer: Das wäre großartig! Eine virtuelle Tour durch verschiedene Arrondissements könnte Besuchern einen echten Einblick in die sozialen und kulturellen Dynamiken geben. Aber wir müssen auch bedenken, dass technische Herausforderungen bestehen – zum Beispiel die genaue Darstellung der komplexen städtischen Strukturen.

>>Cultural Expert: Wissen Sie was? Die Einbindung der lebendigen Kunstszene in virtuelle Rundgänge könnte Besuchern ein Gefühl für die kreative Energie der Stadt vermitteln. Allerdings müssten wir sicherstellen, dass diese digitalen Erlebnisse authentisch sind und nicht zu künstlich wirken.

>>Tourism Specialist: Genau! Diese Künstler sind im Herzen der Sache und könnten wirklich ein Highlight in virtuellen Touren sein. Man könnte sich vorstellen...

>>Historian: Unglaublich! Die Geschichten der Exilanten und kulturellen Bewegungen bieten eine faszinierende Grundlage für virtuelle Erlebnisse. Wenn wir diese Aspekte einbeziehen könnten... aber es wäre wichtig sicherzustellen, dass diese Geschichten korrekt dargestellt werden.

>>Geographer: Na ja... genau das macht Paris so besonders! Diese urbane Struktur bietet einfach unzählige Möglichkeiten für interaktive Erlebnisse. Wir sollten jedoch auch überlegen, wie man solche Projekte finanziert und welche technischen Ressourcen benötigt werden.

>>Cultural Expert: Fantastisch! Stellen Sie sich vor... Besucher schlendern virtuell durch Straßen voller Kunstwerke – das wäre doch etwas! Aber es muss gut geplant sein; vielleicht könnten wir Pilotprojekte starten um Feedback zu sammeln? 
 >>Historian: Ähm, wenn wir über Paris als Sitz der UNESCO sprechen, sollten wir die historische Bedeutung dieser Rolle nicht unterschätzen. Diese Institutionen sind ein Spiegel der welthistorischen Rolle, die Paris seit der Französischen Revolution innehat. Sie bewahren das kulturelle Erbe und bieten eine Plattform für den Dialog über globale Themen.

>>Geographer: Na ja, die geografische Lage von Paris ist wirklich entscheidend für seine politische Bedeutung. Die Stadt ist ein Knotenpunkt für internationale Organisationen wie UNESCO und beeinflusst sowohl urbane Dynamik als auch politische Interaktionen. Das bringt natürlich Herausforderungen für die Stadtregierung mit sich! Was denkt ihr darüber?

>>Cultural Expert: Wissen Sie, es ist faszinierend zu sehen, wie die kulturelle Bedeutung von Paris durch seine Rolle bei der UNESCO verstärkt wird. Diese Institutionen fördern den Austausch von Kulturgütern und tragen zur globalen Wahrnehmung von Paris als kulturelles Zentrum bei. Ich finde es besonders spannend, wie dies auch lokale Künstler inspiriert.

>>Tourism Specialist: Also, wenn wir über diese Aspekte sprechen, dürfen wir nicht vergessen, wie sie das touristische Erlebnis beeinflussen. Besucher aus aller Welt kommen nach Paris, um nicht nur Sehenswürdigkeiten zu genießen, sondern auch die einzigartige Atmosphäre einer Stadt zu erleben, die aktiv an globalen Diskussionen teilnimmt. Habt ihr Beispiele dafür gesehen?

>>Historian: Man könnte sagen, dass diese internationalen Organisationen in Paris Brücken zwischen Vergangenheit und Gegenwart bauen. Sie bewahren das kulturelle Erbe und adressieren moderne Herausforderungen – eine faszinierende Verbindung! Zum Beispiel gibt es viele Programme zur Erhaltung historischer Gebäude.

>>Geographer: Ehrlich gesagt verschärft die Dichte an internationalen Institutionen auch soziale Herausforderungen. Die Stadtregierung muss ständig zwischen internationaler Bedeutung und lokalen Bedürfnissen balancieren – das ist wirklich komplex! Vielleicht könnten mehr soziale Projekte helfen?

>>Cultural Expert: Nun ja, man könnte sich vorstellen, dass diese Institutionen nicht nur politisch wichtig sind, sondern auch künstlerisch inspirierend wirken. Sie beflügeln die kreative Atmosphäre der Stadt und fördern den Austausch von Kulturgütern. Ich habe gehört, dass viele Künstler hierher ziehen wegen dieser inspirierenden Umgebung.

>>Tourism Specialist: Genau! Und diese politische Rolle zieht Besucher an, die fasziniert sind von der Möglichkeit Teil einer Stadt zu sein, die aktiv an globalen Diskussionen teilnimmt. Das macht Paris so besonders als Reiseziel! Es wäre interessant zu wissen, ob dies langfristig positive Effekte auf den Tourismus hat.

>>Historian: Ähm... Wenn wir weiter darüber nachdenken... Es ist bemerkenswert zu sehen, wie diese Organisationen Brücken zwischen Kulturen bauen und gleichzeitig moderne politische Herausforderungen adressieren. Welche konkreten Maßnahmen werden ergriffen?

>>Geographer: Tja... Interessanterweise verstärkt dies nicht nur seine politische Rolle sondern verschärft auch soziale Herausforderungen – ein Balanceakt für die Regierung! Vielleicht sollten wir uns überlegen welche Strategien andere Städte anwenden?

>>Cultural Expert: Fantastisch! Diese Verbindungen schaffen eine lebendige kreative Atmosphäre in der Stadt – wirklich beeindruckend! Ich denke da zum Beispiel an Berlin oder Wien. 
 >>Tourism Specialist: Also, um das Ganze zusammenzufassen: Wir haben über die Vielfalt der Erlebnisse in Paris gesprochen, von den bekannten Sehenswürdigkeiten bis hin zu den versteckten Juwelen. Es ist wichtig, diese Balance zwischen Tradition und Innovation zu bewahren. Vielleicht könnten wir als nächsten Schritt eine Arbeitsgruppe bilden, um virtuelle Touren zu entwickeln, die sowohl historische als auch kulturelle Aspekte einbeziehen. Das wäre doch fantastisch!
>>Historian: Ja, das klingt spannend! Vielleicht könnte die Arbeitsgruppe sich darauf konzentrieren, wie wir historische Ereignisse interaktiv darstellen können. So könnten Besucher wirklich in die Geschichte eintauchen.
