Title,Article,Tags,Personas,Summary,Meeting_Plan,Meeting
An der Place de la Concorde beginnt die Prunk-, Pracht- und Paradestraße Avenue des Champs-Élysées, eine der großen und berühmten „Weltstraßen“. Die 1,5 Kilometer lange und 71 Meter breite Avenue bildet das Kernstück und Rückgrat der einzigartigen vom Osten zum Westen weisenden Axe historique, einer Sichtachse, die im Innenhof des Louvre beginnt, über den Tuileriengarten, die Place de la Concorde und den Triumphbogen bis zur Grande Arche und darüber hinaus reicht. Hier befinden wir uns schon jenseits der westlichen Ausfallstraße, in dem vier Kilometer außerhalb von Paris gelegenen Geschäftsviertel La Défense. Als unter Ludwig XIV. von dem Hofgärtner André Le Nôtre die ersten Bäume (Ulmen) der Champs-Élysées gepflanzt wurden (1670), führte sie noch durch freie Felder. Die beliebte Promenade der Pariser war damals die Straßenkette der aneinandergereihten Boulevards, die selten mit ihren verschiedenen Namen, sondern schlicht Les Grands Boulevards genannt werden.


Weltliche Bauwerke


Antike

Die ältesten Bauwerke der Stadt stehen im Quartier Latin an den Hängen des Montagne Sainte-Geneviève, auf dem sich ab 52 v. Chr. die Römer in dominanter Lage ansiedelten.
Die stark restaurierten Überreste der im 1. Jahrhundert n. Chr. erbauten Arena von Lutetia und die Ruinen der sogenannten Thermen von Cluny (in das Musée national du Moyen Âge) aus der Zeit um 200 n. Chr. sind die einzigen sichtbaren Spuren aus der gallo-römischen Epoche.


Mittelalter

Nach dem Untergang des Römischen Reiches entstanden zunächst vor allem Sakralbauten, während die in Paris weilenden fränkischen Teilkönige sich den ehemaligen Palast der römischen Statthalter auf der Île de la Cité zu eigen machten, der im Laufe der Jahrhunderte mehrmals vergrößert und umgebaut wurde und heute als Palais de la Cité bekannt ist.
Die ältesten erhaltenen Teile des Palais de la Cité sind die in der ersten Hälfte des 13. Jahrhunderts unter Ludwig IX. dem Heiligen von Pierre de Montreuil errichtete Palastkapelle Sainte-Chapelle und die unteren Partien des sogenannten Bonbec-Turmes an der Nordfassade. Die danebenliegenden beiden Tortürme Tour d’Argent (Silberturm) und Tour de César (auch Tour de Montgomery genannte) sowie der nach seiner Uhr Tour de l’Horloge genannte, im 19. Jahrhundert stark veränderte Eckturm entstanden etwas später unter Philippe IV. dem Schönen. Hinter der massiven Doppelturmanlage verbirgt sich die nach dem früheren Palastverwalter (Concierge) benannte Conciergerie, die bereits um 1400 als Gefängnis genutzt wurde und während der Revolution als „Wartesaal für die Guillotine“ diente.
Bereits bald nach 1358 war der Palais de la Cité als Königsresidenz aufgegeben worden, und zwar zu Gunsten des heute verschwundenen Hôtel Saint-Pol, der im Osten von Paris entstandenen Burg von Vincennes und der schon 1190 unter Philippe-Auguste entstandenen Wehranlage des früheren Louvre, deren mächtiger runder Bergfried seinerzeit das rechte Ufer beherrschte.
Das Stadtschloss Louvre, wie wir es heute kennen, ist das Ergebnis von zahlreichen Baukampagnen unter vielen Königen und umfasst Teile aus dem Mittelalter, der Renaissance, der Barockzeit, dem Zweiten Kaiserreich sowie das bedeutende, seit 1981 auf Wunsch des Staatspräsidenten François Mitterrand von dem Architekten Ieoh Ming Pei geschaffene „unterirdische Reich“ des Louvre, das in erster Linie der Schaffung fehlender Infrastrukturen für das hier angesiedelte Museum dient.


Frühe Neuzeit
Aus der zweiten Hälfte des 15. Jahrhunderts und dem 16. Jahrhundert stammen mehrere interessante, hierzulande hôtels particuliers genannte Stadtpaläste des Marais-Viertels, wie beispielsweise das Hôtel de Sens, das zwischen 1475 und 1507 im Auftrag von Tristan von Salazar, Erzbischof von Sens, entstand, das ab 1548 für den Gerichtspräsidenten Jacques de Ligneris errichtete Hôtel Carnavalet, das um 1585 für Diane de France entworfene und jetzt Louis Métezeau zugeschriebene Hôtel d’Angoulême (heutige Bibliothèque historique de la ville de Paris) sowie der Hôtel de Sully genannte Stadtpalast des Finanzinspektors Mesme Gallet, den Roland de Neufbourg 1630 nach den Plänen von Jean I. Androuet du Cerceau vollendete. Er ist heute Sitz des Denkmalpflegevereins (Centre des monuments nationaux).

Auf dem linken Ufer ließ unterdessen Jacques d’Amboise, Abt von Cluny zwischen 1485 und 1510, neben den Ruinen der römischen Thermen das Hôtel de Cluny vollkommen neu erbauen, das den Äbten von Cluny seit 1330 als Stadtresidenz diente. Das dort untergebrachte Musée national du Moyen Âge (Museum des Mittelalters) besitzt den einzigartigen Millefleurs Wandbehang mit Szenen zum Thema der La Dame à la licorne („Die Dame mit dem Einhorn“). Mit dem Brunnen Fontaine des Innocents schufen Pierre Lescot und Jean Goujon 1547 bis 1549 ein Werk, das heute zu den wichtigsten verbleibenden Zeugnissen der frühen Renaissance in Paris gezählt wird. Allerdings wurde die Anordnung der drei originalen Brunnenseiten, die ursprünglich eine Tribüne bildeten, in der zweiten Hälfte des 19. Jahrhunderts vollkommen verändert und eine vierte Seite von Pajou und Houdon hinzugefügt.
Das ursprüngliche Pariser Hôtel de Ville (Rathaus) war zwischen 1551 und 1628 auf Anregung von König Franz I. nach Plänen des italienischen Architekten Domenico da Cortona, genannt Il Boccador(o), im Stil der Renaissanceschlösser des Loiretals entstanden. Es brannte 1871 während des Aufstandes der Kommune ab. Das heutige Rathaus ist eine Kopie des Vorgängerbaus. Das Gebäude im Stil des Klassizismus mit 146 Statuen auf der Fassade wurde in den Jahren 1874 bis 1882 nach Plänen der Architekten Théodore Ballu (1817–1885) und Édouard Deperthes (1833–1898) errichtet. Es befindet sich im 4. Arrondissement an der ehemaligen Place de Grève, der heutigen Place de l’Hôtel-de-Ville.


17. Jahrhundert

Dem Palais du Luxembourg, im Jahre 1615 von Maria von Medici als Landschloss weit außerhalb der damaligen Stadtgrenzen bei dem Architekten Salomon de Brosse in Auftrag gegeben, liegen wenigstens teilweise Pläne des Palazzo Pitti in Florenz zugrunde, in dem die Königinmutter und Regentin ihre Kindheit verlebt hatte. Die Gartenseite erfuhr im 19. Jahrhundert erhebliche Veränderungen. Hier tagt seit 1852 der französische Senat, der den zu dem Palais gehörenden, früher königlichen, heute staatlichen Schlosspark Jardin du Luxembourg der Öffentlichkeit zur Verfügung stellt.
Der Palais Royal, nördlich vom Louvre, wurde in den Jahren 1627 bis 1629 von Jacques Lemercier für den ersten Minister Ludwigs XIII., Kardinal Richelieu, gebaut, kam nach dessen Tod an die Krone und nahm seinen heutigen Namen an. Dort wuchs Ludwig XIV. auf. Heute beherbergt der Palais den Staatsrat (Conseil d’État), den Verfassungsrat (Conseil constitutionnel), das Kultusministerium, aber auch die Comédie-Française. An den Hof, in dem Daniel Buren ein interessantes begehbares Kunstwerk schuf, schließt sich ein schöner Garten an.
Weitere wichtige Bauten des 17. Jahrhunderts sind die Barockkirche des Val-de-Grâce-Klosters, das Collège des Quatre-Nations, heute Sitz des Institut de France, das Hôtel des Invalides und das Observatoire.


18. Jahrhundert

Der Élysée-Palast ursprünglich nach seinem Auftraggeber Hôtel d’Évreux und später nach der nahegelegenen Avenue des Champs-Élysées benannt, ist der Amtssitz des französischen Staatspräsidenten. Erbaut wurde er in den Jahren von 1718 bis 1722 nach den Plänen des Architekten Armand-Claude Mollet, der das umliegende Grundstück kurz zuvor an den Grafen von Évreux, Henri-Louis de la Tour d’Auvergne, verkauft hatte und von diesem nun mit dem Bau einer Residenz beauftragt wurde. Nach dem Tod des Grafen im Jahre 1753 erwarb Jeanne-Antoinette Poisson, besser bekannt als Marquise de Pompadour, den Palast und ließ ihn durch ihren Architekten im Inneren stilvoll herrichten. Der Garten wurde auf ihre Vorstellungen hin vergrößert und um Säulengänge und Lauben sowie ein Labyrinth erweitert. Der Palast liegt nördlich der Seine in einer der weltweit wichtigsten Einkaufsstraßen Rue du Faubourg Saint-Honoré, nur einige Schritte von den Champs-Élysées und wenige Gehminuten von dem Concordenplatz entfernt.
Der Palais Bourbon entstand ebenfalls im 18. Jahrhundert, wurde aber später mit einer klassizistischen Fassade versehen. Er liegt am südlichen Ufer der Seine und gab dem 7. Arrondissement seinem Namen. In ihm tagt die Französische Nationalversammlung. Die Kirche Sainte Marie Madeleine liegt dem Palast auf dem nördlichen Ufer in einer Sichtachse gegenüber.

Unter Ludwig XV. entstanden die grandiosen Bauten von Ange-Jacques Gabriel, welche die Nordseite der Place de la Concorde bilden; die La Monnaie oder Hôtel des Monnaies genannte Münzprägewerkstatt, zwischen 1771 und 1777 von Jacques Denis Antoine geschaffen, und die École militaire (Militärschule), ebenfalls ein Werk von Ange-Jacques Gabriel. Der weitaus imposanteste, von weit her sichtbare Bau aus dieser Zeit ist jedoch das Panthéon, ein Kuppelbau, der sowohl in die sakralen als auch in die profanen Bauten der Stadt eingereiht werden kann, da er mehrmals seine Bestimmung gewechselt hat.
Das Panthéon wurde zwischen 1764 und 1790 von Jacques-Germain Soufflot und seinen Schülern als Klosterkirche für die damals hier befindliche Benediktinerabtei errichtet, deren Refektorium sowie ein Turm in dem nahegelegenen Lycée Henri IV erhalten sind, einer der ältesten und bekanntesten Schulen Frankreichs. Nach der Französischen Revolution 1789 wurde die Kirche zur nationalen Ruhmeshalle erklärt. Nach mehreren Umwidmungen im 19. Jahrhundert ist sie seit 1885 erneut Ruhmeshalle Frankreichs. Entsprechend illuster ist die Liste der hier beigesetzten Personen: Voltaire, Victor Hugo, Émile Zola, Jean-Jacques Rousseau, Pierre und Marie Curie. 1849 gelang dem Physiker Léon Foucault mit dem nach ihm benannten Pendel hier der empirische Nachweis der Erdrotation. Das Pendel befindet sich heute in der Kapelle der ehemaligen Abtei St-Martin-des-Champs, die Teil des Musée des arts et métiers geworden ist.


19. Jahrhundert

Das schönste, wenngleich nicht das repräsentativste Bauwerk des 1. Kaiserreiches schufen zwischen 1806 und 1808 Charles Percier und Fontaine mit dem in der sogenannten Cour Napoléon des Louvre errichteten Arc de Triomphe du Carrousel.
Noch während des Baus des Arc de Triomphe du Carrousel gab Napoléon I. 1806 den großen Triumphbogen an der Place de l’Étoile in Auftrag, der erst 1836 unter Louis-Philippe vollendet wurde. Als Inspiration diente der allerdings deutlich kleinere Titusbogen in Rom. Der Triumphbogen steht im Zentrum des Platzes, der seit 1970 Place Charles de Gaulle – Étoile heißt, am westlichen Ende der Avenue des Champs-Élysées und ist Teil der Axe historique (historische Achse), einer Reihe von Monumenten und großen Straßen, die weiter westlich in das Défense-Viertel weisen.
Im gleichen Jahr wurde der Bau eines Ruhmestempels zu Ehren der napoleonischen Grande Armée geplant. Dieses erst 1842 fertiggestellte Gebäude kennen wir heute als Madeleine-Kirche. Ebenfalls im 1. Kaiserreich wurde der Auftrag für die Errichtung der Börse vergeben. 1808 von Alexandre-Théodore Brongniart begonnen, wurde sie nach dessen Tod 1827 von Éloi Labarre vollendet.

Ab der Mitte des 19. Jahrhunderts verwandelte die bis dahin größtenteils noch vom Mittelalter geprägte Stadt sich in eine prestigevolle, beispielhafte und moderne Metropole, welche die Bewunderung von Tausenden von ausländischen Weltausstellungsbesuchern hervorrief. Der umwälzenden Stadtsanierung, die nach dem Willen Napoleons III. von dem ihm treu ergebenen Baron Haussmann durchgeführt wurde, verdankt Paris seine breiten Straßen, mehrere Brücken, zahlreiche Plätze und Parks sowie die Anlage der beiden Stadtwälder und nicht zuletzt die Säumung der neuen Straßen mit den für Paris so typischen Häusern im sogenannten „Haussmann-Stil“. Durch Charles Marville sind Fotografien aus der damaligen Umbruchszeit erhalten geblieben, die die alten Straßenzüge und Gebäude kurz vor der Neugestaltung dokumentieren. Krönung dieser schaffensfrohen Epoche wurde das als Palais Garnier bezeichnete Opernhaus der Pariser Oper, das 1875 von Charles Garnier fertiggestellt wurde.
Für den Neubau des Universitätsgebäudes der Sorbonne wurde 1885 die größte Pariser Baustelle des 19. Jahrhunderts eröffnet, wenn man von der Konstruktion des Eiffelturmes, dem Werk eines Ingenieurs, absieht. Erst 1901 wurden die Arbeiten abgeschlossen. Die Sorbonne, eine der ältesten Universitäten nördlich der Alpen, war schon im 13. Jahrhundert im Quartier Latin gegründet worden. Hier studierten und lehrten einige der bedeutendsten Philosophen des Mittelalters.

Das Wahrzeichen der Stadt ist der 300,51 Meter hohe Eiffelturm (Tour Eiffel, 324,8 Meter mit Antenne), eine Konstruktion aus dem Jahre 1889, die für die Weltausstellung nur temporär errichtet werden sollte. Der Stahlfachwerkturm ist nach seinem Erbauer Alexandre Gustave Eiffel benannt. Er ist eine der größten Touristenattraktionen mit mehr als sechs Millionen Besuchern jährlich. Im Jahr 2002 wurde der 200-millionste Besucher gezählt.
Über das ganze Stadtgebiet von Paris verteilt, hauptsächlich an den meistbenutzten Fußgängerwegen, befinden sich die Wallace-Brunnen. Die öffentlichen Trinkwasserspender in Form kleiner gusseiserner Skulpturen sind nach dem Engländer Richard Wallace benannt, der ihre Errichtung finanzierte. Ihrer herausragenden Ästhetik wegen gelten sie weltweit als ein Wahrzeichen der Stadt.


20. Jahrhundert
Nicht unumstritten war der Bau der Tour Montparnasse im Süden der Stadt. Der 210 m hohe Büroturm ist das höchste Gebäude in Paris und wurde nach vierjähriger Bauzeit 1973 eröffnet.
In der zweiten Hälfte des 20. Jahrhunderts entwickelte Paris unter anderem dank der sogenannten grands projets (Große Projekte) der französischen Staatspräsidenten eine rege Bautätigkeit.

Georges Pompidou (Staatspräsident von 1969 bis 1974) war 1970 Initiator des neuen Kunst- und Kulturzentrums Centre Georges-Pompidou. Als Preisträger eines internationalen Wettbewerbes wurden Renzo Piano und Richard Rogers mit der Errichtung der spektakulären Metallkonstruktion beauftragt, die zwischen 1972 und 1977 entstand.
Der konservativere Valéry Giscard d’Estaing (Staatspräsident von 1974 bis 1981) begnügte sich mit der Rehabilitation bereits bestehender Bauten, wie dem Umbau des stillgelegten Orsay-Bahnhofes zu einem Museum und der Einrichtung der Cité des sciences et de l’industrie in der Rohbauruine der Schlachthöfe in La Villette.
Allerdings veranlasste Giscard d’Estaing 1980 auch die Gründung des Institut du monde arabe (Institut der arabischen Welt), ebenfalls ein Kunst- und Kulturzentrum mit angeschlossenem Museum, Bibliothek und Theater. Der Bau wurde jedoch erst zwischen 1983 und 1987 unter seinem Nachfolger François Mitterrand von der französischen Architektengruppe Jean Nouvel, Pierre Soria und Architecture Studio verwirklicht.
François Mitterrand (Staatspräsident von 1981 bis 1995) kündigte seinerseits schon in seiner ersten Pressekonferenz nach seinem Amtsantritt den Umbau des Louvre zu einem „würdigen Museum Frankreichs“ an. Der Auftrag zu diesem Großprojekt ging ohne Ausschreibung an den renommierten amerikanischen Architekten chinesischer Herkunft Ieoh Ming Pei.
Die Notwendigkeit, ein neues Finanzministerium zu bauen, ergab sich unter anderem aus der Tatsache, dass die Kabinette der beiden Minister aufgrund des geplanten Umbaus des Louvre aus dem dortigen Nordflügel weichen mussten. Das neue Ministère des Finances (1984–1989), ein Gemeinschaftswerk von Paul Chemetov und Borja Huidobro, entstand auf einem Gelände im Osten der Stadt, wo zur gleichen Zeit der neue Parc de Bercy angelegt wurde und die Stadt Paris von Pierre Parat und Michel Andrault die Mehrzweck-Sporthalle Palais Omnisports de Paris-Bercy errichten ließ.
Persönliches Prestigeobjekt Mitterrands während seiner ersten Amtszeit wurde die neue Opéra Bastille (1983–1989) am gleichnamigen Platz, auf dem am 14. Juli 1789 mit dem Sturm auf die Bastille die Französische Revolution ausgebrochen war und Mitterrand 1981 seinen Wahlsieg gefeiert hatte. Symbolträchtig war auch die Wahl des Einweihungstages dieser nach Plänen des Architekten Carlos Ott in einer eigenwilligen Form aus Glas und Aluminium entstandenen neuen Oper: die erste Aufführung fand am 13. Juli 1989, dem Vorabend des 200. Jahrestags des Sturms auf die Bastille, statt.
Die Grande Arche von Johan Otto von Spreckelsen, ein torförmig durchbrochener Kubus von gewaltigen Ausmaßen, steht im Défense-Viertel außerhalb von Paris. Er wurde 1989 eingeweiht.
Bereits einige Monate zuvor hatte Mitterrand ein weiteres Projekt ins Leben gerufen, um die alte Nationalbibliothek zu entlasten. Die neue Bibliothèque nationale de France (Nationalbibliothek, 1990–1996) wurde vom Architekten Dominique Perrault entworfen. Die vier Ecken des Gebäudes weisen je einen 79 Meter hohen Turm mit einer durchgehenden Glasfront auf. Die Türme sind L-förmig und symbolisieren ein aufgeschlagenes Buch. Jacques Chirac führte die Tradition der „Bauten der Präsidenten“ fort. Am 20. Juni 2006 weihte er das neue Musée du quai Branly von Jean Nouvel ein. Daneben entstanden in der letzten Hälfte des 20. Jahrhunderts zahlreiche sehenswerte kleinere Bauten, wie beispielsweise die Fondation Cartier (1994, Jean Nouvel) und das American Center (1994, Frank Gehry), jetzt Kinomuseum.
Paris ist auch bekannt für seine vornehmen und eleganten Hotels, die unter anderem an der Rue de Rivoli gegenüber dem Tuilerien-Garten, in der rue Castiglione und an der Place Vendôme angesiedelt sind. Hier findet man das Hôtel Le Meurice, das „Westin“ (früher „Intercontinental“ mit seinem repräsentativen Patio), das Hôtel „Lotti“ und das berühmte „Ritz“.


21. Jahrhundert
2006 eröffnete das Musée du quai Branly. 2014 wurden das Museum Fondation Louis Vuitton im Bois de Boulogne und das geschichtsträchtige Grandhotel Hotel The Peninsula Paris nahe dem Triumphbogen eröffnet. 2015 wurde das Hexagone Balard, ein Gebäudeensemble, in dem das französische Verteidigungsministerium seinen neuen Sitz hat, eröffnet. Es bietet 9300 Arbeitsplätze. Ebenfalls 2015 eröffnete die neue Pariser Philharmonie im Parc de la Villette. Der Neubau des Forum des Halles eröffnete im Jahr 2016. 2017 eröffnete der Neue Justizpalast im Nordwesten der Stadt. Der Wolkenkratzer mit 160 Meter Höhe stellt eine bedeutende neue Landmarke dar. Im Jahr 2021 wurden die 180 m und 122 m hohen Tours Duo im 13. Bezirk im Südwesten der Stadt nach vier Jahren Bauzeit eröffnet. Laufende Großprojekte sind der Umbau und die Aufstockung der Tour Montparnasse, die Erweiterung der Gare du Nord, die Erweiterung und Renovierung des Louvre und die Errichtung der 180 m hohen Tour Triangle im 15. Bezirk (Baubeginn: 2021; geplante Fertigstellung: 2026).


Kirchen


Mittelalter

Die frühere Abteikirche Saint-Germain-des-Prés am Boulevard Saint-Germain (6. Arrdt.) erinnert daran, dass der fränkische König Childebert I. aus dem Geschlecht der Merowinger, ein Sohn von Chlodwig I., hier im Jahr 557 eine später sehr bedeutende Abtei gründete. Der Portalturm der heutigen Kirche und die unteren Bereiche der Kirchenschiffe stammen aus dem 11. Jahrhundert, den Chor weihte im Jahr 1163 Papst Alexander II. Das Bauwerk erfuhr bis zum 17. Jahrhundert verschiedene Änderungen. Die Wandmalereien im Kirchenschiff schuf im 19. Jahrhundert Hippolyte Flandrin.
Die Kathedrale Notre Dame de Paris auf der Île de la Cité (4. Arrdt.) ist eine der frühesten gotischen Kathedralen Frankreichs. Sie ist Maria, der Mutter Jesu, geweiht (notre dame = Unsere Liebe Frau). Der Bau wurde im Jahr 1163 unter Bischof Maurice de Sully begonnen und erst 1345 fertiggestellt. Die Ausmaße des Kirchenschiffes betragen 130 mal 48 Meter bei einer Höhe von 35 Metern. Es bietet, Empore eingeschlossen, Raum für 9000 Personen. Die beiden Türme sind 69 Meter hoch, der Dachreiter erreicht 90 Meter.

Die Pfarrkirche Saint-Germain-l’Auxerrois, die dem Ostportal des Louvre (1. Arrdt.) gegenüberliegt, stammt in ihren Grundzügen noch aus der Zeit der Romanik. Sie besitzt allerdings sowohl ein gotisches Strebwerk als auch ein hochgotisches Portal. Die Anbauten an dieser Kirche stammen aus dem Barock. Diese Kirche ist dem heiligen Germanus von Auxerre geweiht (Saint Germain l’Auxerrois).
Die Pfarrkirche Saint-Sulpice südlich vom Boulevard Saint-Germain (6. Arrdt.) ist dem heiligen Sulpicius II. von Bourges geweiht. Sie ersetzte einen romanischen Vorgängerbau aus dem Anfang des 13. Jahrhunderts. Die Arbeiten an der heute existierenden Kirche begannen im Jahre 1649, wurden aufgrund politischer und finanzieller Schwierigkeiten aber erst im 18. Jahrhundert abgeschlossen. Die klassizistische Fassade entwarf Giovanni Servandoni im Jahr 1732. Die Kirche ist berühmt für ihre Cavaillé-Coll-Orgel, eine der größten Orgeln Frankreichs.
Die Palastkapelle Sainte-Chapelle im Palais de la Cité (1. Arrdt.) unweit der Kathedrale ließ Ludwig der Heilige in den 1240er-Jahren erbauen, um sehr kostbare Reliquien aufzunehmen: die Dornenkrone Christi und Teile des „Wahren Kreuzes“. Diese für den gotischen style rayonnant des 13. Jahrhunderts beispielhafte Kapelle gehört zu den schönsten Baudenkmälern der Gotik. Der größte Teil ihrer Wände wird von kostbaren Buntglasfenstern eingenommen, wodurch der hohe Raum von unirdisch wirkendem Licht durchflutet wird.


Neuzeit
Mit dem Bau der Pfarrkirche Saint-Eustache wurde im 16. Jahrhundert begonnen. Die Kirche wurde um 1640 fertiggestellt. Sie befindet sich im 1. Arrondissement und war die Kirche der Händler des benachbarten Marktes (heute mit dem Forum des Halles bebaut). Der spätgotische Sakralbau weist bereits Züge der aufkommenden Renaissance auf.
Der Dôme des Invalides (Invalidendom, eigentlich Invalidenkuppel) wurde zwischen 1670 und 1691 von Jules Hardouin-Mansart auf dem linken Seineufer erbaut (7. Arrdt.). Diese prächtige Kuppelkirche ist, so wie die benachbarte Soldatenkirche Saint-Louis des Invalides Teil des Hôtel des Invalides und zählt zu den schönsten Bauten des klassizistischen Barocks in Frankreich. Ihr Inneres wurde im 19. Jahrhundert zu einem Grabmal für den französischen Kaiser Napoléon I. umgestaltet. Dessen Leichnam ruht hier seit 1861 nach seiner Überführung aus Sankt Helena 1840, so wie verschiedene andere bedeutende Persönlichkeiten.

Der Bau der Kirche La Madeleine nördlich der Place de la Concorde (8. Arrdt.) begann 1764 nach dem Entwurf des Architekten Pierre Contant d’Ivry und wurde im Dezember 1791 aufgrund der Französischen Revolution eingestellt. Die Arbeiten wurden von dem Architekten Jean-Jacques-Marie Huvé (1783–1852) wieder aufgenommen und im Jahre 1842 abgeschlossen, die Weihe zur Pfarrkirche erfolgte am 9. Oktober 1845. Die Innenausstattung entstammt vorwiegend den Jahren 1830–1840. Als besonders sehenswert gilt die Statue der Maria Magdalena von Carlo Marochetti. Die Orgel des bedeutenden französischen Orgelbauers Aristide Cavaillé-Coll (1811–1899) gilt als eine der klangvollsten der Stadt.
Die Basilique du Sacré-Cœur (Basilika vom Heiligen Herzen) ist eine römisch-katholische Wallfahrtskirche auf dem Hügel von Montmartre und bildet den höchstgelegenen Punkt der Stadt nach dem Eiffelturm. Der Bau der Kirche im „Zuckerbäckerstil“ wurde 1875 von dem Architekten Paul Abadie begonnen, der sich in einem Wettbewerb gegen 78 Mitbewerber durchgesetzt hatte und dessen Entwurf deutlich durch den römisch-byzantinischen Stil alter Kirchen wie der Hagia Sophia und des Markusdoms in Venedig inspiriert wurde. Abadie verstarb bereits 1884. Ihm folgten bis zur Fertigstellung 1914 sechs Architekten in der Bauleitung nach.


Grünflächen
Die Pariser Straßen sind mit rund 89.000 Bäumen gesäumt. Das städtische Gartenbauamt Direction des Parcs, Jardins et Espaces Verts de Paris unterhält innerhalb der Stadtgrenzen 2.437 Hektar Grünflächen, zu denen außer den beiden großen Stadtwäldern Bois de Vincennes (995 Hektar) und Bois de Boulogne (846 Hektar) auch die 14 innerstädtischen Friedhöfe (92 Hektar) zählen, die Gartenbauschule École Du Breuil (22 Hektar), das Gartenbauzentrum Jardin des Serres d’Auteuil (8,5 Hektar), in dem Blumen und Sträucher gezüchtet werden, und der neue Centre horticole de la Ville de Paris (Blumenproduktion) in Rungis, Fresnes und Achères (insgesamt 477 Hektar).
Als Erholungsgebiet abzuziehen sind die bepflanzten Böschungen der Ringautobahn Boulevard périphérique (51 Hektar). Auf die Grünanlagen von städtischen Sportanlagen, Schulen, Kindergärten und Krippen entfallen 36 Hektar. Die restliche Fläche (386 Hektar) wird von öffentlichen Promenaden, Parks, Gärten, den squares genannten begrünten Plätzen und von Blumenrabatten eingenommen. Die Stadt Paris besitzt darüber hinaus jenseits ihrer Grenzen sechs weitere Friedhöfe, den Wald Bois de Beauregard bei La Celle-Saint-Cloud.
Außer den städtischen Anlagen stehen den Bewohnern und Besuchern von Paris sieben vom Staat unterhaltene Gärten und Parks mit insgesamt 118 Hektar Fläche zur Verfügung.


Promenaden, Parks und Gärten

