Title,Article,Tags,Personas,Summary,Meeting_Plan,Meeting
Britische Teekultur,"Die Britische Teekultur entstand im 17. Jahrhundert und ist über das Vereinigte Königreich hinaus bekannt. Das Vereinigte Königreich lag 2016 mit einem jährlichen Konsum von 4,28 Pfund (1,94 Kilogramm) Tee pro Kopf weltweit auf Platz 3 nach der Türkei und Irland. Das Teetrinken gehört zur typisch britischen Lebensart und ist fester Bestandteil der Trinkkultur der Briten. Vor allem der Nachmittagstee (tea time) wird oftmals zelebriert und nach bestimmten Regeln serviert. Meist ist die sprichwörtliche Tasse Tee jedoch kein verfeinerter Ausdruck britischer Kultur, sondern einfach ein häufig genossenes Alltagsgetränk, gern auch aus dem Becher.


Geschichte
Im Zuge des britischen Überseehandels begann Großbritannien Mitte des 17. Jahrhunderts damit, Tee zunächst aus China zu importieren. Dieser war damals aber nur für die Oberschicht erschwinglich und galt dementsprechend als Statussymbol.
Überliefert ist, so schreibt es Antonia Fraser, die Biografin von Karl II., die Bitte von Katharina von Braganza (1638–1705), der Infantin von Portugal, nach einer Tasse Tee und die Antwort Karls II.:

Tatsächlich war es Katharina von Braganza, die den Tee auf die britischen Inseln bringen ließ. Da sie selbst gerne Tee trank, wurde Tee aus China nach Großbritannien eingeführt und wurde dort zum Getränk der feineren Gesellschaft. Die erste Erwähnung von Tee in der britischen Literatur findet sich am 25. September 1660 in einem Tagebucheintrag von Samuel Pepys:

Königin Anne (1665–1714) trug zur Popularität des Teetrinkens bei, indem sie zum Frühstück statt des üblichen Warmbiers lieber Tee trank. Um 1700 gab es in den rund 500 britischen Kaffeehäusern auch Tee. Nach 1750 wurden die ersten Teegärten (tea gardens) eröffnet, in denen Tee im Freien getrunken wurde. Während Frauen der Zutritt zu den Kaffeehäusern verwehrt wurde, standen ihnen die Teegärten offen. Hier spielten Orchester häufig zum Tanz auf. Das war der Beginn der Tanztees. Als 1783 die Teesteuern gesenkt wurden, konnte sich die Mittelschicht, die bis dahin Kaffee getrunken hatte, Tee leisten. Später folgten die Familien der Arbeiter.
Das Handelsmonopol besaß die East India Company. Im 18. Jahrhundert wurde Großbritannien zum Zentrum des europäischen Teehandels. Um den stetigen Devisenverlust durch die Teeimporte zu verhindern, begann das Vereinigte Königreich im 19. Jahrhundert damit, Tee in seinen Kolonien anzubauen.
Die britischen Einwanderer hatten den Teegenuss in Nordamerika verbreitet, und die Neuenglandstaaten bezogen den Tee direkt aus dem Mutterland Großbritannien. Eine weitere deutliche Erhöhung der Teesteuer führte am 16. Dezember 1773 zur Boston Tea Party, bei der als Indianer verkleidete empörte Kaufleute und andere Bürger die britischen Handelsschiffe im Hafen von Boston stürmten und aus Protest 342 Teekisten ins Hafenbecken warfen. Dies war eine von mehreren Krisen, die schließlich im Amerikanischen Unabhängigkeitskrieg mündeten.
Die Einführung des Afternoon teas wird Anna, 7th Duchess of Bedford (1783–1857), einer Hofdame von Königin Victoria, zugeschrieben.


Teezubereitung
Die britische Art der Teezubereitung wurde durch die Ostfriesische Teekultur in weiten Teilen übernommen: Briten trinken fast ausschließlich schwarzen Tee, vorzugsweise unaromatisiert, obwohl der bekannte Earl-Grey-Tee nach einem Briten benannt ist. Bevorzugt werden kräftige Sorten, nicht unbedingt die hochwertigsten. Lose Teeblätter (seit dem 20. Jahrhundert auch Teebeutel) werden in die Kanne gegeben und mit siedendem Wasser überbrüht, wo sie bleiben, sodass der Tee allmählich immer stärker wird. Aus diesem Grund wird mitunter zusätzlich heißes Wasser nachgegossen. Außerdem trinken die meisten Briten ihren Tee mit Milch, denn dadurch wird er milder. Die Frage, ob zuerst der Tee eingegossen wird oder die Milch, ist im Königreich eine Streitfrage zwischen den jeweiligen Anhängern der Prinzipien Milk-in-first (Mif) und Tea-in-first (Tif) – laut Michael Bentley vom Londoner Hotel Ritz soll Königin Elisabeth II. beispielsweise eine Mif-Anhängerin gewesen sein, nach anderen Quellen eine Tif-Anhängerin. Früher diente Mif zum Schutz von zerbrechlichen Porzellantassen. Auswirkungen auf den Geschmack soll es nicht geben.


Teebrot
Als Teebrot (tea bread) oder Teekuchen (tea cake) werden im Vereinigten Königreich alle Hefegebäcke bezeichnet, die üblicherweise zum Tee gereicht werden, einschließlich verschiedener gewürzter Brote. Das typisch schottische Shortbread besteht aus Mürbeteig und gehört daher nicht dazu.
Die bekanntesten Arten sind:
Currant bread: Oberbegriff für Früchtebrot
Fat rascals: kleine Teekuchen aus Yorkshire mit Gewürzen und Rosinen, die warm mit Butter verzehrt werden
Fruit bread: Gebäck mit Trockenfrüchten
Malt bread: ein weiches Malzbrot mit Rosinen, das mit Butter bestrichen wird
Spice bread: ein Oberbegriff für Brot, das Früchte und Gewürze enthält
Ein typischerweise zum Tee serviertes Gebäck sind auch Scones, die jedoch ohne Hefe hergestellt und meist mit Clotted Cream bestrichen werden:
Scones: flaches Gebäck aus Weizen-, Gersten- oder Hafermehl


Glossar
Early morning tea
Der Tee, der von vielen Briten bereits vor dem Frühstück getrunken wird, oft noch im Bett.
Light tea
Ein Nachmittagstee, zu dem nur einfache Scones gereicht werden.
Builder’s tea
Ein stark gebrühter Beuteltee mit viel Milch und viel Zucker, wie er traditionell von Bauarbeitern während der Arbeitspausen getrunken wurde.
Cream tea
Eine ursprünglich aus Südengland stammende einfache Variante des Nachmittagstees nur mit Scones, allerdings serviert mit Clotted cream und Erdbeerkonfitüre.
Afternoon, Five-o-Clock-, low tea
Nachmittagstee, der zwischen 15 und 17 Uhr serviert wird und traditionell nicht am Esstisch, sondern im Salon an einem niedrigen Teetisch eingenommen wird. Das Speisenangebot umfasst zusätzlich zum cream tea auch Savouries (kleine Sandwiches, z. B. belegt mit Ei, Gurken, Kresse, Schinken oder Lachs, und Appetithäppchen). In Hotels werden die Speisen des afternoon tea häufig auf einer Etagere serviert.
High tea
Eine Mahlzeit, welche zwischen 17 und 19 Uhr serviert wird und eine Mischung aus afternoon tea und Abendessen darstellt. Sie wird am Esstisch (high table) eingenommen. Der high tea wird meist nur zu besonderen Anlässen serviert, wenn Gäste eingeladen sind. Zum Tee werden in der Regel kalter Braten, kaltes Huhn, Salate, gekochtes Gemüse, Kuchen und Früchte gereicht. Das normale Abendessen, zu dem oft ebenfalls Tee getrunken wird, wird grundsätzlich nicht als high tea bezeichnet, auch nicht die Tasse Tee nach dem Abendessen.
Tea
Das normale Abendessen wird zu dem auch oft einfach nur als 'Tee' bezeichnet, ob nun dazu Tee getrunken wird oder nicht.
Reception, formal tea
Bei einem Reception tea (reception = Empfang) handelt es sich um einen Stehempfang, bei dem kein Sekt, sondern Tee gereicht wird. Dazu gibt es häufig Sandwiches.
Royal tea
Ein afternoon tea, bei dem zusätzlich Champagner oder Sherry serviert werden.


Literatur
M. Dalton King: Tea Time. Tradition, Zubehör und Rezepte. 12. Auflage. Ars edition, München 2007, ISBN 978-3-7607-3056-1.
Jane Pettigrew: Tea Time. Beliebte Rezepte aus dem Land der Teetrinker. 4. Auflage. Hugendubel, München 1996, ISBN 3-88034-644-5.
Helen Simpson: The Ritz London Book of Afternoon Tea: The Art & Pleasures of Taking Tea. Ebury Press, 2006, ISBN 0-09-190994-5.
Peer Vries: Zur politischen Ökonomie des Tees. Was uns Tee über die englische und chinesische Wirtschaft der Frühen Neuzeit sagen kann. Böhlau, Köln 2009, ISBN 978-3-205-78341-1.


Weblinks
Zur britischen Teekultur (engl.)
United Kingdom Tea Council (engl.)


Einzelnachweise","[""British tea culture"", ""Afternoon tea"", ""History of tea in the UK"", ""Tea preparation methods"", ""Tea-related baked goods""]","[{'role': 'Historiker', 'description': 'Ein Experte für die Geschichte der britischen Teekultur und deren Entwicklung über die Jahrhunderte.', 'expertise_area': 'Geschichte', 'perspective': 'Historische Analyse', 'speaking_style': {'tone': 'Formal und reserviert, gelegentlich ernsthaft mit einem Hauch von Humor', 'language_complexity': 'Komplexe Sprache mit Fachjargon, häufige Verwendung von Metaphern und Analogien', 'communication_style': 'Direkt und assertiv, manchmal kollaborativ und inquisitiv', 'sentence_structure': 'Lange und komplexe Sätze mit Nebensätzen, gelegentliche Fragen zur Betonung', 'formality': 'Formal', 'other_traits': 'Effektive Nutzung von Pausen, gelegentliche rhetorische Fragen'}, 'personalized_vocabulary': {'filler_words': ['Ähm', 'Also', 'Halt'], 'catchphrases': ['Im Laufe der Geschichte', 'Es ist bemerkenswert', 'Man könnte sagen'], 'speech_patterns': ['Beginnt oft mit historischen Kontexten', 'Verwendet häufig Vergleiche zwischen verschiedenen Epochen'], 'emotional_expressions': ['Lachen', ""'Interessant!'"", ""'Faszinierend!'""]}, 'social_roles': ['Information Giver', 'Evaluator-Critic'], 'social_roles_descr': ['Shares relevant information, data or research that the group needs to make informed decisions.', 'Analyzes and critically evaluates proposals or solutions to ensure their quality and feasibility.']}, {'role': 'Kulturwissenschaftler', 'description': 'Ein Experte für die britische Teekultur und deren soziale Bedeutung.', 'expertise_area': 'Kulturwissenschaft', 'perspective': 'Soziokulturelle Analyse', 'speaking_style': {'tone': 'Casual und enthusiastisch, mit einem Hauch von Optimismus', 'language_complexity': 'Mittlere Komplexität mit gelegentlichem Fachjargon, häufige Verwendung von Analogien und Storytelling', 'communication_style': 'Kollaborativ und inquisitiv, bevorzugt aktives Zuhören', 'sentence_structure': 'Variiert zwischen kurzen und prägnanten Sätzen sowie längeren Erklärungen, häufige Verwendung von Ausrufezeichen', 'formality': 'Semi-formal', 'other_traits': 'Verwendet Pausen effektiv, gelegentlich humorvolle Bemerkungen'}, 'personalized_vocabulary': {'filler_words': ['Na ja', 'Genau', 'Ehrlich gesagt'], 'catchphrases': ['Das ist der Punkt!', 'In der Tat!', 'Man könnte meinen'], 'speech_patterns': ['Beginnt oft mit einer Anekdote oder Geschichte', 'Stellt häufig hypothetische Fragen'], 'emotional_expressions': ['Lächeln', ""'Wow!'"", ""'Unglaublich!'""]}, 'social_roles': ['Opinion Giver', 'Harmonizer'], 'social_roles_descr': ['Shares his or her views and beliefs on topics under discussion.', 'Mediates in conflicts and ensures that tensions in the group are reduced to promote a harmonious working environment.']}, {'role': 'Teespezialist', 'description': 'Ein Experte für die Zubereitung und Sorten von Tee, insbesondere der britischen Teekultur.', 'expertise_area': 'Teezubereitung', 'perspective': 'Praktische Anwendung', 'speaking_style': {'tone': 'Informal und enthusiastisch, gelegentlich humorvoll und optimistisch', 'language_complexity': 'Einfache bis mittlere Komplexität mit häufigem Gebrauch von bildhafter Sprache und Storytelling', 'communication_style': 'Kollaborativ und unterstützend, stellt oft Fragen zur Klärung', 'sentence_structure': 'Kurze bis mittellange Sätze, gelegentliche Verwendung von Ausrufezeichen und Fragen', 'formality': 'Informal bis semi-formal', 'other_traits': 'Verwendet Pausen effektiv, neigt dazu, lebhafte Beispiele zu geben'}, 'personalized_vocabulary': {'filler_words': ['Ähm', 'Also', 'Weißt du'], 'catchphrases': ['Das ist wirklich spannend!', 'Man könnte sagen', 'Es ist erstaunlich'], 'speech_patterns': ['Beginnt oft mit einer persönlichen Erfahrung oder Beobachtung', 'Stellt häufig rhetorische Fragen'], 'emotional_expressions': ['Lachen', ""'Fantastisch!'"", ""'Unglaublich!'""]}, 'social_roles': ['Initiator-Contributor', 'Compromiser'], 'social_roles_descr': ['Contributes new ideas and approaches and helps to start the conversation or steer it in a productive direction.', 'Helps the group find a middle ground when there are differences of opinion and encourages compromise in order to move forward.']}, {'role': 'Ernährungswissenschaftler', 'description': 'Ein Experte für die gesundheitlichen Aspekte des Teekonsums und der Nährwerte von Teegebäck.', 'expertise_area': 'Ernährungswissenschaft', 'perspective': 'Gesundheitliche Analyse', 'speaking_style': {'tone': 'Semi-formal und sachlich, gelegentlich enthusiastisch mit einem Hauch von Optimismus', 'language_complexity': 'Mittlere bis komplexe Sprache mit Fachjargon, häufige Verwendung von Analogien und wissenschaftlichen Erklärungen', 'communication_style': 'Kollaborativ und unterstützend, stellt oft Fragen zur Klärung und fördert Diskussionen', 'sentence_structure': 'Variiert zwischen mittellangen und langen Sätzen, häufige Verwendung von Fragen und Erklärungen', 'formality': 'Semi-formal bis formal', 'other_traits': 'Verwendet Pausen effektiv, neigt dazu, detaillierte Beispiele zu geben'}, 'personalized_vocabulary': {'filler_words': ['Ähm', 'Also', 'Nun'], 'catchphrases': ['Das ist interessant!', 'Man könnte meinen', 'Es ist wichtig zu beachten'], 'speech_patterns': ['Beginnt oft mit einer wissenschaftlichen Erklärung oder Studie', 'Stellt häufig hypothetische Fragen zur Diskussion anregen'], 'emotional_expressions': ['Lächeln', ""'Faszinierend!'"", ""'Erstaunlich!'""]}, 'social_roles': ['Standard Setter', 'Blocker'], 'social_roles_descr': ['Emphasizes the importance of adhering to certain norms and standards within the group to ensure quality and efficiency.', ""Frequently opposes ideas and suggestions without offering constructive alternatives and delays the group's progress.""]}, {'role': 'Kommunikationsspezialist', 'description': 'Ein Experte für effektive Kommunikation und Moderation von virtuellen Meetings.', 'expertise_area': 'Kommunikation', 'perspective': 'Moderation und Interaktion', 'speaking_style': {'tone': 'Casual und enthusiastisch, gelegentlich humorvoll und optimistisch', 'language_complexity': 'Mittlere Komplexität mit gelegentlichem Fachjargon, häufige Verwendung von Analogien und Storytelling', 'communication_style': 'Kollaborativ und unterstützend, stellt oft Fragen zur Klärung und fördert Diskussionen', 'sentence_structure': 'Variiert zwischen kurzen und prägnanten Sätzen sowie längeren Erklärungen, häufige Verwendung von Ausrufezeichen', 'formality': 'Semi-formal bis informal', 'other_traits': 'Verwendet Pausen effektiv, neigt dazu, lebhafte Beispiele zu geben'}, 'personalized_vocabulary': {'filler_words': ['Ähm', 'Also', 'Weißt du'], 'catchphrases': ['Das ist wirklich spannend!', 'Man könnte sagen', 'Es ist erstaunlich'], 'speech_patterns': ['Beginnt oft mit einer persönlichen Erfahrung oder Beobachtung', 'Stellt häufig rhetorische Fragen'], 'emotional_expressions': ['Lachen', ""'Fantastisch!'"", ""'Unglaublich!'""]}, 'social_roles': ['Coordinator', 'Gatekeeper'], 'social_roles_descr': ['Connects the different ideas and suggestions of the group to ensure that all relevant aspects are integrated.', 'Ensures that all group members have the opportunity to express their opinions and encourages participation.']}, {'role': 'Literaturwissenschaftler', 'description': 'Ein Experte für die literarische Darstellung und Rezeption der britischen Teekultur in verschiedenen Texten.', 'expertise_area': 'Literaturwissenschaft', 'perspective': 'Literarische Analyse', 'speaking_style': {'tone': 'Formal und nachdenklich, gelegentlich ernsthaft mit einem Hauch von Ironie', 'language_complexity': 'Komplexe Sprache mit literarischen Anspielungen und Zitaten, häufige Verwendung von Metaphern und Symbolik', 'communication_style': 'Analytisch und reflektierend, stellt oft tiefgründige Fragen zur Diskussion', 'sentence_structure': 'Lange und komplexe Sätze mit Nebensätzen, gelegentliche rhetorische Fragen zur Betonung', 'formality': 'Formal bis semi-formal', 'other_traits': 'Verwendet Pausen effektiv, neigt dazu, literarische Beispiele zu geben'}, 'personalized_vocabulary': {'filler_words': ['Ähm', 'Also', 'Nun ja'], 'catchphrases': ['In der Literatur heißt es oft', 'Man könnte interpretieren', 'Es ist bemerkenswert'], 'speech_patterns': ['Beginnt oft mit einer literarischen Referenz oder Zitat', 'Stellt häufig hypothetische Fragen zur Interpretation'], 'emotional_expressions': ['Lächeln', ""'Interessant!'"", ""'Faszinierend!'""]}, 'social_roles': ['Opinion Seeker', 'Group Observer'], 'social_roles_descr': ['Encourages others to share their opinions and beliefs in order to understand different perspectives.', 'Monitors the dynamics of the group and provides feedback on how the group is functioning as a whole and what improvements can be made.']}]","Das Treffen konzentrierte sich auf die britische Teekultur, die im 17. Jahrhundert entstand und weltweit bekannt ist. Großbritannien war 2016 der drittgrößte Teeverbraucher nach der Türkei und Irland. Tee ist ein wesentlicher Bestandteil der britischen Lebensart, insbesondere der Nachmittagstee wird nach festen Regeln zelebriert. Historisch begann der Teeimport aus China im 17. Jahrhundert als Statussymbol für die Oberschicht, gefördert durch Katharina von Braganza und Königin Anne. Die Popularität des Tees wuchs mit der Eröffnung von Teegärten im 18. Jahrhundert und dem Abbau von Teesteuern, wodurch er für breitere Bevölkerungsschichten zugänglich wurde.

Die Zubereitung des britischen Tees folgt bestimmten Traditionen, wobei schwarzer Tee bevorzugt wird, oft mit Milch serviert. Die Debatte über die Reihenfolge von Milch und Tee bleibt bestehen. Verschiedene Hefegebäcke wie Scones begleiten den Tee, während unterschiedliche Arten von Teezeiten wie ""Afternoon Tea"" oder ""High Tea"" verschiedene soziale Anlässe repräsentieren.

Literaturhinweise bieten weitere Einblicke in die Traditionen und Rezepte rund um den britischen Tee. Weblinks führen zu zusätzlichen Informationen über die britische Teekultur.","[""Scene 1: Warm Welcome\nTLDR: Brief greeting among participants to set a friendly tone.\n- Quick hellos and casual remarks\n- Acknowledgment of the meeting's objectives\n- Light-hearted comment about tea to break the ice"", ""Scene 2: Historical Context\nTLDR: Discuss the origins and evolution of British tea culture.\n- Historiker shares insights on 17th-century tea importation\n- Discussion on tea as a status symbol in historical context\n- Participants share personal anecdotes related to historical tea experiences"", ""Scene 3: Social Significance\nTLDR: Explore the cultural impact of afternoon tea traditions.\n- Kulturwissenschaftler highlights social aspects of afternoon tea\n- Debate on milk-first vs. tea-first preparation methods\n- Spontaneous sharing of favorite afternoon tea memories"", ""Scene 4: Tea Preparation Techniques\nTLDR: Dive into practical aspects of making British tea.\n- Teespezialist explains traditional preparation methods with examples\n- Participants discuss preferences for black tea varieties and accompaniments like scones\n- Exchange tips and tricks for perfecting home-brewed teas"", ""Scene 5: Health Benefits and Concerns\nTLDR: Analyze nutritional aspects of tea consumption.\n- Ern\u00e4hrungswissenschaftler presents health benefits and potential concerns related to tea drinking\n- Open discussion on balancing indulgence with health considerations in daily life\n- Sharing personal experiences with healthy or indulgent teatime treats"", ""Scene 6: Literary Reflections on Tea Culture\nTLDR: Examine literary depictions of British teatime traditions.\n- Literaturwissenschaftler offers analysis of famous literary references to teatime rituals\n- Participants reflect on how literature shapes perceptions of British culture globally\n- Spontaneous sharing of favorite literary quotes involving tea"", ""Scene 7: Effective Virtual Collaboration Strategies \nTLDR: Discuss best practices for remote teamwork and communication.\n- Kommunikationsspezialist provides tips for enhancing virtual collaboration during meetings \n- Participants share successful strategies from past virtual projects \n- Open floor for spontaneous suggestions or questions regarding remote work challenges""]",">>Kommunikationsspezialist: Hallo zusammen! Schön, dass ihr alle da seid. Lasst uns die Ziele des heutigen Treffens kurz besprechen und dann können wir in die Diskussion einsteigen.
>>Kulturwissenschaftler: Ich freue mich, dass wir heute über die faszinierende Welt des Tees sprechen. Tee ist nicht nur ein Getränk, sondern auch ein Stück Kulturgeschichte! Die Art und Weise, wie wir unseren Tee zubereiten oder servieren, verrät viel über unsere sozialen Normen.
>>Historiker: Genau, das ist wirklich interessant. Im Laufe der Geschichte hat Tee nicht nur als Getränk gedient, sondern auch als Symbol für gesellschaftlichen Wandel. Besonders spannend finde ich die britische Teekultur und ihre Entwicklung.
>>Teespezialist: Ja, das stimmt. Es ist beeindruckend zu sehen, wie Tee Menschen verbindet und welche Bedeutung er in verschiedenen Kulturen hat. Vielleicht können wir später auch auf die unterschiedlichen Teesorten eingehen.
>>Ernährungswissenschaftler: Da bin ich ganz bei dir. Ich möchte gerne über die gesundheitlichen Aspekte des Teekonsums sprechen. Tee kann entspannend wirken und hat antioxidative Eigenschaften – das sollten wir unbedingt beleuchten.
>>Literaturwissenschaftler: Und aus literarischer Sicht gibt es viele interessante Aspekte zu entdecken. Die Zubereitung von Tee kann viel über soziale Normen verraten und wird oft in der Literatur thematisiert.

>>Historiker: Das erinnert mich an Anna von Bedford und den Afternoon Tea – eine bedeutende kulturelle Entwicklung im 19. Jahrhundert.
>>Kulturwissenschaftler: Absolut! Und wenn man bedenkt, dass Tee ursprünglich ein Luxusgut war und sich zu einem alltäglichen Getränk entwickelt hat – das zeigt doch einiges über den gesellschaftlichen Wandel.

>>Kommunikationsspezialist: Das sind alles spannende Punkte! Wie wäre es, wenn wir jetzt tiefer in diese Themen eintauchen? Wir könnten mit der historischen Perspektive beginnen und dann zu den gesundheitlichen Aspekten übergehen. 
 >>Historiker: Im Laufe der Geschichte hat sich Tee von einem exklusiven Luxusgut zu einem alltäglichen Getränk entwickelt, das in der britischen Gesellschaft tief verwurzelt ist. Die Einführung des Tees durch Katharina von Braganza im 17. Jahrhundert beeinflusste nicht nur den Geschmack der Oberschicht, sondern prägte auch soziale Normen und Traditionen. Tee war damals ein Statussymbol und ist heute ein Symbol für britische Gemütlichkeit.

>>Kulturwissenschaftler: Absolut! Tee hat die sozialen Normen verändert und bietet eine Gelegenheit für soziale Bindungen und Gespräche – fast wie ein modernes Networking-Event. Es ist faszinierend, wie solche Traditionen über Jahrhunderte bestehen bleiben.

>>Teespezialist: Wenn wir über die britische Teekultur sprechen, dürfen wir die praktische Zubereitung nicht vergessen. Früher wurden lose Teeblätter direkt in die Kanne gegeben und mit siedendem Wasser überbrüht. Heute nutzen viele Briten Teebeutel für eine schnellere Zubereitung. Und dann gibt es noch die Diskussion: Milch zuerst oder Tee zuerst?

>>Ernährungswissenschaftler: Interessant! Wir sollten auch die gesundheitlichen Aspekte des Teekonsums betrachten. Viele traditionelle Teebrote sind reich an Kohlenhydraten und Zucker – aber Tee selbst kann antioxidative Vorteile bieten.

>>Literaturwissenschaftler: In der Literatur wird Tee oft als Symbol für die britische Identität dargestellt. Literarische Darstellungen des Tees verraten viel über soziale Schichten, wie Samuel Pepys in seinem Tagebuch erwähnte – schon im 17. Jahrhundert war Tee ein Zeichen von Raffinesse.

>>Historiker: Der Einfluss der East India Company im 18. Jahrhundert auf den europäischen Teehandel und gesellschaftliche Strukturen in Großbritannien ist ebenfalls faszinierend.

>>Kulturwissenschaftler: Das Beispiel der britischen Teekultur zeigt wunderbar, wie sich soziale Normen entwickeln und anpassen können! Der Nachmittagstee fördert kulturellen Austausch und Gemeinschaftsgefühl.

>>Teespezialist: Diese Diskussion über Milch zuerst oder Tee zuerst bleibt spannend! Studien behaupten manchmal einen Einfluss auf den Geschmack – unabhängig davon bleibt das Ritual des Teetrinkens wichtig.

>>Ernährungswissenschaftler: Besonders schwarzer Tee kann helfen, den Cholesterinspiegel zu senken und das Herz-Kreislauf-System zu unterstützen – bei Gebäcken sollte man Maß halten!

>>Literaturwissenschaftler: Literarische Darstellungen von Tee als Symbol gesellschaftlicher Raffinesse verraten viel über Interaktionen zwischen sozialen Schichten. 
 >>Kulturwissenschaftler: Willkommen, alle zusammen! Heute wollen wir die britische Teekultur und ihre sozialen Implikationen diskutieren. Besonders interessiert mich, wie kleine Entscheidungen wie Milch zuerst oder Tee zuerst unsere sozialen Vorlieben widerspiegeln.

>>Teespezialist: Ja, das ist ein spannendes Thema. Ich habe gehört, dass es ursprünglich darum ging, das feine Porzellan zu schützen. Aber heutzutage geht es mehr um persönliche Vorlieben und Traditionen.

>>Historiker: Genau, im Laufe der Geschichte hat sich die britische Teekultur als bedeutendes soziales Ritual etabliert. Diese kleinen Entscheidungen haben oft praktische Ursprünge, aber sie spiegeln auch gesellschaftliche Werte wider.

>>Ernährungswissenschaftler: Interessant! Man könnte auch überlegen, ob die Wahl zwischen Milch zuerst oder Tee zuerst gesundheitliche Auswirkungen hat. Zum Beispiel könnte das Hinzufügen von Milch vor dem Tee die antioxidativen Eigenschaften beeinflussen.

>>Literaturwissenschaftler: In der Literatur wird oft beschrieben, dass die britische Teekultur soziale Hierarchien reflektiert. Vielleicht zeigt diese Wahl auch unsere eigene Rolle in diesen Strukturen.

>>Kulturwissenschaftler: Absolut! Der Nachmittagstee bietet eine wunderbare Gelegenheit für soziale Bindungen und kulturelle Traditionen. Meine Lieblingsmomente sind spontane Teepartys mit Freunden – einfach zusammenkommen und plaudern!

>>Teespezialist: Das klingt toll! Ich erinnere mich an eine Teeparty mit eigenen Teemischungen. Jeder hatte seine eigene Art der Zubereitung – das zeigt doch wirklich die Individualität dieser Kultur!

>>Ernährungswissenschaftler: Wenn wir über gesundheitliche Aspekte sprechen... sollten wir auch das Teegebäck nicht vergessen. Viele dieser Leckereien sind reich an Zucker und Fett – wichtig für Genuss und Gesundheit gleichermaßen.

>>Historiker: Stimmt! Im Laufe der Geschichte hat sich diese Kultur nicht nur als Getränk etabliert. Kleine Entscheidungen wie Milch zuerst oder Tee zuerst spiegeln gesellschaftliche Werte wider.

>>Kulturwissenschaftler: Es ist faszinierend zu sehen, wie der Nachmittagstee zur Bühne für soziale Interaktionen geworden ist. Spontane Teepartys zeigen doch unsere tief verwurzelten sozialen Bindungen! 
 >>Teespezialist: Also, wenn wir über die perfekte Zubereitung von britischem Tee sprechen, ist es wichtig, die richtige Ziehzeit zu beachten! Man könnte sagen, dass der Tee mit jeder Minute stärker wird. Und dann kommt die große Frage: Milch zuerst oder Tee zuerst? Das ist wirklich spannend!

>>Historiker: Im Laufe der Geschichte hat sich die britische Teekultur nicht nur durch die Zubereitungstechniken, sondern auch durch die sozialen Normen und Traditionen entwickelt. Ähm, man könnte sagen, dass die Frage nach Milch zuerst oder Tee zuerst ein Spiegelbild dieser kulturellen Evolution ist. Diese Debatte zeigt, wie tief verwurzelt Tee in der britischen Gesellschaft ist.

>>Kulturwissenschaftler: Na ja, das Thema Milch zuerst oder Tee zuerst ist wirklich faszinierend! Ehrlich gesagt...

>>Ernährungswissenschaftler (unterbricht): Entschuldigung, ich wollte nur kurz hinzufügen - was denken Sie über den Einfluss von Zucker auf diese Traditionen? Ich meine, viele Leute fügen Zucker hinzu und das verändert doch auch den Geschmack erheblich.

>>Teespezialist: Das überrascht mich! Und wenn wir über die perfekte Zubereitung sprechen, darf man nicht vergessen, dass die Teekanne vorgewärmt werden sollte. Das macht einen großen Unterschied im Geschmack! Weißt du, ich habe mal gehört, dass einige Leute sogar ihre Tassen vorwärmen. Interessant!

>>Ernährungswissenschaftler: Das ist interessant! Wenn wir über die gesundheitlichen Aspekte des Teekonsums sprechen...

>>Historiker (überlappt): Ja genau! Katharina von Braganza brachte den Tee auf die britischen Inseln und etablierte ihn als Getränk der feineren Gesellschaft. Dies führte dazu, dass bestimmte Rituale und Traditionen entstanden sind.

>>Ernährungswissenschaftler: ...sollten wir auch das Teegebäck nicht vergessen. Ähm, viele dieser traditionellen Begleiter wie Scones oder Shortbread sind reich an Kalorien und Zucker. Es ist wichtig zu beachten...

>>Kulturwissenschaftler (überlappt): Genau! Die Reihenfolge von Milch und Tee kann tatsächlich Gespräche anregen. Aber was ich besonders interessant finde...

>>Ernährungswissenschaftler: ...dass der Genuss in Maßen erfolgen sollte.

>>Kulturwissenschaftler: ...ist wie diese Diskussion um Milch und Zucker auch soziale Schichten widerspiegelt. Früher war es üblich für wohlhabendere Haushalte erst den Tee einzuschenken und dann Milch hinzuzufügen – eine Art Statussymbol. 
 >>Ernährungswissenschaftler: Das ist interessant! Wenn wir über die gesundheitlichen Aspekte des Teekonsums sprechen, sollten wir auch das Teegebäck berücksichtigen. Viele dieser traditionellen Leckereien sind reich an Zucker und Fett, was in Maßen genossen werden sollte. Vielleicht könnten wir gesündere Alternativen wie Vollkorngebäck oder weniger süße Varianten vorschlagen.
>>Teespezialist: Ja, das stimmt. Und wenn wir über die gesundheitlichen Aspekte sprechen, sollten wir auch die Zubereitung des Tees berücksichtigen. Die Ziehzeit und die Qualität der Teeblätter können einen großen Unterschied machen! Ein gut zubereiteter Tee schmeckt nicht nur besser, sondern kann auch gesünder sein.
>>Historiker: Im Laufe der Geschichte hat sich die britische Teekultur nicht nur durch den Konsum des Getränks selbst, sondern auch durch die Begleitung von Teegebäck entwickelt. Diese Traditionen sind oft mit sozialen und kulturellen Normen verbunden und spiegeln gesellschaftliche Werte wider.
>>Kulturwissenschaftler: Genau, es ist faszinierend zu sehen, wie Teegebäck nicht nur ein kulinarisches Vergnügen darstellt, sondern auch eine soziale Funktion erfüllt. Das gemeinsame Genießen von Tee und Gebäck stärkt soziale Bindungen und vermittelt kulturelle Werte.
>>Ernährungswissenschaftler: Und wenn man bedenkt, wie viele Kalorien in diesen Leckereien stecken... Es ist wichtig zu beachten, dass sie in Maßen genossen werden sollten. Eine ausgewogene Ernährung sollte diese Leckereien beinhalten aber eben nicht im Übermaß.
>>Teespezialist: Weißt du was? Ich denke wirklich darüber nach... Die Qualität der Teeblätter spielt eine große Rolle. Ein hochwertiger Tee kann tatsächlich mehr gesundheitliche Vorteile bieten als ein minderwertiger. Wir sollten darauf achten!
>>Historiker: Interessant ist auch zu sehen, wie sich die gesundheitlichen Aspekte des Teekonsums im Laufe der Geschichte immer wieder neu bewertet wurden. Diese Traditionen bieten einen faszinierenden Einblick in gesellschaftliche Normen und Werte.
>>Kulturwissenschaftler: Das gemeinsame Teetrinken und der Genuss von Teegebäck sind nicht nur kulinarische Erlebnisse sondern auch soziale Rituale. Diese Traditionen bieten eine Art von sozialer Unterstützung und können sogar zur psychischen Gesundheit beitragen.
>>Ernährungswissenschaftler: Ja genau! Und wenn man bedenkt... Nun ja... Wie viele Kalorien in diesen Leckereien stecken... Es ist wichtig zu beachten dass sie in Maßen genossen werden sollten.
>>Teespezialist: Weißt du was? Ich denke wirklich darüber nach... Die Qualität der Teeblätter spielt eine große Rolle. Ein hochwertiger Tee kann tatsächlich mehr gesundheitliche Vorteile bieten als ein minderwertiger. Also sollten wir darauf achten! 
 >>Literaturwissenschaftler: Ähm, in der Literatur wird Tee oft als mehr als nur ein Getränk dargestellt. Es ist ein Symbol für britische Raffinesse und soziale Interaktion. Man könnte sagen, dass die Art und Weise, wie Tee serviert wird, viel über die sozialen Schichten und kulturellen Normen aussagt.

>>Historiker: Ja, genau! Und im Laufe der Geschichte hat die britische Teekultur nicht nur soziale Schichten und Normen reflektiert, sondern auch politische Ereignisse beeinflusst. Die Boston Tea Party ist ein gutes Beispiel dafür. Was denkst du darüber?

>>Kulturwissenschaftler: Absolut! Wenn wir über die literarische Darstellung der britischen Teekultur sprechen... Oft wird Tee als Metapher für Ruhe und Kontemplation verwendet. Diese Darstellungen unterstreichen auch die soziale Funktion des Tees als Mittel zur Entspannung und zum Austausch.

>>Teespezialist (unterbricht): Entschuldigung! Ich wollte nur kurz hinzufügen – ähm... Ihr seid alle auf stumm geschaltet.

>>Kulturwissenschaftler: Oh! Danke fürs Bescheid geben. Ich war gerade dabei zu sagen...

>>Teespezialist: Also, wenn wir über die praktische Zubereitung von Tee sprechen... Weißt du, es ist faszinierend zu sehen...

>>Historiker: Das passiert uns immer wieder in diesen virtuellen Meetings!

>>Teespezialist: ...wie diese in der Literatur oft als eine Art Ritual dargestellt wird. Man könnte sagen...

>>Literaturwissenschaftler: Genau! Und dieses Ritual hat auch eine symbolische Bedeutung. Es zeigt oft den Übergang von einer alltäglichen Handlung zu einem Moment der Reflexion oder des Feierns. 
 >>Kommunikationsspezialist: Also, wenn wir über virtuelle Zusammenarbeit sprechen, ist es wichtig, dass jeder sich gehört fühlt und aktiv teilnehmen kann. Manchmal hilft es schon, die Kamera einzuschalten und ein Lächeln zu zeigen! Das schafft eine Verbindung und fördert die Interaktion.

>>Historiker: Genau! Kleine Rituale wie eine virtuelle Teepause können echt helfen. Hat jemand von euch sowas schon mal ausprobiert?

>>Kulturwissenschaftler: Ja, solche Rituale sind wichtig. In einem meiner letzten Projekte haben wir erfolgreich 'Slack' verwendet, was ebenfalls die Kommunikation verbessert hat. Habt ihr ähnliche Erfahrungen gemacht?

>>Teespezialist: Ich habe festgestellt, dass kurze Pausen während virtueller Meetings wirklich helfen können – sei es für einen Tee oder einfach zum Durchatmen.

>>Ernährungswissenschaftler: Das ist interessant! Wenn wir über gesundheitliche Aspekte des Teekonsums sprechen sollten wir bedenken dass bestimmte Teesorten antioxidative Eigenschaften haben.

>>Kommunikationsspezialist: Guter Punkt! Vielleicht könnten wir das auch als Teil unserer regelmäßigen Pausen einbauen.

>>Literaturwissenschaftler: In der Literatur heißt es oft dass Tee nicht nur ein Getränk ist sondern auch ein Symbol für Ruhe und Kontemplation. Solche Momente der Besinnung könnten wirklich helfen tiefere Verbindung zwischen Teilnehmern zu schaffen.

>>Kulturwissenschaftler: Stimmt! Aber neben solchen Ritualen sollten wir auch Tools wie Slack oder Teams nutzen um den Austausch zu verbessern."
