Title,Article,Tags,Personas,Summary,Meeting_Plan,Meeting
Gewaltsame Auseinandersetzungen um den Algerienkrieg erschütterten Anfang der 1960er-Jahre auch Paris. Sowohl die rechtsextreme OAS als auch die Unabhängigkeitsbewegung FLN terrorisierten die Stadt mit Bombenanschlägen und Angriffen auf Polizisten und öffentliche Einrichtungen. Am 17. Oktober 1961 wollten rund 30.000 Menschen friedlich für die Unabhängigkeit Algeriens demonstrieren. Im Massaker von Paris schlug die Polizei diese Demonstration gewaltsam nieder; mindestens 150 Demonstranten wurden getötet. Bei der gewaltsamen Auflösung einer Kundgebung des Parti communiste français am 8. Februar 1962 durch die Polizei, kam es in der Métro-Station Charonne erneut zu einem Zwischenfall, bei dem neun Menschen getötet wurden.
Während der Mai-Unruhen 1968 erlebte die Stadt Studentenrevolten und Massenstreiks.
Die Vororte (Banlieues) von Paris waren Ausgangspunkt und Zentrum der Unruhen in Frankreich 2005, während denen es zu zahlreichen gewalttätigen Ausschreitungen von zumeist jugendlichen Einwanderern kam. Bei den islamistischen Terroranschlägen im Januar 2015, unter anderem auch auf die Redaktionsräume der Satirezeitschrift Charlie Hebdo, wurden von den drei Attentätern insgesamt 17 Menschen getötet. Bei einer ebenfalls islamistischen Anschlagserie am 13. November 2015 an sechs Orten in Paris und Saint-Denis mit Geiselnahmen in der Konzerthalle Bataclan, Sprengstoffanschlägen um das Fußballstadion Stade de France, in dem ein Freundschaftsspiel gegen Deutschland vor 80.000 Besuchern stattfand und der Staatspräsident Hollande anwesend war, und mehreren Schießereien starben weit über hundert Menschen.


Hoheitssymbole

		
			
			
		
		
			
			
		
		
			
			
		
		
			
			
		
		
			
			
		
		
			
			
		
		
			
			
		

Die Stadt Paris führt ein großes und ein kleines Wappen sowie eine blau-rote Flagge. Wappen und Wahlspruch sind an vielen Bauwerken angebracht.

An dem Kranz aus Eichen- und Wacholderlaub hängen die drei der Stadt verliehenen Orden (von rechts nach links in der Draufsicht): Ordre de la Libération (24. März 1945); Croix de Guerre (1914–1918, 28. Juli 1919), Ehrenlegion (9. Oktober 1900)
Die Devise lautet auf Latein „Fluctuat nec mergitur“ (etwa: „Sie verändert sich, geht aber nicht unter“ oder „Sie schwankt, aber sie geht nicht unter“). Der Wahlspruch ist seit mindestens 1581 in Verbindung mit der Stadt nachgewiesen; Georges-Eugène Haussmann machte die Devise als Präfekt des Départements Seine 1853 zum offiziellen Leitspruch der Stadt.
Die beiden Farben werden meist den Farben der französischen Monarchie vor der Revolution zugeordnet. Dabei steht das Rot heraldisch seit den Römern für den Herrscheranspruch und das Blau war den Bourbonen-Lilien unterlegt. Eine andere Erklärung ist, dass Rot die Farbe eines Feldzeichens der Könige von Frankreich war, nämlich des Banners von Dionysius von Paris (französisch Saint Denis), des ersten Bischofs der Stadt und Märtyrers der katholischen Kirche; die Farbe symbolisierte dabei das Blut des Heiligen. Das Blau habe Philippe Auguste (1165–1223) in seine Fahne genommen, weil es als Farbe für die Mutter Gottes (Vierge Marie) steht.


Gesellschaft


Demografie

In der Antike und im Mittelalter ging die Bevölkerung durch die zahlreichen Kriege, Epidemien und Hungersnöte immer wieder zurück. So starben noch 1832 bei einer Choleraepidemie rund 20.000 Menschen. Erst die Industrialisierung im 19. Jahrhundert führte zu einem starken Anstieg der Bevölkerung. 1846 lebten in Paris rund eine Million Menschen, bis 1876 verdoppelte sich diese Zahl auf zwei Millionen. 1921 hatte die Einwohnerzahl von Paris mit knapp drei Millionen ihren historischen Höhepunkt erreicht. Gegenwärtig leben etwas über zwei Millionen Menschen in der Hauptstadt. Im Großraum hingegen hat die Einwohnerzahl stark zugenommen. Lebten 1921 noch 4,85 Millionen Menschen in der Metropolregion, so waren es 94 Jahre später, im Jahre 2015 bereits 12,53 Millionen. Damit zählt Paris zu den Megastädten.
Paris ist stark vom sozioökonomischen Strukturwandel (Gentrifizierung) betroffen: Der durchschnittliche Kaufpreis für Wohnungen lag 2011 bei 8010 Euro pro Quadratmeter, dem Vierfachen des damaligen Preises in Berlin. In beliebten Vierteln wie Saint-Germain-des-Prés konnte er damals bereits 15.000 Euro erreichen. So wurde etwa das 15. Arrondissement, das früher ein Wohnort der Arbeiterschicht gewesen war, zu einem Wohngebiet der wohlhabenden Mittelschicht. Die Preise für Altbauwohnungen sind im Sommer 2019 durchschnittlich auf über 10.000 Euro pro Quadratmeter gestiegen.


Einwanderung

Paris zieht seit Jahrhunderten Menschen aus verschiedenen Ländern und Kulturen an, sei es wegen politischer Verfolgung, aus wirtschaftlichen Gründen oder wegen der kulturellen Anziehungskraft der Stadt. Gegen Ende des 19. Jahrhunderts zogen vor allem Italiener und osteuropäische Juden in die Stadt. Nach dem Ersten Weltkrieg folgten Armenier (nach dem Völkermord 1915), Polen, Russen und Ukrainer („weiße Russen“ nach der Oktoberrevolution 1917). Schon in der Zwischenkriegszeit, v. a. aber nach dem Zweiten Weltkrieg, kamen zahlreiche Gastarbeiter aus Süd- und Osteuropa nach Frankreich und viele von ihnen ließen sich dort nieder, vor allem im Umland von Paris; so führten oft Spanier und Portugiesen den Haushalt der reichen Pariser Familien. Die jüngste und größte Einwanderungswelle stammte aus den ehemaligen französischen Kolonien, etwa von den Antillen, dem Maghreb, Subsahara-Afrika und Indochina. Vor allem die traditionellen Arbeiterviertel im Osten der Stadt waren Anziehungspunkte von Einwanderern, etwa Belleville (19. und 20. Arrondissement), außerdem das 10., das über ein tamilisch-indisch geprägtes Viertel verfügt, das 11. und das 13. Arrondissement, das heute mit der größten Chinatown Europas ostasiatisch geprägt ist. Teile des 18. Arrondissements sind afrikanisch oder arabisch geprägt, vor allem das Quartier de la Goutte-d’Or. Zwischen den überwiegend wohlhabenden und weißen Vierteln im Stadtzentrum und im Westen und den multikulturellen Randgebieten im Osten besteht dabei ein deutlicher Unterschied. Durch die erwähnte Gentrifizierung innerhalb der Stadtgrenzen werden zunehmend ärmere Haushalte und Mieter, oft Einwanderer, aus der Stadt heraus gedrängt. In den Vororten von Paris ist der Anteil der nicht-europäischen Einwanderer weit höher, vor allem in den nördlichen und östlichen, wo Armut, Arbeitslosigkeit und soziale Probleme verbreitet sind; es besteht ein Trend zur Segregation und Ghettobildung (siehe dazu auch den Artikel Banlieue). Da Frankreich die ethnische oder religiöse Zugehörigkeit seiner Bewohner nicht statistisch erfasst, gibt es wenig genaue Daten zur ethnischen Zusammensetzung der Pariser Bevölkerung. In Paris selbst sind 20,4 % der Bevölkerung Einwanderer, also nicht in Frankreich geboren, 14,4 % sind außerhalb Europas geboren. Der Anteil der Jugendlichen unter 18 Jahren mit Migrationshintergrund (mindestens ein Elternteil nicht in Frankreich geboren) beträgt 41 %. Mehr als die Hälfte dieser Jugendlichen haben ihre Wurzeln außerhalb Europas. In der Region Île-de-France liegt dieser Prozentsatz bei 37 %, in einigen Vororten bei über 50 %. Insgesamt sind nach einer Erhebung aus dem Jahr 2006 17 % der Bewohner der Region Île-de-France Einwanderer, 35 % haben einen Migrationshintergrund.


Religionen
Etwa 65 % der Einwohner sind getauft, rund 60 % bekennen sich zum römisch-katholischen Glauben, die meisten praktizieren den lateinischen Ritus, einige wenige auch den armenischen und ukrainischen Ritus. Der Erzbischof von Paris ist auch für die Katholiken der östlichen Riten zuständig. Insgesamt gibt es in Paris innerhalb der politischen Grenzen der Stadt 94 katholische Gemeinden, des Weiteren 73 protestantische Kirchen der verschiedensten Konfessionen, 15 griechisch- und russisch-orthodoxe Kirchen, sechs rumänisch-orthodoxe Kirchen, sieben Synagogen für die etwa 220.000 Juden und 19 Moscheen für die rund 80.000 Muslime, überwiegend Sunniten. Nur knapp 12 % der Christen und etwa 15 % der Juden sind praktizierende Gläubige.


Politik


Stadtregierung

Am 1. Januar 2019 gingen die Gemeinde und das Département Paris unter dem Namen Ville de Paris in einer Gebietskörperschaft mit Sonderstatus auf. Die Stadtregierung wird seit 1977 durch einen Bürgermeister geführt, der vom Stadtrat gewählt wird und gleichzeitig dessen Präsident ist.
Bürgermeisterin ist seit dem 5. April 2014 Anne Hidalgo, nominiert von der Parti socialiste. Ihr Vorgänger Bertrand Delanoë (PS) war 2001 der erste linke Politiker, der in das Rathaus der Hauptstadt einzog. Zuvor stellte mit Jacques Chirac (1977 bis 1995) und Jean Tiberi (1995 bis 2001) die gaullistische RPR den Bürgermeister.
Der erste Bürgermeister der Hauptstadt Jean-Sylvain Bailly wurde am 15. Juli 1789 von der während der Französischen Revolution gebildeten Pariser Selbstverwaltung eingesetzt. Da die Kommune an der diktatorisch organisierten Schreckensherrschaft (La Terreur) beteiligt war, wurde sie 1794 von zwölf getrennten und dezentralisierten Gemeindeverwaltungen ersetzt. Der Staat übernahm die Kontrolle über die Stadt und schuf das Amt des Präfekten der Seine (Préfet de la Seine). Während der Bürgerlichen Revolution von 1848 und der Pariser Kommune von 1870/1871 stand für wenige Monate ebenfalls ein Bürgermeister der Stadt vor.
Am 20. März 1977 wurde Jacques Chirac der erste frei gewählte Bürgermeister von Paris. Die bis dahin einem von der Regierung ernannten Präfekten unterstehende Hauptstadt hatte damit den gleichen Status wie alle übrigen Gemeinden in Frankreich. Eine Ausnahme bildet die Polizei, die weiterhin dem Polizeipräfekten untersteht. Ein Gesetz von 1982 etablierte dann zusätzlich die Ratsversammlungen der Arrondissements. Diese sind beratende Organe, die über begrenzte Befugnisse verfügen. Der Stadtrat (Conseil de Paris) und der Bürgermeister (Maire de Paris) werden jeweils für sechs Jahre gewählt. Die letzte Wahl fand in einem ersten Gang am 15. März 2020 und in einem zweiten am 28. Juni 2020 statt. Die nächste Wahl findet turnusgemäß im Jahr 2026 statt.


Stadtrat (Conseil de Paris)

Der Pariser Stadtrat (Conseil de Paris) besteht aus 163 Mitgliedern. Die Wahlen zum Stadtrat finden alle sechs Jahre im Rahmen der französischen Kommunalwahlen statt. Gewählt wird dabei getrennt nach Arrondissements, wobei jedes Arrondissement eine festgelegte Zahl an Stadträten wählt.
Seit der Wahl des Pariser Stadtrates 2020 setzt sich dieser aus 163 Mitgliedern zusammen. Davon zählen 94 Sitze zur Regierung und 69 zur Opposition.
Die aus 94 Mitgliedern bestehende Regierung setzt sich wie folgt zusammen: 41 Mitglieder der Parti socialiste (PS), 21 Mitglieder der Europe Écologie-Les Verts (GEP), 13 Mitglieder der Divers gauche (DVG), 11 Mitglieder der Parti communiste français (PCF) und 6 Mitglieder der Génération.s.
Die der Regierung mit 69 Sitzen gegenüberstehende Opposition setzt sich folgendermaßen zusammen: 44 Mitglieder der Républicains (LR), 5 Mitglieder der Centristes (LC), 5 Mitglieder des Mouvement démocrate (MoDem), 3 Mitglieder der Horizons, 2 Mitglieder von Agir, 2 Mitglieder von Renaissance (LREM), 1 Mitglied von Objectif France (OF), 1 Mitglied von Soyons libres, 1 Mitglied von La France insoumise (LFI) sowie 2 Mitglieder der Divers gauche (DVG).
Die nächste Wahl des Pariser Stadtrates findet turnusgemäß 2026 statt.


Städtepartnerschaften
Paris unterhält eine einzige Städtepartnerschaft weltweit, und zwar mit Rom seit 1956.

Italien Rom, Italien (1956)
Darüber hinaus unterhält Paris mit folgenden Städten sogenannte Freundschafts- und Kooperationsabkommen:


Kultur und Sehenswürdigkeiten

Frankreich erscheint in Tourismus-Statistiken als das meistbesuchte Land der Erde. Die französische Hauptstadt hat eine Vielzahl sehenswerter kirchlicher und weltlicher Bauwerke, Straßen, Plätze und Parks, etwa 160 Museen, rund 200 Kunstgalerien, circa 100 Theater, über 650 Kinos und mehr als 10.000 Restaurants aufzuweisen. Das Angebot an kulturellen Veranstaltungen ist mit zahlreichen Konzerten, Ausstellungen, Musik- und Filmfestivals, Modenschauen sowie der Austragung sportlicher Wettbewerbe reichhaltig. Die Uferpromenade der Seine in Paris wurde 1991 in die UNESCO-Liste des Weltkulturerbes aufgenommen.
Im ersten Halbjahr 2016 sanken die Besucherzahlen wichtiger Museen in Paris aus verschiedenen Gründen im niedrigen zweistelligen Prozentbereich. 2015 waren die 15 meistbesuchten Museen und museale Monumente von mehr als einer Million Menschen besucht worden, der Louvre hatte über 8 Millionen Besucher.


Theater

Bedingt durch die Tradition des Zentralismus in Frankreich haben die wichtigsten Theater- und Ballettensembles des Landes ihren Sitz in Paris. Das Programm ist mannigfaltig; es ist einem der Veranstaltungskalender, Pariscope oder Officiel des Spectacles, zu entnehmen, die an jedem Zeitungskiosk erhältlich sind. Stark ermäßigte Theaterkarten sind jeden Tag ab 13:00 Uhr für Vorstellungen am Abend desselben Tages an einem der beiden Theaterkioske (Kiosque Théâtre) (vor dem Montparnasse-Bahnhof und neben der Madeleine-Kirche) erhältlich. Die Pariser Oper (heute Opéra national de Paris) und ihre Vorgängerinstitute spielen in der Geschichte der Oper durch stilprägende Uraufführungen eine bedeutende Rolle. Heute betreibt sie zwei Opernhäuser. Die 1875 eröffnete, nach ihrem Architekten Opéra Garnier oder Palais Garnier genannte alte Oper ist mit einer Fläche von 11.237 Quadratmetern das größte Theater der Welt, während die 1989 eingeweihte neue Opéra Bastille sich durch ihre herausragende Bühnentechnik auszeichnet. Seit der Eröffnung der neuen Oper wird das Palais Garnier hauptsächlich, aber nicht ausschließlich für Ballettaufführungen und klassische Opern genutzt. Die Pariser Oper unterhält ein hauseigenes Ballett, das Ballet de l’Opéra de Paris, mit einer angeschlossenen Ballettschule.

Auch die Comédie-Française oder Théâtre français, deren Schauspielensemble sich rühmen darf, 1680 aus der Zusammenlegung von Molières ehemaligem „Illustre Théâtre“ mit anderen Schauspieltruppen hervorgegangen zu sein, hat eine lange Tradition. Berühmte Schauspieler waren unter anderem Sarah Bernhardt und Jean-Louis Barrault. Das heute staatliche Theater spielt ein vorwiegend klassisches Repertoire.
Das Théâtre des Champs-Élysées, von 1911 bis 1913 nach Plänen von Henry van de Velde von Auguste Perret ausgeführt, erregte Anfang des 20. Jahrhunderts durch seine Architektur und skandalumwitterte Aufführungen Aufsehen. Als Musiktheater und Konzerthaus ist es Heimstätte des Orchestre national de France und des Orchestre Lamoureux sowie Stützpunkt der Wiener Philharmoniker in Frankreich.
Aufmerksamkeit gebührt auch den Programmen des Théâtre du Châtelet am Place du Châtelet und dem gegenüberliegenden Théâtre de la Ville (dt. Stadttheater).
Zeitgenössische Komödien, Boulevard- und Vaudeville-Stücke werden in unzähligen kleinen Theatern aufgeführt, wie beispielsweise im Théâtre des Bouffes-Parisiens, das Jacques Offenbach am 5. Juli 1855 gründete. Der Name des Theaters leitet sich ab von „Opéra bouffe“ – „Komische Oper“, wie Offenbach zahlreiche seiner Werke betitelte.
Freunden des Revuetheaters sind die Shows des Moulin rouge, des Lido und des Paradis Latin zu empfehlen. Das Moulin rouge, am 6. Oktober 1889 von Joseph Oller eröffnet, der bereits die Music Hall L’Olympia besaß, leitet seinen Namen ab von der markanten Nachbildung einer roten Mühle auf seinem Dach. Berühmt wurde es durch seine Cancan- und Chahut-Cancan-Tänzerinnen. Nicht ganz so aufwändig, aber unverhohlen erotischer sind die Darbietungen in den Folies Bergère.
Rockkonzerte finden im Zénith im Parc de la Villette und im Palais Omnisports de Paris-Bercy statt. Das Zénith wurde 1983 auf Initiative des damaligen Kulturministers Jack Lang nach Plänen der Architekten Philippe Chaix und Jean-Paul Morel erbaut und am 12. Januar 1984 mit einem Konzert des französischen Sängers Renaud eingeweiht.
Die Arènes de Lutèce (Arenen von Lutetia) gelten als ältestes noch erhaltenes Bauwerk der Hauptstadt. Das römische Amphitheater befindet sich in der Rue Monge, im 5. Arrondissement. Die Arena stammt aus dem 1. Jahrhundert n. Chr. und wurde bis zum Ende des 3. Jahrhunderts genutzt. Circa 17.000 Personen konnten den Theatervorstellungen, aber auch Kämpfen auf Leben und Tod, beiwohnen. Mit dem Aufkommen des Christentums verloren die römischen Zirkusse allgemein an Bedeutung und als im 3. und 4. Jahrhundert die germanischen Stämme in das römische Gallien einfielen, wurden die Arènes de Lutèce stillgelegt und ihre Steine für den Bau von Stadtmauern und anderen Befestigungsanlagen verwendet.


Museen

Das 1793 in der früheren Residenz der französischen Könige eröffnete Musée du Louvre enthält eine der weltweit bedeutendsten Sammlungen mit über 380.000 Werken, von denen etwa 35.000 ausgestellt werden. Die Exponate decken einen Zeitraum, der von der Antike bis zum Ende des 19. Jahrhunderts reicht. Das Gebäude liegt im Zentrum von Paris zwischen dem rechten Seineufer und der Rue de Rivoli. Sein Innenhof liegt in einer Linie mit der Avenue des Champs-Élysées und bildet damit den Ursprung der sogenannten Axe historique, der historischen Achse.

Das Musée d’Orsay entstand in dem ehemaligen gleichnamigen Bahnhof, dem Gare d’Orsay, am südlichen Ufer der Seine gegenüber dem Tuileriengarten. Das Bahnhofsgebäude wurde 1900 von Victor Laloux für die Verbindung Paris–Orléans gebaut, 1939 wegen Kapazitätsproblemen geschlossen und 1978 als historisches Bauwerk eingestuft. Unter Leitung der Architektin Gae Aulenti wurde es von 1980 bis 1986 unter behutsamer Wahrung der alten Bausubstanz zum heutigen Museum umgebaut. Weltweit einzigartig ist die Sammlung französischer Impressionisten. Daneben werden Gemälde, Skulpturen, Fotos und Möbel von herausragender Qualität aus der Zeit von 1848 bis 1914 gezeigt. Vertreten sind fast alle Stilrichtungen dieses Zeitraums sowie Werke vieler Einzelkünstler.
Das 1977 nach Plänen der Architekten Renzo Piano, Richard Rogers und Gianfranco Franchini eröffnete Kunst- und Kulturzentrum Centre Georges-Pompidou (Centre National d’Art et de Culture Georges Pompidou) sorgte durch seine Architektur aus Stahl und Glas für Aufsehen: alle Versorgungsleitungen sind an der Fassade angebracht. Es wurde als interaktives Informationszentrum gestaltet, das freien Zugang zu Wissen garantieren soll. Es beherbergt die Bibliothèque publique d’information (Bpi) und das Musée National d’Art Moderne mit einer hervorragenden Sammlung von Kunstwerken des 20. Jahrhunderts, vor allem Werken des Surrealismus, Fauvismus, Kubismus und des Abstrakten Expressionismus. Das Musikforschungsinstitut IRCAM (Institut de Recherche et Coordination Acoustique/Musique) ist ihm organisatorisch angeschlossen.
Das Musée Picasso besitzt etwa 250 Werke aus allen Schaffensperioden Picassos, insbesondere Gemälde und Skulpturen sowie Gemälde aus der persönlichen Sammlung des Künstlers, unter anderem von Georges Braque, Paul Cézanne, Henri Matisse, Joan Miró und Amedeo Modigliani. Das Museum befindet sich im ehemaligen Hôtel Salé, einem in den Jahren 1656 bis 1659 im Maraisviertel erbauten Hôtel particulier, dessen Bezeichnung sich von seinem damaligen Bauherrn, dem für die Eintreibung von Salzsteuer zuständigen königlichen Staatsbeamten Pierre Aubert, Spitzname Salé („Gesalzener“), ableitet.
Das Musée national du Moyen Âge (vor 1980: Musée de Cluny) in dem spätgotischen ehemaligen Abtspalast Hôtel de Cluny (1485–1490) zeigt eine bedeutende Sammlung mittelalterlicher Kunstgegenstände. Es gestattet den Zutritt zu den benachbarten früheren Thermen aus gallo-römischer Zeit. Im September 2000 wurde neben dem Hôtel de Cluny der mittelalterliche Garten (Jardin médiéval) mit einer Fläche von zirka 5.000 Quadratmetern angelegt.

Das Grand Palais entstand nach Plänen der Preisträger des Prix de Rome, den Architekten Henri Deglane (1851–1932) und Albert Louvet (1860–1936), als Ausstellungshalle zur Pariser Weltausstellung von 1900. Es besitzt eine 240 Meter lange und 20 Meter hohe Fassade mit ionischen Säulen. Im Gebäude finden bedeutende Kunst- und Gemäldeausstellungen statt. Im Westflügel ist der Palais de la découverte (Palast der Entdeckung) untergebracht, ein naturwissenschaftliches Museum, das zu praktischen Erkundungen einlädt und ein Planetarium betreibt.
Dem Grand Palais gegenüber steht der zur gleichen Zeit und zu gleichem Zweck von dem Architekten Charles Girault (1880 Prix de Rome) im neobarocken Stil der Belle Époque errichtete Petit Palais. Der mit einem prunkvoll vergoldeten schmiedeeisernen Eingangstor und reichen Deckenmalereien ausgestattete halbrunde Bau, dessen Fassaden fast nur aus Fenstern bestehen, beherbergt seit 1902 das städtische Museum der schönen Künste Musée d’art moderne de la Ville de Paris.
Nahe dem Eiffelturm befindet sich seit 2006 das Musée du quai Branly für Völkerkunde. Mehrere naturkundliche Museen sind im Muséum national d’histoire naturelle zusammengefasst und befinden sich an verschiedenen Standorten, etwa im Bereich des Jardin des Plantes. Am 27. Oktober 2014 eröffnete die Stiftung Louis Vuitton ein Privatmuseum, das die Kunstsammlung von Bernard Arnault beherbergt. 2021 eröffnete in der Bourse de commerce die Collection Pinault, ein Privatmuseum, das die Kunstsammlung von François Pinault beherbergt.


Bauwerke


Brücken

Die Seine fließt im Großraum Paris ab der Einmündung der Marne bei Vincennes im Pariser Becken in einem weiten Linksbogen von Südosten durch das Zentrum, um dann in einer engen Rechtskurve bei Boulogne-Billancourt sich wieder bis St. Denis nach Norden zu biegen und dabei noch einmal die City von Norden zu umfassen. Danach biegt sie in einem Bogen um Colombes/Villeneuve-la-Garenne erneut nach Nordwesten ab, um sich dann weiter Richtung Ärmelkanal zu schlängeln. Etwa 40 Brücken (ponts) und einige Stege überspannen die Seine und verbinden die zentralen Arrondissements miteinander. Die Insel Île de la Cité ist über insgesamt 9 Brücken sowohl mit der benachbarten Île Saint-Louis verbunden (Pont Saint-Louis) als auch mit den beiden Ufern (rechtes Ufer, in Fließrichtung: Pont d’Arcole, Pont Notre-Dame, Pont au Change; linkes Ufer: Pont de l’Archevêché, Pont au Double, Petit Pont, Pont Saint-Michel). Der Pont Neuf führt über die Westspitze der Insel und verbindet die Insel mit beiden Ufern. Er ist die älteste der heutigen Pariser Seinebrücken. Die jüngste ist die Passerelle Simone-de-Beauvoir, die seit 2006 ohne Strebepfeiler 194 Meter Spannweite überbrückt. Viele Brücken entstanden im 19. Jahrhundert und sind Eisenkonstruktionen. Abends werden die Brücken nach einem bestimmten, die Baustrukturen betonenden Konzept angeleuchtet. Zusammen mit den Uferbefestigungen bilden die Brücken ein städtebaulich prägendes Merkmal der Stadt. Außer den Seinebrücken gibt es noch ca. 300 andere Brückenbauwerke in der Stadt: über Kanäle und Straßen, über Gleise und in Parks.


Plätze und Straßen

Erste urbanistisch relevante Maßnahmen ergriff in Paris Anfang des 17. Jahrhunderts Heinrich IV. mit der Anlage der ersten zwei von insgesamt fünf sogenannten „königlichen Plätzen“.
Die quadratische Place des Vosges (1605–1611), früher Place Royale im Le Marais (4. Arrdt.) bietet ein einzigartig geschlossenes Ensemble von Bauten aus Back- und Quaderstein im Stil des frühen 17. Jahrhunderts. Die Mitte des Platzes ziert das Reiterstandbild von Ludwig XIII.

Zur gleichen Zeit entstand in demselben Stil die dreieckige Place Dauphine (1607–1612) an der westlichen Spitze der Île de la Cité (1. Arrdt.), nach Plänen von Louis Métezeau und Jacques II. Androuet du Cerceau. Die Achse des später zu einem Drittel zerstörten Platzes lässt durch eine Öffnung im Westen den Blick auf die Brücke Pont Neuf und auf das Reiterstandbild von Heinrich IV. frei.
Die Place des Victoires (1675), mit rundem Grundriss, wurde auf Initiative des Höflings François d’Aubusson de La Feuillade nach Plänen von Jules Hardouin-Mansart zu Ehren des Sonnenkönigs Ludwigs XIV. entworfen, um seinem Standbild von Martin Desjardins einen würdigen Rahmen zu geben. Letzteres wurde in der Revolution zerschlagen und erst 1822 durch das heutige Reiterstandbild von Bosio ersetzt. Hier so wie auf den folgenden „Königlichen Plätzen“ ersetzt der schöne hellgelbe Quaderstein, der sich hervorragend für den Steinschnitt eignet, den bisher üblichen Backstein.
Auch die überaus harmonische und in ihrem ursprünglichen Zustand erhaltene Place Vendôme (1690–1720) wurde zu Ehren Ludwigs XIV. angelegt. Die Pläne lieferte abermals Jules Hardouin-Mansart. Das früher hier befindliche Reiterstandbild fiel, wie nahezu alle Abbilder der Mitglieder des französischen Königshauses, der Revolution zum Opfer, was Napoléon I. Gelegenheit gab, hier 1806 in Erinnerung an die Schlacht bei Austerlitz eine 44 Meter hohe Triumphsäule errichten zu lassen.

Die ab 1755 angelegte Place Louis XV (heutige Place de la Concorde) sollte der größte und letzte der „Königsplätze“ von Paris werden. Der Platz blieb unvollendet. Während der Revolution in Place de la Révolution umbenannt, empfing er – an Stelle der zerstörten Reiterstatue Ludwigs XV. – die Guillotine, unter der im Jahre 1793 Ludwig XVI. und die Königin Marie-Antoinette enthauptet wurden. Seit 1836 wird der Platz von dem 23 Meter hohen Obelisken von Luxor dominiert. Daneben befinden sich zwei aufwändig gestaltete Brunnen von Jakob Ignaz Hittorff.
