Title,Article,Tags,Personas,Summary,Meeting_Plan,Meeting
Parallel dazu intensivierte das US-Militär die 1966 begonnene „Pazifizierung“, die die ländlichen Regionen unter Kontrolle des Thieu-Regimes bringen sollte. Mit einem „Revolutionären Entwicklungsprogramm“ imitierte die ARVN die Methoden der NLF. Teams von je 60 Vietnamesen zogen in ein Dorf, boten soziale Dienste an und versprachen Sicherheit, um die Einwohner auf Thieus Seite zu ziehen. Das Programm war bisher an häufig fehlender Abstimmung zwischen US- und ARVN-Truppen, nicht weitergeleiteten oder verschleppten Entscheidungen in den korrupten Saigoner Behörden, mangelhafter Ausbildung der Rekruten und vielen Anschlägen der NLF auf sie gescheitert. Erst nach der Tet-Offensive und infolge des Phoenix-Tötungsprogramms zeigten die Beeinflussungsversuche breitere Wirkung.
Ab Herbst 1968 übergab das US-Militär im Zuge der von Johnson versprochenen „De-Amerikanisierung“ der ARVN mehr Eigenverantwortung. Dazu wurde diese von 685.000 auf 800.000 Mann vergrößert, ihre Ausbildung verbessert und ihre Bewaffnung modernisiert. Abrams ließ ARVN- und US-Einheiten erstmals gemeinsam kämpfen, um ihnen die Offensiven gegen die NLF allmählich ganz zu überlassen. Südvietnams Generäle waren jedoch nicht an einer Ausweitung der Kampfeinsätze interessiert. Die Desertionen in der ARVN stiegen sprunghaft an. Die Stadtbevölkerung Südvietnams sah sich von den USA verraten. Am 1. November 1968 stellte Johnson die Bombardierung Nordvietnams ein. Diese Maßnahme und der von Johnson verkündete Durchbruch in Richtung Friedensverhandlungen mit Vietnam erfolgte auch aus taktischen Gründen vor dem Hintergrund der Präsidentschaftswahl und ging als ein sogenannter October Surprise in die Geschichte ein.


„Vietnamisierung“

Der Republikaner Richard Nixon war als strenger Antikommunist bekannt. Er hatte 1954 einen US-Luftangriff auf Dien Bien Phu gefordert, Diems Diktatur und die Eskalation der Bombardierungen vorbehaltlos unterstützt. Er glaubte wie seine Vorgänger an die Dominotheorie, wollte Südvietnam daher unbedingt erhalten und die US-Unterstützung nicht aufgeben. Er sah den Vietnamkrieg aber als Hindernis dafür, die globale Hegemonie der USA in einer multipolaren, von mehreren Großmächten dominierten Welt zu wahren. Daher strebte er mit Geheimdiplomatie eine Entspannung der Beziehungen zur Sowjetunion und Volksrepublik China an, die auch deren Waffenhilfe an Nordvietnam beenden sollte. Dazu zentralisierte er die politischen Entscheidungsprozesse seiner Regierung im Nationalen Sicherheitsrat um Sicherheitsberater Henry Kissinger. Nixons Außenminister und Verteidigungsminister blieben profillose Befehlsempfänger.
Nixon gewann die US-Präsidentschaftswahl 1968 mit dem Versprechen, einen „Frieden mit Ehre“ auszuhandeln. Zu seinem Wahlsieg trug bei, dass Thieu seine Teilnahme an den Pariser Gesprächen drei Tage vor dem US-Wahltermin absagte. Nixon hatte Thieu zuvor über Anna Chennault kontaktiert und ihn dazu gedrängt, die Verhandlungen noch vor der Wahl scheitern zu lassen. Er wollte ebenso wenig wie seine Vorgänger vor US-Bürgern und Verbündeten als Verlierer des Vietnamkriegs dastehen, sondern sie von seinem Friedenswillen überzeugen und zugleich Nordvietnam zur Akzeptanz des Saigoner Regimes zwingen, um den US-Kriegseinsatz ohne Glaubwürdigkeitsverlust beenden zu können. Darum lehnten er und Kissinger einen einseitigen Abzug der US-Truppen ab. Um innenpolitisch die nötige Zeit für einen Verhandlungserfolg mit Nordvietnam zu gewinnen und seine Deeskalationsabsicht zu zeigen, schlug Nixon am 14. Mai 1969 im US-Fernsehen den gleichzeitigen Abzug der NVA- und US-Truppen vor und garantierte den Erhalt des Thieu-Regimes. Am 8. Juni sagte er Thieu bei ihrem ersten Treffen zu, die ARVN für die Selbstverteidigung angemessen aufzurüsten und ihn stets von allen Geheimgesprächen mit Hanoi zu unterrichten. Am 9. Juli zogen die ersten US-Soldaten aus Südvietnam ab. Hanoi lehnte Nixons Vorschläge jedoch umgehend ab, da die von den USA abhängige ARVN bloß deren Krieg fortsetzen solle. Im Juli bildete die NLF eine provisorische Revolutionsregierung (PRG), die Hanoi sofort als einzige legitime Vertretung des südvietnamesischen Volkes anerkannte. Die PRG wurde in allen von der NLF beherrschten Gebieten organisiert und durch Nguyễn Thị Bình in Paris vertreten. Am 30. Juli versprach Nixon Thieu bei seinem Besuch in Saigon streng vertraulich weitere Bombardierungen Nordvietnams, damit Thieu dem US-Truppenabzug zustimmte.
Nach der am 25. Juli 1969 erklärten Nixon-Doktrin wollten die USA verbündete asiatische Staaten weiterhin militärisch und ökonomisch unterstützen, aber ihnen die militärische Selbstverteidigung überlassen. Damit gab Nixon die von Johnson im Vorjahr eingeleitete Deeskalation als seinen Politikwechsel aus. In Südvietnam wurde diese „Vietnamisierung“ als US-Innenpolitik auf Kosten der ARVN abgelehnt. Creighton W. Abrams bremste wegen seiner Erfahrungen mit der ARVN das Abzugstempo. Die USA erhöhten deren Truppen auf über eine Million Mann, rüsteten sie mit modernen Waffensystemen auf und bildeten sie daran aus. Die Kämpfe der ARVN mit NLF und NVA nahmen danach ab und einige ARVN-Einheiten waren militärisch erfolgreich. Jedoch blieben Desertionen und Korruption in der ARVN verbreitet. Das Thieu-Regime blieb unpopulär und von US-Finanzhilfe abhängig.
Im März 1970 weitete Thieu auf Druck der USA das Pazifierungsprogramm aus und beschloss eine Landreform. Bis 1972 erhielten 800.000 südvietnamesische Familien Land. Der Anteil der Grundeigentümer stieg von 29 auf 56 % der Bevölkerung. Mit dem Ausbau der Infrastruktur und Produktionsanreizen gelang es Thieus Regime in zwei Jahren, weite Teile Südvietnams zu kontrollieren. Wegen der durch Flüchtlingsströme veränderten Besiedlungsstruktur, dem fortgesetzten Phoenixprogramm, dessen Brutalität der NLF neue Anhänger zutrieb, der Korruption in den Behörden, einer weiteren manipulierten Wahl und der allgemeinen Kriegsmüdigkeit erhielt Thieu jedoch weiterhin kaum Sympathien der Bevölkerung und verfehlte damit sein Ziel, Südvietnam dauerhaft zu stabilisieren. Ein Bericht des US-Senats resümierte im Februar 1970: Unter Thieu bleibe Südvietnam auf US-Hilfe angewiesen, die Vietnamisierung könne mit ihm nur scheitern.
Ab Juni 1969 zogen die USA 25.000, ab September weitere 60.000, ab März 1970 150.000, 1971 177.000 US-Soldaten aus Südvietnam ab. Etwa alle sechs Monate folgten weitere 50.000 Mann. Ende 1970 standen noch 334.000, 1971 noch 157.000, 1972 noch 95.000 (davon nur 6000 Kampftruppen), Anfang 1973 noch 27.000 US-Soldaten in Südvietnam.


Invasionen in Kambodscha und Laos

Nixon wollte seinen Ruf als Antikommunist nutzen und Nordvietnam durch unberechenbares Vorgehen überzeugen, er würde sogar einen Atomkrieg riskieren, um einen Erfolg der Pariser Gespräche zu erzwingen. Er nannte diese Strategie intern Madman theory. Im Februar 1969 befahl er die streng geheime Operation MENU, von der nicht einmal der Stabschef der Air Force erfuhr. Dabei warf die US-Luftwaffe mit stillschweigender Duldung von Prinz Norodom Sihanouk in 14 Monaten rund 100.000 Tonnen Bomben auf Rückzugsgebiete der NLF und NVA in Kambodscha und Laos. Anschließend durchsuchten US-Spezialtrupps die betroffenen Gebiete, um Überlebende zu töten. Dabei starben eine unbekannte Menge Zivilisten. Der Nachschub für die NLF verringerte sich um nur 10 %. Die NVA wich ins Landesinnere Kambodschas aus und verstärkte den laufenden Kambodschanischen Bürgerkrieg. Im Juni 1969 stellte Nixon Nordvietnam ein Ultimatum bis zum 1. November, in Verhandlungen über einen wechselseitigen Truppenabzug aus Südvietnam einzuwilligen, und drohte andernfalls mit schweren Folgen. Als Hanoi ablehnte, brachten seine Sicherheitsberater Nixon nur mit Mühe davon ab, Luftangriffe auf Hanoi und eine Seeblockade Nordvietnams zu befehlen.

Am 18. März 1970 stürzte der US-freundliche Minister Lon Nol den Regenten Kambodschas, Prinz Sihanouk. Die Beteiligung der CIA an dem Putsch bleibt unbewiesen. Lon Nol wollte die Roten Khmer und die mit ihnen verbündeten NVA-Kräfte vertreiben. Nach seinem Sturz beschloss Sihanouk, die Roten Khmer zu unterstützen. Ihre Reihen wuchsen von 6.000 auf 50.000 Kämpfer an. Am 29. März 1970 startete Nordvietnam auf Wunsch der Roten Khmer eine Offensive gegen die kambodschanische Armee. Sie überrannten schnell große Teile Ostkambodschas und übergaben die neu gewonnenen Gebiete den Roten Khmer.
Diese Lage nutzte die US-Armee für eine Bodenoffensive gegen Grenzgebiete Kambodschas nahe Saigon, in denen sie das Hauptquartier der NLF vermutete. Am 1. Mai 1970 rückten dort 43.000 Soldaten der ARVN und 31.000 US-Soldaten ein. In der „Schlacht von Kambodscha“ töteten sie rund 2000 NLF-Kämpfer, zerstörten viele Waffenlager und Bunker, ohne aber das Hauptquartier zu finden. Die meisten NLF-Kräfte wichen weiter ins Landesinnere aus und halfen dort den Roten Khmer, ihre Herrschaft allmählich auf fast 50 % Kambodschas auszudehnen. Zugleich dünnte der Vorstoß die US- und ARVN-Truppen in Südvietnam aus und entlastete somit die dortigen NLF-Kräfte. In den USA wuchsen die Proteste auch im US-Kongress auf einen Höchststand, so dass Nixon die Invasion Kambodschas im Juni 1970 beenden musste.
Im September 1969 beschloss der US-Kongress ein gesetzliches Verbot von US-Bodentruppen in Thailand und Laos. Am 10. Oktober 1969 drohte Nixon mit dem Start kernwaffenbestückter Bomber im Rahmen der Operation Giant Lance mit seiner Entschlossenheit zu einem Dritten Weltkrieg, womit er die Sowjetunion vergeblich einzuschüchtern suchte. Im Dezember 1970 verbot der Kongress Nixon US-Bodeneinsätze in Laos. Vom 8. Februar bis 24. März 1971 versuchte die ARVN allein die Nachschublinien der NLF in Laos zu unterbrechen (Operation Lam Son 719), um der Vietnamisierung und Verhandlungen mit Nordvietnam Zeit zu verschaffen. Doch die NLF erfuhr von den Einsatzplänen und schlug die ARVN-Truppen in die Flucht. Nur massive US-Luftangriffe verhinderten, dass sie völlig aufgerieben wurden.
Weitere schwere Luftangriffe der USA auf Kambodscha und Laos fanden in den Operationen „Commando Hunt“ von 1968 bis 72 und „Freedom Deal“ von 1970 bis 73 statt. Die Ziele dieser Operationen wurden jedoch nicht erreicht. Die Kambodschanische Regierung schätzte später, dass insgesamt mehr als 20 Prozent der Güter des Landes während des Bürgerkriegs zerstört wurden. Zwei Millionen Menschen von sieben Millionen Einwohnern wurden während des Bürgerkriegs aus den ländlichen Gebieten in die Städte vertrieben, insbesondere nach Phnom Penh, das von etwa 600.000 im Jahr 1970 auf eine geschätzte Bevölkerung von fast zwei Millionen im Jahr 1975 anwuchs.


Oster-Offensive 1972

Nach der verlorenen Tet-Offensive hatte NLF-General Giap dem Aufbau konventioneller Streitkräfte in Südvietnam Vorrang vor Guerillagefechten gegeben. Für diesen Aufbau erhielt Nordvietnam 1970 neue Waffenlieferungen von Sowjetunion und China, indem es ihren Konflikt geschickt ausnutzte. Die NLF festigte während der Kambodscha-Invasion 1970 ihren Einfluss im Mekongdelta, band dort dauerhaft ARVN-Kräfte und konnte so bis Mitte 1971 auch in anderen Teilen Südvietnams wieder Fuß fassen. Im Juli 1971 bot Kissinger der Volksrepublik China bessere Beziehungen zu den USA an, wenn sie Hanoi zum Einwilligen in Kompromisse bei den Pariser Gesprächen nötigen würde. Nixon wollte die Volksrepublik China als erster US-Präsident im Februar 1972 besuchen. Nordvietnams Premierminister Phạm Văn Đồng konnte Mao nicht von diesem Besuchsplan abbringen. Um der befürchteten Annäherung zwischen USA und China zuvorkommen, bereitete Hanoi eilig einen Großangriff der NVA auf Südvietnam vor.
Erneut schätzten US-Geheimdienste beobachtete Truppenbewegungen in Nordvietnam falsch ein. Im März überschritten 120.000 NVA-Soldaten in drei Angriffskeilen die Grenzen zu Südvietnam und eroberten in wenigen Tagen die fünf nördlichen Provinzen, große Teile des zentralen Hochlandes mit Kon Tum und drangen bis auf 70 km vor Saigon vor. Da Thieu alle ARVN-Kräfte zum Schutz der Großstädte zusammenziehen musste, eroberte die NLF im Mekongdelta viele ARVN-Basen. Dies zeigte dem Thieu-Regime, dass Frieden nur mit der NLF erreichbar wäre, und den USA, dass die Vietnamisierung ebenso illusorisch war wie ein militärischer Sieg.
Für Nixon waren eine militärische Niederlage und der Verlust Südvietnams im Wahljahr 1972 jedoch unannehmbar. Er kündigte am 8. Mai 1972 als bisher schwerste Eskalation des Kriegs die Verminung des Hafens von Hải Phòng, eine Seeblockade und erneute Flächenbombardierungen Nordvietnams an. Bei dieser Operation Linebacker warf die US-Luftwaffe im Juni 112.000 Tonnen Bomben ab, darunter erstmals auch sich selbst elektronisch ins Ziel steuernde präzisionsgelenkte Munition (eng. Smart Bombs). Diese unterbrachen den Nachschub für die NVA wirksam, sodass die ARVN deren Kräfte bis zum Juli zurückschlagen konnte. Dabei starben rund 100.000 NVA- und 25.000 ARVN-Soldaten. Erneut flohen hunderttausende Südvietnamesen aus ihren Dörfern. Entgegen der Warnungen der Berater Nixons protestierten die Sowjetunion und China nur schwach gegen die Eskalation und setzten ihre Entspannungspolitik mit den USA fort. Dies zeigte Hanoi, dass Kompromisse mit den USA unvermeidbar waren. Die meisten US-Bürger stimmten der erneuten Bombardierung Nordvietnams laut Umfragen zu. Jedoch wuchs der Widerstand im US-Kongress, den Krieg weiter zu finanzieren.


Pariser Waffenstillstand
Kissinger hatte seit 1967 Kontakte mit Vertretern Nordvietnams. In Nixons Auftrag, von dem weder Thieu noch US-Außenminister William P. Rogers wussten, bot er Hanoi im Dezember 1968 und erneut im Mai 1969 Geheimgespräche an, um die mit vier Parteien komplizierten Pariser Gespräche zu umgehen und Thieu, der jede Reduktion von US-Hilfe ablehnte, zu Kompromissen zu zwingen. Er sah voraus, dass sich das Saigoner Regime nach dem US-Truppenabzug nicht halten würde. Die Geheimgespräche sollten den USA einen Rückzug ohne Glaubwürdigkeitsverlust gestatten. Am 21. Februar 1970 traf Kissinger erstmals den kommunistischen Spitzenpolitiker Lê Đức Thọ, mit dem er fortan regelmäßig verhandelte. Tho sah Nordvietnam als Sieger des Kriegs und lehnte jede Lösung ab, die den Kommunisten in Südvietnam keine dominante Rolle zubilligen würde. Erst nach der Bombardierung 1972 sah er das Anliegen der USA, ohne Gesichtsverlust aus dem Krieg herauszukommen, als im eigenen Interesse liegend an.
Kissinger konnte jedoch keinen wechselseitigen Truppenabzug durchsetzen, da der einseitige Truppenabzug der USA weit fortgeschritten war und US-Kongress wie US-Bürger eine weitere Eskalation ablehnten. Im Herbst 1972 erkannte Tho den Fortbestand des Thieu-Regimes vorläufig an und schlug einen nationalen Rat zur Vorbereitung allgemeiner Wahlen vor, in dem auch die NLF und neutrale Gruppen gleichberechtigt vertreten sein sollten. Nordvietnam werde einem Waffenstillstand sofort zustimmen und alle Kriegsgefangenen austauschen, falls die USA ihre Angriffe einstellen und in 60 Tagen aus Südvietnam abziehen würden. Kissinger setzte ein gemeinsames Kontrollgremium für den Waffenstillstand und internationale Überwachung des Friedensprozesses durch.
Thieu, der in Paris nicht mitverhandelt hatte, hatte inzwischen durch seinen Geheimdienst von Kissingers Geheimgesprächen mit Tho erfahren. Daraufhin lehnte er den Vertragsentwurf strikt ab. Kissinger versuchte den Kompromiss mit diplomatischem Druck zu retten und erklärte am 25. Oktober: „Wir glauben, der Frieden steht vor der Tür.“ Damit begünstigte er Nixons hohen Wahlsieg im November 1972. Dieser wollte ein für die USA und Südvietnam günstigeres Abkommen aushandeln. Er überließ der ARVN große Waffenbestände der US-Armee (Operation Enhance Plus) und versprach Thieu in geheimen Briefen, er werde weitere Luftangriffe anordnen, falls Hanoi den Waffenstillstand nach dem US-Abzug missachte. Am 13. Dezember befahl er die Operation Linebacker II, um Hanoi zum Einlenken zu zwingen. Dabei flog die US-Luftwaffe vom 18. bis 29. Dezember 1972 (außer am Heiligabend) pausenlos 3.500 Angriffe auf Nordvietnam, tötete 2.000 Zivilisten und zerstörte einige Viertel Hanois. Damit erreichte das Ansehen der USA weltweit einen historischen Tiefpunkt.

Danach beteiligte sich Nordvietnam wieder an den Pariser Gesprächen. Der Vertragsentwurf vom Oktober wurde nur noch in Randdetails verändert. Am 27. Januar 1973 unterzeichneten alle Beteiligten das Pariser Abkommen. Es verpflichtete die USA zum vollständigen Truppenabzug in 60 Tagen, Nordvietnam zur Freilassung aller Kriegsgefangenen, untersagte allen Fremdmächten militärische Einmischung in Laos und Kambodscha, erlaubte Nordvietnam, etwa 140.000 NVA-Soldaten in Südvietnam zu lassen, und der NLF, die von ihr kontrollierten Gebiete bis zur allgemeinen Wahl zu verwalten. Die entmilitarisierte Zone um den 20. Breitengrad wurde in eine vorläufige Demarkationslinie umgewandelt und war somit keine völkerrechtlich anerkannte Grenze mehr. Damit erfüllte der Vertrag alle Hauptforderungen Nordvietnams, nicht aber Südvietnams, das den Verbleib von US-Truppen im Land und Abzug der NVA gefordert hatte. Sein Fortbestand hing allein davon ab, ob die USA Nixons geheime briefliche Zusagen an Thieu einhalten würden. Zudem versprach Nixon Nordvietnam in einem geheimen Zusatzprotokoll Milliardenhilfe für den Wiederaufbau. Bis Ende März verließen offiziell die letzten stationierten und kriegsgefangenen US-Soldaten Vietnam. Erstmals seit etwa 100 Jahren standen dort keine ausländischen Truppen mehr. Die US-Regierung stellte das Abkommen als den von Nixon fünf Jahre zuvor versprochenen „ehrenvollen Frieden“ dar, obwohl ihr die Vertragsmängel bewusst waren. Kissinger schätzte die Überlebensdauer des Thieu-Regimes auf anderthalb Jahre.


Nordvietnam erobert Südvietnam

Von März bis 15. August 1973 bombardierte die US-Luftwaffe weiterhin Kämpfer der Roten Khmer in ganz Kambodscha mit 250.000 Tonnen Sprengstoff. Die US-Luftwaffe argumentierte, dass die Bombardierung den Fall von Phnom Penh an die Roten Khmer verhindert habe, die die Stadt belagert hatten. Nixon musste die Angriffe einstellen lassen, weil der US-Kongress im Juni alle Finanzmittel dafür gestrichen hatte. Zudem setzte der Kongress Wirtschaftshilfe für Nordvietnam aus, bis alle Fälle vermisster US-Soldaten geklärt wären. Im November beschloss er die War Powers Resolution. Sie befristete jede künftige US-Militärintervention auf zunächst 60 Tage, die der US-Präsident nur mit Erlaubnis einer Mehrheit der Kongressabgeordneten verlängern konnte oder in weiteren 30 Tagen beenden musste. Der Kongress leitete zudem das Amtsenthebungsverfahren gegen Nixon ein. Darum konnte dieser sein Beistandsversprechen an Thieu nicht einhalten.
Beide Regimes in Vietnam brachen häufig das Pariser Abkommen. Die ARVN-Generäle nahmen nicht am Nationalen Rat teil und besetzten 1973 etwa 1.000 Dörfer, um ihren Machtbereich auszudehnen. Obwohl die ARVN mit 1,1 Millionen fast viermal so viele Soldaten hatte wie die NVA, hatten bei ihr zwei Drittel davon, bei der NVA nur 10 % (etwa 30.000 Soldaten) stationäre und defensive Aufgaben. Sie überließen der ARVN kampflos Gebiete, die im Kriegsfall nur schwer zu verteidigen wären. Nordvietnam baute den Ho-Chi-Minh-Pfad zu einer breiten Straße mit Versorgungslagern aus und legte eine 2.000 km lange Pipeline bis ins südliche Kambodscha an. Bis zum Jahresende 1974 kontrollierte die NVA ein relativ geschlossenes Gebiet in Südvietnam. Die NLF band 50 % der ARVN-Truppen im Mekongdelta.
Durch den Abzug der US-Armee verloren 300.000 Südvietnamesen ihre Arbeitsplätze; die Arbeitslosigkeit stieg in Südvietnam auf 40 %. Die Ölkrise 1973 verteuerte Importe und verstärkte Inflation und Rezession. Zudem verursachte das Thieu-Regime durch Marktkontrolle erhöhte Preise und sinkende Vorräte für Reis. Es kam zu Versorgungsengpässen in den Städten. 1974 bewilligte der US-Kongress der ARVN noch 700 Millionen Dollar Militärhilfe, die nach Abzug von Transportkosten auf 300 Millionen sanken und somit kaum noch effektive Kampfeinsätze ermöglichten. Wegen sinkender Kampfmoral und zu niedrigem Sold desertierten 1974 240.000 ARVN-Soldaten. Die Korruption in und zwischen den Truppenteilen wuchs. Da viele ihrer Soldaten plünderten, lehnten immer mehr Bauern die ARVN ganz ab. Südvietnams nichtkommunistische Opposition war zerstritten. Die Oberschicht brachte allmählich ihren Besitz aus dem Land. Thieu blieb passiv und verließ sich bis zu Nixons Rücktritt im August 1974 auf die Zusagen der noch 9000 US-Militärberater, die USA würden ihm notfalls beistehen.

Anfang Dezember 1974 besetzte die NLF die Provinzhauptstadt Đồng Xoài nahe Kambodscha. Am 18. Dezember beschloss Hanoi daraufhin eine Frühjahrsoffensive der NVA zur Eroberung des zentralen Hochlandes Südvietnams, um 1976 einen Aufstand in den Großstädten einzuleiten. Im März 1975 überschritt die NVA die Demarkationslinie nach Südvietnam mit 16 Divisionen und eroberte wie geplant zunächst Ban Me Thuot. Thieu gab das zentrale Hochland daraufhin auf und befahl der ARVN den Rückzug in die Küstenregion um Saigon, um seine Herrschaft zu retten. Der befehlshabende ARVN-General verließ jedoch mit seiner Familie das Land. Die führerlosen ARVN-Truppen flohen ungeordnet und ermöglichten so der NVA das ungehinderte Vorrücken. Am 25. März eroberte sie Huế, Tage später Đà Nẵng, im April Pleiku, Nha Trang und Bien Hoa ohne die erwarteten verlustreichen Schlachten. Nun beschloss Hanoi, auch Saigon anzugreifen; dieser letzte Akt des Krieges wird im englischsprachigen Raum als Ho Chi Minh Campaign (Ho-Chi-Minh-Feldzug) bezeichnet.
Am 21. April 1975 floh Thieu ins Ausland; General Duong Van Minh übernahm für neun Tage sein Amt. Gerald Ford, der als Vizepräsident in Nixons Amt nachgerückt war und seine Wahlchancen zum US-Präsidenten wahren wollte, lehnte wie von Hanoi erwartet erneute US-Luftangriffe und Soforthilfen für die ARVN gegen den Rat von US-Stabschef Frederick C. Weyand ab. Während der US-Kongress darüber beriet, rückte die NVA schon gegen Saigon vor.
Am 21. April erreichte sie Saigons Stadtrand. Erst daraufhin leiteten CIA und US-Militärberater eine Evakuierung ein. In der Woche darauf brachten US-Piloten pro Tag etwa 7.500 Personen mit Passagierflugzeugen aus Saigon. Am 28. und 29. April zerstörten nord- und südvietnamesische Bomben den Flughafen. Große US-Helikopter brachten am 29. und 30. April nochmals 7.014 Personen aus der Stadt auf US-Flugzeugträger vor der Küste. Insgesamt verließen über 130.000 Südvietnamesen ihr Land; etwa 30.000 davon erreichten die Philippinen. Als deren Präsident Marcos die weitere Aufnahme von Flüchtlingen verweigerte, nahm Guam 50.000 Südvietnamesen auf. Auf dem Gelände der US-Botschaft kam es in den letzten 18 Stunden der Evakuierung mit Hubschraubern (Operation Frequent Wind) zum Kampf zwischen fluchtwilligen Vietnamesen und US-Bürgern sowie zu Schusswechseln zwischen US-Wachpersonal und ARVN-Soldaten. Am 30. April nahm die NVA die Innenstadt und um 11:30 den Präsidentenpalast Saigons ohne Widerstand ein. Sie wurde von einigen Südvietnamesen freudig begrüßt. Am Nachmittag erklärte Duong Van Minh die Kapitulation, die nur der deutsche Journalist Börries Gallasch aufzeichnete.


Bilanz


Tote und Verletzte
Die Gesamtzahl der durch diesen Krieg getöteten Vietnamesen wird verschieden geschätzt, weil Kriegszeitraum und Kriegsgebiete verschieden bestimmt werden, amtliche Aufzeichnungen fehlen, geheim gehalten oder gefälscht wurden, viele Opfer nicht identifizierbar oder unauffindbar waren und bis heute Menschen an kriegsbedingten Schäden sterben.
Im Jahr 1978 schätzte Guenter Lewy insgesamt 1.353.000 Menschen, darunter 627.000 Zivilisten, 444.000 kommunistische Soldaten und 282.000 amerikanische und südvietnamesische Soldaten, die zwischen 1965 und 1974 durch Kriegshandlungen getötet wurden. Ein Komitee des US-Senats aus dem Jahr 1975 schätzte etwa 1,4 Millionen zivile Opfer in Südvietnam aufgrund des Krieges, darunter 415.000 Tote zwischen 1965 und 1974. Rudolph J. Rummel schätzt, dass von 1960 bis 1975 1.747.000 Vietnamesen im Krieg getötet wurden. Hinzu kommen vietnamesische, laotische und kambodschanische Opfer der Demozide, die vor, in und nach diesem Krieg stattfanden. Marc Frey schätzte 2,3 Millionen von 1961 bis 1975 im Krieg getötete Vietnamesen. Gesamtschätzungen reichen bis zu vier Millionen, etwa einem Achtel der Gesamtbevölkerung Vietnams, davon 2,6 Millionen Südvietnamesen und 1,1 Millionen NVA- und NLF-Kämpfer. Während des US-Kriegseinsatzes befragte US-Bürger glaubten dagegen, es habe nur etwa 100.000 vietnamesische Kriegsopfer gegeben.

