Title,Article,Tags,Personas,Summary,Meeting_Plan,Meeting
Obwohl die Bomben Nordvietnams Infrastruktur, Militäreinrichtungen und Energieproduktion bis 1968 weitgehend zerstörten, verfehlten sie das strategische Ziel, die Infiltration Südvietnams zu stoppen und Verhandlungen zu erzwingen. Sie erreichten stattdessen, dass Nordvietnams Bevölkerung zusammenrückte, nachts mit riesigen Menschenmengen so viele Zerstörungen wie möglich reparierte, viele Industrieanlagen unter die Erde verlegte und den Transport von Kriegsmaterial und Kämpfern nach Südvietnam steigerte. Mithilfe sowjetischer Waffen wurde seine Luftverteidigung erheblich effektiver, sodass Nordvietnam bis 1968 950 US-Flugzeuge abschoss.
Ab 3. April 1965 bombardierte die US Air Force zudem jene Bereiche des Ho-Chi-Minh-Pfades, die durch Laos führten (Operation Steel Tiger). Ab 6. Dezember 1965 versuchten auch US-Bodentruppen den Pfad zu unterbrechen, besonders bei den Gebirgspässen zwischen Nordvietnam und Laos (Operation Tiger Hound). Nach der am 1. November 1968 gestoppten Bombardierung Nordvietnams befahl Johnson die Operation Commando Hunt, um das inzwischen ausgebaute Wegenetzwerk in Laos zu unterbrechen. Damit wurden für 1969 geplante NLF-Angriffe in Südvietnam zwar verzögert, aber es gelang nie, den Pfad vollständig zu zerstören.


Chemische Kriegführung

Seit den 1950er Jahren hatten US-Militärlabors in Fort Detrick mit Herbiziden experimentiert, die im Zweiten Weltkrieg als Chemiewaffen entwickelt und danach kommerziell genutzt worden waren, und ihre Wirkung in der Natur für militärische Zwecke getestet. Seit 1959 waren diese Mittel in Südvietnam getestet worden. Aufgrund der Erfolgsberichte darüber machte US-Präsident Kennedy diese Stoffe 1961 zum zentralen Bestandteil einer flexiblen, innovativen Counterinsurgency-Strategie und ordnete ihren Einsatz in Vietnam persönlich an. Dabei nutzte die US-Regierung eine Lücke im Genfer Protokoll von 1925 aus, das Krieg mit Chemiewaffen nur gegen Menschen, aber nicht gegen Pflanzen verbot. Um den Großbestellungen der US-Armee nachkommen zu können, ließen die Hersteller Dow Chemical und Monsanto die Synthese der Ausgangsstoffe bei höherer Temperatur ablaufen, wodurch der Dioxin-Gehalt anstieg.

Im Juli 1961 trafen die ersten Lieferungen unter Kodenamen wie Agent Orange, Agent Blue, Agent Purple und Agent White in Südvietnam ein. Im Januar 1962 begann die Operation Ranch Hand („Farmgehilfe“): Dabei versprühten die US Air Force und die ARVN in Vietnam und den Grenzgebieten von Laos und Kambodscha systematisch solche dioxinhaltigen Herbizide. Diese entlaubten den Dschungel, um Straßen, Wasserwege und Grenzgebiete zu entblößen, Ernten zu vernichten und so den NLF-Kämpfern Schutz, Hinterhalte, Nahrung und sozialen Rückhalt zu entziehen. Unter Johnson wurde daraus ab 1965 das historisch größte Programm chemischer Kriegführung. Dabei versprühten die USA bis 1971 etwa 20 Millionen Gallonen (80 Millionen Liter) der mit Dioxin verunreinigten Herbizide. 1971 wurde der Einsatz dieser Mittel gestoppt.


Bodenkrieg
Während Johnson und der Nationale Sicherheitsrat Auswahl, Zeitpunkte und Intensität der Bombardierungen bestimmten, entschied das MACV über Aufstellung und Einsätze der US-Bodentruppen. General Westmoreland betrachtete den Vietnamkrieg als konventionellen Krieg, bei dem es auf die Kampfunfähigkeit, also das Töten, Gefangennehmen oder Verletzen möglichst vieler Gegner mit möglichst wenigen eigenen Verlusten ankam („Abnutzungsstrategie“). Dazu diente die Methode des Search and Destroy etwa bei der groß angelegten Operation Masher im Frühjahr 1966. Ihr Erfolgsmaßstab war der Body Count, also die Menge getöteter Gegner.
Am 8. März 1965 landeten die ersten US-Kampftruppen in Đà Nẵng, um den dortigen Stützpunkt zu schützen. Weitere US-Truppen umgaben die jeweiligen US-Militärbasen („Enklave-Strategie“). Dann erhielt die Erste Kavalleriedivision den Auftrag, das Vorrücken der NLF im zentralen Hochland Südvietnams aufzuhalten. Weitere Kampftruppen konzentrierten sich auf die Gebiete nahe der demilitarisierten Zone (17. Breitengrad). Sie sollten eigene Militärbasen schützen, zugeteilte Gebiete durchsuchen, aufgefundene NLF-Kampfeinheiten vernichten, Grenzregionen kontrollieren und das Einsickern von NLF-Kräften verhindern. Das MACV verteilte die US-Kampftruppen nicht danach, möglichst viele Gebiete zu erobern, sondern danach, dem Gegner möglichst große Verluste zuzufügen, um ihm militärische Angriffe dauerhaft unmöglich zu machen. Dazu setzten Hubschrauber kleine luftbewegliche-Infanterie-Einheiten in einem Gebiet ab, das sie durchkämmten. So wenige Männer wie möglich sollten als eine Art „Köder“ den Kontakt zum Gegner herstellen. Sobald sie gegnerische Kämpfer entdeckten oder von diesen angegriffen wurden, fixierten sie deren Standort und forderten Luftunterstützung an. Diese vernichtete die Gegner durch massives Feuer, so viel, wie verfügbar war.
Die weitaus meisten Gebiete für diese Suchaktionen lagen in den Küstenebenen, einige im zentralen Hochland, in der Khe-Sanh-Region nahe der Grenze zu Laos und im Mekongdelta. Überall gab es vom Durchkämmen ausgenommene Zonen, weil die nächste US-Basis zu wenige Soldaten oder die NLF zu viele Kämpfer dort hatte. Diese Zonen wurden bei Rück- oder Überflügen unkontrolliert mit Artillerie beschossen oder mit den restlichen Bomben beworfen. Dafür verbrauchte die US-Armee 1966 und 1967 fast 50 % ihrer Kampfmunition, in manchen zugeteilten Gebieten bis zu 85 %. Damit tötete sie eine unbekannte Zahl Zivilisten und vertrieb Überlebende aus ihren Wohngegenden. Dies erschwerte die spätere „Pazifizierung“ erheblich.

Viele unerfahrene US-Soldaten leerten ihre kompletten Magazine im Dauerfeuer, sodass spätere Versionen des M16-Gewehres einen 3-Schuss-Modus erhielten. Zudem setzten die meisten US-Befehlshaber, die über einen relativ großen Handlungsspielraum verfügten, bei Kontakt zum Gegner auf die Feuerkraft ihrer Kommandos. 70 % der abgefeuerten Artilleriegeschosse wurden allerdings in Situationen verbraucht, bei denen es zu gar keinen oder nur leichten Gefechten kam. Statistisch wurden für jeden getöteten NLF-Kämpfer 50.000 Schuss verwendet.
Obwohl sie entgegen den Erwartungen keine messbare entscheidende Dezimierung der NLF erreichten, forderten die US-Stabschefs immer mehr Soldaten und Feuerkraft. Bis Ende 1965 sandte die US-Regierung 184.000, bis Ende 1966 400.000, bis Ende 1967 485.000, bis Januar 1968 548.000 US-Soldaten in den Vietnamkrieg. Allen US-Maßnahmen fehlten objektive Maßstäbe, was sie tatsächlich erreichten. So blieb unklar, ob mehr eingesetzte US-Bodentruppen prozentual mehr Gegner töteten:

Die Gesamtzahlen des Body Count kamen durch systematisch gefälschte Gefechtsberichte zustande, weil die NLF-Kämpfer ihre Toten in der Regel mitnahmen, die US-Soldaten keine fremden Leichen im Dschungel suchen wollten und diese kaum von Zivilisten unterscheidbar waren. Das unbeobachtete Töten von Zivilisten und Übertreiben der Zahlen wurde üblich, weil Beförderungen von möglichst hohen Body Counts abhingen. Zudem befahl das MACV im Februar 1966, die Verluste des Gegners müssten bis zum Jahresende die von Hanoi bekanntgegebene Infiltration neuer Kämpfer unbedingt übersteigen. Reden von Regierungsmitgliedern erhöhten den Erfolgsdruck. So behauptete Dean Rusk im März 1967, es gebe Beweise, dass der Gegner seine Kräfte nicht aufrechterhalten könne. Im Herbst sprach Westmoreland von „Licht am Ende des Tunnels“; der Sieg sei nun absehbar. Intern bestritt die CIA dies seit Frühjahr 1967 und schätzte die Zahl der NLF-Kämpfer doppelt so hoch ein wie das MACV, da sie den Ausgleich der Verluste durch eine rasche Rekrutierung in Südvietnam annahm. Das MACV dagegen bestritt das Scheitern seiner Zermürbungsstrategie. Die US-Regierung akzeptierte seine niedrigere Schätzung und segnete damit die systematischen Falschangaben beim Body Count ab. So blieb diese Art der Erfolgsmessung auch nach der Tet-Offensive bestehen.
Verschiedene Maßnahmen sollten das „Schlachtfeld“ Südvietnam (eine eindeutige Front gab es gegen Guerillas nicht) gegen Infiltration isolieren. Dazu integrierte die US-Armee eine „Ranger Force“ in die ARVN, vergrößerte deren Spezialeinheiten und richtete Bootspatrouillen gegen Nachschub auf dem Seeweg ein. Auch das Wehrdorf-Programm der CIA, die Studies and Observation Group, Minenfelder und Garnisonen sowie die spätere Invasion von Laos dienten diesem Zweck. Jedoch verfehlten alle diese Maßnahmen ihr Ziel, weil Südvietnams Grenze zu lang und zu sehr in Wildnis gelegen war und der Ho-Chi-Minh-Pfad ständig neu aufgebaut und erweitert wurde.

Nach schweren Niederlagen im ersten Kriegsjahr zog die NVA ab Juli 1966 alle wehrfähigen Nordvietnamesen ein und wuchs von 250.000 auf 400.000 Mann. Bis zu 5.000 davon gelangten monatlich über den Ho-Chi-Minh-Pfad in den Süden, bis dort 1966 etwa 200.000 NVA-Soldaten neben rund 120.000 Guerillakämpfern kämpften. Ihr Oberbefehlshaber General Nguyễn Chí Thanh setzte anfangs auf überfallartige Angriffe auf ARVN- und US-Basen, die hohe Verluste unter den Angreifern forderten. Nach der verlorenen Schlacht im Ia-Drang-Tal (November 1965) änderte er die Strategie, vermied Großschlachten und verwickelte vor allem Sicherheitspatrouillen der ARVN in viele zerstreute Einzelkämpfe. 95 % dieser Kampfeinsätze führten Einheiten von 300 bis 600 Mann durch. Um die Lufthoheit der US Air Force unwirksam werden zu lassen, bewegten sie sich nur nachts und während der Regenzeit, bevorzugten den Nahkampf und benutzten ausgedehnte Tunnelsysteme als Waffendepots und Rückzugsorte. Damit zwangen sie die US-Bodentruppen, sich zu verteilen, immer mehr Sicherungsaufgaben von der ARVN zu übernehmen und stets in ihre Basen zurückzukehren. US-Soldaten, denen Sprache und Kultur des Landes fremd waren, konnten kaum zwischen Guerillas und Bauern unterscheiden, mussten aber immer mehr vietnamesische Dörfer selbst kontrollieren und verstärkten durch ihr Verhalten den Eindruck, ein ausländischer Aggressor bedrohe das Volk und müsse von allen Vietnamesen gemeinsam bekämpft werden. Trotz vielfacher waffentechnischer und numerischer Unterlegenheit behielten Tanhs Truppen so die strategische Initiative und zerstörten die Aussicht der USA, ihren Kriegseinsatz und eigene Verluste örtlich und zeitlich zu begrenzen. Die NLF konnte Verluste bis 1968 stets auffangen und ihre gezielten Nadelstiche fortsetzen. Obwohl US-Armee und ARVN zuletzt fast fünfmal so viele Soldaten aufboten, hielten ihre Gegner einen stetigen Strom an Material und Kämpfern aufrecht, die gut ausgebildet und meist weitaus motivierter waren. Die ARVN konnte einmal besetzte Gebiete selten lange halten. Zudem musste die US-Armee viele Soldaten zum Schutz ihrer Militärbasen und dort gelagerten Waffen einsetzen, da diese ständig angegriffen wurden. Auch höhere Tötungsraten späterer US-Operationen schränkten den Aktionsradius der NLF nicht ein: Sie entschied weiterhin, wo, wann und wie lange gekämpft wurde. 1969 gingen weiterhin 75 % aller Kämpfe von ihr aus.
Um die eskalierenden Kampfhandlungen mit den amerikanischen Truppen zu bewältigen, führte Nordvietnam eine Mobilisierung der Gesellschaft nach dem Vorbild des Volkskriegs durch, bei dem jedes Gesellschaftsmitglied an der Kriegsanstrengung beteiligt sein müsse. Weil die meisten Männer zum Militär eingezogen wurden, mussten Frauen deren Rolle in der Wirtschaft übernehmen, ihr Anteil am Arbeitskräftebestand in Nordvietnam stieg auf rund 75 %. Der Anteil der auf lokaler Ebene in politischen Funktionen tätigen Frauen verdoppelte sich während des Krieges auf annähernd die Hälfte der dortigen Posten.


Thieu-Regime
Im Februar 1965 entmachteten die ARVN-Generäle Nguyễn Cao Kỳ, Nguyễn Chánh Thi und Nguyễn Văn Thiệu das Khánh-Regime und versprachen den USA enge Zusammenarbeit gegen die NLF. Im März 1965 warnte Thieu die USA, die NLF beherrsche bereits 75 % Südvietnams. Er forderte verstärkte US-Bodeneinsätze, damit die ARVN eher defensive Aufgaben übernehmen konnte. Damit überließ diese den US-Truppen immer mehr die Kontrolle des Landes. In der ARVN und den Städten Südvietnams blieb das eigene Militärregime umstritten.
Im März 1966 entließ Kỳ den Buddhisten Thi, der die ARVN-Einheiten von fünf nördlichen Provinzen befehligte. Dagegen protestierten die Buddhisten der Region, die mit der NLF ein Kriegsende aushandeln wollten. Ihr Führer Tri Quang erhielt enormen Zulauf von Teilen der ARVN. Obwohl Thieu baldige Wahlen für eine verfassunggebende Versammlung versprach, nahmen die Proteste zu, bis Kỳ Đà Nẵng mit Hilfe von US-Truppen besetzen und buddhistische Pagoden umzingeln ließ. Daraufhin setzten Demonstranten in Huế das US-Konsulat in Brand. Auch in Saigon protestierten immer mehr Buddhisten, Katholiken und andere Zivilisten gegen den US-Kriegseinsatz. Während die Überläufer der ARVN mit Kỳ und Thieu verhandelten, besetzten US-Truppen und loyale ARVN-Truppen Huế Anfang Juni und schlugen den Aufstand blutig nieder (180 Tote, über 700 Verletzte). Damit war der Versuch städtischer Südvietnamesen gescheitert, den Krieg zu beenden. Im September 1967 hielten Kỳ und Thieu zwar demokratische Wahlen ab, an denen aber kaum Buddhisten teilnahmen. Trotz starker Wahlmanipulationen erhielt Thieu nur 34,8 % der Wählerstimmen. Die verfassunggebende Versammlung focht das Wahlergebnis an. Erst nach einer Intervention von US-Botschafter Ellsworth Bunker wählte sie Thieu zum Präsidenten Südvietnams und ließ zwei seiner Gegenkandidaten verhaften. Die meisten Südvietnamesen erkannten Thieu daher nicht an, sondern betrachteten ihn als US-Marionette.

Thieu schuf einen auf Korruption basierenden Konsens, indem er die Generäle der ARVN an den Subventionen der USA beteiligte. Zudem unterstützte ihn die chinesischstämmige Handelselite. Die Militärs teilten auch illegale Märkte wie den Verkauf von Heroin unter anderem an US-Soldaten unter sich auf. Auch unter Thieu diente die ARVN vor allem der Machtzuteilung und Machtkontrolle und blieb deshalb militärisch wenig effektiv.


Verhandlungs- und Vermittlungsangebote
Da sich die fortgesetzte Bombardierung Nordvietnams innen- und außenpolitisch nur durch parallel gezeigte Verhandlungsbereitschaft rechtfertigen ließ, bot Johnson Hanoi in der ersten Bombardierungspause im Juli 1965 erstmals Verhandlungen über die Anerkennung Südvietnams an. Das diente vor allem der Beruhigung der US-Bevölkerung. Im Dezember 1965 bot die US-Regierung in einem 14-Punkte-Plan erneut an, die Bombardierungen einzustellen, wenn Hanoi die Unterstützung der NLF in Südvietnam beende. Diese sollte weiterhin nicht in Südvietnam mitregieren dürfen. Nordvietnam machte umgekehrt das Einstellen der Luftangriffe zur Vorbedingung für Verhandlungen. Vermittlungsversuche von polnischen (November 1966), britischen und sowjetischen Diplomaten (Februar 1967) scheiterten jeweils an zeitgleich verstärkten US-Luftangriffen. Bis 1967 gab es an die 2000 solcher Vorstöße von Einzelpersonen aus Drittstaaten.
Bei der Konferenz von Glassboro im Juni 1967 vereinbarte Johnson mit dem sowjetischen Ministerpräsidenten Alexei Nikolajewitsch Kossygin den Einstieg in eine Begrenzung der strategischen Atomwaffen. Kossygin lehnte jedoch Johnsons Angebot ab, auch über die Abrüstung von antiballistischen Raketensystemen zu verhandeln; wegen des Vietnamkriegs der USA, der ihre kriegerische Absicht zeige, könne die Sowjetunion nicht auf die Anschaffung solcher Abwehrsysteme verzichten.
Im September 1967 bot Johnson mit der „San-Antonio-Formel“ erstmals an, die Luftangriffe einzustellen, sobald Nordvietnam in ernsthafte Verhandlungen einwillige und keine weiteren Kämpfer nach Südvietnam sende. Dann könne die NLF eine politische Rolle in Südvietnam spielen. Da er am Ziel eines unabhängigen Südvietnams und eines militärischen Sieges über die NLF festhielt und gleichzeitig Hanois Außenbezirke bombardieren ließ, reagierte Nordvietnam nicht auf das Angebot. Die dortige Führung hielt Verhandlungen seit dem Bruch der Genfer Beschlüsse von 1954 nur noch nach eindeutigen militärischen Erfolgen für sinnvoll und gab ihr Ziel eines vollständigen Rückzugs der USA, einer Machtbeteiligung der NLF und späteren Wiedervereinigung Vietnams nie auf. Verhandlungsangebote nutzte sie vor allem dazu, die US-Luftangriffe in der westlichen Öffentlichkeit moralisch zu diskreditieren.
Von 1965 bis 1968 versuchte Johnson mehrmals, Papst Paul VI. als Vermittler zwischen den Kriegsparteien zu gewinnen. Er erbat vom Papst öffentliche Kritik an Nordvietnam, seiner Behandlung der US-Kriegsgefangenen, und Einflussnahme auf katholische Amtsträger in Südvietnam, NLF-Anhänger unter den Südvietnamesen von den US-Zielen zu überzeugen. Paul VI. lehnte diese Rolle ab und telegrafierte stattdessen im Februar 1965 an Johnson, er befürchte, der bevorstehende US-Kriegseinsatz könne in einen allgemeinen Krieg eskalieren. Ende 1967 erklärte er Johnson, er verstehe seine guten Absichten, könne aber niemals Krieg zustimmen. Er bot an, der Sowjetunion die friedlichen Ziele der USA zu erläutern. Er verfolgte den Plan, eine Weihnachtsmesse in Saigon zu feiern und dann Nordvietnam zu besuchen. Nach der Tet-Offensive ließ Johnson diese Vermittlungsangebote jedoch zugunsten der Pariser Gespräche fallen.


Tet-Offensive 1968

Seit 1961 hatte die NLF ihre Strategie analog zu Maos Volkskriegskonzept auf Eroberung ländlicher Regionen begrenzt, um Südvietnams Großstädte im Küstengürtel einzuschnüren. Wegen hoher NLF-Verluste im Süden forderte General Tanh im Juni 1967 in Hanoi, die als zweite Stufe vorgesehene Städteeroberung vorzuziehen. Daraufhin bereitete sein Nachfolger Vo Nguyen Giap einen koordinierten Überraschungsangriff lokaler Guerillakämpfer mit Kräften der NLF und NVA auf die meisten Groß- und Provinzhauptstädte Südvietnams vor. Dieser sollte den USA zeigen, dass ihr Militär kein Zentrum Südvietnams dauerhaft sichern könne und ein Sieg somit illusorisch sei, sie zur Deeskalation bewegen, die ARVN zersplittern und im Idealfall einen allgemeinen Aufstand gegen das Regime in Südvietnam einleiten. Um den Überraschungseffekt zu erhöhen, wurde das vietnamesische Neujahrsfest (Tet), an dem traditionell Waffenruhe herrschte, als Angriffsdatum gewählt.
Waffen wurden in Südvietnams Städte geschmuggelt. Zur Ablenkung zog Giap im Herbst 20.000 NVA-Soldaten bei einer US-Basis zusammen und begann am 21. Januar 1968 die Schlacht um Khe Sanh. Um eine Niederlage wie in Dien Bien Phu unbedingt zu vermeiden, verteidigte Westmoreland diese US-Basis mit 50.000 US- und ARVN-Soldaten. Johnson ließ die Umgebung bis April mit der historisch dichtesten Menge Sprengstoff (100.000 Tonnen) bombardieren. Giap war die Ablenkung gelungen.

Nach einzelnen verfrühten Angriffen begann am 31. Januar 1968 die Tet-Offensive. Dabei griffen rund 84.000 Kämpfer zeitgleich zahlreiche Provinz- und Distrikthauptstädte an und versuchten, diese zu erobern. Einen solch heftigen Großangriff hatte die US-Armee trotz Warnungen ihrer Geheimdienste nicht erwartet. In Saigon drangen NLF-Kommandos bis in die US-Botschaft vor. Sie wurden aber in Straßenkämpfen von ARVN-Kräften rasch zurückgedrängt und in den meisten Städten in wenigen Tagen ausgeschaltet. Dabei zerstörten US-Kampfhubschrauber ganze Stadtviertel. Das Ergebnis in Bến Tre kommentierte der US-Befehlshaber mit dem bekannten Satz: „Wir mussten Ben Tre zerstören, um es zu retten.“ Nur in der Schlacht um Huế hielten sich 7.500 NVA-Soldaten bis zum 24. Februar. Sie ermordeten zwischen 2.000 und 6.000 unbewaffnete Zivilisten. Bei der Rückeroberung in Häuser- und Straßenkämpfen starben 216 US-Soldaten. Huế wurde fast vollständig zerstört. 100.000 Einwohner mussten fliehen.

Bis März 1968 starben bei der Tet-Offensive über 14.000 Zivilisten, davon 6.000 in Saigon, 25.000 wurden verwundet und 670.000 obdachlos. Der erhoffte Aufstand der Südvietnamesen blieb aus. Die NLF verlor bis zu 40.000 Kämpfer (50 %), viele frühere Hochburgen und Rückzugsgebiete und damit erhebliche wirtschaftliche Ressourcen, Ansehen und Rekrutierungschancen bei der Landbevölkerung. Diese erhoffte nun fast nur noch ein Ende der Kämpfe. Die NLF-Truppen erholten sich nie mehr von ihren Verlusten. Die reguläre NVA musste diese ausgleichen und trug fortan die Hauptlast des Kriegs.
Am 3. April 1968 beschloss Nordvietnams Führung, Verhandlungen mit den USA aufzunehmen. Ho, der seit 1965 nur noch als moralischer Schlichter interner Richtungskämpfe auftrat, forderte am 20. Juli 1968 letztmals, den Krieg bis zum endgültigen Sieg fortzusetzen. Er starb am 2. September 1969 ohne Nachfolger. Staatschef wurde Ton Duc Thang. Zwischen den Parteifunktionären Le Duan, der auf einen raschen militärischen Sieg gedrängt hatte, und Trường Chinh, der langfristiger Aufbau- und Überzeugungsarbeit Vorrang geben wollte, kam es zum Streit über die Folgerungen aus der Niederlage für die weitere Kriegführung.


„Pazifizierung“
Die US-Generalstäbe wollten die Niederlage der NLF nutzen, um erweiterte Kriegspläne durchzusetzen. Westmoreland schlug im Februar 1968 ein Landeunternehmen gegen NVA-Stellungen an der Küste Nordvietnams nahe der entmilitarisierten Zone vor, verlangte Angriffe von Bodentruppen auf NVA-Rückzugsgebiete in Laos und Kambodscha und verschärfte Luftangriffe, um den Ho-Chi-Minh-Pfad wirksam zu unterbrechen. General Earle Wheeler unterstützte den Plan und forderte dafür Ende Februar weitere 206.000 US-Soldaten, also die Einberufung von Reservisten: Andernfalls werde Nordvietnam langfristig siegen. Erfolgskriterien und einen Zeitrahmen für diese neuen Bodeneinsätze nannte er nicht.
US-Verteidigungsminister McNamara trat Ende Februar 1968 infolge der Tet-Offensive und Konflikten mit Johnson um die Militärstrategie zurück. Sein seit 1. März amtierender Nachfolger Clark M. Clifford befürwortete eine Rückkehr zur Enklaven-Strategie von 1965. Die US-Armee sollte sich ab sofort auf den Schutz der Großstädte begrenzen, der ARVN das Bekämpfen der Gegner überlassen und so den Vietnamesen einen internen Verhandlungsfrieden ermöglichen. Bevor Johnson seine Entscheidung für Cliffords Plan bekanntgeben konnte, veröffentlichte die New York Times am 10. März die Truppenforderung der Generäle. Daraufhin formierte sich Widerstand im US-Kongress: 139 von 400 Abgeordneten des Repräsentantenhauses verlangten in einer Resolution eine umfassende Neubewertung des gesamten US-Kriegseinsatzes. Johnsons außenpolitische Berater McGeorge Bundy, George Ball und Dean Acheson rieten anders als im Vorjahr am 25. März gegen Ausdehnung und unveränderte Fortsetzung des Kriegs. Die Tet-Offensive bewirkte einen Meinungsumschwung; die überraschende Offensivkraft des Gegners, den man am Rande des Zusammenbruchs geglaubt hatte, zerstörte die Hoffnung der US-Bürger auf das baldige Kriegsende und Johnsons Glaubwürdigkeit. Die Wähler fühlten sich von der Regierung irregeführt, die jahrelang den baldigen Sieg nach der jeweils nächsten Eskalation versprochen hatte. Hinzu kam die enorme Belastung des Staatshaushaltes und der US-Wirtschaft durch den Krieg.
Am 31. März 1968 gab Johnson in einer Rede an die Nation bekannt, er werde die Bombardements begrenzen, Nordvietnam Verhandlungen anbieten und nicht zur Wiederwahl antreten. Er ernannte Averell Harriman zum US-Vertreter für die geplanten Pariser Friedensgespräche und forderte Südvietnam auf, mehr Verantwortung für den Krieg zu übernehmen. Wie realistisch der letzte Punkt war, wurde in den USA kontrovers diskutiert. Nordvietnam ging auf Johnsons Angebot ein und begann ab Mai 1968 in Paris Verhandlungen mit den USA. Beide Seiten hielten jedoch an ihren Kriegszielen fest. Johnson stellte zwar ein Ende der Bombardements nördlich des 20. Breitengrades in Aussicht, verdreifachte aber die Bombardierungen in Südvietnam. Aufständische Gebiete wie das dicht besiedelte Mekongdelta ließ er dreimal so stark bombardieren wie den Norden. Der militärische Effekt dieses Vorgehens war minimal, da der Gegner weite Teile seiner Infrastruktur und Logistik unter die Oberfläche verlagert hatte. In der Hälfte der bombardierten Gebiete im Süden war die NLF laut Gabriel Kolko nicht aktiv, sodass dort nur die Zivilbevölkerung getroffen wurde.
Ende März ersetzte Johnson Westmoreland durch General Creighton Abrams. Dieser verkleinerte die US-Einheiten zu mobilen und nahkampferprobten Einsatzkommandos, die auch bisher gemiedene Sumpf- und Dschungelgebiete durchkämmten. Er vermehrte die „Search-and-destroy“-Einsätze, an denen sich im März und April rund 100.000 US-Soldaten beteiligten. Das im Juni 1968 gestartete „Phoenix-Programm“ der CIA sollte der NLF die Operationsbasis endgültig entziehen. Dabei gingen von US-Offizieren ausgebildete Spezialeinheiten der ARVN gegen lokale Kämpfer vor. Bis Mitte 1971 verhafteten sie 28.000 Guerillakämpfer, erschossen 20.000 und bewogen 17.000, auch mit Folter, die Seiten zu wechseln. Das Thieu-Regime benutzte das Programm zum Eliminieren von Oppositionellen, sodass die Spezialeinheiten auch viele nichtkommunistische Zivilisten ermordeten. Das Phoenix-Programm tötete zwischen 1968 und 1972 26.000 bis 41.000 mutmaßliche NLF-Mitglieder.
