Title,Article,Tags,Personas,Summary,Meeting_Plan,Meeting
Im Mai 1961 erlaubte Kennedy das Absetzen kleiner, schwer bewaffneter Geheimkommandos von südvietnamesischen Agenten, die von US-Militärberatern ausgebildet wurden, in Nordvietnam. Die nötigen Flüge organisierte die ARVN, getarnt als private Luftfahrtgesellschaft. Später wurden dazu auch Piloten aus Taiwan ausgebildet. Von diesen Aktionen sollte die US-Bevölkerung auch dann nichts erfahren, als sie von Nordvietnam entdeckt wurden. Dies geschah erstmals bereits im Juli 1961; fast alle weiteren eingeschleusten Agenten wurden kurz nach ihrer Landung in Nordvietnam entdeckt und inhaftiert. Gleichwohl wurden die Agententeams bis Mitte 1964 auf mehrere hundert Personen erhöht. Die Zusammenarbeit zwischen Südvietnam und Taiwan wurde dabei auch nach Diems Sturz fortgesetzt.
US-Außenminister Dean Rusk und US-Verteidigungsminister Robert McNamara begründeten den verstärkten US-Einsatz im November 1961 mit dem SEATO-Vertrag. Ein Appeasement würde zum Sieg der Kommunisten in ganz Indochina, zum Verlust der Glaubwürdigkeit der USA bei asiatischen Verbündeten und zur Zerstörung der SEATO führen. Die von den Stabschefs, dem Verteidigungsministerium und Diem geforderte Entsendung regulärer Truppen und gezielte Bombenangriffe auf Hanoi lehnte Kennedy aber ab. Stattdessen ließ er die Mittel für die ARVN stark aufstocken, die Eliteeinheit Green Berets entsenden und das Military Assistance Command, Vietnam (MACV) nahe Saigon als Oberkommando einrichten. Er autorisierte die CIA, im Norden Sabotageakte durchzuführen. Die Operation 34A („OPLAN34“) wurde gestartet. Das Saigoner Büro der CIA wurde damit zu einem Aktivposten, dessen Aktivitäten der US-Kongress nicht ausreichend überwachte.
Zwischen 1959 und 1961 bildeten die US-Militärberater in der geheimen Operation White Star in Laos die Royal Laotian Army aus und gewannen Rekruten des Stammes der Hmong. Vor allem wegen der enormen US-Waffenlieferungen, darunter Hubschraubern, gepanzerten Truppentransportern und moderner Artillerie, war die ARVN 1962 militärisch gegen die Widerstandskämpfer erfolgreich und übernahm die strategische und taktische Initiative im Bürgerkrieg.
Diem und sein Bruder Ngo Dinh Nhu, der Sicherheitschef, benutzten die Guerilla-Abwehrstrategie jedoch vor allem zur verstärkten Unterdrückung der Bauern. Dazu sah der aufwendige Taylor-Staley-Plan vor, die Landbevölkerung ab März 1962 in „Wehrdörfern“ zu konzentrieren. Dagegen wehrten sich die meisten Dorfbewohner, weil es ihre religiösen Gebräuche verletzte und ihre ohnehin schwierige soziale Lage zusätzlich verschlechterte. Außer in einigen Hochlandgebieten, wo die CIA den Plan durchführte, war das Wehrdorfprogramm ein fataler Rückschlag für Diems Regime. Anfang 1963 in der Schlacht um Ap Bac schlug ein einziges, relativ schlecht bewaffnetes, aber entschlossenes NLF-Bataillon die Angriffe numerisch weit überlegener Verbände der ARVN zurück. Dabei zeigte sich die Unfähigkeit der südvietnamesischen Offiziere.

Im Mai 1963 löste Diem mit einem Verbot der buddhistischen Flagge in Huế monatelange schwere Unruhen aus, die ganz Südvietnam erfassten (Buddhistenkrise). Bei Protestdemonstrationen erschoss die Polizei Frauen und Kinder. Es kam zu Hungerstreiks und Selbstverbrennungen. Im August stellte Diems Bruder Nhu das Land unter Kriegsrecht. Zugleich knüpfte er über Frankreichs Staatspräsident de Gaulle erste Kontakte mit Hanoi, ohne den US-Botschafter zu informieren.
Kennedy stand nun vor der Wahl, weiter ein korruptes und in Südvietnam abgelehntes Regime zu stützen, das die Siegchancen der NLF durch sein Verhalten erhöhte, oder Diem zu stürzen und damit in Südvietnams Souveränität einzugreifen. Nur Paul Kattenburg riet in dieser Situation, das US-Militär aus Südvietnam abzuziehen und das Land sich selbst zu überlassen, wurde aber im Nationalen Sicherheitsrat zurückgewiesen. Wichtige Berater Kennedys wie Averell Harriman und George Wildman Ball wollten Diem fallenlassen. Kennedy ernannte Henry Cabot Lodge junior zum neuen US-Botschafter in Saigon. Lodge sollte von Diem die Absetzung Nhus verlangen und andernfalls unzufriedene ARVN-Generäle zu einem Putsch ermutigen. Um den Druck auf Diem zu erhöhen, empfahlen McNamara und Maxwell Taylor Kennedy nach ihrem Besuch in Saigon im September den Abzug der US-Militärberater und Reduktion der Militärhilfe für die ARVN. Daraufhin zog Kennedy am 11. Oktober 1963 1.000 Militärberater ab. Er wollte die übrigen bis 1965 aus Vietnam zurückziehen. Am 2. November 1963 stürzten unzufriedene ARVN-Offiziere Diem und Nhu; beide wurden nach ihrer Festnahme ermordet. Lodge, der von dem Putschplan gewusst und Diem nicht darüber informiert hatte, stritt nach seiner Rückkehr in die USA im Juni 1964 jede US-Beteiligung ab. Mehrere Berater Kennedys, darunter Vizepräsident Lyndon B. Johnson, sahen in dem Putsch später einen schweren Fehler, der die USA noch stärker an Südvietnam gebunden habe.
Das ZK der kommunistischen Partei in Hanoi reagierte Im Oktober 1963 in direkter Folge auf den Putsch mit der Resolution 9, welche den Einsatz regulärer nordvietnamesischer Truppen im Süden autorisierte. Die Entscheidung wurde mit den militärischem Erfolg bei Ap Bac, der Zusicherung uneingeschränkter Hilfe seitens der Volksrepublik China beim Besuch von Liu Shaoqi im Mai 1963 und der Instabilität des Regimes im Süden begründet. Ziel der Eskalation war die Hoffnung den südvietnamesischen Staat zu zerschlagen, bevor eine absehbare US-amerikanische Intervention voll wirksam werden könne. Politisch hatte sich damit Le Duan gegen den alten Führungszirkel um Ho Chi Minh und Vo Nguyen Giap durchgesetzt. Er bestimmte ab 1963 maßgeblich die Geschicke des Landes im Krieg. Innenpolitisch führte die Machtverschiebung zu einer Zentralisierung und Repression, welche im Sinne des Stalinismus keine Abweichung von der Parteilinie zuließ.


Kriegseintritt der USA
Nach dem tödlichen Attentat auf John F. Kennedy am 22. November 1963 rückte Johnson in das Präsidentenamt auf. Er hatte die Containmentpolitik seiner Vorgänger stets unterstützt. Am 26. November bestätigte er ein für Kennedy verfasstes Memorandum, das Südvietnam fortgesetzte Hilfe gegen jede kommunistische Aggression versprach. Er werde nicht zulassen, dass „Vietnam den gleichen Weg nimmt wie China“, sondern dafür sorgen, dass Südvietnams Generäle „die Kommunisten das Fürchten lehren“. Um seine auf sozialen Ausgleich gerichtete Innenpolitik (Great Society) im US-Kongress abzusichern, wollte Johnson außenpolitisch die US-Interessen in Indochina wahren und das Überleben Südvietnams garantieren.
Dessen neuer Machthaber General Dương Văn Minh, ein Buddhist, strebte gegen Johnsons Willen einen Kompromiss mit der NLF an und forderte von den US-Militärs mehr Zurückhaltung. Im Januar 1964 wurde er mit Zustimmung Johnsons von einer von General Nguyễn Khánh geführten Offiziersgruppe gestürzt. Weitere Militärcoups folgten; bis Ende 1967 kam es in Südvietnam zu keiner stabilen Regierung mehr. Nordvietnam nutzte diese Lage und schickte mehr Kämpfer und Material dorthin. Damit sollte die NLF zuerst das zentrale Hochland und das Mekongdelta unter ihre Kontrolle bringen, um danach auch in den Großstädten Südvietnams anzugreifen.
Bei seinem Vietnambesuch im März 1964 stellte McNamara fest, dass die NLF 40 % der Gebiete Südvietnams und bis zu 90 % der Gebiete um Saigon kontrollierte. Die ARVN hatte im Mekongdelta 3000 Soldaten verloren, eine hohe Anzahl ihrer Soldaten desertierten, viele akzeptierten Khánh nicht als Oberbefehlshaber. Öffentlich behauptete McNamara dennoch Fortschritte bei der Abwehr der NLF. Intern empfahl er, die Militärhilfe zu erhöhen und vor der Präsidentschaftswahl (November 1964) keine US-Bodentruppen zu entsenden. Diese würden die Kampfmoral der ARVN nur weiter schwächen und dann immer mehr US-Truppen erforderlich machen (Schneeballeffekt). Daraufhin verstärkte Johnson die von Kennedy initiierte verdeckte OPLAN34. Dabei führten CIA, US-Armee und ARVN gemeinsame Sabotageakte in Nordvietnam durch, um das Regime in Saigon zu entlasten und zu stabilisieren. Zudem ließ er das Verteidigungsministerium die Bombardierung Nordvietnams nun detailliert planen. Er ernannte Maxwell Taylor zum US-Botschafter in Saigon, berief General William Westmoreland zum Oberkommandierenden des MACV und erhöhte die Zahl der US-Militärberater in Südvietnam bis Ende 1964 von 16.000 auf 23.300. Zugleich bot er Hanoi Wirtschaftshilfe an, falls es die Unterstützung der NLF einstellen und das Regime in Saigon anerkennen würde; andernfalls müsse es mit US-Luftangriffen rechnen (Seaborn-Mission). Im Gegenzug bot Hanoi an, ein neutrales Südvietnam anzuerkennen, falls die USA ihr Militär dort vollständig abziehen würden. Bei einem Vermittlungsversuch von UN-Generalsekretär U Thant im September 1964 bestanden beide Seiten auf diesen unvereinbaren Forderungen.
Ab Mai 1964 wollte Johnson seinen geplanten Kriegseinsatz vom US-Kongress autorisieren lassen, um diesen und damit auch die US-Bevölkerung stärker einzubinden. Die Resolution dazu sollte wegen eines fehlenden Kriegsanlasses erst nach der Präsidentschaftswahl im November vorgelegt werden. Im Wahlkampf stellte Johnson seinen Gegenkandidaten Barry Goldwater als gefährlichen Kriegstreiber dar, der den Vietnamkrieg ausweiten und die USA in einen Atomkrieg mit der Sowjetunion stürzen würde, und versprach, keine Bodentruppen nach Vietnam zu senden.

Am 31. Juli 1964 griff ein südvietnamesisches Sabotagekommando im Rahmen von „OPLAN34“ zwei nordvietnamesische Inseln an. Am 1. August lief das US-Kriegsschiff Maddox in den Golf von Tonkin ein, um die Nordvietnamesische Volksarmee (NVA) elektronisch auszuforschen. Aus ungeklärten Gründen entsandte Nordvietnams Küstenwache am 2. August drei Schnellboote zur Maddox. Diese fürchtete einen Torpedoangriff, eröffnete das Feuer, versenkte eins der Boote, beschädigte die übrigen und meldete diesen „Tonkin-Zwischenfall“ der US-Regierung. Am 4. August meldete die Turner Joy während eines Gewitters irrtümlich weitere Torpedoangriffe, zog die Meldung aber zurück. Die NSA legte Johnson nur jene 10 % des für den Zwischenfall relevanten Funkverkehrs vor, die einen Angriff nahelegten. Johnson ordnete noch am selben Abend erste Luftschläge auf Hanoi an und begründete diese im US-Fernsehen als Vergeltung für „wiederholte unprovozierte Gewaltakte“. Die Beteiligung von US-Kriegsschiffen an Sabotageaktionen wurde dem Kongress verheimlicht. Staatssekretär George Ball gab später zu, dass sie in den Golf von Tonkin entsandt worden waren, um einen Kriegsgrund zu provozieren. Die sofortigen Vergeltungsschläge waren seit Monaten vorbereitet gewesen.
Am 7. August beschloss der US-Kongress nach kurzer Debatte mit nur zwei Gegenstimmen (Ernest Gruening, Wayne Morse) die Tonkin-Resolution. Diese erlaubte der US-Regierung „alle notwendigen Maßnahmen, um jedweden bewaffneten Angriff auf US-Streitkräfte abzuwehren und weitere Aggression zu verhindern.“ Sie sollte eine förmliche Kriegserklärung ersetzen und diente den USA bis zu ihrer Rücknahme 1970 als Legalisierung aller folgenden Kampfeinsätze ihrer Streitkräfte in Indochina. Johnson erreichte die Kongressmehrheit dafür mit Hilfe von Senator William Fulbright und dem Versprechen, er plane vor der Wahl keine Entsendung von Bodentruppen. Er brachte Goldwaters Kritik zum Schweigen, er sei „weich zum Kommunismus“, und errang einen Erdrutschsieg bei der Präsidentschaftswahl am 3. November 1964.
Mit den gezielten und angedrohten weiteren US-Luftschlägen erprobte die US-Regierung, wie sich 1970 herausstellte, ein um 1960 entwickeltes Konzept der „Nötigungsdiplomatie“, das koordinierte Gewalt und Verhandlungsangebote kombinierte. Bewirkt wurde das Gegenteil: Die Regierung in Hanoi rechnete nicht mehr mit dem Rückzug der USA nach dem Zusammenbruch des Regimes in Südvietnam; vielmehr erwartete sie eine Invasion der USA in ganz Vietnam und stellte sich darauf ein, US-Truppen auch im Süden direkt zu bekämpfen. Ab September 1964 entsandte sie daher bewaffnete Kampftruppen über den Ho-Chi-Minh-Pfad nach Südvietnam und ließ diesen dafür weiter ausbauen.
Am 1. November 1964 griff die NLF in Biên Hòa erstmals direkt eine US-Militärbasis an. Das bestärkte Johnson in seiner Absicht, Nordvietnam zu bombardieren, um die NLF im Süden zu schwächen. Zunächst bezahlten die USA eine Aufstockung der ARVN um 100.000 auf 660.000 Mann, um das Regime von General Nguyễn Khánh zu stützen. Im Dezember 1964 verübte die NLF einen Bombenanschlag auf ein Saigoner Hotel, wo US-Militärberater wohnten, und besiegte zwei numerisch und waffentechnisch weit überlegene ARVN-Bataillone bei Binh Gia. Nun wollten Johnsons Berater Nordvietnam früher bombardieren, um Südvietnams Regime vor dem Zusammenbruch zu retten.


Verbündete Staaten
Die Volksrepublik China hatte die NLF 1960 als erster Staat anerkannt. Dabei sah sie ihre Rolle als Unterstützer von „Befreiungsbewegungen“ gegen beide Supermächte, Sowjetunion und USA, in Ländern der Dritten Welt. Nach dem Tonkin-Zwischenfall erklärte sie, im Falle einer US-Invasion in Nordvietnam einzugreifen. Mao ließ dazu Truppen von 300.000 bis 500.000 Mann nahe der Südgrenze Chinas aufstellen, dort zwei Flugplätze bauen und nordvietnamesische Piloten ausbilden. Im Dezember 1964 schlossen beide Staaten ein Militärhilfeabkommen. Im Juni 1965 trafen erste chinesische Hilfstruppen in Nordvietnam ein. Bis 1969 half die Volksrepublik China Nordvietnam vor allem mit Personal zur Instandsetzung und Erhaltung von Straßen, Schienenwegen und Flugplätzen, stellte Luftabwehrkräfte bereit und lieferte militärisches Material.

Seit dem chinesisch-sowjetischen Zerwürfnis konkurrierte die Sowjetunion mit der Volksrepublik China, die im Oktober 1964 Atommacht wurde, um politischen Einfluss in Indochina. Am 14. Oktober 1964 wurde Nikita Sergejewitsch Chruschtschow in der Sowjetunion gestürzt. Er hatte die friedliche Koexistenz mit den USA verfolgt und Nordvietnam deshalb zwar mit rund 500 Millionen Dollar Wirtschaftshilfe und leichten Waffen unterstützt, die Lieferung von Flak-Geschützen und Panzerabwehrwaffen jedoch stets abgelehnt. Nach seinem Sturz verwies Hanoi die wenigen sowjetischen Militärberater des Landes. Sein Nachfolger Leonid Iljitsch Breschnew vereinbarte daraufhin mit Hanoi im Februar 1965 ein Militärhilfeabkommen. Nach den ersten Bombenabwürfen der USA auf Nordvietnam ging die Sowjetunion ab November 1964 auf Konfrontationskurs zu den USA und verurteilte alle weiteren US-Bombardierungen. Sie lieferte Nordvietnam Boden-Luft-Raketen des Typs S-75 sowie Flugzeuge, darunter Mig-21, und für Angriffe auf US-Basen geeignete Artillerie. Nordvietnam erhielt somit von beiden Staaten erhebliche Kriegsmittel und spielte sie bei deren Vergabe und bei der diplomatischen Unterstützung bis zum Kriegsende erfolgreich gegeneinander aus. Ho war dabei eher am Bündnis mit der Sowjetunion, Le Duan eher an China interessiert. Bis 1968 entsandte die Sowjetunion 2.000 Militärberater und überflügelte China als wichtigster Waffenlieferant Nordvietnams. Bis 1975 gewährte sie zudem Kredite im Wert von rund fünf Milliarden Dollar. Die Volksrepublik China dagegen zog ihre Berater ab 1967 aus Nordvietnam zurück und stellte ihre Wirtschaftshilfe während der Kulturrevolution weitgehend ein. Nach dem Zwischenfall am Ussuri (März–September 1969) nahm sie diese wieder auf und lieferte in den folgenden Jahren Waren im Wert von 500 Millionen Dollar an Nordvietnam.
Nordkorea unterstützte Nordvietnam ab 1967 aktiv mit einem Kontingent an Kampfpiloten, die vor allem bei der Verteidigung Hanois zum Einsatz kamen. Bereits 1965 hatte Kim Il-sung mehrfach erklärt, dass Nordkorea jederzeit bereit sei, Nordvietnam militärisch zu unterstützen. In den Kämpfen starben 14 nordkoreanische Militärangehörige, denen in der vietnamesischen Gemeinde Tân Dĩnh mit einer Gedenkstätte gedacht wird. Erst 2001 wurde die Teilnahme nordkoreanischer Piloten an den Luftkämpfen über Nordvietnam von der vietnamesischen Regierung offiziell bestätigt.

Die DDR rief ihre Bürger ab 1965 zu „internationaler Solidarität“ mit Nordvietnam auf. Für humanitäre Hilfe bestimmte Spenden wurden auch für militärische Mittel benutzt. Deren Umfang ist jedoch nicht bekannt. Ab 1973 bildete die DDR pro Jahr 20 bis 30 Nordvietnamesen zu Offizieren aus.
Die US-Regierung versuchte ab April 1964, so viele Staaten wie möglich als Unterstützer ihres Vietnameinsatzes zu gewinnen („More Flags“-Programm), um diesen nicht unilateral aussehen zu lassen. Bis Dezember sandten 15 Staaten meist symbolische Hilfsbeiträge. Nur die SEATO-Mitglieder Australien, Neuseeland, die Philippinen, Thailand sowie Südkorea und Taiwan stellten bedeutende nichtmilitärische Güter bereit. Johnson bat die SEATO-Staaten dann um Kampftruppen. Großbritannien lehnte ab, da es seit 1963 die nachkoloniale Föderation um Malaysia gegen Angriffe Indonesiens mit 30.000 Soldaten schützte, darunter den US-Militärstützpunkt in Singapur, den die USA für ihre Eindämmungspolitik gegenüber der Volksrepublik China brauchten. Die übrigen Staaten entsandten Militär nur gegen das Versprechen der USA, alle damit verbundenen Kosten zu tragen.
Die SEATO stimmte dem US-Einsatz nie offiziell zu. Südkorea, kein SEATO-Mitglied, stellte bis 1966 die meisten Streitkräfte, erhielt dafür umfassende Wirtschafts-, Modernisierungs- und Militärhilfen und vertragliche Zusagen der USA, ihre Truppen in Südkorea nicht zu reduzieren. Der philippinische Präsident Ferdinand Marcos erhielt zusätzlich 80 Millionen Dollar Wirtschaftshilfe für eine nichtmilitärische Hilfstruppe, zog diese aber 1969 angesichts heftiger Bürgerproteste wieder ab. Thailand erlaubte den USA seit 1964 die Nutzung seiner Flugplätze für Bombenangriffe auf Laos und Nordvietnam, dann auch den Bau von acht US-Militärbasen mit 37.000 US-Soldaten, die ihr eigenes Rundfunknetzwerk AFTN (American Forces Thailand Network) hatten. Es gab Studios an folgenden Standorten: Flughafen Udon Thani (1970: Absturz eines beschädigten Phantom-Flugzeug in die Studios), Flughafen Ubon Ratchathani sowie den Luftwaffenstützpunkten Nakhon Ratchasima und Takhli. Dafür wurde in Thailand die Infrastruktur verbessert, so u. a. eine neue Fernstraße, die Thanon Mittraphap durch die USA angelegt. Es erhielt für eine 1967 entsandte Division jährlich 75 Millionen Dollar Militärhilfe. Australien unterstützte mit den USA 1965 den blutigen Militärputsch von Suharto in Indonesien und stockte seine Hilfstruppen für Südvietnam bis 1967 auf. Zusammen entsandten diese Staaten bis 1969 in der Spitze insgesamt 68.850 Soldaten, die sie in unterschiedlichem Tempo bis 1973 wieder abzogen:

Die NATO hatte das US-Engagement in Indochina bis 1963 vorbehaltlos als mit ihren Zielen identisch bejaht. Der Truppenaufmarsch der USA in Südvietnam löste 1964 jedoch Besorgnis aus, er könne das Bündnis schwächen. Nach dem Tonkin-Zwischenfall wiesen die NATO-Staaten Forderungen der USA zurück, eigene Truppen nach Vietnam zu entsenden. Seit Juli 1965 zeigten sich die skandinavischen Staaten besorgt über die Eskalation und zivile Opfer und forderten die USA zum Verhandeln mit ihren Kriegsgegnern auf. Zweifel an den behaupteten Kriegsgründen der USA und deren Nichtkonsultation der NATO verstärkten die Kritik. Frankreich unterstützte wie schon 1954 ein neutrales Südvietnam und verurteilte die Bombardierung Nordvietnams. Der damalige Bundesaußenminister Gerhard Schröder dagegen fürchtete, eine Niederlage in oder ein Rückzug der USA aus Südvietnam könne die Sowjetunion zu erpresserischen Vorstößen in Europa ermutigen und somit die Sicherheit der Bundesrepublik Deutschland gefährden.
Bundeskanzler Ludwig Erhard unterstützte den US-Kriegseinsatz auch gegenüber skeptischen NATO-Partnern, gab den USA aber im April 1965 mit 30 Millionen Dollar weniger als die Hälfte der geforderten Summe. Er versuchte im Dezember 1965, die Zahlungsfristen für deutsche Rüstungskäufe in den USA zu verlängern, die der frühere Bundesverteidigungsminister Franz Josef Strauß den USA 1961 zum Ausgleich der US-Devisen für die in der Bundesrepublik stationierten US-Truppen zugesagt hatte. Johnson wies diesen Vorstoß im September 1966 zurück. Der Dissens mit den USA über die Aufteilung der Militärkosten trug wesentlich zum Sturz Erhards bei. Sein Nachfolger Kurt Georg Kiesinger vereinbarte daraufhin mit den USA und Großbritannien im Januar 1967, die Zentralbanken der EWG und die westdeutschen Banken würden ihre Reserven von US-Dollar nicht zum Ankauf von Gold nutzen. Damit stützte die Bundesrepublik wesentlich den Dollarkurs und seine Funktion als Leitwährung, die das durch den Vietnamkrieg verursachte US-Haushaltsdefizit erheblich gefährdet hatte.
Willy Brandt kritisierte den Kriegseinsatz der USA weder als Bundesaußenminister noch als Bundeskanzler, um die Sicherheitsgarantien der USA für Berlin nach der Berlinkrise 1961, die deutsch-amerikanische Freundschaft, den Ruf der SPD als atlantische Partei und seine Entspannungspolitik nicht zu gefährden. 1965 kritisierte er die Dominotheorie, Anfang 1968 nannte er den Rückzug der USA aus Vietnam wünschenswert und lehnte deutsche Militärbeiträge ab. Im Februar forderte die SPD auf Druck der Parteibasis einen sofortigen Bombardierungsstopp. Brandt betonte dagegen den Friedenswillen der USA und äußerte auch für Nixons Bombardierungen 1972 Verständnis.
Als die USA bis Juli 1966 zwei Drittel ihrer Aufklärungsflugzeuge und bis 1967 66.000 Soldaten aus Westeuropa nach Südvietnam verlegt hatten, konnten sie ihre Sicherheitsgarantie für die NATO-Staaten nicht mehr erfüllen. Nachdem die Sowjetunion den Prager Frühling 1968 militärisch niedergeschlagen hatte, rückten die NATO-Staaten wieder enger an die Seite der USA. Blockfreie Staaten wie Indien dagegen sahen das Verhalten der USA in Vietnam und das der Sowjetunion im Ostblock als vergleichbare gewaltsame Einmischung an.
Kanada blieb im Krieg zwar neutral, viele Kanadier dienten aber als Freiwillige in den US-Streitkräften, obwohl dies nach kanadischem Recht eigentlich verboten war. Es wird geschätzt, dass zwischen 30000 und 40000 Kanadier im Kriegseinsatz waren, von denen mehr als 125 starben. Nach anderen Schätzungen fielen 400 Kanadier, 4000 wurden verwundet. Trotz des Verbots des Kriegsdienstes in fremden Streitkräften wurde keiner der Freiwilligen juristisch verfolgt. Kanada beteiligte sich aber an der Internationalen Kontrollkommission – die die Einhaltung der Genfer Vereinbarungen überwachen sollten – mit 240 Soldaten und 50 Beratern des Außenministeriums.


Bombardierungen

Die USA wollten Nordvietnam nicht erobern und seine Existenz nicht gefährden, um keinen Atomkrieg mit der Sowjetunion und/oder China zu riskieren. Sie wollten Südvietnam solange halten, bis Nordvietnam es anerkennen und seine Infiltrationsversuche einstellen würde. Deshalb bombardierten sie anfangs begrenzte Ziele und steigerten ihre Bodentruppen graduell, ohne die volle Kapazität der US Army einzusetzen. Dabei verließ sich das Oberkommando des MACV auf seine technisch und materiell überlegenen Waffen, die Luftüberlegenheit der US Air Force und die Beweglichkeit seiner Hubschrauber, die US-Truppen rasch überallhin transportieren konnten. Weil Nordvietnam diesem „Technowar“ nichts Gleichwertiges entgegensetzen konnte, erwartete man, dass es seine Kräfte bald erschöpfen und die Kämpfe einstellen würde. Die Bombardierung von Militärstützpunkten Nordvietnams, von der NLF beherrschten Gebieten Südvietnams und Nachschublinien auch in Nachbarstaaten sollte den Krieg für Nordvietnam unbezahlbar machen, es von der Unterstützung der NLF abbringen, diese von Nachschub abschneiden und Grenzkontrollen im Süden erleichtern. Politisch sollte sie Südvietnams Regime stabilisieren und die konservative Opposition in den USA zufriedenstellen, die eine unbeschränkte Bombardierung Nordvietnams verlangte.
Nach dem Angriff der NLF auf den US-Stützpunkt Camp Holloway bei Plei Cu befahl Johnson die dreiwöchige Operation Flaming Dart (7.–28. Februar 1965) als Strafaktion. Dabei wurden nordvietnamesische Truppenstandorte bombardiert, die man als Unterstützer der NLF-Angriffe im Süden ansah. Nachdem die NLF weitere US-Basen im Süden angriff, beschlossen die US-Stabschefs die Operation Rolling Thunder. Dabei wurden zunächst acht Wochen lang 94 Ziele in Nordvietnam bombardiert, hauptsächlich Nachschubdepots und Transportknotenpunkte. Vom 13. bis 18. Mai gab es eine Bombardierungspause für Verhandlungen. Dabei hielt Nordvietnam sein für die USA unannehmbares Ziel eines unabhängigen und wiedervereinigten Vietnam fest, reparierte rasch Schäden am Ho-Chi-Minh-Pfad und stellte sowjetische Luftabwehrraketen um Hanoi und andere Industriezentren auf.
Johnson widerstand Forderungen des US-Militärs, auch dicht bevölkerte Ballungszentren zu bombardieren. Er suchte die Ziele wöchentlich selbst aus, nahm Großstädte, Deichanlagen und Grenzgebiete nahe der Grenze zu China von den Bombardierungen aus und stellte heraus, dass nur militärisch als wichtig erachtete Anlagen zerstört werden sollten. Die Bombardierung betraf zunächst Regionen um den 17. Breitengrad, später immer weiter nördlich gelegene Gebiete, darunter auch viele militärisch unbedeutende Orte. Sie töteten laut McNamara „wöchentlich 1.000 Zivilisten“, auch mit Napalm und Splitterbomben.

